hit_id,bigram_lower,adj_form_lower,all_forms_lower,adv_form_lower,text_window,token_str
apw_eng_19980121_1418_74:13-14,any_wiser,wiser,(+)_any_wiser,any,"to fall tomorrow ? will i be any wiser tomorrow , having reached 18 ?","what if my birthday were to fall tomorrow ? Will I be any wiser tomorrow , having reached 18 ?"
pcc_eng_09_072.7936_x1161173_48:7-8,any_wiser,wiser,(+)_any_wiser,any,is burning binary bits of information any wiser ?,Is burning binary bits of information any wiser ?
pcc_eng_20_073.2179_x1166700_08:8-9,any_wiser,wiser,(+)_any_wiser,any,"although it is doubtful that we are any wiser than our predecessors , we can","Although it is doubtful that we are any wiser than our predecessors , we can at least try to improve our understanding of these issues ."
pcc_eng_20_086.0803_x1374599_07:4-5,any_wiser,wiser,(+)_any_wiser,any,but is anyone any wiser as to what his policies are,"But is anyone any wiser as to what his policies are ? """
pcc_eng_15_053.5050_x0848581_61:20-21,any_wiser,wiser,(+)_any_wiser,any,"all over the world , are we any wiser or more fully informed of the","Armed with Zizek 's apercus disseminated in numerous books and articles circulated all over the world , are we any wiser or more fully informed of the total picture of the world today after his brilliant disclosure ?"
pcc_eng_21_087.7829_x1402629_48:31-32,any_wiser,wiser,(+)_any_wiser,any,in the wrong direction before he was any wiser .,"Mc Kelvin initially played the inside route when Green started to break toward the inside , but thus , he was turned completely in the wrong direction before he was any wiser ."
