hit_id,bigram_lower,adj_form_lower,all_forms_lower,adv_form_lower,text_window,token_str
pcc_eng_18_009.0507_x0130288_19:14-15-16,necessarily_indicative,indicative,not_necessarily_indicative,necessarily,it is harvested and processed is not necessarily indicative of its current quality and vigour,""" The age of the seed after it is harvested and processed is not necessarily indicative of its current quality and vigour ."
pcc_eng_24_028.9558_x0452055_52:12-13-14,necessarily_indicative,indicative,not_necessarily_indicative,necessarily,"i said , very rough and not necessarily indicative of what the final product will","These sketches are , as I said , very rough and not necessarily indicative of what the final product will look like ."
pcc_eng_13_006.0242_x0081002_10:14-15-16,necessarily_indicative,indicative,not_necessarily_indicative,necessarily,"that features james taylor , is not necessarily indicative of this set 's sound ,",""" Soul Companion , "" the single that features James Taylor , is not necessarily indicative of this set 's sound , nor its greatest strength ."
pcc_eng_23_037.5692_x0590867_12:21-22-23,necessarily_indicative,indicative,not_necessarily_indicative,necessarily,"from 2009 - 2012 , is not necessarily indicative of doping , "" he continued",""" In addition , atypical blood data , which may be within this database from 2009 - 2012 , is not necessarily indicative of doping , "" he continued ."
pcc_eng_23_038.9389_x0612917_19:19-20-21,necessarily_indicative,indicative,not_necessarily_indicative,necessarily,"or "" corridors "" ) is not necessarily indicative of mineralization on the syndicate 's","( See : Management cautions that mineralization present on proximal properties ( or "" corridors "" ) is not necessarily indicative of mineralization on the Syndicate 's Property ."
pcc_eng_11_066.4129_x1058722_21:17-18-19,necessarily_indicative,indicative,not_necessarily_indicative,necessarily,particular selection of ptc software is not necessarily indicative of the timing of recognition of,More information can be found at The announcement of any particular selection of PTC software is not necessarily indicative of the timing of recognition of revenue therefrom or the level of revenue for any particular period .
pcc_eng_09_007.5210_x0105624_24:6-7-8,necessarily_indicative,indicative,not_necessarily_indicative,necessarily,the historical results achieved are not necessarily indicative of future prospects .,The historical results achieved are not necessarily indicative of future prospects .
