hit_id,adv_form_lower,adj_form_lower,bigram_lower,neg_form_lower,all_forms_lower,text_window,token_str
pcc_eng_05_035.3794_x0556854_228:19-20-21,exactly,happy,exactly_happy,not,not_exactly_happy,2009 friday the 13th reboot were not exactly happy with the fans .,5 . The actors and behind - the-scenes people interviewed regarding the 2009 Friday the 13th reboot were not exactly happy with the fans .
nyt_eng_19991013_0160_128:3-4-5,exactly,happy,exactly_happy,not,not_exactly_happy,she 's not exactly happy .,she 's not exactly happy .
pcc_eng_21_016.1275_x0244129_03:15-16-17,exactly,happy,exactly_happy,not,not_exactly_happy,knows nothing about and she 's not exactly happy with the situation .,Horses are something this city slicker amateur photographer knows nothing about and she 's not exactly happy with the situation .
pcc_eng_04_074.6840_x1190183_19:4-5-6,exactly,happy,exactly_happy,not,not_exactly_happy,so i 'm not exactly happy with krispy kreme right now :,So I 'm not exactly happy with Krispy Kreme right now : ( .....
pcc_eng_21_018.8022_x0287475_42:11-12-13,exactly,happy,exactly_happy,not,not_exactly_happy,may be blurry because dice was not exactly happy with me holding his mouth open,I have pictures they may be blurry because Dice was not exactly happy with me holding his mouth open and poking around for 10 minutes haha .
pcc_eng_05_090.1893_x1442757_117:09-10-11,exactly,happy,exactly_happy,not,not_exactly_happy,"mean , i know you were not exactly happy those last years . """,""" I mean , I know you were not exactly happy those last years . """
pcc_eng_29_085.6182_x1366827_20:3-4-5,exactly,happy,exactly_happy,not,not_exactly_happy,"she 's not exactly happy with her life , one that","She 's not exactly happy with her life , one that has been mapped out for her , but she does n't know any other way of living ."
pcc_eng_25_085.1821_x1362397_081:3-4-5,exactly,happy,exactly_happy,not,not_exactly_happy,"i 'm not exactly happy about it either , but remember","I 'm not exactly happy about it either , but remember , not everyone gets the ending they "" deserve "" , and well , in a way Littlefinger exactly got what he deserved ."
pcc_eng_04_077.8819_x1241959_33:29-30-31,exactly,happy,exactly_happy,not,not_exactly_happy,enjoy -- but some people are not exactly happy about the purchase .,"The Ann Arbor Justice Center , which houses the 15th District Court , has a new $ 150,000 sculpture for visitors to enjoy -- but some people are not exactly happy about the purchase ."
pcc_eng_04_070.9054_x1129086_095:2-3-4,exactly,happy,exactly_happy,not,not_exactly_happy,"while not exactly happy , joanie and trixie are lively","While not exactly happy , Joanie and Trixie are lively presences , not the passive background decor sex workers function as on shows like The Sopranos ."
apw_eng_19980514_1417_20:15-16-17,exactly,happy,exactly_happy,not,not_exactly_happy,"kong , and the missus is not exactly happy you 're not taking her along","if your next excursion takes you to Hong Kong , and the missus is not exactly happy you 're not taking her along yet again , best check in at the Mandarin Oriental ."
