hit_id,adv_form_lower,adj_form_lower,bigram_lower,neg_form_lower,all_forms_lower,text_window,token_str
pcc_eng_22_089.8459_x1436041_16:3-4-5,exactly,clear,exactly_clear,not,not_exactly_clear,"it 's not exactly clear how that will pan out ,","It 's not exactly clear how that will pan out , but one can expect that it will have a lasting impact on the Alexandrians - especially with Rick - and how they will tackle the heating up battle against Negan and his cohorts ."
pcc_eng_00_030.6404_x0479115_59:26-27-28,exactly,clear,exactly_clear,not,not_exactly_clear,just how it is done is not exactly clear .,"Although the benefits and advantages of teaching baby sign language are stated clearly by the businesses selling programmes , just how it is done is not exactly clear ."
pcc_eng_04_054.8889_x0870370_6:3-4-5,exactly,clear,exactly_clear,not,not_exactly_clear,"it 's not exactly clear what spencer means by "" ready","It 's not exactly clear what Spencer means by "" ready , "" though he may be referring to games being updated to support the new power of Project Scorpio ."
pcc_eng_04_040.8859_x0644766_22:3-4-5,exactly,clear,exactly_clear,not,not_exactly_clear,it is not exactly clear why some patients with mental health,"It is not exactly clear why some patients with mental health disorders get worse as seasons change , he said ."
pcc_eng_08_077.4702_x1238126_01:41-42-43,exactly,clear,exactly_clear,not,not_exactly_clear,year and i feel something just not exactly clear on what .,"Finding Worth in the Middle of the Earth : Finding Worth in the Middle of the Earth : Here I am , it 's almost the end of a new month of the new year and I feel something just not exactly clear on what ."
pcc_eng_10_078.3293_x1249805_047:5-6-7,exactly,clear,exactly_clear,not,not_exactly_clear,even if you 're not exactly clear on the math -- and if,"Even if you 're not exactly clear on the math -- and if you 're me , then you 're definitely not clear on the math -- you wind up with a working understanding of stuff like thrust - to - weight ratios and atmospheric drag ."
pcc_eng_20_081.0184_x1292818_089:17-18-19,exactly,clear,exactly_clear,not,not_exactly_clear,"tight shots , so it 's not exactly clear where you are .","With all of the Gymkhana videos we start with really tight shots , so it 's not exactly clear where you are ."
apw_eng_20080912_0026_16:3-4-5,exactly,clear,exactly_clear,not,not_exactly_clear,it was not exactly clear when fakorede made her unusual defense,it was not exactly clear when Fakorede made her unusual defense : British media were banned from reporting the incident until she was found guilty earlier this month .
pcc_eng_27_105.1516_x1684814_25:19-20-21,exactly,clear,exactly_clear,not,not_exactly_clear,"the novel , and it 's not exactly clear why anyone would think it makes","His sexually deviant prissy - boy version of Rakes differs wildly from the novel , and it 's not exactly clear why anyone would think it makes any sense in a film that is so grounded in every other respect ."
pcc_eng_03_088.2387_x1412655_11:3-4-5,exactly,clear,exactly_clear,not,not_exactly_clear,it is not exactly clear why coffee is linked to reduced,"It is not exactly clear why coffee is linked to reduced liver disease risk , but existing data shows that coffee drinkers exhibit significantly lower levels of the liver enzymes gamma-glutamyl transferase ( GGT ) and alanine transaminase ( ALT ) than those who avoid coffee altogether ."
pcc_eng_28_070.6311_x1126597_06:3-4-5,exactly,clear,exactly_clear,not,not_exactly_clear,"it 's not exactly clear when he was struck , but","It 's not exactly clear when he was struck , but he did share a photo of his arm on Instagram on Monday morning ( Oct. 16 ) ."
pcc_eng_26_088.0284_x1407331_05:10-11-12,exactly,clear,exactly_clear,not,not_exactly_clear,site is going to be is not exactly clear yet -- the site briefly went,Quite what the site is going to be is not exactly clear yet -- the site briefly went online but disappeared very quickly .
pcc_eng_04_085.3523_x1362864_03:16-17-18,exactly,clear,exactly_clear,not,not_exactly_clear,paid for by ... it 's not exactly clear . ),( Another $ 5.4 million in renovations would be paid for by ... it 's not exactly clear . )
pcc_eng_14_003.3633_x0038237_04:12-13-14,exactly,clear,exactly_clear,not,not_exactly_clear,"for your body , it is not exactly clear what they are supposed to do","Although back exercises are great for your body , it is not exactly clear what they are supposed to do in terms of curing a spinal abnormality , such as a herniated disc or spinal stenosis ."
pcc_eng_28_018.3139_x0280009_30:3-4-5,exactly,clear,exactly_clear,not,not_exactly_clear,it is not exactly clear why the actual stonehenge was built,"It is not exactly clear why the actual Stonehenge was built , however with the new technology they have found that the rocks came from up to 130 miles away around 4000 years ago ."
