hit_id,bigram_lower,adj_form_lower,all_forms_lower,adv_form_lower,text_window,token_str
pcc_eng_15_083.5671_x1334345_038:10-11,yet_unformed,unformed,(+)_yet_unformed,yet,"disciplines , models give shape to the yet unformed , and climate specifically is known","In both disciplines , models give shape to the yet unformed , and climate specifically is known only through modeling ."
pcc_eng_15_054.6771_x0867481_112:5-6,yet_unformed,unformed,(+)_yet_unformed,yet,"she is a person yet unformed , becoming at times a plaything","She is a person yet unformed , becoming at times a plaything of the "" older "" dancers who , driven by momentary interest , roll her among each other ."
pcc_eng_11_014.8456_x0223962_130:5-6,yet_unformed,unformed,(+)_yet_unformed,yet,what worlds in the yet unformed occident may come refined with the,What worlds in the yet unformed Occident may come refined with the accents that are ours ?
pcc_eng_16_008.4899_x0121643_08:18-19,yet_unformed,unformed,(+)_yet_unformed,yet,the disintegration prerequisite for evolution ; the yet unformed and forming that will eventually emerge,It is the chaos of metamorphosis and transformation ; of the disintegration prerequisite for evolution ; the yet unformed and forming that will eventually emerge into the vivid Colors of Creation .
pcc_eng_01_002.8993_x0030626_151:19-20,yet_unformed,unformed,(+)_yet_unformed,yet,"alive , right since it all was yet unformed and unexpressed .","It peeps into man , into each manifest being inert and alive , right since it all was yet unformed and unexpressed ."
pcc_eng_27_062.9058_x1000811_3:15-16,yet_unformed,unformed,(+)_yet_unformed,yet,"yet unfounded , its organization of heralds yet unformed , and magic is still a","It is an age when Valdemar is yet unfounded , its organization of Heralds yet unformed , and magic is still a wild and uncontrolled force ."
pcc_eng_10_041.9021_x0661828_51:38-39,yet_unformed,unformed,(+)_yet_unformed,yet,"a new sort of work , as yet unformed , is taking its place .","Recent changes , Saval argues , suggest that "" the career path that defined the white - collar worker for generations ... is coming to a close , and that a new sort of work , as yet unformed , is taking its place . """
pcc_eng_00_039.7588_x0626087_148:8-9,yet_unformed,unformed,(+)_yet_unformed,yet,"your eyes saw my substance , being yet unformed .","Your eyes saw my substance , being yet unformed ."
pcc_eng_29_062.8609_x0999474_26:21-22,yet_unformed,unformed,(+)_yet_unformed,yet,to impute their own priorities to a yet unformed papacy .,"Some of this good feeling is the traditional , optimistic attempt of partisans to impute their own priorities to a yet unformed papacy ."
pcc_eng_28_074.6371_x1191028_277:10-11,yet_unformed,unformed,(+)_yet_unformed,yet,"supreme is "" the form of the yet unformed , the pattern of the yet","The Almighty Supreme is "" the form of the yet unformed , the pattern of the yet uncreated . """
pcc_eng_01_107.02293_x1716886_003:5-6,yet_unformed,unformed,(+)_yet_unformed,yet,"when the universe was yet unformed , all which existed would be","When the universe was yet unformed , all which existed would be called sorcery ."
