hit_id,adv_form_lower,adj_form_lower,bigram_lower,neg_form_lower,all_forms_lower,text_window,token_str
pcc_eng_15_041.3227_x0651986_040:6-7-8,immediately,obvious,immediately_obvious,not,not_immediately_obvious,"the dynasty 's weakness was not immediately obvious to young chonghou , whose family","The dynasty 's weakness was not immediately obvious to young Chonghou , whose family had served the emperor for generations ."
pcc_eng_07_059.6184_x0947558_15:07-09-10,immediately,obvious,immediately_obvious,not,not_immediately_obvious,"that training , it would not be immediately obvious that , for example , an","Without that training , it would not be immediately obvious that , for example , an underlined town name meant that the nearby train station shared the name , 2 or that navigable rivers were labelled in uppercase ."
pcc_eng_03_033.3422_x0523855_17:48-50-51,immediately,obvious,immediately_obvious,not,not_immediately_obvious,a fallacy whose application may not be immediately obvious .,"In the public discourse , it is often more convenient to show Craig 's position as an instance of something that is a more commonly recognized meme , like the Courtier 's Reply , than to show it as an instance of a fallacy whose application may not be immediately obvious ."
pcc_eng_18_011.2865_x0166510_085:4-6-7,immediately,obvious,immediately_obvious,not,not_immediately_obvious,this category may not be immediately obvious to observers considering bar exam pass,This category may not be immediately obvious to observers considering bar exam pass rates .
pcc_eng_11_065.9636_x1051454_36:23-24-25,immediately,obvious,immediately_obvious,not,not_immediately_obvious,"quite strong , though this is not immediately obvious by her appearance .","Shrewd and well - educated , she also keeps in excellent physical shape and is actually quite strong , though this is not immediately obvious by her appearance ."
pcc_eng_04_008.1970_x0116490_13:3-4-5,immediately,obvious,immediately_obvious,not,not_immediately_obvious,it 's not immediately obvious what pinterest would want with instapaper,It 's not immediately obvious what Pinterest would want with Instapaper .
pcc_eng_04_040.5889_x0639995_36:25-26-27,immediately,obvious,immediately_obvious,not,not_immediately_obvious,their advantage in ways that were not immediately obvious .,There are many other such examples of how hackers might be able to cleverly manipulate commercial data to their advantage in ways that were not immediately obvious .
pcc_eng_25_037.5005_x0590783_26:12-14-15,immediately,obvious,immediately_obvious,not,not_immediately_obvious,norwegian terrorism and science may not be immediately obvious .,"OK , the connection between the Norwegian terrorism and science may not be immediately obvious ."
pcc_eng_12_002.6771_x0027107_25:19-21-22,immediately,obvious,immediately_obvious,not,not_immediately_obvious,there to differentiate that is not so immediately obvious ?,"Visual clues are all very well and good , but what else is there to differentiate that is not so immediately obvious ?"
pcc_eng_05_086.4896_x1383300_03:38-40-41,immediately,obvious,immediately_obvious,not,not_immediately_obvious,elements of designs which may not be immediately obvious .,"Founder of Jewels by Moksh , Milan Chokshi believes that pure luxury is all about attention to details , and when it comes to high jewellery , it is distinguished in certain elements of designs which may not be immediately obvious ."
pcc_eng_06_020.1645_x0310068_016:22-23-24,immediately,obvious,immediately_obvious,not,not_immediately_obvious,have an allegorical meaning that is not immediately obvious .,A work of art often has an obvious meaning or interpretation but it may also have an allegorical meaning that is not immediately obvious .
apw_eng_20091121_0504_1:14-16-17,immediately,obvious,immediately_obvious,not,not_immediately_obvious,is making with england may not be immediately obvious to those sitting in the twickenham,even Martin Johnson acknowledges that any progress he is making with England may not be immediately obvious to those sitting in the Twickenham stands or watching on television .
pcc_eng_04_073.5035_x1170957_098:23-24-25,immediately,obvious,immediately_obvious,not,not_immediately_obvious,"your research , if it 's not immediately obvious why your research has broader relevance","Catherine Osborne suggests that "" A good way to be ' accessible ' when talking about your research , if it 's not immediately obvious why your research has broader relevance to the state of the world , is to start by saying 'a big problem in my field / subfield is X. People have tried to solve it in ways Y and Z ."
pcc_eng_19_012.3696_x0183660_06:08-09-10,immediately,obvious,immediately_obvious,not,not_immediately_obvious,fishing in the marlborough sounds is not immediately obvious to visitors to this aquatic playground,Commercial fishing in the Marlborough Sounds is not immediately obvious to visitors to this aquatic playground at the top of the South Island .
pcc_eng_27_050.6028_x0801645_4:5-6-7,immediately,obvious,immediately_obvious,not,not_immediately_obvious,"although the reasons are not immediately obvious , in some countries art historians","Although the reasons are not immediately obvious , in some countries art historians gain considerable prestige by attributing hitherto neglected works of art to major artists , but little or none for downgrading attributions ."
pcc_eng_02_006.0498_x0081701_31:20-21-22,immediately,obvious,immediately_obvious,not,not_immediately_obvious,implications or - if it 's not immediately obvious - their relevance to the terms,"Briefly highlight a couple of the most salient points , drawing out their implications or - if it 's not immediately obvious - their relevance to the terms of reference ."
pcc_eng_06_022.1340_x0342033_07:3-4-5,immediately,obvious,immediately_obvious,not,not_immediately_obvious,it 's not immediately obvious of the space that is within,It 's not immediately obvious of the space that is within this unpretentious family home boasting a combination of character & modern - day living .
pcc_eng_23_004.2714_x0052656_47:4-6-7,immediately,obvious,immediately_obvious,not,not_immediately_obvious,""" it may not be immediately obvious which devices will prove to be",""" It may not be immediately obvious which devices will prove to be compliant , but you can certainly narrow the search by eliminating options you do n't need and are n't required to have . """
pcc_eng_00_017.9746_x0274002_085:15-16-17,immediately,obvious,immediately_obvious,not,not_immediately_obvious,subjects where the image ideas are not immediately obvious .,I like to begin photography workshops with difficult subjects where the image ideas are not immediately obvious .
pcc_eng_24_020.9516_x0322211_055:3-5-6,immediately,obvious,immediately_obvious,not,not_immediately_obvious,it must not be immediately obvious from her complexion either .,It must not be immediately obvious from her complexion either .
pcc_eng_11_012.3254_x0183066_24:20-21-22,immediately,obvious,immediately_obvious,not,not_immediately_obvious,", even if those links are not immediately obvious .","Species and ecosystems do not exist in isolation , but are inextricably linked , even if those links are not immediately obvious ."
