hit_id,adv_form_lower,adj_form_lower,bigram_lower,neg_form_lower,all_forms_lower,text_window,token_str
pcc_eng_11_004.4272_x0055503_27:10-11-12,particularly,new,particularly_new,nothing,nothing_particularly_new,"we have seen , there is nothing particularly new or particularly interesting "" in the",""" From what we have seen , there is nothing particularly new or particularly interesting "" in the reveal , said Jonathan Chaplin , an analyst at New Street Research , in a research note ."
pcc_eng_00_063.5045_x1010480_21:3-4-5,particularly,new,particularly_new,nothing,nothing_particularly_new,there 's nothing particularly new under the hood of this early,"There 's nothing particularly new under the hood of this Early Access hit , but so far its RTS mechanics and tower - defense vibe have been executed very well ."
pcc_eng_22_009.2391_x0132835_11:1-2-3,particularly,new,particularly_new,nothing,nothing_particularly_new,"nothing particularly new there : after all , intel","Nothing particularly new there : after all , Intel 's new Ivy Bridge processors , to be launched in 2012 , do just that ."
pcc_eng_23_006.1388_x0082918_017:3-4-5,particularly,new,particularly_new,nothing,nothing_particularly_new,"there is nothing particularly new about ' new atheism ' ,","There is nothing particularly new about ' New Atheism ' , and its most identifiable spokespeople , Richard Dawkins , Sam Harris , and Daniel Dennett , have gained a wider platform for restating atheist and non-religious views ."
pcc_eng_14_034.4988_x0541173_11:34-35-36,particularly,new,particularly_new,nothing,nothing_particularly_new,", "" said her book had nothing particularly new or exciting , and it could","One letter written in 1968 by Knopf 's editor Judith Jones after reading Munro 's first book of short stories , "" Dance of the Happy Shades , "" said her book had nothing particularly new or exciting , and it could be easily overlooked ."
pcc_eng_22_060.9413_x0969101_257:3-4-5,particularly,new,particularly_new,nothing,nothing_particularly_new,"there 's nothing particularly new about their movement , except that","There 's nothing particularly new about their movement , except that perhaps they are exceptionally rude ."
pcc_eng_05_081.0593_x1295791_30:14-15-16,particularly,new,particularly_new,nothing,nothing_particularly_new,be informed later that there was nothing particularly new about krispy kreme doughnuts .,"I was , of course , to be informed later that there was nothing particularly new about Krispy Kreme doughnuts ."
pcc_eng_11_012.3035_x0182732_04:26-27-28,particularly,new,particularly_new,nothing,nothing_particularly_new,you 'll notice that there 's nothing particularly new about the notion of a customer,"Simple enough - but for all you marketers out there who 've been at this for a while , you 'll notice that there 's nothing particularly new about the notion of a customer journey ."
pcc_eng_23_035.2532_x0553260_078:4-5-6,particularly,new,particularly_new,nothing,nothing_particularly_new,but there was nothing particularly new in doing that : ecclesiastics had,But there was nothing particularly new in doing that : ecclesiastics had long featured prominently in medieval depictions of hell .
pcc_eng_12_004.0463_x0049178_28:1-6-7,particularly,new,particularly_new,nothing,nothing_particularly_new,"nothing in it should be particularly new to readers , but it does","Nothing in it should be particularly new to readers , but it does recount the tragically human side of this story ."
pcc_eng_28_011.0513_x0162558_14:3-4-5,particularly,new,particularly_new,nothing,nothing_particularly_new,"there 's nothing particularly new here , which is a little","There 's nothing particularly new here , which is a little disappointing , but there 's no denying that wasting aliens is fun ."
pcc_eng_12_010.7270_x0157559_02:09-10-11,particularly,new,particularly_new,nothing,nothing_particularly_new,"words were nice , he said nothing particularly new or enthralling .","While his words were nice , he said nothing particularly new or enthralling ."
