hit_id,adv_form_lower,adj_form_lower,bigram_lower,neg_form_lower,all_forms_lower,text_window,token_str
pcc_eng_10_073.5711_x1173124_044:48-49-50,that,different,that_different,not,not_that_different,"you will see that we 're not that different from other "" normal "" americans","You may think we 're all a bunch of unwashed geeks who eat Cheetos out of the vending machines and are awkward around the opposite sex but if you actually do any kind of investigation into the lives we live , you will see that we 're not that different from other "" normal "" Americans ."
pcc_eng_12_033.9044_x0532475_027:3-4-5,that,different,that_different,not,not_that_different,it 's not that different from what a musician does .,It 's not that different from what a musician does .
pcc_eng_21_011.9487_x0176702_08:17-18-19,that,different,that_different,not,not_that_different,whose experience of the world is not that different to yours .,"Note that the pig is a living , breathing animal whose experience of the world is not that different to yours ."
pcc_eng_10_075.5354_x1204675_33:11-12-13,that,different,that_different,not,not_that_different,", french and italian cuisines are not that different , he said .","But in the end , French and Italian cuisines are not that different , he said ."
pcc_eng_07_106.3686_x1703065_03:3-4-5,that,different,that_different,not,not_that_different,it 's not that different from wanting to have a good,It 's not that different from wanting to have a good hair day every single day .
pcc_eng_28_073.4956_x1172629_35:11-12-13,that,different,that_different,not,not_that_different,"it 's still wild country , not that different than the way it was 100",""" To me , it 's still wild country , not that different than the way it was 100 , 150 years ago . """
pcc_eng_13_003.5499_x0041044_034:4-5-6,that,different,that_different,not,not_that_different,"branch structure is not that different than kaki , like d. kaki","Branch structure is not that different than Kaki , like D. kaki it is open , with coarse twigs ."
pcc_eng_08_075.8157_x1211241_07:14-15-16,that,different,that_different,not,not_that_different,"staff every year and it 's not that different ( from ours ) , """,""" The variety category recognizes the whole staff every year and it 's not that different ( from ours ) , "" says "" 30 Rock "" executive producer Robert Carlock , a double nominee this year for penning two of the series ' episodes ."
pcc_eng_22_008.7142_x0124436_22:16-17-18,that,different,that_different,not,not_that_different,"contemporary womanhood is that it is not that different from contemporary "" manhood . ""","For me , the greatest "" secret "" about contemporary womanhood is that it is not that different from contemporary "" manhood . """
pcc_eng_21_091.0357_x1455110_46:4-6-7,that,different,that_different,not,not_that_different,"the enemy might not be that different in 2030 , but the economic","The enemy might not be that different in 2030 , but the economic climate has changed ."
pcc_eng_00_068.9738_x1098604_31:6-7-8,that,different,that_different,not,not_that_different,"and my invented universe is not that different from our own , when you","And my invented universe is not that different from our own , when you really examine it ."
pcc_eng_09_034.0071_x0534385_033:13-14-15,that,different,that_different,not,not_that_different,"more pricey and snooty , are not that different .","The second type , while much more pricey and snooty , are not that different ."
pcc_eng_05_032.6924_x0513376_07:4-5-6,that,different,that_different,not,not_that_different,""" it 's not that different from a human cake , just",""" It 's not that different from a human cake , just a little drier than you or I would like , "" said Valerie Minteer , co-owner of in Hagerstown 's Bones and Cones Eatery , which sells cakes , cookies and other baked goods for people and pets ."
pcc_eng_07_100.8751_x1614106_34:18-19-20,that,different,that_different,not,not_that_different,"towards them , "" they are not that different from people .","She saw where my attention had gone and titled her head towards them , "" They are not that different from people ."
pcc_eng_19_014.8379_x0223479_159:17-18-19,that,different,that_different,not,not_that_different,we 're having here is really not that different than what you see in scandinavia,"But , in terms of other key points the conversation we 're having here is really not that different than what you see in Scandinavia ."
pcc_eng_11_018.9613_x0290394_37:09-10-11,that,different,that_different,not,not_that_different,run into liberal christians who are not that different .,Then you run into liberal Christians who are not that different .
pcc_eng_15_036.0611_x0566852_06:15-16-17,that,different,that_different,not,not_that_different,this wrought iron coffee table is not that different in term of design .,"Quite similar to the other coffee table , this wrought iron coffee table is not that different in term of design ."
