hit_id,adv_form_lower,adj_form_lower,bigram_lower,neg_form_lower,all_forms_lower,text_window,token_str
pcc_eng_20_007.3921_x0103002_66:16-18-19,that,great,that_great,n't,n't_that_great,the 17th green that was n't all that great .,But there was a television movie adaptation of Miracle on the 17th Green that was n't all that great .
pcc_eng_23_007.8932_x0111324_13:20-21-22,that,great,that_great,n't,n't_that_great,escape since her ground game is n't that great .,""" I knew I needed to be on the bottom because I could escape since her ground game is n't that great ."
pcc_eng_08_058.3804_x0929252_21:5-6-7,that,great,that_great,n't,n't_that_great,"the sound design is n't that great , but it 's serviceable .","The sound design is n't that great , but it 's serviceable ."
pcc_eng_14_035.6985_x0560554_085:4-5-6,that,great,that_great,n't,n't_that_great,"my pain was n't that great , i was able to remain","My pain was n't that great , I was able to remain calm between contractions , and I never got the urge to push ."
pcc_eng_11_092.9988_x1489332_4:2-3-4,that,great,that_great,n't,n't_that_great,Is n't that great or crazy ?,Is n't that great or crazy ?
pcc_eng_29_037.9719_x0596761_129:21-22-23,that,great,that_great,n't,n't_that_great,you can see my pictures are n't that great .,Not now though because my camera lens was murdered by my roomba and as you can see my pictures are n't that great .
pcc_eng_29_089.3267_x1426573_10:17-18-19,that,great,that_great,n't,n't_that_great,the images themselves the quality is n't that great and with the notion of allowing,Again enough to work with luckily ' however looking at the images themselves the quality is n't that great and with the notion of allowing the epic landscape and beaut to be such an important aspect of the imagery I wanted to encourage a balance tone as well as elaborating on such detail of the setting !
pcc_eng_02_087.8175_x1403635_18:23-25-26,that,great,that_great,n't,n't_that_great,"'ll recall , he was n't all that great in 400 pas in oakland before","I was not high on his prospects at the beginning of this year , and if you 'll recall , he was n't all that great in 400 PAs in Oakland before getting dealt to St. Louis ."
apw_eng_20030216_0475_36:6-7-8,that,great,that_great,n't,n't_that_great,"`` my success rate is n't that great , but i enjoy the challenge","`` My success rate is n't that great , but I enjoy the challenge . ''"
pcc_eng_05_083.1142_x1328905_51:69-70-71,that,great,that_great,n't,n't_that_great,"a , this club just was n't that great .","Curiosity was the main thing that 'd kept us patient while we'd waited outside , and while it 's a nice place on the inside , with the same loud , aggressive , danceable but nearly indecipherable trap music ( "" I want a smart girrrl wid a dumb bootay ... "" ) that 's ever so popular down here in the A , this club just was n't that great ."
nyt_eng_19990429_0227_24:08-09-10,that,great,that_great,n't,n't_that_great,"my experience with california wines is n't that great , '' he said .","`` My experience with California wines is n't that great , '' he said ."
pcc_eng_03_081.6334_x1305812_51:33-34-35,that,great,that_great,n't,n't_that_great,"had , so the danger is n't that great .","But other analysts say that U.S. banks are much less vulnerable to those kinds of shocks and have much less exposure to Europe than they once had , so the danger is n't that great ."
pcc_eng_12_018.6696_x0285872_47:15-16-17,that,great,that_great,n't,n't_that_great,'s performance but the rest are n't that great either .,Praveen might be shown the door after yesterday 's performance but the rest are n't that great either .
pcc_eng_02_044.7622_x0707930_13:12-13-14,that,great,that_great,n't,n't_that_great,"'s license photos , usually are n't that great .","Passport photos , like driver 's license photos , usually are n't that great ."
pcc_eng_24_020.1560_x0309335_021:5-6-7,that,great,that_great,n't,n't_that_great,"the atmosphere here was n't that great despite the peace and order ,","The atmosphere here was n't that great despite the peace and order , as the extreme gap between rich and the poor could be seen everywhere ."
nyt_eng_20070522_0013_45:5-6-7,that,great,that_great,n't,n't_that_great,"`` wow , is n't that great ? '' romney responded .","`` Wow , is n't that great ? '' Romney responded ."
pcc_eng_20_034.0860_x0534953_17:38-39-40,that,great,that_great,n't,n't_that_great,rain stopped thinking that sneek was n't that great .,"... a drunk Dutch couple from a balcony across the road , the chavy man had his top off and was wearing a baseball cap , I set off before the rain stopped thinking that Sneek was n't that great ."
pcc_eng_10_048.3869_x0766487_17:3-4-5,that,great,that_great,n't,n't_that_great,"commercials are n't that great , with some exceptions , blowout","Commercials are n't that great , with some exceptions , blowout games are boring , and the halftime show was terrible ."
pcc_eng_10_023.8560_x0369194_86:7-8-9,that,great,that_great,n't,n't_that_great,"he also says the flames were n't that great , though , so if you","He also says the flames were n't that great , though , so if you 're going for effect ( and you probably are , if you 're lighting your hand on fire ) , I might recommend the higher alcohol content for a shorter time ."
pcc_eng_02_036.1467_x0568900_48:15-18-19,that,great,that_great,n't,n't_that_great,that they use are n't really all that great for eating as the tannins cause,Dianne explains to us that the majority of the apples that they use are n't really all that great for eating as the tannins cause them to be quite bitter .
pcc_eng_13_083.5661_x1334825_11:19-21-22,that,great,that_great,n't,n't_that_great,"have some success , are n't always that great .","Even a lot of the name players , the ones you 've seen have some success , are n't always that great ."
pcc_eng_14_099.0074_x1584271_5:10-12-13,that,great,that_great,n't,n't_that_great,picture if my explanation was n't all that great .,I attached an example picture if my explanation was n't all that great .
pcc_eng_07_051.1088_x0810054_29:6-7-8,that,great,that_great,n't,n't_that_great,""" his poll numbers were n't that great going into the general election ,",""" His poll numbers were n't that great going into the general election , "" Redfield said ."
pcc_eng_29_097.6011_x1560761_10:12-14-15,that,great,that_great,n't,n't_that_great,execution of those plans has n't been that great .,"For the Patriots , the actual execution of those plans has n't been that great ."
pcc_eng_27_007.1980_x0099619_026:09-10-11,that,great,that_great,n't,n't_that_great,"n't like lao , which was n't that great because we were there for a","I did n't like Lao , which was n't that great because we were there for a whole month ."
pcc_eng_02_005.4657_x0072196_11:09-10-11,that,great,that_great,n't,n't_that_great,", disney 's track record is n't that great with bd releases , is it","I mean , Disney 's track record is n't that great with BD releases , is it ?"
pcc_eng_15_041.0371_x0647403_6:7-8-9,that,great,that_great,n't,n't_that_great,"sometimes you think these courses are n't that great , and people do dismiss them","Sometimes you think these courses are n't that great , and people do dismiss them as classroom rubbish , but I 've found the experience of being around top-class coaches and looking at the game from this new perspective fantastic . """
pcc_eng_11_067.1524_x1070722_089:7-8-9,that,great,that_great,n't,n't_that_great,""" at least the expectations are n't that great , "" gibbs joked .",""" At least the expectations are n't that great , "" Gibbs joked ."
pcc_eng_27_055.8050_x0885848_20:6-7-8,that,great,that_great,n't,n't_that_great,"skiing down the couloir was n't that great , it was quite firm and","Skiing down the couloir was n't that great , it was quite firm and icy , but skiing down the Ballroom and Wildcat in Alta Ski Area was nice ."
pcc_eng_09_008.0436_x0114115_25:4-5-6,that,great,that_great,n't,n't_that_great,This difference is n't that great in western societies .,This difference is n't that great in western societies .
pcc_eng_07_064.7358_x1030046_37:13-14-15,that,great,that_great,n't,n't_that_great,"biggie , the plot just is n't that great .","Secondly , and this is the biggie , the plot just is n't that great ."
pcc_eng_02_041.0608_x0648160_23:4-5-6,that,great,that_great,n't,n't_that_great,"this special is n't that great , which makes her slightly over-cost","This special is n't that great , which makes her slightly over-cost ."
pcc_eng_14_013.2954_x0198588_10:3-4-5,that,great,that_great,n't,n't_that_great,2010 was n't that great of a vintage .,2010 was n't that great of a vintage .
pcc_eng_12_006.1248_x0082565_12:56-57-58,that,great,that_great,n't,n't_that_great,became kind of mealy and were n't that great to eat on their own .,"We enjoyed a fun day of apple picking in Hood River last weekend so I had lots to choose from and ended up using four varieties , super sweet fuji's , tart granny smith's , flavorful spitzenburgs and winter banana apples which were perfect for apple butter because they became kind of mealy and were n't that great to eat on their own ."
pcc_eng_05_035.4370_x0557789_31:09-10-11,that,great,that_great,n't,n't_that_great,henning and hart / hart are n't that great of matches .,Hart / Henning and Hart / Hart are n't that great of matches .
pcc_eng_26_001.0120_x0000197_26:7-8-9,that,great,that_great,n't,n't_that_great,i find that most people are n't that great about going back to the book,"I find that most people are n't that great about going back to the Book Crossingwebsite and adding a journal entry , but it 's still nice to know that my already - read books are out there getting read again ."
pcc_eng_20_082.3774_x1314762_043:22-23-24,that,great,that_great,n't,n't_that_great,", simply because your micro is n't that great .","After a ladder reset a higher ranked player might destroy you with a few units , simply because your micro is n't that great ."
pcc_eng_05_004.6457_x0059237_14:12-13-14,that,great,that_great,n't,n't_that_great,"matter is , peyton manning is n't that great when it matters most .","The simple fact of the matter is , Peyton Manning is n't that great when it matters most ."
pcc_eng_04_077.2010_x1230811_040:4-5-6,that,great,that_great,n't,n't_that_great,the springs were n't that great though and the couch was hard,"The springs were n't that great though and the couch was hard underneath and he stopped after a short while , frowning ."
pcc_eng_test_1.1197_x01944_10:18-19-20,that,great,that_great,n't,n't_that_great,at the mom pictures still is n't that great ... and essentially ... the oil,I think the other thing to watch is of the wind at the mom pictures still is n't that great ... and essentially ... the oil market is relying on China at the moment as it has some for the past five years China 's accounted for about two -thirds ... of incremental upload them on ... and the fact is is that although we had pretty decent ... oil import figures for July ... um most of the oil over last fall that was that she could be destined for storage ... and the import picture in China is n't actually that great in Chinese imports of oil actually peaked last year ... when all really seeing the growth so we we pulled up a chart of oil prices are up around a hundred tendon the ... benchmark of UTI who are yet to me ... one oh nine ninety I just ... how much further can I go ... well ... that that the of the hard questions like I will not ... depends on a couple things look if you get out in the stressful most ... blokes ... but you 're putting a seal does n't seem on denominated in dollars with the ceiling as ...
pcc_eng_19_011.9388_x0176729_19:27-28-29,that,great,that_great,n't,n't_that_great,for you if the supply is n't that great .,"If you intend to mail your jewellery , discover how a lot it can be to get it came back for you if the supply is n't that great ."
pcc_eng_16_026.3477_x0410355_032:08-10-11,that,great,that_great,n't,n't_that_great,", the overall story is n't all that great .","Even still , the overall story is n't all that great ."
pcc_eng_26_085.7392_x1370325_25:7-8-9,that,great,that_great,n't,n't_that_great,the acting in part 3 is n't that great and has to be some of,The acting in Part 3 is n't that great and has to be some of the worst in the series .
pcc_eng_18_007.7175_x0108739_05:13-14-15,that,great,that_great,n't,n't_that_great,"when we did , it was n't that great - for either of us .","We hardly had sex , and when we did , it was n't that great - for either of us ."
pcc_eng_23_018.7320_x0286149_009:3-5-6,that,great,that_great,n't,n't_that_great,"most are n't all that great , some are okay , and","Most are n't all that great , some are okay , and a few are just amazing ."
pcc_eng_17_042.4102_x0668881_08:18-19-20,that,great,that_great,n't,n't_that_great,( trust me - they are n't that great ) while attending your big oscar,"But if you would like to have my odds of winning ( trust me - they are n't that great ) while attending your big Oscar party , here is what you will need to mark down ."
pcc_eng_07_104.4614_x1672467_048:20-21-22,that,great,that_great,n't,n't_that_great,the choice for the guys is n't that great .,"Girls are n't the only ones who like to wear jewelry , but the choice for the guys is n't that great ."
pcc_eng_22_062.9823_x1002045_13:4-5-6,that,great,that_great,n't,n't_that_great,The deals were n't that great .,The deals were n't that great .
pcc_eng_19_080.1111_x1278027_44:4-5-6,that,great,that_great,n't,n't_that_great,The meal was n't that great .,The meal was n't that great .
pcc_eng_18_040.0913_x0632549_26:3-4-5,that,great,that_great,n't,n't_that_great,you were n't that great of a shinobi anyway .,You were n't that great of a shinobi anyway .
pcc_eng_13_080.9379_x1292117_10:27-29-30,that,great,that_great,n't,n't_that_great,", but it just was n't all that great .","It 's not that I did n't enjoy it , and it could be largely dependent on the spots we visited , but it just was n't all that great ."
pcc_eng_13_038.5795_x0607644_02:20-21-22,that,great,that_great,n't,n't_that_great,"list , but his upside is n't that great .","He has already made it farther than some of the prospects on that list , but his upside is n't that great ."
pcc_eng_17_049.1116_x0777293_4:09-10-11,that,great,that_great,n't,n't_that_great,"that if the original movie was n't that great ( or , even if it","Others say that if the original movie was n't that great ( or , even if it is ) , that a fresh look could be the ticket to a film and a story that everyone enjoys ."
pcc_eng_01_106.1397_x1699278_04:10-12-13,that,great,that_great,n't,n't_that_great,quality of the audio is n't all that great but this is what i got,( I know the quality of the audio is n't all that great but this is what I got )
pcc_eng_13_032.5540_x0510202_078:18-19-20,that,great,that_great,n't,n't_that_great,"felt , because the prognosis was n't that great and the doctors were , you","And I 'd always wanted to do it but I never felt , because the prognosis was n't that great and the doctors were , you know , every time I asked them about , you know , whether I should commit to a longer term plan of any sort , they would always kind of look a little bit hesitant ."
pcc_eng_14_081.3695_x1299399_2:11-12-13,that,great,that_great,n't,n't_that_great,"heck , but they really are n't that great against act bosses ( andy ,","Novasorcs are fun as heck , but they really are n't that great against act bosses ( andy , meph , and baal ) because their top- end damage is rather low ( so they take too long against high-hitpoint monsters ) ."
pcc_eng_29_009.1800_x0132220_051:18-19-20,that,great,that_great,n't,n't_that_great,n't want to because it was n't that great of an update .,I know I should have updated on school but I did n't want to because it was n't that great of an update .
pcc_eng_01_099.4088_x1590856_26:16-17-18,that,great,that_great,n't,n't_that_great,"that max 's animation ecosystem is n't that great , even if the tools are","Dominating all the tech stuff is the fact is that Max 's animation ecosystem is n't that great , even if the tools are workable ."
pcc_eng_27_008.6525_x0123184_20:21-22-23,that,great,that_great,n't,n't_that_great,quality of the ice cream was n't that great .,Parfait style Japanese ice cream that was good in concept but too bad the quality of the ice cream was n't that great .
pcc_eng_03_012.8597_x0191798_32:13-15-16,that,great,that_great,n't,n't_that_great,- and the plants were n't even that great .,I too was shocked at their prices - and the plants were n't even that great .
pcc_eng_19_079.5479_x1268978_26:28-29-30,that,great,that_great,never,never_that_great,"great you are because you 're never that great , "" chizik said .",""" You have to be strong enough to be able to block out the positives when they 're telling you how great you are because you 're never that great , "" Chizik said ."
pcc_eng_01_065.6827_x1046237_20:20-22-23,that,great,that_great,not,not_that_great,it looks like republicans have not been that great at winning presidential elections lately .,"Despite the dubious ( and geopolitically catastrophic ) wins of George W. Bush , it looks like Republicans have not been that great at winning presidential elections lately ."
pcc_eng_00_038.2131_x0601125_52:13-15-16,that,great,that_great,not,not_that_great,the stories because really am not all that great at stories .,Ok so my husband does most of the stories because really am not all that great at stories .
pcc_eng_29_031.8575_x0497902_131:12-13-14,that,great,that_great,not,not_that_great,", the difference between regions is not that great , as shown in table 10","To put this into context , the difference between regions is not that great , as shown in table 10 ."
pcc_eng_17_101.1508_x1618803_28:01-12-13,that,great,that_great,not,not_that_great,"Not that the American Robotnik design used prior to that was that great , but at least","Not that the American Robotnik design used prior to that was that great , but at least it did n't look THAT goofy and ugly ."
pcc_eng_20_004.3211_x0053357_009:3-4-5,that,great,that_great,not,not_that_great,"it 's not that great , but i suppose it could","It 's not that great , but I suppose it could be worse ."
pcc_eng_25_098.8053_x1582817_02:7-8-9,that,great,that_great,not,not_that_great,we apologize that your experience was not that great .,We apologize that your experience was not that great .
nyt_eng_19990206_0074_24:6-8-9,that,great,that_great,not,not_that_great,"the arab revolt was actually not all that great , historians now say .","the Arab revolt was actually not all that great , historians now say ."
pcc_eng_22_007.2457_x0100749_034:4-5-6,that,great,that_great,not,not_that_great,"but it 's not that great , and i feel like it","But it 's not that great , and I feel like it 's better left a mystery than revealing how lame it is to the world ."
pcc_eng_09_042.9863_x0679366_21:09-10-11,that,great,that_great,not,not_that_great,"3d skills , unfortunately i 'm not that great in that area .","For the 3D skills , unfortunately I 'm not that great in that area ."
pcc_eng_14_006.5919_x0090483_21:27-28-29,that,great,that_great,not,not_that_great,"teas and many of them are not that great in my opinion , but they","They do sell loose teas as well if you go on their site ... they sell a lot of different teas and many of them are not that great in my opinion , BUT they do have some gems in their lineup ."
pcc_eng_03_004.7334_x0060329_123:16-17-18,that,great,that_great,not,not_that_great,", but the screenplays were just not that great , and the people who were","We had gotten to the screenplay stage last time , but the screenplays were just not that great , and the people who were doing it before were just not very powerful in Hollywood ."
pcc_eng_26_035.1956_x0552751_07:7-8-9,that,great,that_great,not,not_that_great,"okay , so the picture is not that great but we went through a lot","Okay , so the picture is not that great but we went through a lot of them do they must have tasted okay !"
pcc_eng_26_001.6630_x0010741_3:28-29-30,that,great,that_great,not,not_that_great,"years , so the results were not that great but i had fun .","I didnt make anything I just played which was a nice thing to do because I have n't done that in years , so the results were not that great but I had fun ."
apw_eng_20030831_0335_18:4-5-6,that,great,that_great,not,not_that_great,"the differences were not that great , she said .","the differences were not that great , she said ."
pcc_eng_10_045.1638_x0714591_231:19-20-21,that,great,that_great,not,not_that_great,'m pregnant at all and its not that great to begin with !,I do n't think my immune system is as good when I 'm pregnant at all and its not that great to begin with !
pcc_eng_08_075.3391_x1203593_26:5-6-7,that,great,that_great,not,not_that_great,However the quality is not that great by todays standards .,However the quality is not that great by todays standards .
pcc_eng_14_009.9189_x0144124_14:15-16-17,that,great,that_great,not,not_that_great,can find online for download is not that great .,Most of the software for Mac that you can find online for download is not that great .
pcc_eng_07_020.8582_x0321117_006:3-4-5,that,great,that_great,not,not_that_great,"i am not that great at reading patterns , i get","I am not that great at reading patterns , I get confused and lost ."
pcc_eng_22_084.5355_x1350335_1:12-13-14,that,great,that_great,not,not_that_great,", so the image quality is not that great .","Remember , the camera sucks , so the image quality is not that great ."
pcc_eng_10_049.7553_x0788459_56:09-11-12,that,great,that_great,not,not_that_great,friends is that we 're not all that great with money .,General consensus among friends is that we 're not all that great with money .
pcc_eng_09_085.2641_x1363262_010:35-37-38,that,great,that_great,not,not_that_great,most of these options are not all that great .,"Buying the best micro SD card can be particularly difficult when you consider the fact that there are a great many options that are available to you , but most of these options are not all that great ."
nyt_eng_19960606_0804_18:6-7-8,that,great,that_great,not,not_that_great,but the odds still are not that great : out of every 100 patients,"but the odds still are not that great : Out of every 100 patients given Activase , only about 11 appeared to avoid serious stroke damage because of the drug ."
pcc_eng_03_017.2123_x0262355_29:7-8-9,that,great,that_great,not,not_that_great,"but then again , it 's not that great of a pic .","But then again , it 's not that great of a pic ."
pcc_eng_16_027.1807_x0423733_08:4-5-6,that,great,that_great,not,not_that_great,road conditions are not that great during monsoon in panchgani and mahabaleshwar,Road conditions are not that great during monsoon in Panchgani and Mahabaleshwar due to heavy rainfall in this area .
pcc_eng_05_039.6113_x0624909_097:23-24-25,that,great,that_great,not,not_that_great,"in his best seasons he was not that great , but looked good cause he","Why the Indians think they can fix Graves , I do not know , as even in his best seasons he was not that great , but looked good cause he got the saves ."
pcc_eng_26_001.4108_x0006662_128:3-5-6,that,great,that_great,not,not_that_great,"i 've not been that great , and usually it 's been","I 've not been that great , and usually it 's been someone who 's passed on ."
pcc_eng_03_008.1610_x0115796_11:17-19-20,that,great,that_great,not,not_that_great,in a social mud may not be that great .,The disparities between a word world described here and one erected in a social MUD may not be that great .
pcc_eng_16_027.4836_x0428703_063:3-5-6,that,great,that_great,not,not_that_great,"it 's not even that great of a costu- ... wait ,","It 's not even that great of a costu- ... wait , what are those , stumps on its back ?"
pcc_eng_15_042.9091_x0677623_27:3-4-5,that,great,that_great,not,not_that_great,"i 'm not that great with computers and , unfortunately ,","I 'm not that great with computers and , unfortunately , am not in the habit of saving all my stuff on a regular basis ."
pcc_eng_26_001.9121_x0014754_135:15-16-17,that,great,that_great,not,not_that_great,wrist in case your grip is not that great yet !,Make sure the camera strap is around your wrist in case your grip is not that great yet !
pcc_eng_06_022.4952_x0347844_093:5-6-7,that,great,that_great,not,not_that_great,Room service food was not that great .,Room service food was not that great .
pcc_eng_13_036.0574_x0566709_07:22-23-24,that,great,that_great,not,not_that_great,xt performance on open cl is not that great .,My hypothesis ( not based on actual data ) is that the Power VR 5 XT performance on Open CL is not that great .
pcc_eng_01_044.5448_x0703471_266:6-7-8,that,great,that_great,not,not_that_great,"( actually , i 'm not that great with my own thoughts .","( Actually , I 'm not that great with my own thoughts ."
pcc_eng_15_091.7115_x1466305_12:13-14-15,that,great,that_great,not,not_that_great,"the m performance rear spoiler is not that great , and i really think you","The mounting surface contact area for the M performance rear spoiler is not that great , and I really think you should use the betalink adhesive here ."
pcc_eng_12_006.6998_x0091998_28:5-6-7,that,great,that_great,not,not_that_great,the color palette is not that great and the pictures taken in lighting,"The color palette is not that great and the pictures taken in lighting conditions different than ideal ones , do not have many details and their clarity suffers ."
pcc_eng_06_108.8365_x1744448_464:16-17-18,that,great,that_great,not,not_that_great,"when it does , it is not that great .","It takes too much time to build suspense and when it does , it is not that great ."
