hit_id,adv_form_lower,adj_form_lower,bigram_lower,neg_form_lower,all_forms_lower,text_window,token_str
pcc_eng_19_078.0095_x1244134_099:21-22-23,that,close,that_close,not,not_that_close,""" except that people usually are not that close to bee colonies to notice the",""" This is normal and no reason for alarm , "" Mussen said , "" except that people usually are not that close to bee colonies to notice the normal demise of substantial numbers of overwintering bees . """
nyt_eng_20050108_0107_23:09-10-11,that,close,that_close,not,not_that_close,that nfl teams in general were not that close like in college and that the,i heard that NFL teams in general were not that close like in college and that the Broncos had problems .
pcc_eng_15_011.8235_x0174725_095:4-5-6,that,close,that_close,not,not_that_close,admittedly i 'm not that close to the technology work that we,"Admittedly I 'm not that close to the technology work that we do , unlike someone like Mike would be or even our director of marketing , Joel ."
nyt_eng_20001107_0452_25:7-8-9,that,close,that_close,not,not_that_close,"the senate , though , was not that close .","the Senate , though , was not that close ."
apw_eng_20081024_1003_40:18-19-20,that,close,that_close,not,not_that_close,interview a group whose views are not that close to the overall population 's views,"that means that one time in 20 , pollsters expect to interview a group whose views are not that close to the overall population 's views ."
pcc_eng_19_049.4519_x0782061_11:23-24-25,that,close,that_close,not,not_that_close,at the same time we 're not that close because we 're losing all those,"We 've been telling everyone ' we 're close , we 're close , ' but at the same time we 're not that close because we 're losing all those games ."
