hit_id,adv_form_lower,adj_form_lower,bigram_lower,neg_form_lower,all_forms_lower,text_window,token_str
pcc_eng_01_049.3187_x0780822_33:13-14-15,that,familiar,that_familiar,not,not_that_familiar,but casual sports fans are just not that familiar with him .,"Boxing fans like the guy , but casual sports fans are just not that familiar with him ."
pcc_eng_06_103.9576_x1665503_11:4-5-6,that,familiar,that_familiar,not,not_that_familiar,""" I 'm not that familiar with him . """,""" I 'm not that familiar with him . """
pcc_eng_09_007.1714_x0099940_17:6-7-8,that,familiar,that_familiar,not,not_that_familiar,"for me , i 'm not that familiar with muscle injuries .","For me , I 'm not that familiar with muscle injuries ."
pcc_eng_14_002.3003_x0021146_10:1-2-3,that,familiar,that_familiar,not,not_that_familiar,not that familiar with this style but i have,Not that familiar with this style but I have found that rye is really appealing to me in general .
pcc_eng_28_046.0717_x0729323_42:24-25-26,that,familiar,that_familiar,not,not_that_familiar,food item that i am just not that familiar with .,"I 've learned so much by reading your search for the mediteranean wrap , which is a food item that I am just not that familiar with ."
nyt_eng_20001022_0159_33:26-27-28,that,familiar,that_familiar,not,not_that_familiar,"he said , `` i 'm not that familiar with the older americans act .","asked about reauthorizing the Older Americans Act , which provides meals , health and transportation for the elderly , he said , `` I 'm not that familiar with the Older Americans Act . ''"
nyt_eng_19990117_0192_20:7-8-9,that,familiar,that_familiar,not,not_that_familiar,"`` for young people who are not that familiar with it , '' mccadden said","`` For young people who are not that familiar with it , '' McCadden said , `` it sounds faintly ` retro ' but at the same time new ."
pcc_eng_19_048.8500_x0772254_29:15-17-18,that,familiar,that_familiar,not,not_that_familiar,"portugal , you probably are not all that familiar with this breed and its very","I realise that as the breed is rare in Portugal , you probably are not all that familiar with this breed and its very serious health problems , but until Pedigree Dogs Exposed , there was widespread denial that SM was anything more than a very rare disease ( some national breed clubs were stating until recently that fewer than 1 % of cavaliers had it -- utter nonsense ! ) , and while clubs paid lip service to working to eradicate MVD , the reality is that they did -- and still do -- very little that is concrete ."
pcc_eng_15_005.1986_x0067696_14:4-5-6,that,familiar,that_familiar,not,not_that_familiar,"i 'm actually not that familiar with weber or his followers ,","I 'm actually not that familiar with Weber or his followers , so I do n't know if any of them have extended this concept to "" international law "" as well ."
pcc_eng_19_043.4019_x0684596_176:3-4-5,that,familiar,that_familiar,not,not_that_familiar,"i 'm not that familiar with his work , but for","I 'm not that familiar with his work , but for the most part it 's pretty cool ."
pcc_eng_02_031.0385_x0486198_086:4-5-6,that,familiar,that_familiar,not,not_that_familiar,"if you 're not that familiar with a plan , see if","If you 're not that familiar with a plan , see if it 's possible to avoid a long-term commitment ."
pcc_eng_09_094.4382_x1511826_4:3-4-5,that,familiar,that_familiar,not,not_that_familiar,"i am not that familiar with it , having lived in","I am not that familiar with it , having lived in the Pacific NW all my life !"
nyt_eng_19990208_0432_12:08-10-11,that,familiar,that_familiar,not,not_that_familiar,of the players i had not been that familiar with .,`` Some of the players I had not been that familiar with .
pcc_eng_03_003.0765_x0033546_14:14-15-16,that,familiar,that_familiar,not,not_that_familiar,the text widget if you are not that familiar with html .,This makes it much easier to use the text widget if you are not that familiar with HTML .
pcc_eng_28_016.2210_x0246331_27:21-22-23,that,familiar,that_familiar,not,not_that_familiar,conspiracy theories especially if you 're not that familiar with her yet .,"And lastly you want to avoid talking to girls about politics , religion and conspiracy theories especially if you 're not that familiar with her yet ."
pcc_eng_01_090.2145_x1442543_32:3-4-5,that,familiar,that_familiar,not,not_that_familiar,i 'm not that familiar with huskies so i do n't,"I 'm not that familiar with huskies so I do n't know any particulars about them , but she may be asking you to go out in a much more subtle way ."
pcc_eng_03_081.6622_x1306292_3:3-4-5,that,familiar,that_familiar,not,not_that_familiar,i 'm not that familiar with this bird so i did,I 'm not that familiar with this bird so I did n't spot this .
pcc_eng_10_079.9853_x1276593_019:5-7-8,that,familiar,that_familiar,not,not_that_familiar,many of us are not all that familiar with fasting and it appears that,Many of us are not all that familiar with fasting and it appears that not many Korean EM churches are encouraging fasting .
pcc_eng_08_072.2829_x1154162_20:5-6-7,that,familiar,that_familiar,not,not_that_familiar,"even if you 're not that familiar with art , you probably know","Even if you 're not that familiar with art , you probably know what Andy Warhol 's Campbell 's Soup cans look like ."
pcc_eng_20_030.0508_x0469674_37:10-11-12,that,familiar,that_familiar,not,not_that_familiar,"that , each discipline typically is not that familiar with even the visualization of the","On top of that , each discipline typically is not that familiar with even the visualization of the other ."
