hit_id,bigram_lower,adj_form_lower,all_forms_lower,adv_form_lower,text_window,token_str
pcc_eng_12_026.0568_x0405384_04:11-12,remotely_funny,funny,(+)_remotely_funny,remotely,the hunt for anyone who finds him remotely funny .,We 're on the hunt for anyone who finds him remotely funny .
pcc_eng_00_095.0026_x1520146_43:6-7,remotely_funny,funny,(+)_remotely_funny,remotely,how can you find anything remotely funny about a marker of a 6,How can you find anything remotely funny about a marker of a 6 year old ?
pcc_eng_27_098.0893_x1570404_2:13-14,remotely_funny,funny,(+)_remotely_funny,remotely,"2019 arts in reach winter showcase , remotely funny !","Please join us for the 2019 Arts In Reach Winter Showcase , Remotely Funny !"
pcc_eng_00_099.0120_x1585219_055:16-17,remotely_funny,funny,(+)_remotely_funny,remotely,addition to your inability to say anything remotely funny or interesting to the person you,"But what is it like when , in addition to your inability to say anything remotely funny or interesting to the person you are into , you have a mental health problem as well ?"
pcc_eng_04_056.4892_x0896164_07:6-7,remotely_funny,funny,(+)_remotely_funny,remotely,"if you think this is remotely funny , there is something seriously wrong","If you think this is remotely funny , there is something seriously wrong with you ."
nyt_eng_20071206_0126_10:4-5,remotely_funny,funny,(+)_remotely_funny,remotely,and the only remotely funny joke is a racist one .,and the only remotely funny joke is a racist one .
