hit_id,context_group,colloc,adv,adj,sent_text,sent_id,adv_index,json_source,prev_sent,next_sent,corpus_segment,corpus,date,polarity,context,context_word,context_type,in_basic,line_in_source,year,context_overlap
nyt_eng_19950119_0197_1:16,outdated_input_file,about_impossible,about,impossible,The prison drama is such a limited and overworked movie genre that it 's just about impossible for filmmakers to do anything new with it -- and even worthy efforts like  -LBQ-  The Shawshank Redemption  -RDQ-  invariably tend to be collections of bits and pieces of movies we 've already seen .,nyt_eng_19950119_0197_1,16,,,,nyt_eng_19950119,Nyt1-old,1995-01-19,positive,be-ADV-ADJ_positive,be-ADV-ADJ,basic,True,43892,1995,False
nyt_eng_19950423_0004_60:11,outdated_input_file,about_right,about,right,"It Watkins catches four passes a year , that 's about right .  -RDQ-",nyt_eng_19950423_0004_60,11,,,,nyt_eng_19950423,Nyt1-old,1995-04-23,positive,be-ADV-ADJ_positive,be-ADV-ADJ,basic,True,69279,1995,False
apw_eng_20030316_0626_4:6,neg-ext-nonsubj,absolutely_certain,absolutely,certain,"-LBQ-  I ca n't be absolutely certain of it , it depends on events as they unfold but the sequence has always been the situation crystallizing one way or the other in New York .  -RDQ-",apw_eng_20030316_0626_4,6,apw_eng_200303,"A Cabinet meeting  -LBQ-  will be sometime early this week ,  -RDQ-  he said .","-LBQ-  We 've put ourselves in the position to make the commitment ,  -RDQ-  he said .",apw_eng_20030316,Apw,2003-03-16,negative,not_VP-adv,not,VP-adv,False,63749,2003,False
nyt_eng_19961209_0558_27:4,outdated_input_file,absolutely_convinced,absolutely,convinced,"-LBQ-  People are absolutely convinced of his innocence ,  -RDQ-  Valencia said .",nyt_eng_19961209_0558_27,4,,,,nyt_eng_19961209,Nyt1-old,1996-12-09,positive,be-ADV-ADJ_positive,be-ADV-ADJ,basic,True,264688,1996,False
nyt_eng_19960411_0595_28:18,outdated_input_file,absolutely_critical,absolutely,critical,"Treasury Secretary Robert Rubin said the legislative proposal would increase savings , which he maintained is  -LBQ-  absolutely critical to continuing and improving upon the strong economic performance .  -RDQ-",nyt_eng_19960411_0595_28,18,,,,nyt_eng_19960411,Nyt1-old,1996-04-11,positive,be-ADV-ADJ_positive,be-ADV-ADJ,basic,True,186822,1996,False
nyt_eng_19970131_0494_53:4,neg-ext-subj,absolutely_foolproof,absolutely,foolproof,"No technology is absolutely foolproof , but if anybody tells you ABS is n't worth having , he or she is telling you wrong .",nyt_eng_19970131_0494_53,4,nyt_eng_199701,"In snow and icy conditions , ABS can save a lot of body work .",ABS is one option that should be standard equipment .,nyt_eng_19970131,Nyt1,1997-01-31,negative,no_subj-det,no,subj-det,False,455,1997,False
nyt_eng_19980115_0542_2:24,outdated_input_file,absolutely_imperative,absolutely,imperative,"-LBQ-  The disturbing news that a major tobacco company appears to have targeted children  -RDQ-  demonstrates  -LBQ-  more than ever that it is absolutely imperative that Congress take action now ,  -RDQ-  Clinton said .",nyt_eng_19980115_0542_2,24,,,,nyt_eng_19980115,Nyt1-old,1998-01-15,positive,be-ADV-ADJ_positive,be-ADV-ADJ,basic,True,402921,1998,False
nyt_eng_19970108_0024_28:8,outdated_input_file,absolutely_ludicrous,absolutely,ludicrous,"-LBQ-  Recruiting in its present state is absolutely ludicrous ,  -RDQ-  Brown went on .",nyt_eng_19970108_0024_28,8,,,,nyt_eng_19970108,Nyt1-old,1997-01-08,positive,be-ADV-ADJ_positive,be-ADV-ADJ,basic,True,273838,1997,False
nyt_eng_19951017_0723_10:12,outdated_input_file,absolutely_powerless,absolutely,powerless,"-LBQ-  It 's a song and dance , and you are absolutely powerless .",nyt_eng_19951017_0723_10,12,,,,nyt_eng_19951017,Nyt1-old,1995-10-17,positive,be-ADV-ADJ_positive,be-ADV-ADJ,basic,True,126248,1995,False
nyt_eng_19980203_0074_23:9,outdated_input_file,absolutely_screwy,absolutely,screwy,Her performance is as courageous as it is absolutely screwy -LRB- coming soon to a drag club near you  -COL-  a slew of Ms. Dinsmoors -RRB- .,nyt_eng_19980203_0074_23,9,,,,nyt_eng_19980203,Nyt1-old,1998-02-03,positive,be-ADV-ADJ_positive,be-ADV-ADJ,basic,True,409190,1998,False
nyt_eng_20060123_0082_25:14,neg-ext-nonsubj,all_new,all,new,The idea of training people by using feedback from brain activity is not all new .,nyt_eng_20060123_0082_25,14,nyt_eng_200601,"It does seem , Mackey said , that the subjects  -LBQ-  really learned to control their brain and , through that , their pain .  -RDQ-","For years , pain clinics have offered biofeedback to help patients try to stem their suffering by learning to control physical functions like heart rate and breathing .",nyt_eng_20060123,Nyt2,2006-01-23,negative,not_VP-adv,not,VP-adv,False,32384,2006,False
nyt_eng_19960731_0615_2:11,outdated_input_file,all_relative,all,relative,"To the New York Giants , though , it is all relative .",nyt_eng_19960731_0615_2,11,,,,nyt_eng_19960731,Nyt1-old,1996-07-31,positive,be-ADV-ADJ_positive,be-ADV-ADJ,basic,True,221159,1996,False
nyt_eng_19970516_0632_12:8,outdated_input_file,all_thirtysomething,all,thirtysomething,"Olajuwon , Barkley and Clyde Drexler are all thirtysomething and wondering how to get Barkley a ring once and for all .",nyt_eng_19970516_0632_12,8,,,,nyt_eng_19970516,Nyt1-old,1997-05-16,positive,be-ADV-ADJ_positive,be-ADV-ADJ,basic,True,318339,1997,False
nyt_eng_19960329_0362_16:9,outdated_input_file,almost_abject,almost,abject,In most of these Everding 's failure was almost abject .,nyt_eng_19960329_0362_16,9,,,,nyt_eng_19960329,Nyt1-old,1996-03-29,positive,be-ADV-ADJ_positive,be-ADV-ADJ,basic,True,182406,1996,False
nyt_eng_19960912_0348_17:17,outdated_input_file,almost_impossible,almost,impossible,"The three-member majority , for instance , said in a statement that it would be  -LBQ-  almost impossible  -RDQ-  for a rival to create a highly successful cable programming channel , if it could n't get the program on Time Warner or TCI cable systems , which together serve about 40 percent of the market .",nyt_eng_19960912_0348_17,17,,,,nyt_eng_19960912,Nyt1-old,1996-09-12,positive,be-ADV-ADJ_positive,be-ADV-ADJ,basic,True,234724,1996,False
nyt_eng_19950227_0465_7:11,outdated_input_file,almost_impossible,almost,impossible,"But in practice , she said , it can be almost impossible to predict .",nyt_eng_19950227_0465_7,11,,,,nyt_eng_19950227,Nyt1-old,1995-02-27,positive,be-ADV-ADJ_positive,be-ADV-ADJ,basic,True,54052,1995,False
nyt_eng_19960803_0028_30:5,outdated_input_file,almost_over,almost,over,Their year together is almost over .,nyt_eng_19960803_0028_30,5,,,,nyt_eng_19960803,Nyt1-old,1996-08-03,positive,be-ADV-ADJ_positive,be-ADV-ADJ,basic,True,222135,1996,False
nyt_eng_19950604_0054_14:8,outdated_input_file,almost_synonymous,almost,synonymous,"According to Webster 's , it is almost synonymous with wary moderation  -COL-   -LBQ-  something portioned out or distributed , usually grudgingly .  -RDQ-",nyt_eng_19950604_0054_14,8,,,,nyt_eng_19950604,Nyt1-old,1995-06-04,positive,be-ADV-ADJ_positive,be-ADV-ADJ,basic,True,81851,1995,False
nyt_eng_19961015_0576_1:4,outdated_input_file,already_fierce,already,fierce,International competition was already fierce enough in the mid-1980 's to prompt Federal Reserve policymakers to wonder at the divergence between labor costs and inflation .,nyt_eng_19961015_0576_1,4,,,,nyt_eng_19961015,Nyt1-old,1996-10-15,positive,be-ADV-ADJ_positive,be-ADV-ADJ,basic,True,246326,1996,False
nyt_eng_19970703_0046_19:11,outdated_input_file,also_apparent,also,apparent,The new spirit of cooperation between management and staff is also apparent in wage negotiations .,nyt_eng_19970703_0046_19,11,,,,nyt_eng_19970703,Nyt1-old,1997-07-03,positive,be-ADV-ADJ_positive,be-ADV-ADJ,basic,True,334464,1997,False
nyt_eng_19960916_0310_33:19,outdated_input_file,also_clear,also,clear,"And , despite indications that many Americans still believe he committed a brutal double slaying , it is also clear he believes deeply in his ability to persuade people of his innocence .",nyt_eng_19960916_0310_33,19,,,,nyt_eng_19960916,Nyt1-old,1996-09-16,positive,be-ADV-ADJ_positive,be-ADV-ADJ,basic,True,235855,1996,False
nyt_eng_19960523_0583_11:29,outdated_input_file,also_emblematic,also,emblematic,The meltdown of the San Francisco Housing Authority _ it was taken over by the team from the Department of Housing and Urban Development in March _ is also emblematic of nearly a dozen such authorities whose mismanaged properties have helped blacken the tarnished image of public housing .,nyt_eng_19960523_0583_11,29,,,,nyt_eng_19960523,Nyt1-old,1996-05-23,positive,be-ADV-ADJ_positive,be-ADV-ADJ,basic,True,201761,1996,False
nyt_eng_19970610_0583_21:9,outdated_input_file,also_hymns,also,hymns,"-LBQ-  In that sense , the songs are also hymns .",nyt_eng_19970610_0583_21,9,,,,nyt_eng_19970610,Nyt1-old,1997-06-10,positive,be-ADV-ADJ_positive,be-ADV-ADJ,basic,True,326721,1997,False
nyt_eng_19960508_1323_22:13,outdated_input_file,also_meandering,also,meandering,"If  -LBQ-  Under the Domim Tree  -RDQ-  is touching , it is also meandering and narratively diffuse .",nyt_eng_19960508_1323_22,13,,,,nyt_eng_19960508,Nyt1-old,1996-05-08,positive,be-ADV-ADJ_positive,be-ADV-ADJ,basic,True,196861,1996,False
nyt_eng_19980202_0362_20:10,outdated_input_file,also_mine,also,mine,"Some even call out her name , which is also mine , from across the street  -COL-   -LBQ-  Mirta , what are you doing here ? You 've come back ?  -RDQ-",nyt_eng_19980202_0362_20,10,,,,nyt_eng_19980202,Nyt1-old,1998-02-02,positive,be-ADV-ADJ_positive,be-ADV-ADJ,basic,True,409064,1998,False
nyt_eng_19951119_0047_10:3,outdated_input_file,also_revered,also,revered,"He is also revered as the person who understands computer technology best , at a time when just about everybody else is still trying to figure out how to get their CD-ROM to play .",nyt_eng_19951119_0047_10,3,,,,nyt_eng_19951119,Nyt1-old,1995-11-19,positive,be-ADV-ADJ_positive,be-ADV-ADJ,basic,True,137494,1995,False
nyt_eng_19950723_0151_2:5,outdated_input_file,also_uncertain,also,uncertain,The 1999 festival is also uncertain .,nyt_eng_19950723_0151_2,5,,,,nyt_eng_19950723,Nyt1-old,1995-07-23,positive,be-ADV-ADJ_positive,be-ADV-ADJ,basic,True,98133,1995,False
nyt_eng_19951009_0249_42:15,outdated_input_file,also_weak,also,weak,"The evidence against him was proven weak , but the defense conspiracy theory was also weak .",nyt_eng_19951009_0249_42,15,,,,nyt_eng_19951009,Nyt1-old,1995-10-09,positive,be-ADV-ADJ_positive,be-ADV-ADJ,basic,True,123091,1995,False
nyt_eng_19960127_0155_30:6,outdated_input_file,also_willing,also,willing,"Unlike Graf , she is also willing to attack the net with regularity .",nyt_eng_19960127_0155_30,6,,,,nyt_eng_19960127,Nyt1-old,1996-01-27,positive,be-ADV-ADJ_positive,be-ADV-ADJ,basic,True,160295,1996,False
nyt_eng_19960911_0380_14:13,outdated_input_file,always_crowded,always,crowded,THE  -LBQ-  CRISIS  -RDQ-  MEETINGS of Malden Mill 's top managers are always crowded and always in the same place  -COL-  the fourth floor conference room in Building 30 .,nyt_eng_19960911_0380_14,13,,,,nyt_eng_19960911,Nyt1-old,1996-09-11,positive,be-ADV-ADJ_positive,be-ADV-ADJ,basic,True,234344,1996,False
nyt_eng_19950227_0524_33:16,outdated_input_file,always_difficult,always,difficult,"I lived through a segregated society , and each time change came about it was always difficult .  -RDQ-",nyt_eng_19950227_0524_33,16,,,,nyt_eng_19950227,Nyt1-old,1995-02-27,positive,be-ADV-ADJ_positive,be-ADV-ADJ,basic,True,54081,1995,False
apw_eng_19970319_0860_2:7,neg-ext-nonsubj,always_french,always,french,"The new Paris woman is not always French , as Suzie Wong of China and Mongolian-inspired luxury fashions took the spotlight at Ungaro , Kenzo , and Dior .",apw_eng_19970319_0860_2,7,apw_eng_199703,"Showbiz , funny biz and just plain business fought it out in a killer marathon series of nearly 100 shows for fall ready-to-wear this year .","Dior 's John Galliano , a Gibraltar-born Englishman , got lavish praise for his own line _ less for the clothes than the style of show .",apw_eng_19970319,Apw,1997-03-19,negative,not_VP-adv,not,VP-adv,False,11317,1997,False
nyt_eng_20050821_0076_34:4,neg-ext-nonsubj,always_interested,always,interested,Elkarra was n't always interested in Muslims ' rights .,nyt_eng_20050821_0076_34,4,nyt_eng_200508,-LBQ-  I just wish more people knew about Islam -- especially before they start criticizing it .  -RDQ-,"Growing up in San Francisco , he attended mosque every week and prayed with his family , but he was more concerned about improving his jump shot than reading the Quran .",nyt_eng_20050821,Nyt2,2005-08-21,negative,not_VP-adv,not,VP-adv,False,86723,2005,False
nyt_eng_19970809_0167_47:3,outdated_input_file,always_proud,always,proud,"I was always proud of her , out there fighting the good fight .  -RDQ-",nyt_eng_19970809_0167_47,3,,,,nyt_eng_19970809,Nyt1-old,1997-08-09,positive,be-ADV-ADJ_positive,be-ADV-ADJ,basic,True,347030,1997,False
nyt_eng_20100715_0012_9:17,neg-ext-nonsubj,always_right,always,right,"-LBQ-  One thing I 've noticed in the last few days is that forecasts are not always right , so we 'll have to wait and see .  -RDQ-",nyt_eng_20100715_0012_9,17,nyt_eng_201007,I think we 're pleased with getting the winds from a number of different directions .,"As it happened , the Scottish weather on Wednesday was nastier and more persistent than anyone expected , raining out the planned four-hole exhibition match that was to feature seven long-retired Open champions , with 20 other past Open winners , some active and some retired .",nyt_eng_20100715,Nyt2,2010-07-15,negative,not_VP-adv,not,VP-adv,False,10993,2010,False
nyt_eng_19940929_0205_15:17,outdated_input_file,annoyingly_imprecise,annoyingly,imprecise,"Although the manual drew less attention to the Legacy 's power shortage , the shifter was annoyingly imprecise , making it hard to tell what gear the car was in .",nyt_eng_19940929_0205_15,17,,,,nyt_eng_19940929,Nyt1-old,1994-09-29,positive,be-ADV-ADJ_positive,be-ADV-ADJ,basic,True,20081,1994,False
nyt_eng_19950323_0392_13:14,outdated_input_file,apparently_mutual,apparently,mutual,"The late superstar was an idol of the singer ; the feeling was apparently mutual , judging from a passage in Torme 's 1988 autobiography ,  -LBQ-  It Was n't All Velvet .  -RDQ-",nyt_eng_19950323_0392_13,14,,,,nyt_eng_19950323,Nyt1-old,1995-03-23,positive,be-ADV-ADJ_positive,be-ADV-ADJ,basic,True,60641,1995,False
nyt_eng_19990107_0378_13:5,neg-ext-nonsubj,as_advanced,as,advanced,"The NBA is not as advanced in its scheduling as many had hoped , but the league said it would be able to play its 50 - to 52-game schedule by going to four games a week , up one-half game from the norm .",nyt_eng_19990107_0378_13,5,nyt_eng_199901,He said the two sides are united in efforts to win back fans and it would be done  -LBQ-  if we work hard .  -RDQ-,"There will be some strings of three games in as many days , but they will be kept to a minimum .",nyt_eng_19990107,Nyt1,1999-01-07,negative,not_VP-adv,not,VP-adv,False,43456,1999,False
nyt_eng_19970618_0789_41:17,outdated_input_file,as_all-american,as,all-american,Most self-serving quote from their press kit  -COL-   -LBQ-  Burnin ' Daylight 's musical influences are as all-American as their name _ it came from a line in a John Wayne movie .  -RDQ-,nyt_eng_19970618_0789_41,17,,,,nyt_eng_19970618,Nyt1-old,1997-06-18,positive,be-ADV-ADJ_positive,be-ADV-ADJ,basic,True,328989,1997,False
nyt_eng_19950920_0128_11:3,outdated_input_file,as_alphabetical,as,alphabetical,"They are as alphabetical as a desk drawer , an orderly world , easier this way for one to get what one seeks .",nyt_eng_19950920_0128_11,3,,,,nyt_eng_19950920,Nyt1-old,1995-09-20,positive,be-ADV-ADJ_positive,be-ADV-ADJ,basic,True,117067,1995,False
nyt_eng_19971215_0732_8:3,outdated_input_file,as_amusing,as,amusing,"Barney is as amusing _ and often as incorrigible _ a character as earlier Richler heroes , but he 's also a little older and wiser .",nyt_eng_19971215_0732_8,3,,,,nyt_eng_19971215,Nyt1-old,1997-12-15,positive,be-ADV-ADJ_positive,be-ADV-ADJ,basic,True,392603,1997,False
nyt_eng_20010809_0090_26:14,neg-ext-nonsubj,as_bad,as,bad,"-LBQ-  And if that 's so bad , well , it 's not as bad as the false intellectualism that makes the careers of the truly fashionable .",nyt_eng_20010809_0090_26,14,nyt_eng_200108,This is what I 've done .  -RDQ-,"People like Boulez , whose works , for me , are unreadable .",nyt_eng_20010809,Nyt2,2001-08-09,negative,not_VP-adv,not,VP-adv,False,19273,2001,False
nyt_eng_19950821_0056_28:10,outdated_input_file,as_bad,as,bad,"Luckily for the Cards , the Bears were just as bad .",nyt_eng_19950821_0056_28,10,,,,nyt_eng_19950821,Nyt1-old,1995-08-21,positive,be-ADV-ADJ_positive,be-ADV-ADJ,basic,True,107753,1995,False
apw_eng_20050120_1240_11:22,neg-ext-nonsubj,as_bearish,as,bearish,"-LBQ-  This says to me that while we had a very volatile day and inventories rose , the prices were n't as bearish as one would expect , says Jason Schenker , an analyst for Wachovia Corp. in Charlotte , North Carolina .",apw_eng_20050120_1240_11,22,apw_eng_200501,"The market spent most of the day continuing to digest largely bearish inventory data , released late Wednesday , that showed bigger-than-expected increases in crude and refined-product stocks .","-LBQ-  I think that people expected prices would drop further , and they did n't .  -RDQ-",apw_eng_20050120,Apw,2005-01-20,negative,not_VP-adv,not,VP-adv,False,15742,2005,False
nyt_eng_20021016_0068_10:22,neg-ext-nonsubj,as_bleak,as,bleak,"Georgia State Law School professor Marjorie Fine Knowles says the picture of women 's performance at the top may not be as bleak as it seems , since we have yet to reach a critical mass of women in such positions .",nyt_eng_20021016_0068_10,22,nyt_eng_200210,"In Georgia , no scandals swirl around women CEOs , but since only four of the 190 corporate chiefs are female , it 's hardly a fair sample .","What about corporate boards , though _ would n't women be better watchdogs ? They 're not insiders , that 's for sure .",nyt_eng_20021016,Nyt2,2002-10-16,negative,not_VP-adv,not,VP-adv,False,33600,2002,False
nyt_eng_20001023_0199_33:23,neg-ext-nonsubj,as_captivating,as,captivating,"While these chapters may be instructive for those who seek to understand the mechanics of international economics , they are not nearly as captivating as the tales of ancient pillage and plunder .",nyt_eng_20001023_0199_33,23,nyt_eng_200010,"Indeed , the last hundred pages of Bernstein 's book are dominated by his discussion of the decline of the gold standard .",,nyt_eng_20001023,Nyt2,2000-10-23,negative,not_VP-adv,not,VP-adv,False,12114,2000,False
nyt_eng_19950102_0042_11:3,outdated_input_file,as_close,as,close,They are as close as you can get to asking writers of the Constitution why they wrote it they way they did .,nyt_eng_19950102_0042_11,3,,,,nyt_eng_19950102,Nyt1-old,1995-01-02,positive,be-ADV-ADJ_positive,be-ADV-ADJ,basic,True,39907,1995,False
nyt_eng_19960513_0129_38:10,neg-ext-nonsubj,as_close,as,close,The AFA 's Rushing says the vote was n't as close as it looked .,nyt_eng_19960513_0129_38,10,nyt_eng_199605,"-LBQ-  When the vote is that close , I do n't think we really know what was wrong with it .  -RDQ-","Many newer attendants voted in favor of the contract , fearing negotiations under the Railway Labor Act would drag on for years and the wage issue would never get resolved , she said .",nyt_eng_19960513,Nyt1,1996-05-13,negative,not_VP-adv,not,VP-adv,True,703,1996,False
nyt_eng_19970906_0012_10:16,neg-ext-nonsubj,as_comfortable,as,comfortable,"Posada has essentially been Dwight Gooden 's personal catcher , and the Yankees are not as comfortable with him as with Girardi .",nyt_eng_19970906_0012_10,16,nyt_eng_199709,"Although Girardi and Manager Joe Torre sounded positive , Girardi 's absence is a serious problem for the Yankees because he is durable , experienced and adept at handling a fragile staff .","-LBQ-  You lose something when you lose Joe , no question about it ,  -RDQ-  Torre said .",nyt_eng_19970906,Nyt1,1997-09-06,negative,not_VP-adv,not,VP-adv,True,7511,1997,False
nyt_eng_19970903_0467_31:13,outdated_input_file,as_common,as,common,"In the Hispanic culture , tesitos , or herbal teas , are as common as Mexican rice and beans .",nyt_eng_19970903_0467_31,13,,,,nyt_eng_19970903,Nyt1-old,1997-09-03,positive,be-ADV-ADJ_positive,be-ADV-ADJ,basic,True,355139,1997,False
nyt_eng_19970802_0164_20:7,outdated_input_file,as_common,as,common,Thyroid cancer is about three times as common in women as in men and has been increasing in this country by 0.9 percent a year since 1973 .,nyt_eng_19970802_0164_20,7,,,,nyt_eng_19970802,Nyt1-old,1997-08-02,positive,be-ADV-ADJ_positive,be-ADV-ADJ,basic,True,344739,1997,False
nyt_eng_19950227_0368_16:65,outdated_input_file,as_confining,as,confining,"But Glenn Loury , a Boston University economics professor who perhaps best fit the mold of a  -LBQ-  public intellectual  -RDQ-  -- he was one of a group of black scholars who recently met with Vice President Al Gore and helped influence the administration 's strategy on affirmative action -- said that academics must resist falling into a neoconservative lockstep that would be just as confining as any liberal orthodoxy .",nyt_eng_19950227_0368_16,65,,,,nyt_eng_19950227,Nyt1-old,1995-02-27,positive,be-ADV-ADJ_positive,be-ADV-ADJ,basic,True,53966,1995,False
nyt_eng_19990903_0321_1:7,neg-ext-nonsubj,as_crowded,as,crowded,Nancy Fowler 's life is n't as crowded as it used to be .,nyt_eng_19990903_0321_1,7,nyt_eng_199909,,No longer do hundreds of thousands of visitors gather near her Conyers home to look heavenward in search of visions of the Virgin Mary .,nyt_eng_19990903,Nyt1,1999-09-03,negative,not_VP-adv,not,VP-adv,False,46790,1999,False
nyt_eng_19980413_0143_4:29,outdated_input_file,as_difficult,as,difficult,"While blacks and other minorities had , and in some instances still have , a difficult time breaking down white male barriers to these jobs , it was as difficult , if not moreso , for women .",nyt_eng_19980413_0143_4,29,,,,nyt_eng_19980413,Nyt1-old,1998-04-13,positive,be-ADV-ADJ_positive,be-ADV-ADJ,basic,True,430393,1998,False
nyt_eng_19960310_0153_28:6,neg-ext-subj,as_divisive,as,divisive,Perhaps no issue has been as divisive as outsourcing _ or shifting work to outside companies .,nyt_eng_19960310_0153_28,6,nyt_eng_199603,\* Outsourcing .,GM wants to make its core operations less dependent on its parts plants .,nyt_eng_19960310,Nyt1,1996-03-10,negative,no_subj-det,no,subj-det,False,623,1996,False
nyt_eng_19970910_0425_24:7,neg-ext-nonsubj,as_edible,as,edible,But the labels may not be as edible as Means makes them out to be .,nyt_eng_19970910_0425_24,7,nyt_eng_199709,-LBQ-  They 're edible .  -RDQ-,"Tom Gillespie , produce product manager at Cal Emblem Labels Inc. , a California company that designs and makes the labels for numerous produce growers , says the labels are made from different paper stocks , including a semigloss .",nyt_eng_19970910,Nyt1,1997-09-10,negative,not_VP-adv,not,VP-adv,True,7346,1997,False
nyt_eng_20041022_0165_15:32,neg-ext-nonsubj,as_funny,as,funny,"The exposition strains credibility with arbitrary jumps of logic and coincidental meetings , and the first two scenes -LRB- especially Leo and Jack 's  -LBQ-  show  -RDQ-  -RRB- simply are n't as funny as they should be .",nyt_eng_20041022_0165_15,32,nyt_eng_200410,"While sometimes amusing , his dialogue is seldom brilliant , and he settles for a few obvious lines the play could do without .","Yet once the main action and the masquerade are under way ,  -LBQ-  Leading Ladies  -RDQ-  is consistently funny -- indeed , increasingly hilarious as it progresses .",nyt_eng_20041022,Nyt2,2004-10-22,negative,not_VP-adv,not,VP-adv,False,39443,2004,False
nyt_eng_20040818_0156_70:5,neg-ext-nonsubj,as_good,as,good,"It 's not nearly as good as Apple 's iChat , which offers a still bigger , smoother , clearer picture and never costs anything .",nyt_eng_20040818_0156_70,5,nyt_eng_200408,"The video is far superior to the tiny , jerky , time-delayed effect of the IM chat programs and programs like Windows Messenger .","But SightSpeed is available for Mac and Windows , and permits video calls between them .",nyt_eng_20040818,Nyt2,2004-08-18,negative,not_VP-adv,not,VP-adv,False,13869,2004,False
nyt_eng_19980311_0118_21:9,outdated_input_file,as_good,as,good,"And while only half thought adoption was  -LBQ-  as good as having one 's own child ,  -RDQ-  90 percent had a positive view of the process .",nyt_eng_19980311_0118_21,9,,,,nyt_eng_19980311,Nyt1-old,1998-03-11,positive,be-ADV-ADJ_positive,be-ADV-ADJ,basic,True,419602,1998,False
apw_eng_19950318_0242_11:7,neg-ext-nonsubj,as_hardline,as,hardline,"While the Baku government is not as hardline as the Central Asian states of Turkmenistan and Uzbekistan across the Caspian Sea ,  -LBQ-  the symptoms are there ,  -RDQ-  said Shavadoglu .",apw_eng_19950318_0242_11,7,apw_eng_199503,"He added that a party district leader , Faramaz Abdulayev-Alakhverdi , was recently jailed for an article he wrote to the satirical newspaper Zheshmeh .","At the height of the fight Friday to suppress the rebellion , some 2,000 government troops stormed the barracks where some 600 mutinous police had refused Aliev 's demand to disarm and surrender .",apw_eng_19950318,Apw,1995-03-18,negative,not_VP-adv,not,VP-adv,False,28822,1995,False
nyt_eng_19970530_0353_24:14,outdated_input_file,as_high,as,high,"Some REIT officials expect by 2001 the market value of REITs could be as high as $ 250 billion , with the industry eventually dominated by 15 to 25 large , national companies .",nyt_eng_19970530_0353_24,14,,,,nyt_eng_19970530,Nyt1-old,1997-05-30,positive,be-ADV-ADJ_positive,be-ADV-ADJ,basic,True,322958,1997,False
