hit_id,context_group,colloc,adv,adj,sent_text,sent_id,adv_index,json_source,prev_sent,next_sent,corpus_segment,corpus,date,polarity,context,context_word,context_type,in_basic,line_in_source,year,context_overlap
nyt_eng_19960414_0075_58:4,outdated_input_file,so_sick,so,sick,"Some locals are so sick of winter weather -LRB- particularly now that it 's April -RRB- that they 've taken to sending death threats to the national groundhog , Wiarton Willie , who erroneously forecast an early thaw .",nyt_eng_19960414_0075_58,4,,,,nyt_eng_19960414,Nyt1-old,1996-04-14,positive,be-ADV-ADJ_positive,be-ADV-ADJ,basic,True,187660,1996,False
nyt_eng_19970607_0069_14:6,outdated_input_file,so_simple,so,simple,But the question is not so simple as it sounds at first .,nyt_eng_19970607_0069_14,6,,,,nyt_eng_19970607,Nyt1-old,1997-06-07,positive,be-ADV-ADJ_positive,be-ADV-ADJ,basic,True,325700,1997,False
nyt_eng_19960508_0729_15:9,neg-ext-nonsubj,so_simple,so,simple,"One of the newest books that is n't so simple , especially for those of us who do n't do much shopping at the health food stores , is  -LBQ-  366 Healthful Ways to Cook Tofu and Other Meat Alternatives  -RDQ-  by Robin Robertson -LRB- Plume\/Penguin , $ 15.95 -RRB- .",nyt_eng_19960508_0729_15,9,nyt_eng_199605,The recipes are easy to follow and relatively simple .,"This paperback promises  -LBQ-  hearty roasts with all the trimmings , succulent burgers and rich stews ,  -RDQ-  all with meat alternatives .",nyt_eng_19960508,Nyt1,1996-05-08,negative,not_VP-adv,not,VP-adv,True,847,1996,False
nyt_eng_20000306_0211_6:9,neg-ext-nonsubj,so_simple,so,simple,"Nowadays , though , things are not quite so simple .",nyt_eng_20000306_0211_6,9,nyt_eng_200003,"Terrorists they used to be , of course .","In 1996 , after a spate of Israeli air raids had killed some 200 Lebanese civilians , both the Israeli army and Hezbollah , its chief adversary in southern Lebanon , agreed to restrict their battles to uninhabited areas .",nyt_eng_20000306,Nyt2,2000-03-06,negative,not_VP-adv,not,VP-adv,False,92543,2000,False
nyt_eng_19980324_0525_17:4,outdated_input_file,so_small,so,small,"-LBQ-  They are so small sometimes the MRI does not see them ,  -RDQ-  said Dodgers chief orthopedist Frank Jobe , who is with the team in Vero Beach .",nyt_eng_19980324_0525_17,4,,,,nyt_eng_19980324,Nyt1-old,1998-03-24,positive,be-ADV-ADJ_positive,be-ADV-ADJ,basic,True,424134,1998,False
nyt_eng_19990612_0039_29:4,neg-ext-nonsubj,so_sure,so,sure,I 'm not so sure it 's as out of hand as it may seem to be .,nyt_eng_19990612_0039_29,4,nyt_eng_199906,It 's a situation I 'll deal with .,This is a regrettable situation that I think can go away as quickly as it came .  -RDQ-,nyt_eng_19990612,Nyt1,1999-06-12,negative,not_VP-adv,not,VP-adv,False,19481,1999,False
nyt_eng_19951107_0541_15:18,neg-ext-nonsubj,so_sure,so,sure,"Now , three years after he shook the firmament with aggressive betting opportunities , he is n't so sure .",nyt_eng_19951107_0541_15,18,nyt_eng_199511,"Handel may not be Svengali , but he operates across the river from New York City and its two tracks and its mammoth off-track betting system , and he prospers .",He also does n't buy the view that simulcasting is the salvation of the business .,nyt_eng_19951107,Nyt1,1995-11-07,negative,not_VP-adv,not,VP-adv,True,50892,1995,False
nyt_eng_19990712_0440_21:6,neg-ext-nonsubj,so_tired,so,tired,"Mentally , I 'm not so tired yet .",nyt_eng_19990712_0440_21,6,nyt_eng_199907,"-LBQ-  I have no injuries , but I have n't been playing .",But it 's very demanding traveling to tournaments .,nyt_eng_19990712,Nyt1,1999-07-12,negative,not_VP-adv,not,VP-adv,False,40439,1999,False
nyt_eng_19980623_0518_17:6,neg-ext-nonsubj,so_tolerant,so,tolerant,"But he was n't always so tolerant , or so naive as to ignore the political value of expressing outrage , especially during campaigns .",nyt_eng_19980623_0518_17,6,nyt_eng_199806,And it is also possible that he has gradually learned to try to contain the insults by responding coolly .,"Few in New York politics have forgotten the painful lesson learned by Robert Abrams , then the attorney general , after he called Sen. Alfonse D'Amato a fascist toward the end of the 1992 senatorial campaign .",nyt_eng_19980623,Nyt1,1998-06-23,negative,not_VP-adv,not,VP-adv,False,62060,1998,False
nyt_eng_20080125_0233_54:4,neg-ext-nonsubj,so_toxic,so,toxic,Tiki is not so toxic and Shockey not so suffocating .,nyt_eng_20080125_0233_54,4,nyt_eng_200801,"At the end of the night , fans may wish Barber and Shockey had been there to provide much-needed answers .",Let 's just say the Giants have benefited from good timing and leave it at that .,nyt_eng_20080125,Nyt2,2008-01-25,negative,not_VP-adv,not,VP-adv,False,81207,2008,False
nyt_eng_19941022_0183_24:8,outdated_input_file,so_unhappy,so,unhappy,"After the cease-fire , the Saudis were so unhappy with the outcome that they proposed a secret plan to arm Iraqi Shiite insurgents , and one top U.S. Army general developed a secret contingency plan for U.S. tanks to roll north to Baghdad -- a project quickly shut down by his appalled superiors .",nyt_eng_19941022_0183_24,8,,,,nyt_eng_19941022,Nyt1-old,1994-10-22,positive,be-ADV-ADJ_positive,be-ADV-ADJ,basic,True,25213,1994,False
nyt_eng_19971206_0151_5:11,outdated_input_file,so_voluminous,so,voluminous,"Such reports are standard in crash investigations but these are so voluminous that for the first time , they will be distributed on CD-ROM .",nyt_eng_19971206_0151_5,11,,,,nyt_eng_19971206,Nyt1-old,1997-12-06,positive,be-ADV-ADJ_positive,be-ADV-ADJ,basic,True,389486,1997,False
nyt_eng_20021202_0127_24:4,neg-ext-nonsubj,so_well-suited,so,well-suited,"It 's not so well-suited , though , to treat the residual neck injury that can have repercussions from a person 's shoulders to his feet .",nyt_eng_20021202_0127_24,4,nyt_eng_200212,"American medicine is  -LBQ-  second to none  -RDQ-  for saving the life of someone who 's hit by a car , what Firor calls  -LBQ-  rescue care .  -RDQ-","-LBQ-  What we have is a fragmented system ,  -RDQ-  the specialization so distinct that when a colleague told a skin doctor about the itch up in his eye , the dermatologist said he 'd have to see an eye doctor for that .",nyt_eng_20021202,Nyt2,2002-12-02,negative,not_VP-adv,not,VP-adv,False,6640,2002,False
nyt_eng_20010302_0138_15:8,neg-ext-nonsubj,solely_responsible,solely,responsible,"-LBQ-  See Spot Run  -RDQ-  is n't solely responsible for the dumbing down of movies , but it 's part of the dismal phenomenon .",nyt_eng_20010302_0138_15,8,nyt_eng_200103,"Arquette 's overwound attempts at goofiness are n't liberating , only enervating .",Jay Carr can be e-mailed at jcarr -LRB- at -RRB- globe.com .,nyt_eng_20010302,Nyt2,2001-03-02,negative,not_VP-adv,not,VP-adv,False,79550,2001,False
nyt_eng_19950605_0660_21:19,outdated_input_file,solely_responsible,solely,responsible,"Excuse me , but I thought that was the job of the head coach , who is almost solely responsible for shaping the philosophy and personality of a team .",nyt_eng_19950605_0660_21,19,,,,nyt_eng_19950605,Nyt1-old,1995-06-05,positive,be-ADV-ADJ_positive,be-ADV-ADJ,basic,True,82407,1995,False
nyt_eng_19970106_0346_27:6,outdated_input_file,sometimes_incoherent,sometimes,incoherent,"By late 1994 he was sometimes incoherent in class -LRB- he had taught at Boston University for years -RRB- , and even on the air , but still refused to listen to friends ' urging that he check into a hospital .",nyt_eng_19970106_0346_27,6,,,,nyt_eng_19970106,Nyt1-old,1997-01-06,positive,be-ADV-ADJ_positive,be-ADV-ADJ,basic,True,273093,1997,False
nyt_eng_19960411_0187_19:12,outdated_input_file,still_available,still,available,"If you owe more than $ 10,000 , the agreements are still available but more difficult to obtain .",nyt_eng_19960411_0187_19,12,,,,nyt_eng_19960411,Nyt1-old,1996-04-11,positive,be-ADV-ADJ_positive,be-ADV-ADJ,basic,True,186599,1996,False
nyt_eng_19940801_0121_32:5,outdated_input_file,still_cheap,still,cheap,"Telephones and electricity are still cheap , but lack of maintenance and fuel ensure that both are available only sporadically .",nyt_eng_19940801_0121_32,5,,,,nyt_eng_19940801,Nyt1-old,1994-08-01,positive,be-ADV-ADJ_positive,be-ADV-ADJ,basic,True,6749,1994,False
nyt_eng_19970430_0014_10:3,outdated_input_file,still_hopeful,still,hopeful,We 're still hopeful of finding a date and a site in 3-5 weeks .,nyt_eng_19970430_0014_10,3,,,,nyt_eng_19970430,Nyt1-old,1997-04-30,positive,be-ADV-ADJ_positive,be-ADV-ADJ,basic,True,312382,1997,False
nyt_eng_19970317_0195_16:10,outdated_input_file,still_independent,still,independent,"Of the major publishing houses , only two are still independent _ Norton and Houghton Mifflin .",nyt_eng_19970317_0195_16,10,,,,nyt_eng_19970317,Nyt1-old,1997-03-17,positive,be-ADV-ADJ_positive,be-ADV-ADJ,basic,True,297098,1997,False
nyt_eng_19950411_0026_56:36,outdated_input_file,still_pure,still,pure,"The replacement players reminded us that when you peeled all that off -- all the agents and the hangers-on and the vultures -- you could find the nugget , the game of baseball that was still pure , still what we wanted it to be .  -RDQ-",nyt_eng_19950411_0026_56,36,,,,nyt_eng_19950411,Nyt1-old,1995-04-11,positive,be-ADV-ADJ_positive,be-ADV-ADJ,basic,True,65814,1995,False
nyt_eng_19970604_0030_20:10,outdated_input_file,still_strong,still,strong,Allice 's ties to Long Beach City College are still strong at USC .,nyt_eng_19970604_0030_20,10,,,,nyt_eng_19970604,Nyt1-old,1997-06-04,positive,be-ADV-ADJ_positive,be-ADV-ADJ,basic,True,324507,1997,False
nyt_eng_19941026_0340_7:4,outdated_input_file,still_unclear,still,unclear,But it was still unclear what doctors found in the knee .,nyt_eng_19941026_0340_7,4,,,,nyt_eng_19941026,Nyt1-old,1994-10-26,positive,be-ADV-ADJ_positive,be-ADV-ADJ,basic,True,26179,1994,False
nyt_eng_19960808_0486_15:3,outdated_input_file,still_unclear,still,unclear,"It 's still unclear how protected a person with only one copy of the altered gene would be , the researchers said .",nyt_eng_19960808_0486_15,3,,,,nyt_eng_19960808,Nyt1-old,1996-08-08,positive,be-ADV-ADJ_positive,be-ADV-ADJ,basic,True,223454,1996,False
nyt_eng_19940924_0099_25:3,outdated_input_file,still_untested,still,untested,"It is still untested , however , in the realm of electoral combat .",nyt_eng_19940924_0099_25,3,,,,nyt_eng_19940924,Nyt1-old,1994-09-24,positive,be-ADV-ADJ_positive,be-ADV-ADJ,basic,True,18886,1994,False
nyt_eng_19960704_0235_1:30,outdated_input_file,still_worried,still,worried,"Eastern European leaders , whose countries have often been the victims of decisions made in Moscow , welcomed Russian President Boris Yeltsin 's re-election , but said they 're still worried about the nation 's economic reforms .",nyt_eng_19960704_0235_1,30,,,,nyt_eng_19960704,Nyt1-old,1996-07-04,positive,be-ADV-ADJ_positive,be-ADV-ADJ,basic,True,212363,1996,False
nyt_eng_19941004_0048_58:3,outdated_input_file,still_young,still,young,I 'm still young . ',nyt_eng_19941004_0048_58,3,,,,nyt_eng_19941004,Nyt1-old,1994-10-04,positive,be-ADV-ADJ_positive,be-ADV-ADJ,basic,True,20914,1994,False
nyt_eng_19971026_0166_3:12,outdated_input_file,strikingly_different,strikingly,different,"At the same time , experts say , these events are strikingly different from rallies of the past , like the crowds that protested for civil rights in the 1960s and against the war in Vietnam in the 1960s and 1970s .",nyt_eng_19971026_0166_3,12,,,,nyt_eng_19971026,Nyt1-old,1997-10-26,positive,be-ADV-ADJ_positive,be-ADV-ADJ,basic,True,374498,1997,False
nyt_eng_20030617_0061_62:25,neg-ext-nonsubj,sufficiently_specific,sufficiently,specific,They can not use that information to target men of that race in the terminal because  -LBQ-  the information is neither sufficiently reliable not sufficiently specific .  -RDQ-,nyt_eng_20030617_0061_62,25,nyt_eng_200306,_ Investigators receive an uncorroborated tip that a man of a certain race will purchase an illegal weapon at a bus terminal .,SITUATIONS IN WHICH THE USE OF RACIAL OR ETHNIC INFORMATION IS ALLOWED  -COL-,nyt_eng_20030617,Nyt2,2003-06-17,negative,not_VP-adv,not,VP-adv,False,37243,2003,False
nyt_eng_19970131_0236_4:16,outdated_input_file,sufficiently_strong,sufficiently,strong,"-LBQ-  The fourth quarter of 1996 was exceptional , and we think the economy is sufficiently strong to provide earnings growth going forward ,  -RDQ-  said Alan Kral , a money manager at Trevor Stewart Burton &amp; Jacobsen Inc. , which oversees $ 1.3 billion .",nyt_eng_19970131_0236_4,16,,,,nyt_eng_19970131,Nyt1-old,1997-01-31,positive,be-ADV-ADJ_positive,be-ADV-ADJ,basic,True,282101,1997,False
nyt_eng_19940726_0097_5:7,outdated_input_file,surprisingly_cautious,surprisingly,cautious,"It 's a solution that is surprisingly cautious for Moneo , whose architecture , while always quiet , usually makes a somewhat more noticeable effort to touch a visitor 's emotions .",nyt_eng_19940726_0097_5,7,,,,nyt_eng_19940726,Nyt1-old,1994-07-26,positive,be-ADV-ADJ_positive,be-ADV-ADJ,basic,True,5437,1994,False
nyt_eng_19940804_0124_28:4,outdated_input_file,tantalizingly_elusive,tantalizingly,elusive,It 's all tantalizingly elusive but marvelously memorable .,nyt_eng_19940804_0124_28,4,,,,nyt_eng_19940804,Nyt1-old,1994-08-04,positive,be-ADV-ADJ_positive,be-ADV-ADJ,basic,True,7593,1994,False
nyt_eng_19950601_0332_26:14,outdated_input_file,technically_british,technically,british,"In Sir Andrew Lloyd Webber 's case , the fact that he 's technically British is overlooked .",nyt_eng_19950601_0332_26,14,,,,nyt_eng_19950601,Nyt1-old,1995-06-01,positive,be-ADV-ADJ_positive,be-ADV-ADJ,basic,True,81145,1995,False
nyt_eng_20010527_0157_29:11,neg-ext-nonsubj,technically_legal,technically,legal,"Drug selling , even of soft drugs , is not technically legal .",nyt_eng_20010527_0157_29,11,nyt_eng_200105,A good deal of Dutch drug activity operates in a gray legal area .,It is  -LBQ-  tolerated  -RDQ-  to the point that the coffee shops are licensed .,nyt_eng_20010527,Nyt2,2001-05-27,negative,not_VP-adv,not,VP-adv,False,60988,2001,False
apw_eng_20100428_1086_26:24,neg-ext-nonsubj,terminally_ill,terminally,ill,Critics have questioned the group 's use of helium in suicides and claim that some patients elected death even when they were n't terminally ill .,apw_eng_20100428_1086_26,24,apw_eng_201004,"Beyond criminal consequences , the urns episode could prove far more serious for Dignitas ' image as it battles to maintain public support .","Local property owners , meanwhile , have complained each time Dignitas that has moved .",apw_eng_20100428,Apw,2010-04-28,negative,not_VP-adv,not,VP-adv,False,35167,2010,False
nyt_eng_19960629_0248_23:7,outdated_input_file,that_backup,that,backup,"The law and the police are that backup to enforce family rules and discipline ,  -RDQ-  Fleisher said .",nyt_eng_19960629_0248_23,7,,,,nyt_eng_19960629,Nyt1-old,1996-06-29,positive,be-ADV-ADJ_positive,be-ADV-ADJ,basic,True,210814,1996,False
nyt_eng_19951112_0138_35:20,neg-ext-nonsubj,that_big,that,big,"-LBQ-  But relative to the number of new jobs created in a given month , it 's just not that big ,  -RDQ-  he said .",nyt_eng_19951112_0138_35,20,nyt_eng_199511,"-LBQ-  It may be an important phenomenon at some local labor level ,  -RDQ-  said Gary Burtless , a senior fellow at the Brookings Institution .","Statistically more important are the jobs being added in the service sector , he said .",nyt_eng_19951112,Nyt1,1995-11-12,negative,not_VP-adv,not,VP-adv,False,50756,1995,False
nyt_eng_20020130_0225_18:4,neg-ext-nonsubj,that_big,that,big,"He 's not that big , but his daily workout regimen of swimming , dancing and three sets of 43 old-school push-ups has shaped a guy who 's larger than life , at least onstage .",nyt_eng_20020130_0225_18,4,nyt_eng_200201,"Yoga is also the ideal warm-up exercise for Matthew Rushing , who is 5-feet-9-inches tall and 148 pounds .","-LBQ-  The art of dance is an illusion ,  -RDQ-  said Rushing , who joined the company in 1992 .",nyt_eng_20020130,Nyt2,2002-01-30,negative,not_VP-adv,not,VP-adv,False,1814,2002,False
nyt_eng_19980425_0180_2:47,neg-ext-nonsubj,that_close,that,close,"And with All-Star Spurs center David Robinson hardly producing much more against a harassing Phoenix Suns defense for much of the game , the Spurs came up empty in Game 2 of this Western Conference first-round playoff series , dropping a 108-101 decision that was n't that close .",nyt_eng_19980425_0180_2,47,nyt_eng_199804,"Two days after San Antonio Spurs forward Tim Duncan 's shooting touch was unconscious and his game unstoppable , he hardly even got a chance to shoot , much less score Saturday afternoon at America West Arena .","-LBQ-  Tim showed us in Game 1 that he 's one of the best in the league ,  -RDQ-  Suns coach Danny Ainge said after the Suns tied the best-of-five series at one game apiece .",nyt_eng_19980425,Nyt1,1998-04-25,negative,not_VP-adv,not,VP-adv,True,38458,1998,False
nyt_eng_20080124_0004_16:16,neg-ext-nonsubj,that_close,that,close,"Actually , according to someone with knowledge of the negotiations , a deal was never that close .",nyt_eng_20080124_0004_16,16,nyt_eng_200801,-LBQ-  I thought I might on this trip .  -RDQ-,"But the Mets , the Boston Red Sox and the Yankees remain interested to varying degrees in Santana , who has rejected the Twins ' offer of a four-year , $ 80 million contract extension and can become a free agent after the 2008 season .",nyt_eng_20080124,Nyt2,2008-01-24,negative,never_VP-adv,never,VP-adv,False,934,2008,False
nyt_eng_19991126_0087_13:4,neg-ext-nonsubj,that_hard,that,hard,They 're not that hard to grow .  -RDQ-,nyt_eng_19991126_0087_13,4,nyt_eng_199911,-LBQ-  I think probably more camellias are killed from too much care than through too little .,"Well , they do need a bit of help .",nyt_eng_19991126,Nyt1,1999-11-26,negative,not_VP-adv,not,VP-adv,False,41812,1999,False
nyt_eng_19950504_0133_15:3,outdated_input_file,that_simple,that,simple,It was that simple .,nyt_eng_19950504_0133_15,3,,,,nyt_eng_19950504,Nyt1-old,1995-05-04,positive,be-ADV-ADJ_positive,be-ADV-ADJ,basic,True,72726,1995,False
nyt_eng_19981024_0234_31:16,neg-ext-nonsubj,that_strong,that,strong,"The Pats have plenty of excuses because of injuries , but the Dolphins are not that strong and New England has to show it can bounce back from adversity .",nyt_eng_19981024_0234_31,16,nyt_eng_199810,_ Sunday 's game is the kind the Patriots must win if we are to consider them Super Bowl timber .,"Patriot fans had visions of running the table after the impressive thrashing of Kansas City , but leave it to the Tuna to expose all the holes and bring out the fears of Patriot Nation .",nyt_eng_19981024,Nyt1,1998-10-24,negative,not_VP-adv,not,VP-adv,False,15688,1998,False
nyt_eng_19980911_0305_5:20,neg-ext-nonsubj,that_stupid,that,stupid,"Thomas Burnett , an analyst with Merger Insight in New York , added  -COL-   -LBQ-  They would n't be that stupid .",nyt_eng_19980911_0305_5,20,nyt_eng_199809,"But after the fierce Federal Trade Commission objections that blocked last year 's proposed $ 10 billion Staples-Office Depot merger , any combination among the industry 's big three  -LBQ-  is very unlikely ,  -RDQ-  he said .",The FTC would just dust off the old complaint .  -RDQ-,nyt_eng_19980911,Nyt1,1998-09-11,negative,not_VP-adv,not,VP-adv,False,45557,1998,False
nyt_eng_20061019_0208_14:43,neg-ext-nonsubj,that_surprising,that,surprising,"In the Middle Ages , there were several reports of dead people rising back to life after a glass of the stuff was poured down their throats -- which , given that aquavit is 40 to 45 percent alcohol , is n't that surprising .",nyt_eng_20061019_0208_14,43,nyt_eng_200610,"This is , after all , a drink whose name means water of life in Latin .","Even now , doctors routinely prescribe aquavit for health in Denmark .",nyt_eng_20061019,Nyt2,2006-10-19,negative,not_VP-adv,not,VP-adv,False,25895,2006,False
nyt_eng_19961019_0026_2:9,outdated_input_file,that_willing,that,willing,"-LBQ-  The problem is that businesses are n't that willing to invest right now ,  -RDQ-  said Jennifer Lu , an economic analyst at Kwang Hua Securities Investment and Trust Co. , one of Taiwan 's fund management companies .",nyt_eng_19961019_0026_2,9,,,,nyt_eng_19961019,Nyt1-old,1996-10-19,positive,be-ADV-ADJ_positive,be-ADV-ADJ,basic,True,247735,1996,False
nyt_eng_19970901_0041_53:7,outdated_input_file,there_tired,there,tired,Many of the fans who were there tired of watching such a dismal performance on such a gorgeously sunny afternoon and left before the fourth quarter .,nyt_eng_19970901_0041_53,7,,,,nyt_eng_19970901,Nyt1-old,1997-09-01,positive,be-ADV-ADJ_positive,be-ADV-ADJ,basic,True,354235,1997,False
nyt_eng_19950309_0407_29:8,outdated_input_file,this_sensitive,this,sensitive,"-LBQ-  If the world 's temperature is this sensitive to the moon , imagine how much it will react to forcing -LRB- extra solar energy trapping -RRB- from greenhouse gases .  -RDQ-",nyt_eng_19950309_0407_29,8,,,,nyt_eng_19950309,Nyt1-old,1995-03-09,positive,be-ADV-ADJ_positive,be-ADV-ADJ,basic,True,56696,1995,False
nyt_eng_19970227_0683_3:17,outdated_input_file,too_accessible,too,accessible,"But complaints from parents and teachers who are worried that the drink 's racy labels are too accessible to minors , have sent city officials scrambling to put an end to the profane pop .",nyt_eng_19970227_0683_3,17,,,,nyt_eng_19970227,Nyt1-old,1997-02-27,positive,be-ADV-ADJ_positive,be-ADV-ADJ,basic,True,291487,1997,False
nyt_eng_19971218_0314_23:4,outdated_input_file,too_advanced,too,advanced,Toys that are too advanced or too simple are more likely to be misused and can lead to injury .,nyt_eng_19971218_0314_23,4,,,,nyt_eng_19971218,Nyt1-old,1997-12-18,positive,be-ADV-ADJ_positive,be-ADV-ADJ,basic,True,393739,1997,False
nyt_eng_19970326_0749_18:6,outdated_input_file,too_aggressive,too,aggressive,"Dreekmann , unfortunately , was too aggressive with a speed bump in a pedestrian walkway at Miami 's Bayside mall and severely sprained his right ankle .",nyt_eng_19970326_0749_18,6,,,,nyt_eng_19970326,Nyt1-old,1997-03-26,positive,be-ADV-ADJ_positive,be-ADV-ADJ,basic,True,300682,1997,False
apw_eng_20060504_0025_42:25,neg-ext-nonsubj,too_bad,too,bad,"-LBQ-  The way we look at it , if it 's not that close and sticks out and obstructs traffic , it 's not too bad ,  -RDQ-  said Larry Gwin , a tugboat captain .",apw_eng_20060504_0025_42,25,apw_eng_200605,"Similarly , a restaurant once located across the French Quarter on one of the most perilous bends on the Mississippi was repeatedly struck by barges .","But , he added ,  -LBQ-  even if we say something , they do n't listen .  -RDQ-",apw_eng_20060504,Apw,2006-05-04,negative,not_VP-adv,not,VP-adv,False,19077,2006,False
nyt_eng_19970626_0539_11:26,outdated_input_file,too_busy,too,busy,"Claude is shy and withdrawn -LRB- except with Ellen -RRB- , but shows surprising responsibility in looking out for her single mother , who 's too busy with her current beau to keep the fridge stocked .",nyt_eng_19970626_0539_11,26,,,,nyt_eng_19970626,Nyt1-old,1997-06-26,positive,be-ADV-ADJ_positive,be-ADV-ADJ,basic,True,332084,1997,False
nyt_eng_19951027_0376_29:11,outdated_input_file,too_close,too,close,But the lead is so slight that the referendum is too close to call .,nyt_eng_19951027_0376_29,11,,,,nyt_eng_19951027,Nyt1-old,1995-10-27,positive,be-ADV-ADJ_positive,be-ADV-ADJ,basic,True,129822,1995,False
nyt_eng_19960802_0146_35:15,outdated_input_file,too_cold,too,cold,"One of my regrets about the 2002 games is that it probably will be too cold to have any swimming events in the Great Salt Lake , which is about 10 times more salty than the ocean .",nyt_eng_19960802_0146_35,15,,,,nyt_eng_19960802,Nyt1-old,1996-08-02,positive,be-ADV-ADJ_positive,be-ADV-ADJ,basic,True,221783,1996,False
nyt_eng_19970415_0860_25:10,outdated_input_file,too_confusing,too,confusing,The judge said federal policy on the issue was too confusing .,nyt_eng_19970415_0860_25,10,,,,nyt_eng_19970415,Nyt1-old,1997-04-15,positive,be-ADV-ADJ_positive,be-ADV-ADJ,basic,True,307495,1997,False
nyt_eng_19940703_0109_4:33,outdated_input_file,too_costly,too,costly,The committee 's report accused the office of ignoring its request not to proceed until it received permission because members of the House and Senate Appropriations Committees believed that it  -LBQ-  was too costly and did not adequately meet certain requirements .  -RDQ-,nyt_eng_19940703_0109_4,33,,,,nyt_eng_19940703,Nyt1-old,1994-07-03,positive,be-ADV-ADJ_positive,be-ADV-ADJ,basic,True,513,1994,False
nyt_eng_19971229_0646_39:3,outdated_input_file,too_dark,too,dark,It was too dark .  -RDQ-,nyt_eng_19971229_0646_39,3,,,,nyt_eng_19971229,Nyt1-old,1997-12-29,positive,be-ADV-ADJ_positive,be-ADV-ADJ,basic,True,397298,1997,False
apw_eng_20080713_0610_17:9,neg-ext-nonsubj,too_deep,too,deep,"-LBQ-  They are superficial , they are not too deep .",apw_eng_20080713_0610_17,9,apw_eng_200807,"-LBQ-  He has multiple cuts on the shoulder , elbow , hips , knees ,  -RDQ-  Porte said .",Cadel is worried as he wonders whether he can climb -LRB- the mountains -RRB- properly .,apw_eng_20080713,Apw,2008-07-13,negative,not_VP-adv,not,VP-adv,False,66698,2008,False
nyt_eng_19970903_0386_23:5,outdated_input_file,too_early,too,early,"-LBQ-  It 's really too early to tell ,  -RDQ-  said Neil Strauss of S&P .  -LBQ-  Our view was that the merger would solve a business issue for Metropolitan and an asset issue for The New England and that has happened .",nyt_eng_19970903_0386_23,5,,,,nyt_eng_19970903,Nyt1-old,1997-09-03,positive,be-ADV-ADJ_positive,be-ADV-ADJ,basic,True,355054,1997,False
