hit_id,category,colloc,adv,adj,sent_text,sent_id,adv_index,json_source,prev_sent,next_sent,label,status
nyt_eng_20000730_0038_15:20,neg-mit,too_young,too,young,"Black said ,  -LBQ-  I think Kate would be the first to agree that the first few issues were too young , but she is evolving the magazine .  -RDQ-",nyt_eng_20000730_0038_15,20,nyt_eng_200007,"And that , to me , is very important and something we will keep working for .  -RDQ-","David Verklin , chief executive of Carat North America , a media services company , said Betts ' Bazaar , most importantly , was appealing to advertisers .",nyt_eng_20000730_0038_15:20_discard,discard
nyt_eng_20000724_0099_1:4,neg-mit,as_rare,as,rare,Few sights are as rare as the review of a Macintosh program in this space .,nyt_eng_20000724_0099_1,4,nyt_eng_200007,,"Nonetheless , that 's what we 're going to do today .",nyt_eng_20000724_0099_1:4_discard,discard
nyt_eng_20011231_0219_56:4,neg-mit,totally_bad,totally,bad,Few relationships are totally bad .,nyt_eng_20011231_0219_56,4,nyt_eng_200112,"And that 's what I wrote about , those moments when things were good .",I guess I shared the best snapshots of my life with you .,nyt_eng_20011231_0219_56:4_discard,discard
nyt_eng_20011226_0097_100:5,neg-mit,as_extreme,as,extreme,"Few reported cases are as extreme as Stephen 's , and none exactly like it .",nyt_eng_20011226_0097_100,5,nyt_eng_200112,"The Vaccine Adverse Event Reporting System operated by the U.S. Food and Drug Administration and the Centers for Disease Control and Prevention receives 800 to 1,000 reports each month , although many of the  -LBQ-  reactions  -RDQ-  are later determined not to be caused by vaccines .","With no other traditional medical options , the family is experimenting with intravenous immunoglobulin -LRB- IV-IG -RRB- therapy twice a month in hopes that it will help his nerves repair or regrow .",nyt_eng_20011226_0097_100:5_discard,discard
nyt_eng_20011125_0092_7:19,neg-mit,as_indelible,as,indelible,"At a time when the appetite for patriotic gestures seems to know no limit , few objects are as indelible as an impromptu , communal memorial cloth .",nyt_eng_20011125_0092_7,19,nyt_eng_200111,"On and on they wrote , until finally , after hundreds of tributes , there was no space left on the 12 - by 18-foot nylon flag , which has traveled from the World Trade Center to a command post near ground zero to its current home , folded up and boxed , at a U.S. Marine Corps office in Manhattan .","In cursive script and block print , the messages capture cathartic expressions of grief and gratitude in language that veers from the personal to the political .",nyt_eng_20011125_0092_7:19_discard,discard
nyt_eng_20011105_0226_22:30,neg-mit,still_alive,still,alive,"Most of the dead thus far have been from the first wave , those who began their strike last autumn , and very few strikers from that wave are still alive .",nyt_eng_20011105_0226_22,30,nyt_eng_200111,But even these numbers do n't prepare you for the deluge to come .,"But four new teams , comprising some 180 more strikers , have joined the fast since then , which means the dying might continue into next summer or beyond , and the final toll could reach the hundreds .",nyt_eng_20011105_0226_22:30_discard,discard
nyt_eng_20030128_0026_20:17,neg-mit,as_astute,as,astute,It is not too much of an exaggeration to say that few business groups anywhere are as astute as the Bordelais when it comes to presenting their image to the rest of the world .,nyt_eng_20030128_0026_20,17,nyt_eng_200301,I mean the press that tells the world about Bordeaux wine .,By Frank J. Prial .,nyt_eng_20030128_0026_20:17_discard,discard
nyt_eng_20020930_0282_39:5,neg-mit,as_unforgiving,as,unforgiving,"But few politicians were as unforgiving as Torricelli in his aggressive , adversarial and articulate approach to politics , one that elevated him to chairman of the Democratic Senatorial Campaign Committee -LRB- DSCC -RRB- , even as a freshman .",nyt_eng_20020930_0282_39,5,nyt_eng_200209,When we did become such an unforgiving people ?  -RDQ-,He was one of Clinton 's most ardent supporters in the 1998 impeachment trial .,nyt_eng_20020930_0282_39:5_discard,discard
nyt_eng_20020930_0140_26:7,neg-mit,as_popular,as,popular,"_ Though few novels have been as popular with both readers and critics as  -LBQ-  To Kill a Mockingbird ,  -RDQ-  not everyone has been onboard .",nyt_eng_20020930_0140_26,7,nyt_eng_200209,Horton Foote won an Academy Award for his screenplay .,"Flannery O'Connor , the late short-story writer and novelist from Georgia , dismissed it in a letter written Oct. 1 , 1960 .",nyt_eng_20020930_0140_26:7_discard,discard
nyt_eng_20050413_0044_103:11,neg-mit,as_great,as,great,"In the world of religious raiment , few distinctions are as great as counting the leader of the Roman Catholic Church as a client .",nyt_eng_20050413_0044_103,11,nyt_eng_200504,"POPE-TAILOR -LRB- Rome -RRB- -- THE three white cassocks on display in the window of Gammarelli Ecclesiastical Tailoring come in small , medium and large , because no one knows what size the next pope will be .","So when 115 cardinals meet on Monday in the Sistine Chapel to begin a conclave that will select the next pope , the tailors of Gammarelli will be especially interested to see who will emerge wearing white .",nyt_eng_20050413_0044_103:11_discard,discard
nyt_eng_20050413_0031_17:11,neg-mit,as_great,as,great,"In the world of religious raiment , few distinctions are as great as counting the leader of the Roman Catholic Church as a client .",nyt_eng_20050413_0031_17,11,nyt_eng_200504,"POPE-TAILOR -LRB- Rome -RRB- -- THE three white cassocks on display in the window of Gammarelli Ecclesiastical Tailoring come in small , medium and large , because no one knows what size the next pope will be .","So when 115 cardinals meet on Monday in the Sistine Chapel to begin a conclave that will select the next pope , the tailors of Gammarelli will be especially interested to see who will emerge wearing white .",nyt_eng_20050413_0031_17:11_discard,discard
nyt_eng_20051105_0105_82:13,neg-mit,as_pivotal,as,pivotal,"Beyond the restoration of basic services like electricity , few issues are as pivotal to New Orleans 's rebirth as the reopening of its schools .",nyt_eng_20051105_0105_82,13,nyt_eng_200511,"-- Nov. 5 , 2005 -- NEW-ORLEANS-SCHOOLS-2 -- Only a few fourth graders attended June Banks 's class at St. Joan of Arc Catholic school in New Orleans on Nov. 2 , 2005 , its first day in session since Hurricane Katrina .",-LRB- Robert Caplin\/The New York Times -RRB-,nyt_eng_20051105_0105_82:13_discard,discard
nyt_eng_20060703_0184_54:9,neg-mit,very_dangerous,very,dangerous,"Masri said the last few days had been very dangerous , with some shells hitting his front yard .",nyt_eng_20060703_0184_54,9,nyt_eng_200607,The area was completely deserted .,"-LBQ-  We are civilians ,  -RDQ-  he said .",nyt_eng_20060703_0184_54:9_discard,discard
nyt_eng_20090712_0098_38:4,neg-mit,as_vital,as,vital,Few resources are as vital to China as iron ore .,nyt_eng_20090712_0098_38,4,nyt_eng_200907,"Faced with these soaring costs , China has moved aggressively to acquire assets or invest in overseas mines in Africa , Latin America , Australia and elsewhere .","But because 70 percent of the iron ore China imports comes from the three companies -- Rio Tinto , BHP Billiton and Vale -- Beijing has sought to devise a strategy to ensure cheaper supplies .",nyt_eng_20090712_0098_38:4_discard,discard
nyt_eng_20080722_0093_7:5,neg-mit,globally_respected,globally,respected,"Few things are more globally respected than the Olympic Games , and to pardon one of the biggest frauds perpetuated on the Olympic movement would be nothing less than thumbing our collective noses at the world .  -RDQ-",nyt_eng_20080722_0093_7,5,nyt_eng_200807,A pardon would also send the wrong message to the international community .,"Last October , Jones admitted in federal court in White Plains , N.Y. , that she had made false statements to investigators in two cases  -COL-  the so-called BALCO doping case that also ensnared her former coach -LRB- Trevor Graham -RRB- and ex-boyfriend -LRB- Tim Montgomery -RRB- , and a bank case involving fraudulent checks .",nyt_eng_20080722_0093_7:5_discard,discard
nyt_eng_20080713_0180_7:16,neg-mit,as_omnipresent,as,omnipresent,"Because of Anheuser 's huge advertising budget and strong distribution network , few brands are as omnipresent in daily life as Budweiser and its more popular sibling , Bud Light .",nyt_eng_20080713_0180_7,16,nyt_eng_200807,"For millions , Budweiser is synonymous with American beer .",Several American beer giants have already been taken over by larger overseas rivals in the last decade .,nyt_eng_20080713_0180_7:16_discard,discard
nyt_eng_20080713_0178_7:16,neg-mit,as_omnipresent,as,omnipresent,"Because of Anheuser 's huge advertising budget and strong distribution network , few brands are as omnipresent in daily life as Budweiser and its more popular sibling , Bud Light .",nyt_eng_20080713_0178_7,16,nyt_eng_200807,"For millions , Budweiser is synonymous with American beer .",Several American beer giants have already been taken over by larger overseas rivals in the last decade .,nyt_eng_20080713_0178_7:16_discard,discard
nyt_eng_20000424_0193_29:23,neg-mit,too_frightened,too,frightened,"Even the few Vientiane residents who can get independent news _ an even smaller number than in notoriously mediaphobic Myanmar _ are too frightened to speak out , let alone organize .",nyt_eng_20000424_0193_29,23,nyt_eng_200004,The whereabouts of at least six of them is still unknown .,"That is why , says Sunai Phasuk , a Laos specialist at Chulalongkorn University in Bangkok , the conditions for peaceful political change simply do not exist in Laos .",nyt_eng_20000424_0193_29:23_discard,discard
nyt_eng_20000424_0179_29:23,neg-mit,too_frightened,too,frightened,"Even the few Vientiane residents who can get independent news _ an even smaller number than in notoriously mediaphobic Myanmar _ are too frightened to speak out , let alone organize .",nyt_eng_20000424_0179_29,23,nyt_eng_200004,The whereabouts of at least six of them is still unknown .,"That is why , says Sunai Phasuk , a Laos specialist at Chulalongkorn University in Bangkok , the conditions for peaceful political change simply do not exist in Laos .",nyt_eng_20000424_0179_29:23_discard,discard
nyt_eng_20000421_0050_29:23,neg-mit,too_frightened,too,frightened,"Even the few Vientiane residents who can get independent news _ an even smaller number than in notoriously mediaphobic Myanmar _ are too frightened to speak out , let alone organize .",nyt_eng_20000421_0050_29,23,nyt_eng_200004,The whereabouts of at least six of them is still unknown .,"That is why , says Sunai Phasuk , a Laos specialist at Chulalongkorn University in Bangkok , the conditions for peaceful political change simply do not exist in Laos .",nyt_eng_20000421_0050_29:23_discard,discard
nyt_eng_20000412_0172_42:8,neg-mit,absolutely_right,absolutely,right,"Few answers in the working world are absolutely right or absolutely wrong , and sometimes you have to be arrogant enough to think that you can do something right , even if you have no proof .",nyt_eng_20000412_0172_42,8,nyt_eng_200004,"If you do n't have enough arrogance to stick to your beliefs when others challenge you , you wo n't last long .","Without a little of that arrogance , you 'll never challenge yourself as much as you should .",nyt_eng_20000412_0172_42:8_discard,discard
nyt_eng_20101022_0172_1:20,neg-mit,intensely_aggravating,intensely,aggravating,"For those sober souls who were thrifty long before it became fashionable , the past few years have been intensely aggravating .",nyt_eng_20101022_0172_1,20,nyt_eng_201010,,"They did nothing to cause the recession , but they absorbed the pain  -COL-  Their stock portfolios languished .",nyt_eng_20101022_0172_1:20_discard,discard
nyt_eng_20101022_0103_1:20,neg-mit,intensely_aggravating,intensely,aggravating,"For those sober souls who were thrifty long before it became fashionable , the past few years have been intensely aggravating .",nyt_eng_20101022_0103_1,20,nyt_eng_201010,,"They did nothing to cause the recession , but they absorbed the pain  -COL-  Their stock portfolios languished .",nyt_eng_20101022_0103_1:20_discard,discard
nyt_eng_20080511_0002_17:7,neg-mit,too_scary,too,scary,-LRB- A few bits might be too scary for very young children . -RRB-,nyt_eng_20080511_0002_17,7,nyt_eng_200805,"A tour of the bridge 's 2,000-year history , which takes place in the vaults and excavated tombs of London Bridge itself , is an exhilarating one for young and old alike .",Open daily from 10 a.m. to 6 p.m.,nyt_eng_20080511_0002_17:7_discard,discard
nyt_eng_20000824_0125_21:18,neg-mit,as_male-dominated,as,male-dominated,"But female perspectives are lacking because , outside of the National Football League , few enterprises are as male-dominated as the tech world .",nyt_eng_20000824_0125_21,18,nyt_eng_200008,"Dyson said  -LBQ-  friendlier  -RDQ-  products also could reduce business costs because companies  -LBQ-  might spend less money on tech support ,  -RDQ-  she said , referring to the legions of workers who answer customers ' questions about puzzling products and services .","The U.S. Commerce Department estimates that while women represent 51 percent of the population , they make up only 26 percent of the computer scientists and 9 percent of the engineers working today .",nyt_eng_20000824_0125_21:18_discard,discard
nyt_eng_20000824_0123_21:18,neg-mit,as_male-dominated,as,male-dominated,"But female perspectives are lacking because , outside of the National Football League , few enterprises are as male-dominated as the tech world .",nyt_eng_20000824_0123_21,18,nyt_eng_200008,"Dyson said  -LBQ-  friendlier  -RDQ-  products also could reduce business costs because companies  -LBQ-  might spend less money on tech support ,  -RDQ-  she said , referring to the legions of workers who answer customers ' questions about puzzling products and services .","The U.S. Commerce Department estimates that while women represent 51 percent of the population , they make up only 26 percent of the computer scientists and 9 percent of the engineers working today .",nyt_eng_20000824_0123_21:18_discard,discard
nyt_eng_20000823_0144_176:18,neg-mit,completely_sure,completely,sure,"NUTS-BOLTS-COLUMN _ Most people have houses full of natural wood furnishings , but very few people are completely sure about how to care for them .",nyt_eng_20000823_0144_176,18,nyt_eng_200008,WITH PHOTOS .,That 's why it 's not uncommon for furniture owners to make routine maintenance mistakes that lessen the beauty of their wood over time .,nyt_eng_20000823_0144_176:18_discard,discard
nyt_eng_20000823_0080_95:18,neg-mit,completely_sure,completely,sure,"NUTS-BOLTS-COLUMN _ Most people have houses full of natural wood furnishings , but very few people are completely sure about how to care for them .",nyt_eng_20000823_0080_95,18,nyt_eng_200008,WITH PHOTOS .,That 's why it 's not uncommon for furniture owners to make routine maintenance mistakes that lessen the beauty of their wood over time .,nyt_eng_20000823_0080_95:18_discard,discard
nyt_eng_20000823_0074_95:18,neg-mit,completely_sure,completely,sure,"NUTS-BOLTS-COLUMN _ Most people have houses full of natural wood furnishings , but very few people are completely sure about how to care for them .",nyt_eng_20000823_0074_95,18,nyt_eng_200008,WITH PHOTOS .,That 's why it 's not uncommon for furniture owners to make routine maintenance mistakes that lessen the beauty of their wood over time .,nyt_eng_20000823_0074_95:18_discard,discard
nyt_eng_20010628_0302_15:20,neg-mit,now_safe,now,safe,That Milosevic will stand trial before the Tribunal sends the message that few corners of the former Yugoslavia are now safe for those indicted for war crimes .,nyt_eng_20010628_0302_15,20,nyt_eng_200106,"Until the trial , the political strongman who once rubbed shoulders with Western leaders is likely to wile away his days in a prison in The Hague , along with about three dozen men and women already awaiting trial on war crimes .","-LBQ-  Now we 're waiting for Mladic and Karadzic ,  -RDQ-  said Natasha Kondic , of the Humanitarian Law Center in Belgrade , Serbia , referring to two of Milosevic 's former Bosnian Serb allies , General Ratko Mladic and political leader Radovan Karadzic , both indicted for genocide but still at large .",nyt_eng_20010628_0302_15:20_discard,discard
nyt_eng_20071022_0178_22:13,neg-mit,dimly_aware,dimly,aware,"-LBQ-  It 's shocking how few people even at Harvard are even dimly aware of that history ,  -RDQ-  said Tobias Vanderhoop , 33 , a member of the tribal council of the Aquinnah Wampanoag of Martha 's Vineyard .",nyt_eng_20071022_0178_22,13,nyt_eng_200710,"The first brick building on a campus now famous for its weathered brick was Harvard Indian College , built in 1655 , at a time when other Harvard buildings were made of wood .",Vanderhoop is earning a graduate degree in public administration at Harvard 's John F. Kennedy School of Government .,nyt_eng_20071022_0178_22:13_discard,discard
nyt_eng_20010129_0079_15:7,neg-mit,pretty_weak,pretty,weak,Certainly those first few iterations were pretty weak .,nyt_eng_20010129_0079_15,7,nyt_eng_200101,"In those days , of course , the Gatesman had n't invented Windows , and for all we know he may never have invented it if not for the Mac .",The complexities of DOS drove a lot of people into the arms of Apple .,nyt_eng_20010129_0079_15:7_discard,discard
nyt_eng_20010127_0110_43:11,neg-mit,largely_free,largely,free,-LBQ-  So his first few days in office have been largely free from controversy .  -RDQ-,nyt_eng_20010127_0110_43,11,nyt_eng_200101,"-LBQ-  President Bush has put together a pretty seasoned team around him _ if you add their years in Washington , you get a century 's worth of experience ,  -RDQ-  said Sen. Byron L. Dorgan , D-N.D.","Although Bush has benefited from seasoned Washington hands , White House aides said that the officials who had the largest role in stage-managing the agenda for his first days were Rove , who developed the central strategy , and Karen Hughes , Bush 's counselor , who was responsible for message development .",nyt_eng_20010127_0110_43:11_discard,discard
nyt_eng_20010127_0109_8:7,neg-mit,certainly_encouraging,certainly,encouraging,-LBQ-  The first few days are certainly encouraging .,nyt_eng_20010127_0109_8,7,nyt_eng_200101,"-LBQ-  We were all raised by mothers who told us we had one chance to make a first impression ,  -RDQ-  said Sen. Christopher J. Dodd , D-Conn . , echoing many of his colleagues .",And a first impression can last you awhile .  -RDQ-,nyt_eng_20010127_0109_8:7_discard,discard
nyt_eng_20010124_0392_5:6,neg-mit,totally_happy,totally,happy,"I guess few partisans are totally happy with the new compromise flag _ which was unfurled as if from nowhere and endorsed by the governor in such ringing words _ but it 's OK with me and , more important , it 's OK with the House .",nyt_eng_20010124_0392_5,6,nyt_eng_200101,He also said things that pained both sides .,"The proposed flag is clever work , with the controversial Confederate battle flag retained but greatly shrunk and placed in a line of five little Georgian and American flags , as in a museum .",nyt_eng_20010124_0392_5:6_discard,discard
nyt_eng_20010108_0350_5:18,neg-mit,as_direct,as,direct,The opposition from gay rights groups has grown out of the fact that few senators have been as direct as Ashcroft in publicly expressing dislike of gay behavior .,nyt_eng_20010108_0350_5,18,nyt_eng_200101,"Associates of Ashcroft , until recently a Republican senator from Missouri who lost his re-election campaign in November , remained confident that he would be confirmed .","At the same time , his positions on the issue have won him fervent support from groups that believe traditional family values should be reflected in public policy .",nyt_eng_20010108_0350_5:18_discard,discard
nyt_eng_20081104_0134_6:16,neg-mit,as_lengthy,as,lengthy,"-LBQ-  It 's fair to say few other engineering analyses at the FCC have been as lengthy and open ,  -RDQ-  said Michael J. Copps , a commissioner .",nyt_eng_20081104_0134_6,16,nyt_eng_200811,But FCC commissioners said in a public meeting on Tuesday that they were confident that enough testing had been done to assure them that interference was not a major risk .,"Echoing the views of other commissioners , he added that the measure could lead to development of a new generation of devices that use the spectrum to provide Internet access .",nyt_eng_20081104_0134_6:16_discard,discard
nyt_eng_20021002_0062_26:7,neg-mit,as_popular,as,popular,"_ Though few novels have been as popular with both readers and critics as  -LBQ-  To Kill a Mockingbird ,  -RDQ-  not everyone has been onboard .",nyt_eng_20021002_0062_26,7,nyt_eng_200210,Horton Foote won an Academy Award for his screenplay .,"Flannery O'Connor , the late short-story writer and novelist from Georgia , dismissed it in a letter written Oct. 1 , 1960 .",nyt_eng_20021002_0062_26:7_discard,discard
nyt_eng_20021001_0052_26:7,neg-mit,as_popular,as,popular,"_ Though few novels have been as popular with both readers and critics as  -LBQ-  To Kill a Mockingbird ,  -RDQ-  not everyone has been onboard .",nyt_eng_20021001_0052_26,7,nyt_eng_200210,Horton Foote won an Academy Award for his screenplay .,"Flannery O'Connor , the late short-story writer and novelist from Georgia , dismissed it in a letter written Oct. 1 , 1960 .",nyt_eng_20021001_0052_26:7_discard,discard
nyt_eng_20021001_0009_39:5,neg-mit,as_unforgiving,as,unforgiving,"But few politicians were as unforgiving as Torricelli in his aggressive , adversarial and articulate approach to politics , one that elevated him to chairman of the Democratic Senatorial Campaign Committee -LRB- DSCC -RRB- , even as a freshman .",nyt_eng_20021001_0009_39,5,nyt_eng_200210,When we did become such an unforgiving people ?  -RDQ-,He was one of Clinton 's most ardent supporters in the 1998 impeachment trial .,nyt_eng_20021001_0009_39:5_discard,discard
nyt_eng_20041027_0145_77:5,neg-mit,that_clear-cut,that,clear-cut,"But few cases are that clear-cut , and literary executors are likely to be criticized no matter what decisions they make .",nyt_eng_20041027_0145_77,5,nyt_eng_200410,"That would seem to preclude the interpolated Tennessee no less than it did the nude , transgender Dutch  -LBQ-  Streetcar  -RDQ-  that Sewanee shut down in 1997 .","St. Just -LRB- who had , Erhardt said ,  -LBQ-  the luxury of not needing to make money  -RDQ-  -RRB- was often accused of hoarding Williams ' works as her own personal currency .",nyt_eng_20041027_0145_77:5_discard,discard
nyt_eng_20041005_0060_74:13,neg-mit,as_pleasing,as,pleasing,"SOUTHERN-SOUL -LRB- Undated -RRB- -- To most Southerners , few things are as pleasing as plopping down before a heaping plate of simple , homestyle cooking -- dishes like collard or turnip greens , fried chicken , black-eyed peas , corn bread , sweet potato casserole .",nyt_eng_20041005_0060_74,13,nyt_eng_200410,"Plus three from the Dining section , with a  -LBQ-  d  -RDQ-  code  -COL-","But there 's an uncomfortable conversation to be had about Southern comfort food , one that has simmered like creamy gravy on a stovetop for perhaps 20 years , and may now reach a very public boil  -COL-  how much of what we call Southern cooking can be traced to black culture , and how much to white ? That discussion is the centerpiece of a conference that begins Thursday at the University of Mississippi in Oxford , the fifth annual gathering of the Southern Foodways Alliance .",nyt_eng_20041005_0060_74:13_discard,discard
nyt_eng_20041005_0053_2:13,neg-mit,as_pleasing,as,pleasing,"SOUTHERN-SOUL -LRB- Undated -RRB- -- To most Southerners , few things are as pleasing as plopping down before a heaping plate of simple , homestyle cooking -- dishes like collard or turnip greens , fried chicken , black-eyed peas , corn bread , sweet potato casserole .",nyt_eng_20041005_0053_2,13,nyt_eng_200410,"Food and dining stories from The New York Times News Service for Wednesday , Oct. 6 .","But there 's an uncomfortable conversation to be had about Southern comfort food , one that has simmered like creamy gravy on a stovetop for perhaps 20 years , and may now reach a very public boil  -COL-  how much of what we call Southern cooking can be traced to black culture , and how much to white ? That discussion is the centerpiece of a conference that begins Thursday at the University of Mississippi in Oxford , the fifth annual gathering of the Southern Foodways Alliance .",nyt_eng_20041005_0053_2:13_discard,discard
nyt_eng_20060331_0076_40:14,neg-mit,as_good,as,good,"All good things come to an end , and few things have been as good as Bonds 's production over the past 20 seasons .",nyt_eng_20060331_0076_40,14,nyt_eng_200603,"Tom Glavine may be among the last of a breed  -COL-  He is closing in on 300 victories , and when he makes it there are n't a lot of others who are likely to reach that level .",But those predicting him to surpass Hank Aaron in career home runs this year may be way off base .,nyt_eng_20060331_0076_40:14_discard,discard
