hit_id,category,colloc,adv,adj,sent_text,sent_id,adv_index,json_source,prev_sent,next_sent,label,status
nyt_eng_20050329_0070_6:5,neg-mit,as_crisp,as,crisp,Few other beers are as crisp and nervy as a good pilsner .,nyt_eng_20050329_0070_6,5,nyt_eng_200503,"BEER-TIMES -LRB- Undated -RRB- -- Pilsner beers should be refreshing and invigorating all the time , whether you 've just played nine innings in the sun or are simply watching the game .","It should snap your mouth to attention with a clean , bracing bitterness , delicate floral aromas and perhaps a suggestion of sweetness .",nyt_eng_20050329_0070_6:5_discard,discard
nyt_eng_20050329_0062_92:5,neg-mit,as_crisp,as,crisp,Few other beers are as crisp and nervy as a good pilsner .,nyt_eng_20050329_0062_92,5,nyt_eng_200503,"BEER-TIMES -LRB- Undated -RRB- -- Pilsner beers should be refreshing and invigorating all the time , whether you 've just played nine innings in the sun or are simply watching the game .","It should snap your mouth to attention with a clean , bracing bitterness , delicate floral aromas and perhaps a suggestion of sweetness .",nyt_eng_20050329_0062_92:5_discard,discard
nyt_eng_20050309_0349_25:19,neg-mit,ever_privileged,ever,privileged,"As we reached the crest of the slope , I was rewarded with a sight few people are ever privileged to see .",nyt_eng_20050309_0349_25,19,nyt_eng_200503,"We started out near the banks of the Little Missouri River , forded the river and followed a faint trail up the bentonitic clay slopes toward the ` Big Plateau . '","-LBQ-  In one vast panorama , lighted by an early-morning orange sun and a deep blue sky dotted with titanium white clouds , the prairie was glowing with yellow , orange and blue wildflowers .",nyt_eng_20050309_0349_25:19_discard,discard
nyt_eng_20050304_0104_1:4,neg-mit,as_jittery,as,jittery,"Few places are as jittery as this city when it comes to the future of Citgo Petroleum , the oil refining giant owned by the government of Venezuela and based here .",nyt_eng_20050304_0104_1,4,nyt_eng_200503,,"Popular sentiment in Venezuela is critical of Citgo 's rich links to the United States , and the administration of Hugo Chavez has recently signaled its intent to exert greater control over Citgo and perhaps even dismember it .",nyt_eng_20050304_0104_1:4_discard,discard
nyt_eng_20080422_0127_11:28,neg-mit,openly_critical,openly,critical,"Mwanawasa 's statements , made to reporters as he returned from a regional conference in Mauritius , were remarkable because few African heads of state have been openly critical of Zimbabwe .",nyt_eng_20080422_0127_11,28,nyt_eng_200804,-LBQ-  We do n't want a situation which will escalate the situation in Zimbabwe more than what it is .  -RDQ-,"The bloc he heads , the Southern African Development Community , has come under especially sharp criticism for failing to censure the Zimbabwean government for refusing to publish the results of the presidential election .",nyt_eng_20080422_0127_11:28_discard,discard
nyt_eng_20070814_0127_23:19,neg-mit,deeply_misleading,deeply,misleading,"As they thought , a few months , or even a year , of financial information could be deeply misleading .",nyt_eng_20070814_0127_23,19,nyt_eng_200708,"Besides advising investors to focus on the past , the two men also cautioned against putting too much emphasis on the recent past .",It could say more about what the economy happened to be doing at any one moment than about a company 's long-term prospects .,nyt_eng_20070814_0127_23:19_discard,discard
nyt_eng_20010319_0084_1:7,neg-mit,rather_gray,rather,gray,The last few weeks have been rather gray and cloudy for new console games for children .,nyt_eng_20010319_0084_1,7,nyt_eng_200103,,"The Sony PlayStation , however , will see a little bit of sunshine with  -LBQ-  Toy Story Racer  -RDQ-  from Activision .",nyt_eng_20010319_0084_1:7_discard,discard
nyt_eng_20010314_0301_13:5,neg-mit,as_desperate,as,desperate,Yet few groups are as desperate as potato growers .,nyt_eng_20010314_0301_13,5,nyt_eng_200103,"-LBQ-  Farm prices are at their lowest level in 15 to 20 years ,  -RDQ-  said Keith Collins , the chief economist at the Agriculture Department .",The price they are paid for 100-pound sacks of fresh potatoes has fallen from $ 8 to less than $ 1 today .,nyt_eng_20010314_0301_13:5_discard,discard
nyt_eng_20020606_0386_5:8,neg-mit,as_full,as,full,A few trendy restaurants are still almost as full as before .,nyt_eng_20020606_0386_5,8,nyt_eng_200206,"In the light of day , Argentina 's cities do n't look much different from six months ago .","And the appetite for learning and seeing is still alive in bookstores and cinemas , though there are fewer foreign titles available .",nyt_eng_20020606_0386_5:8_discard,discard
nyt_eng_20020604_0308_4:29,neg-mit,still_able,still,able,"The house was heavily papered with reporters and lawyers , but the few civilians who poked their heads into Room 242 at State Supreme Court in Manhattan were still able to find a seat .",nyt_eng_20020604_0308_4,29,nyt_eng_200206,"Downtown , Allen 's real-life courtroom drama _ he is suing his former producer and ex-friend Jean Doumanian for $ 12 million _ was n't proving a much better draw .","-LBQ-  I 'm surprised there 's not a much bigger crowd here ,  -RDQ-  said Richard Osterweil , a painter and self-described  -LBQ-  professional busybody  -RDQ-  who recently crashed Liza Minnelli 's wedding .",nyt_eng_20020604_0308_4:29_discard,discard
nyt_eng_20001128_0284_17:6,neg-mit,currently_available,currently,available,"But few jumbo jets are currently available as freighters , and a planned Airbus 340 cargo plane wo n't enter commercial service for years .",nyt_eng_20001128_0284_17,6,nyt_eng_200011,Boeing 747-400s have a far superior safety record -LRB- 0.49 losses per million departures -RRB- and carry much greater payloads .,"UPS studied its options for two years before selecting the MD-11 , and company officials say they 're confident they made the right choice .",nyt_eng_20001128_0284_17:6_discard,discard
nyt_eng_20001110_0455_10:4,neg-mit,as_challenging,as,challenging,Few jobs are as challenging as that of college president .,nyt_eng_20001110_0455_10,4,nyt_eng_200011,"She went to Dillard University in New Orleans on a scholarship , then obtained her doctoral degree at Harvard .","It requires the management skills of a corporate CEO and the political skill to mediate between vastly disparate , and often stubborn , constituencies _ a school 's faculty members , students , administrators and alumni .",nyt_eng_20001110_0455_10:4_discard,discard
nyt_eng_20001103_0352_1:9,neg-mit,as_pivotal,as,pivotal,Few presidential elections in U.S. history have been as pivotal as those coming up on Nov. 7 .,nyt_eng_20001103_0352_1,9,nyt_eng_200011,,"In past elections candidates often faced international crises threatening major conflict , or impending economic recession .",nyt_eng_20001103_0352_1:9_discard,discard
nyt_eng_20001102_0402_1:9,neg-mit,as_pivotal,as,pivotal,Few presidential elections in U.S. history have been as pivotal as those coming up on Nov. 7 .,nyt_eng_20001102_0402_1,9,nyt_eng_200011,,"In past elections candidates often faced international crises threatening major conflict , or impending economic recession .",nyt_eng_20001102_0402_1:9_discard,discard
nyt_eng_20001102_0400_1:9,neg-mit,as_pivotal,as,pivotal,Few presidential elections in U.S. history have been as pivotal as those coming up on Nov. 7 .,nyt_eng_20001102_0400_1,9,nyt_eng_200011,,"In past elections candidates often faced international crises threatening major conflict , or impending economic recession .",nyt_eng_20001102_0400_1:9_discard,discard
nyt_eng_20011019_0113_19:24,neg-mit,as_conceited,as,conceited,"I mean , you do look at yourself in the mirror and notice little bumps on your face , but few guys are as conceited as Derek Zoolander .",nyt_eng_20011019_0113_19,24,nyt_eng_200110,"And as far as vanity goes , that was pretty exaggerated too .",Accuracy  -COL-  2.5 Overall  -COL-  8.5,nyt_eng_20011019_0113_19:24_discard,discard
nyt_eng_20011017_0098_19:24,neg-mit,as_conceited,as,conceited,"I mean , you do look at yourself in the mirror and notice little bumps on your face , but few guys are as conceited as Derek Zoolander .",nyt_eng_20011017_0098_19,24,nyt_eng_200110,"And as far as vanity goes , that was pretty exaggerated too .",Accuracy  -COL-  2.5 Overall  -COL-  8.5,nyt_eng_20011017_0098_19:24_discard,discard
nyt_eng_20011017_0097_19:24,neg-mit,as_conceited,as,conceited,"I mean , you do look at yourself in the mirror and notice little bumps on your face , but few guys are as conceited as Derek Zoolander .",nyt_eng_20011017_0097_19,24,nyt_eng_200110,"And as far as vanity goes , that was pretty exaggerated too .",Accuracy  -COL-  2.5 Overall  -COL-  8.5,nyt_eng_20011017_0097_19:24_discard,discard
nyt_eng_20011004_0439_55:4,neg-mit,as_dark,as,dark,Few hours are as dark as these for the world .,nyt_eng_20011004_0439_55,4,nyt_eng_200110,There is not a single teardrop or act of contrition for past atrocities .,"On one side is Bin Laden 's blind fundamentalism , dedicated to destroying American civilian and military life .",nyt_eng_20011004_0439_55:4_discard,discard
nyt_eng_20051217_0081_22:35,neg-mit,even_aware,even,aware,"And while , theoretically , top students from any high school in the country can apply for the preparatory schools , the system has become so rarefied that few people from working-class neighborhoods are even aware that the opportunity exists .",nyt_eng_20051217_0081_22,35,nyt_eng_200512,"Administrators at the grandes ecoles say students who do not follow the focused , specialized curriculum of the preparatory schools have almost no chance of being accepted .","-LBQ-  There 's a lack of information , no one talked to us about the preparatory schools ,  -RDQ-  said Alexis Blasselle , 20 , the daughter of working-class parents and now a student at the exclusive Ecole Polytechnique .",nyt_eng_20051217_0081_22:35_discard,discard
nyt_eng_20051215_0182_4:17,neg-mit,as_indie,as,indie,"A few days in the life of a struggling Hollywood actress ,  -LBQ-  Parker  -RDQ-  is as indie as they come  -COL-  shot on video , hand-held camerawork , found sound .",nyt_eng_20051215_0182_4,17,nyt_eng_200512,"-LBQ-  King Kong  -RDQ-  may provide Watts with massive global stardom - and she 's good in it , too - but  -LBQ-  Ellie Parker ,  -RDQ-  made for 0.001 percent of the catering budget of  -LBQ-  Kong ,  -RDQ-  proves she 's one of the nerviest actresses around .",Writer\/director\/costar Scott Coffey is an acting friend of Watts 's who made a short version of this film around the time they both appeared in  -LBQ-  Mulholland  -RDQ-  ; a successful screening at Sundance gave him the momentum to turn it into a feature .,nyt_eng_20051215_0182_4:17_discard,discard
nyt_eng_20050907_0270_12:5,neg-mit,so_upset,so,upset,"A few Democrats were so upset by the tone of Chertoff 's remarks that they walked out of the briefing , said Rep. Elijah Cummings , D-Md . , who said he stayed for all of the remarks but became increasingly frustrated by what he heard .",nyt_eng_20050907_0270_12,5,nyt_eng_200509,People felt we are not going to get the truth here .  -RDQ-,"-LBQ-  The picture was being painted that things were not as bad as they appeared to be  -RDQ-  in news media reports , Cummings said in an interview .",nyt_eng_20050907_0270_12:5_discard,discard
nyt_eng_20050205_0057_1:30,neg-mit,fiercely_outspoken,fiercely,outspoken,"Back in 2002 , when the City Council was weighing Mayor Michael R. Bloomberg 's proposal to eliminate smoking from all indoor public places , few opponents were more fiercely outspoken than James McBratney , president of the Staten Island Restaurant and Tavern Association .",nyt_eng_20050205_0057_1,30,nyt_eng_200502,,He frequently ripped Bloomberg as a billionaire dictator with a prohibitionist streak that would undo small businesses like his bar and his restaurant .,nyt_eng_20050205_0057_1:30_discard,discard
nyt_eng_20050205_0056_30:30,neg-mit,fiercely_outspoken,fiercely,outspoken,"Back in 2002 , when the City Council was weighing Mayor Michael R. Bloomberg 's proposal to eliminate smoking from all indoor public places , few opponents were more fiercely outspoken than James McBratney , president of the Staten Island Restaurant and Tavern Association .",nyt_eng_20050205_0056_30,30,nyt_eng_200502,"But at the very least , the president indicated during his State of the Union address on Wednesday , it may offer workers a better deal .",He frequently ripped Bloomberg as a billionaire dictator with a prohibitionist streak that would undo small businesses like his bar and his restaurant .,nyt_eng_20050205_0056_30:30_discard,discard
nyt_eng_20081230_0162_3:12,neg-mit,ever_simple,ever,simple,"But when it comes to college admissions , few things are ever simple .",nyt_eng_20081230_0162_3,12,nyt_eng_200812,"The new policy is called Score Choice , and the College Board hopes it will reduce student stress around the SAT and college admissions .","Some highly selective colleges have already said that they will not go along with Score Choice , and the policy is stirring heated debate among high school counselors and college admissions officials .",nyt_eng_20081230_0162_3:12_discard,discard
nyt_eng_20081230_0131_3:12,neg-mit,ever_simple,ever,simple,"But when it comes to college admissions , few things are ever simple .",nyt_eng_20081230_0131_3,12,nyt_eng_200812,"The new policy is called Score Choice , and the College Board hopes it will reduce student stress around the SAT and college admissions .","Some highly selective colleges have already said that they will not go along with Score Choice , and the policy is stirring heated debate among high school counselors and college admissions officials .",nyt_eng_20081230_0131_3:12_discard,discard
nyt_eng_20081225_0023_145:5,neg-mit,so_consistent,so,consistent,Few writers have been so consistent over so many years in the tone and execution of their work .,nyt_eng_20081225_0023_145,5,nyt_eng_200812,-LBQ-  It 's a more surreptitious sense of discovery that happens to the writer himself .  -RDQ-,"Just before rehearsals began for the West End production of  -LBQ-  The Birthday Party  -RDQ-  half a century ago , Pinter sent a letter to his director , Peter Wood .",nyt_eng_20081225_0023_145:5_discard,discard
nyt_eng_20091217_0092_21:29,neg-mit,truly_operational,truly,operational,"The Federation of American Scientists estimates that about 2,000 of them are actually deployed , while the Arms Control Association says that perhaps just a few hundred are truly operational .",nyt_eng_20091217_0092_21,29,nyt_eng_200912,"Russia has 3,000-8 ,000 of them , according to the Center for Defense Information .","Estimates of U.S. tactical nuclear weapons range from 500-1 ,200 , with about 150-240 still deployed in Belgium , Germany , Italy , the Netherlands and Turkey , half as many as about five years ago .",nyt_eng_20091217_0092_21:29_discard,discard
nyt_eng_20060601_0151_30:5,neg-mit,simply_dull,simply,dull,A few bits are simply dull .,nyt_eng_20060601_0151_30,5,nyt_eng_200606,That 's the nature of unscripted comedy ; sometimes what passes for raw is really too much rambling .,"But when the show works , it 's hilarious .",nyt_eng_20060601_0151_30:5_discard,discard
nyt_eng_20020826_0116_1:16,neg-mit,wrenchingly_candid,wrenchingly,candid,"In the turbulent history of the American presidency , few public moments have been more wrenchingly candid than when George W. Bush learned that terrorists had struck the American homeland last Sept. 11 .",nyt_eng_20020826_0116_1,16,nyt_eng_200208,,Bush was interrupted with the tragic news while he read to children at a Florida school with the cameras rolling .,nyt_eng_20020826_0116_1:16_discard,discard
nyt_eng_20040917_0183_31:6,neg-mit,as_cosmopolitan,as,cosmopolitan,"But few cars are quite as cosmopolitan as Suzuki 's latest sedans , the compact Forenza and midsize Verona .",nyt_eng_20040917_0183_31,6,nyt_eng_200409,"-LRB- NYT37 -RRB- UNDATED -- Sept. 17 , 2004 -- Adv . for Sunday , Sept. 19 -- ABOUT-CARS-SUZUKI -- In today 's global auto industry , Chinese workers bolt bumpers onto Jeeps while good ol' boys drive Nissan trucks off the assembly line in Mississippi -LRB- and polish Mercedes 's three-pointed star in Alabama -RRB- .","The 2004 Suzuki Verona , inside and out .",nyt_eng_20040917_0183_31:6_discard,discard
nyt_eng_20040917_0036_14:6,neg-mit,so_gauche,so,gauche,Few national leaders would be so gauche as to venture their opinion on another country 's election .,nyt_eng_20040917_0036_14,6,nyt_eng_200409,"Blair , of course , is not saying who he favors in the U.S. presidential race .",But speculation as to his feelings is rife in Britain .,nyt_eng_20040917_0036_14:6_discard,discard
nyt_eng_20050806_0128_129:8,neg-mit,so_uneventful,so,uneventful,"Their first few weeks in Iraq were so uneventful that they were called  -LBQ-  Lucky Lima ,  -RDQ-  But when death came , it came in abundance .",nyt_eng_20050806_0128_129,8,nyt_eng_200508,The troops from Columbus were Lima Company .,The first wave was during a series of dangerous missions in May .,nyt_eng_20050806_0128_129:8_discard,discard
nyt_eng_20050806_0128_122:8,neg-mit,so_uneventful,so,uneventful,"Their first few weeks in Iraq were so uneventful that they were called  -LBQ-  Lucky Lima ,  -RDQ-  But when death came , it came in abundance .",nyt_eng_20050806_0128_122,8,nyt_eng_200508,"The troops from Columbus , Ohio were Lima Company .",The first wave was during a series of dangerous missions in May .,nyt_eng_20050806_0128_122:8_discard,discard
nyt_eng_20050806_0128_116:8,neg-mit,so_uneventful,so,uneventful,"Their first few weeks in Iraq were so uneventful that they were called  -LBQ-  Lucky Lima ,  -RDQ-  But when death came , it came in abundance .",nyt_eng_20050806_0128_116,8,nyt_eng_200508,"The troops from Columbus , Ohio were Lima Company .",The first wave was during a series of dangerous missions in May .,nyt_eng_20050806_0128_116:8_discard,discard
nyt_eng_20050806_0128_53:8,neg-mit,so_uneventful,so,uneventful,"Their first few weeks in Iraq were so uneventful that they were called  -LBQ-  Lucky Lima ,  -RDQ-  But when death came , it came in abundance .",nyt_eng_20050806_0128_53,8,nyt_eng_200508,"The troops from Columbus , Ohio were Lima Company .",The first wave was during a series of dangerous missions in May .,nyt_eng_20050806_0128_53:8_discard,discard
nyt_eng_20050806_0087_9:8,neg-mit,so_uneventful,so,uneventful,Their first few weeks in Iraq were so uneventful that they were called  -LBQ-  Lucky Lima .  -RDQ-,nyt_eng_20050806_0087_9,8,nyt_eng_200508,The troops from Columbus were Lima Company .,"But when death came , it came in abundance .",nyt_eng_20050806_0087_9:8_discard,discard
nyt_eng_20050806_0051_8:8,neg-mit,so_uneventful,so,uneventful,Their first few weeks in Iraq were so uneventful that they were called  -LBQ-  Lucky Lima .  -RDQ-,nyt_eng_20050806_0051_8,8,nyt_eng_200508,The troops from Columbus were Lima Company .,"But when death came , it came in abundance .",nyt_eng_20050806_0051_8:8_discard,discard
nyt_eng_20050806_0048_14:8,neg-mit,so_uneventful,so,uneventful,Their first few weeks in Iraq were so uneventful that they were called  -LBQ-  Lucky Lima .  -RDQ-,nyt_eng_20050806_0048_14,8,nyt_eng_200508,"IRAQ-MARINES-OHIO -LRB- Columbus , Ohio -RRB- -- The troops from Columbus were Lima Company .","But when death came , it came in abundance .",nyt_eng_20050806_0048_14:8_discard,discard
nyt_eng_20050806_0042_37:8,neg-mit,so_uneventful,so,uneventful,"Their first few weeks in Iraq were so uneventful that they were called  -LBQ-  Lucky Lima ,  -RDQ-  But when death came , it came in abundance .",nyt_eng_20050806_0042_37,8,nyt_eng_200508,"IRAQ-MARINES-OHIO -LRB- Columbus , Ohio -RRB- -- The troops from Columbus were Lima Company .",The first wave was during a series of dangerous missions in May .,nyt_eng_20050806_0042_37:8_discard,discard
nyt_eng_20050806_0039_35:8,neg-mit,so_uneventful,so,uneventful,"Their first few weeks in Iraq were so uneventful that they were called  -LBQ-  Lucky Lima ,  -RDQ-  But when death came , it came in abundance .",nyt_eng_20050806_0039_35,8,nyt_eng_200508,"IRAQ-MARINES-OHIO -LRB- Columbus , Ohio -RRB- -- The troops from Columbus were Lima Company .",The first wave was during a series of dangerous missions in May .,nyt_eng_20050806_0039_35:8_discard,discard
nyt_eng_20050802_0212_48:12,neg-mit,as_untouchable,as,untouchable,"Besides the party 's monopoly on power , few orthodoxies are as untouchable today as hostility toward Japan .",nyt_eng_20050802_0212_48,12,nyt_eng_200508,Having a hated neighbor shores up national solidarity and helps distract people from the failings of the Chinese Communist Party .,"Yu Jie , a Chinese author who spent time in Japan researching a book on the two countries ' relations ,  -LBQ-  Iron and Plough ,  -RDQ-  and went on to write another book about his experiences in Japan , discovered that at his own expense .",nyt_eng_20050802_0212_48:12_discard,discard
nyt_eng_20060228_0221_3:25,neg-mit,fully_internet-based,fully,internet-based,"Although both for-profit colleges and traditional ones have expanded their Internet and online offerings in recent years , only a few dozen universities are fully Internet-based , and most of them are for-profit ones .",nyt_eng_20060228_0221_3,25,nyt_eng_200602,That change is expected to be of enormous value to the commercial education industry .,"The provision is just one sign of how an industry that once had a dubious reputation has gained new influence , with well-connected friends in the government and many congressional Republicans sympathetic to their entrepreneurial ethic .",nyt_eng_20060228_0221_3:25_discard,discard
nyt_eng_20060201_0028_13:9,neg-mit,largely_thematic,largely,thematic,"The few new ideas he did unveil were largely thematic , not backed by broad programmatic initiatives .",nyt_eng_20060201_0028_13,9,nyt_eng_200602,"The budget deficit , rising again despite Bush 's promise to cut it in half by the time he leaves office in 2009 , effectively handcuffs him when it comes to new initiatives .","Three years into the war in Iraq , Bush tried to strike a tone of optimism , saying that  -LBQ-  we are in this fight , and we are winning .  -RDQ-",nyt_eng_20060201_0028_13:9_discard,discard
nyt_eng_20010425_0213_66:18,neg-mit,as_joyful,as,joyful,"Federal Reserve announced its surprise rate cut and Wall Street soared on cue , few places were as joyful as the wicker - and upholstery-lined streets of this one-note Piedmont town .",nyt_eng_20010425_0213_66,18,nyt_eng_200104,"HIGH-POINT-SHOW -LRB- High Point , N.C. -RRB- _ On April 18 , when the","The news came on the eve of the semiannual International Home Furnishings Market here , just as 80,000 wholesale buyers and sales representatives began jostling through 10 million square feet of furniture and accessories showrooms , signing the deals that will determine which love seats , wall units and dinette sets will land in stores next fall .",nyt_eng_20010425_0213_66:18_discard,discard
nyt_eng_20010425_0182_22:18,neg-mit,as_joyful,as,joyful,"Federal Reserve announced its surprise rate cut and Wall Street soared on cue , few places were as joyful as the wicker - and upholstery-lined streets of this one-note Piedmont town .",nyt_eng_20010425_0182_22,18,nyt_eng_200104,"HIGH-POINT-SHOW -LRB- High Point , N.C. -RRB- _ On April 18 , when the","The news came on the eve of the semiannual International Home Furnishings Market here , just as 80,000 wholesale buyers and sales representatives began jostling through 10 million square feet of furniture and accessories showrooms , signing the deals that will determine which love seats , wall units and dinette sets will land in stores next fall .",nyt_eng_20010425_0182_22:18_discard,discard
nyt_eng_20010409_0182_9:20,neg-mit,so_punctilious,so,punctilious,The administration was careful not to talk of the arrested crew as hostages -LRB- a few congressmen were not so punctilious -RRB- .,nyt_eng_20010409_0182_9,20,nyt_eng_200104,"As one senior official put it , America was trying to give the Chinese time to let things cool down .","More important , Bush squelched any opportunity for the factions in his foreign-policy team to dash off in different directions by ensuring that the president himself and his secretary of state , Colin Powell , were the only ones to speak in public .",nyt_eng_20010409_0182_9:20_discard,discard
nyt_eng_20010406_0158_9:20,neg-mit,so_punctilious,so,punctilious,The administration was careful not to talk of the arrested crew as hostages -LRB- a few congressmen were not so punctilious -RRB- .,nyt_eng_20010406_0158_9,20,nyt_eng_200104,"As one senior official put it , America was trying to give the Chinese time to let things cool down .","More important , Bush squelched any opportunity for the factions in his foreign-policy team to dash off in different directions by ensuring that the president himself and his secretary of state , Colin Powell , were the only ones to speak in public .",nyt_eng_20010406_0158_9:20_discard,discard
nyt_eng_20010406_0157_9:20,neg-mit,so_punctilious,so,punctilious,The administration was careful not to talk of the arrested crew as hostages -LRB- a few congressmen were not so punctilious -RRB- .,nyt_eng_20010406_0157_9,20,nyt_eng_200104,"As one senior official put it , America was trying to give the Chinese time to let things cool down .","More important , Bush squelched any opportunity for the factions in his foreign-policy team to dash off in different directions by ensuring that the president himself and his secretary of state , Colin Powell , were the only ones to speak in public .",nyt_eng_20010406_0157_9:20_discard,discard
