hit_id,bigram_lower,adj_form_lower,all_forms_lower,adv_form_lower,text_window,token_str
pcc_eng_21_017.7401_x0270204_10:5-6-7,necessarily_representative,representative,not_necessarily_representative,necessarily,"while these families are not necessarily representative of the total sample , they","While these families are not necessarily representative of the total sample , they illustrate recurring themes : households struggling with income volatility , unplanned expenses , and finding ways to save and invest , but also using creative -- and sometimes counterintuitive -- budget and money management strategies to help make ends meet ."
pcc_eng_14_099.8810_x1598385_25:7-8-9,necessarily_representative,representative,not_necessarily_representative,necessarily,results obtained for past clients are not necessarily representative of results which may be obtained,Results obtained for past clients are not necessarily representative of results which may be obtained in your case .
pcc_eng_26_095.3154_x1525253_030:11-12-13,necessarily_representative,representative,not_necessarily_representative,necessarily,"favorite authors , but they 're not necessarily representative .","I have my own favorite authors , but they 're not necessarily representative ."
pcc_eng_17_043.6545_x0688850_11:09-10-11,necessarily_representative,representative,not_necessarily_representative,necessarily,sample may represent an initial product not necessarily representative of the bulk of material emitted,This one sample may represent an initial product not necessarily representative of the bulk of material emitted from the volcano .
pcc_eng_02_093.4308_x1494389_44:7-8-9,necessarily_representative,representative,not_necessarily_representative,necessarily,the opinions of lipozene users are not necessarily representative of all lipozene customers .,The opinions of Lipozene users are not necessarily representative of all Lipozene customers .
pcc_eng_08_043.6386_x0690087_12:15-16-17,necessarily_representative,representative,not_necessarily_representative,necessarily,"a rep council vote and is not necessarily representative of the 1,400 teachers in the","The union's "" no vote "" was actually a rep council vote and is not necessarily representative of the 1,400 teachers in the district ."
pcc_eng_25_039.3415_x0620589_029:10-11-12,necessarily_representative,representative,not_necessarily_representative,necessarily,things about the time and are not necessarily representative of the values held by vintage,"They reveal many things about the time and are not necessarily representative of the values held by Vintage Wings of Canada , its staff and volunteers ."
pcc_eng_27_003.7550_x0044217_12:27-28-29,necessarily_representative,representative,not_necessarily_representative,necessarily,the basis of polarized internet subcultures not necessarily representative of the chinese internet as a,"In researching the Chinese equivalents of Reddit or 4 chan , instead of Facebook , Han is drawing conclusions on the basis of polarized internet subcultures not necessarily representative of the Chinese internet as a whole ."
pcc_eng_15_096.7874_x1548209_020:16-17-18,necessarily_representative,representative,not_necessarily_representative,necessarily,of carl and myself and are not necessarily representative of the opinions of anyone else,"As always , these awards merely reflect the evaluations of Carl and myself and are not necessarily representative of the opinions of anyone else at ANN or any random squirrels you may speak with ."
pcc_eng_06_021.4885_x0331464_86:22-23-24,necessarily_representative,representative,not_necessarily_representative,necessarily,that of the author and is not necessarily representative of any association or organization with,"Although I should n't have to say it , any opinion expressed herein is solely that of the author and is not necessarily representative of any association or organization with which I may be affiliated or involved ."
pcc_eng_25_091.9969_x1472492_1:6-7-8,necessarily_representative,representative,not_necessarily_representative,necessarily,fifa footage from switch ad not necessarily representative of final game,FIFA footage from Switch ad not necessarily representative of final game
pcc_eng_05_033.2076_x0521749_274:08-09-10,necessarily_representative,representative,not_necessarily_representative,necessarily,", research done on powerlifters is not necessarily representative of anyone else who should deadlift","Also , research done on powerlifters is not necessarily representative of anyone else who should deadlift ."
pcc_eng_03_031.9250_x0500945_133:14-15-16,necessarily_representative,representative,not_necessarily_representative,necessarily,"from the album but it 's not necessarily representative of the whole album , at","It 's one of my favourite songs from the album but it 's not necessarily representative of the whole album , at least musically ."
