hit_id,bigram_lower,adj_form_lower,all_forms_lower,adv_form_lower,text_window,token_str
pcc_eng_00_008.6342_x0123248_079:30-31-32,necessarily_representative,representative,n't_necessarily_representative,necessarily,"footage over and over that is n't necessarily representative of what really happened . ""","And I 'm looking forward to sitting on the porch . "" ) , his wife ( "" a lot of the same footage over and over that is n't necessarily representative of what really happened . "" ) , his mother ( "" these people were underprivileged anyway , so this is working out well for them . "" - chuckling slightly ) , his FEMA chief ( "" I am going to fix a stiff martini and think about that . "" ) , his cabinet and the whole machinery , built precisely to take care of American citizens in the wake of any disaster of this proportion - all will go into the annals of American politics and humanity as some of the most disgraceful moments ever ."
nyt_eng_20050917_0077_15:18-19-20,necessarily_representative,representative,n't_necessarily_representative,necessarily,"footage over and over that is n't necessarily representative of what really happened , ''","when she complained of seeing `` a lot of the same footage over and over that is n't necessarily representative of what really happened , '' the first lady sounded just like Donald Rumsfeld shirking responsibility for the looting of Baghdad ."
pcc_eng_18_091.1747_x1460279_08:10-11-12,necessarily_representative,representative,n't_necessarily_representative,necessarily,page are stock photos and are n't necessarily representative of the final products .,Illustrations on this page are stock photos and are n't necessarily representative of the final products .
pcc_eng_18_085.3677_x1366028_165:25-26-27,necessarily_representative,representative,n't_necessarily_representative,necessarily,accelerando tales that stross maintains is n't necessarily representative of the larger body of his,"I came at Stross initially on Michael Swanwick 's recommendation , like so many of us with the Accelerando tales that Stross maintains is n't necessarily representative of the larger body of his work ."
pcc_eng_07_053.5131_x0848795_147:23-24-25,necessarily_representative,representative,n't_necessarily_representative,necessarily,"75,000 -- but that money was n't necessarily representative of a large audience .","At this point , Hargis ' Christian Crusade had grown to a monthly budget of $ 75,000 -- but that money was n't necessarily representative of a large audience ."
pcc_eng_07_059.7392_x0949465_10:14-15-16,necessarily_representative,representative,n't_necessarily_representative,necessarily,""" of tv and film is n't necessarily representative of the true 1980s .","Of course , the "" ' 80s "" of TV and film is n't necessarily representative of the true 1980s ."
pcc_eng_19_016.5679_x0251117_10:33-34-35,necessarily_representative,representative,n't_necessarily_representative,necessarily,"to world war i , is n't necessarily representative of the album as a whole","Although the album 's first single "" This Ain't A Scene , It 's An Arms Race , "" with its militant musical underpinnings and references to World War I , is n't necessarily representative of the album as a whole , it does illustrate a band finally content to be who they are -themselves ."
pcc_eng_22_086.2539_x1378067_29:6-7-8,necessarily_representative,representative,n't_necessarily_representative,necessarily,because a ) pictures are n't necessarily representative of how a girl looks in,Because A ) pictures are n't necessarily representative of how a girl looks in person and B ) there 's a chemistry element that you ca n't quantify beforehand .
pcc_eng_16_050.7947_x0806065_24:6-7-8,necessarily_representative,representative,n't_necessarily_representative,necessarily,"however , the nfss is n't necessarily representative of the current situation either .","However , the NFSS is n't necessarily representative of the current situation either ."
pcc_eng_00_036.5375_x0574066_03:7-8-9,necessarily_representative,representative,n't_necessarily_representative,necessarily,"the data , though , is n't necessarily representative of just eugene , and that","The data , though , is n't necessarily representative of just Eugene , and that , according to our local air agency , skews things a little ."
pcc_eng_29_085.9236_x1371750_35:35-36-37,necessarily_representative,representative,not_necessarily_representative,necessarily,", and thus the average is not necessarily representative of all potential test-takers fromthat language","In such a case , one should not include very small groups in such a comparison , since the individual test-taker has a disproportionate influence on the average , and thus the average is not necessarily representative of all potential test-takers fromthat language ."
pcc_eng_03_008.1601_x0115781_14:30-31-32,necessarily_representative,representative,not_necessarily_representative,necessarily,"discovery that one 's parents are not necessarily representative of the human species , that","One of the most profound and universal realizations of later childhood , a realization that probably is never totally integrated , is the discovery that one 's parents are not necessarily representative of the human species , that one has grown up in an idiosyncratically structured family with its own peculiarities and dramas ."
pcc_eng_17_059.4764_x0944589_063:09-10-11,necessarily_representative,representative,not_necessarily_representative,necessarily,cautions that the countries reviewed are not necessarily representative of the g-20 countries .,The report cautions that the countries reviewed are not necessarily representative of the G-20 countries .
pcc_eng_08_105.1899_x1687032_21:12-13-14,necessarily_representative,representative,not_necessarily_representative,necessarily,"provide information pertaining to experts , not necessarily representative of the people doing the work","But beware , they may provide information pertaining to experts , not necessarily representative of the people doing the work ."
pcc_eng_15_004.1793_x0051199_24:5-6-7,necessarily_representative,representative,not_necessarily_representative,necessarily,although their ideas were not necessarily representative of the opinions of their contemporaries,"Although their ideas were not necessarily representative of the opinions of their contemporaries , or of the realities of statecraft in early modern Europe , each work was widely known and read in its time and afterward ."
pcc_eng_19_020.2667_x0310965_13:11-12-13,necessarily_representative,representative,not_necessarily_representative,necessarily,"relatively small and homogenous sample , not necessarily representative of the wider uk population .","The study was a relatively small and homogenous sample , not necessarily representative of the wider UK population ."
pcc_eng_23_046.1591_x0729668_26:08-09-10,necessarily_representative,representative,not_necessarily_representative,necessarily,since those vocal constituent opponents are not necessarily representative of the public .,Particularly since those vocal constituent opponents are not necessarily representative of the public .
pcc_eng_23_084.8815_x1355645_21:16-17-18,necessarily_representative,representative,not_necessarily_representative,necessarily,over the past few weeks are not necessarily representative of any sudden crisis which has,The sudden decline of Greece 's best and brightest over the past few weeks are not necessarily representative of any sudden crisis which has developed over the past few months .
pcc_eng_04_049.4853_x0783531_092:18-19-20,necessarily_representative,representative,not_necessarily_representative,necessarily,"were limited , very expensive and not necessarily representative of the end performance ( due","Just 5 years ago , my options for prototyping a concept were limited , very expensive and not necessarily representative of the end performance ( due to lack of material choices or properties inherent to the prototyping process ) ."
pcc_eng_14_080.7935_x1290162_45:13-14-15,necessarily_representative,representative,not_necessarily_representative,necessarily,"very unusual , and they 're not necessarily representative of something that we see right","So yes , his sculptures look very unusual , and they 're not necessarily representative of something that we see right here ."
pcc_eng_06_108.8997_x1745532_27:35-36-37,necessarily_representative,representative,not_necessarily_representative,necessarily,a random sample and therefore are not necessarily representative of the whole population .,"The polling industry 's professional body , the Marketing Research and Intelligence Association , says online surveys cannot be assigned a margin of error as they are not a random sample and therefore are not necessarily representative of the whole population ."
pcc_eng_04_104.5515_x1672801_17:19-20-21,necessarily_representative,representative,not_necessarily_representative,necessarily,species and notice how these are not necessarily representative of reality but were learned behaviors,Look at all the beliefs we amass that divide us as a species and notice how these are not necessarily representative of reality but were learned behaviors that further perpetuated the destructive cycles in human behavior that we see today .
pcc_eng_test_3.04763_x42109_08:42-43-44,necessarily_representative,representative,not_necessarily_representative,necessarily,"many around the country , and not necessarily representative of my own .","What I earn is merely enough to cover food and transport expenses in London over a week , but I value the experience for the insight it may provide into the lives and realities of many around the country , and not necessarily representative of my own ."
pcc_eng_10_019.7780_x0303476_14:18-19-20,necessarily_representative,representative,not_necessarily_representative,necessarily,means they were n't random and not necessarily representative of all men who have played,"The brains studied were mostly donated by concerned families , which means they were n't random and not necessarily representative of all men who have played football ."
pcc_eng_28_079.8739_x1275824_49:22-23-24,necessarily_representative,representative,not_necessarily_representative,necessarily,versus solely fulfilling domestic duties is not necessarily representative of what mothers at home are,The societal implication that staying at home means you are living a life of luxury versus solely fulfilling domestic duties is not necessarily representative of what mothers at home are doing .
pcc_eng_24_103.5595_x1659320_22:7-8-9,necessarily_representative,representative,not_necessarily_representative,necessarily,the things i do online are not necessarily representative of most internet addicts .,The things I do online are not necessarily representative of most Internet Addicts .
pcc_eng_24_036.8042_x0578946_08:3-4-5,necessarily_representative,representative,not_necessarily_representative,necessarily,comments are not necessarily representative of prepare new york 's views,Comments are not necessarily representative of Prepare New York 's views or beliefs .
pcc_eng_07_057.2392_x0908888_19:19-20-21,necessarily_representative,representative,not_necessarily_representative,necessarily,"health , the biobank participants are not necessarily representative of the general uk population or","The study does n't prove whether or how muscle strength might influence health , the Biobank participants are not necessarily representative of the general UK population or that of other countries ."
pcc_eng_10_072.2098_x1151182_27:32-33-34,necessarily_representative,representative,not_necessarily_representative,necessarily,realize the feeling of intimidation was not necessarily representative of all women in gaza .,"A Gazan woman working in the private sector , who spoke to The Media Line on condition of anonymity , said it was important to realize the feeling of intimidation was not necessarily representative of all women in Gaza ."
pcc_eng_03_045.3218_x0718004_6:3-4-5,necessarily_representative,representative,not_necessarily_representative,necessarily,it is not necessarily representative of where they will actually be,It is not necessarily representative of where they will actually be drafted .
pcc_eng_test_1.1499_x02415_124:17-18-19,necessarily_representative,representative,not_necessarily_representative,necessarily,due to .jpg compression they are not necessarily representative of the quality of the transfer,"Full-resolution captures are available by clicking individual images , but due to .jpg compression they are not necessarily representative of the quality of the transfer ."
pcc_eng_22_007.0094_x0096898_121:4-5-6,necessarily_representative,representative,not_necessarily_representative,necessarily,"the sample is not necessarily representative , for people have many reasons","The sample is not necessarily representative , for people have many reasons to click "" like "" on the movement 's well - tailored page -- I have been following Casa Pound for several years -- but the report observes that Casa Pound 's supporters tend to be male and tend to distrust institutions ."
pcc_eng_21_025.3273_x0393071_22:09-10-11,necessarily_representative,representative,not_necessarily_representative,necessarily,whose genetic information was used are not necessarily representative of all americans .,Me customers whose genetic information was used are not necessarily representative of all Americans .
pcc_eng_11_066.2717_x1056416_16:4-5-6,necessarily_representative,representative,not_necessarily_representative,necessarily,"Our covers are not necessarily representative . ""","Our covers are not necessarily representative . """
pcc_eng_21_076.0376_x1212613_8:14-15-16,necessarily_representative,representative,not_necessarily_representative,necessarily,"those of the individual authors and not necessarily representative of the gmcte , cgsr ,","The opinions expressed on this blog are those of the individual authors and not necessarily representative of the GMCTE , CGSR , or the University of Saskatchewan ."
pcc_eng_06_070.2142_x1119923_22:18-19-20,necessarily_representative,representative,not_necessarily_representative,necessarily,"from refugees and defectors , is not necessarily representative of those still living in the","Also , Kretchun cautioned that the research , based on accounts from refugees and defectors , is not necessarily representative of those still living in the country ."
pcc_eng_18_006.8789_x0095227_016:4-5-6,necessarily_representative,representative,not_necessarily_representative,necessarily,"it 's therefore not necessarily representative , and especially likely to be","It 's therefore not necessarily representative , and especially likely to be unrepresentative once you get to college or subject level ."
pcc_eng_05_083.7342_x1338981_30:27-28-29,necessarily_representative,representative,not_necessarily_representative,necessarily,presentation or other communication vehicles are not necessarily representative of the views and opinions of,The views and opinions expressed by the SOI Industry Consortium through officers in the SOI Industry Consortium or in this presentation or other communication vehicles are not necessarily representative of the views and opinions of individual members .
pcc_eng_26_003.8053_x0045203_09:19-20-21,necessarily_representative,representative,not_necessarily_representative,necessarily,articles selected here for analysis are not necessarily representative of the globe and mail 's,It is important to highlight that we abide by the fact that articles selected here for analysis are not necessarily representative of the Globe and Mail 's overall coverage of social issues nor the evidence presented in this report serve as proof of bias in media in Canada .
pcc_eng_val_3.04490_x41870_04:12-13-14,necessarily_representative,representative,not_necessarily_representative,necessarily,may not be accurate and are not necessarily representative of the experiences of the advisor,"Comments are not verified , may not be accurate and are not necessarily representative of the experiences of the advisor 's clients ."
pcc_eng_18_037.2396_x0586285_16:22-23-24,necessarily_representative,representative,not_necessarily_representative,necessarily,"lessons , meaning they were "" not necessarily representative of the nation as a whole","An Ofsted spokeswoman insisted that the figures were based on a "" sample "" of lessons , meaning they were "" not necessarily representative of the nation as a whole "" ."
pcc_eng_00_016.2604_x0246368_02:1-2-3,necessarily_representative,representative,not_necessarily_representative,necessarily,"not necessarily representative of the book , this is","Not necessarily representative of the book , this is a peek at some of the mystery ."
pcc_eng_01_044.0793_x0696012_10:4-5-6,necessarily_representative,representative,not_necessarily_representative,necessarily,human behavior is not necessarily representative of what is happening deep inside,Human behavior is not necessarily representative of what is happening deep inside our psychic .
pcc_eng_05_004.4982_x0056899_10:19-20-21,necessarily_representative,representative,not_necessarily_representative,necessarily,"i actually attended , and are not necessarily representative of the entire meeting , given","What follows are just some random notes and observations from the sessions I actually attended , and are not necessarily representative of the entire meeting , given of course that I picked the topics that tickled my curiosity ."
pcc_eng_07_009.0572_x0130558_2:09-10-11,necessarily_representative,representative,not_necessarily_representative,necessarily,of air near ground level is not necessarily representative of the troposphere as a whole,The composition of air near ground level is not necessarily representative of the troposphere as a whole .
pcc_eng_08_078.4529_x1254176_43:6-7-8,necessarily_representative,representative,not_necessarily_representative,necessarily,"the opinions expressed here are not necessarily representative of the opinions of hedgebrook ,","The opinions expressed here are not necessarily representative of the opinions of Hedgebrook , its staff or board members ."
pcc_eng_11_098.5959_x1579848_18:11-12-13,necessarily_representative,representative,not_necessarily_representative,necessarily,"lesbians mingle dating site experiences are not necessarily representative of , credits for an hour","Top dating sites for lesbians Mingle dating site Experiences are not necessarily representative of , credits for an hour is all that online dating really something works both you , but he has no say in how ."
pcc_eng_06_093.9660_x1503589_75:20-21-22,necessarily_representative,representative,not_necessarily_representative,necessarily,statements made by individuals and are not necessarily representative of the institution of which they,All quotes featured by professors and school leaders on this website are public statements made by individuals and are not necessarily representative of the institution of which they are associated .
pcc_eng_08_044.8757_x0710079_46:15-16-17,necessarily_representative,representative,not_necessarily_representative,necessarily,""" mormon apologists "" write is not necessarily representative of what most "" mormons ""","Let 's just be clear : what some "" Mormon Apologists "" write is not necessarily representative of what most "" Mormons "" think or believe ."
pcc_eng_29_093.0438_x1486867_15:6-7-8,necessarily_representative,representative,not_necessarily_representative,necessarily,"admittedly , that company was not necessarily representative of the treasury world as a","Admittedly , that company was not necessarily representative of the treasury world as a whole ."
pcc_eng_03_009.9521_x0144759_35:09-10-11,necessarily_representative,representative,not_necessarily_representative,necessarily,apparent reaction at that meeting was not necessarily representative of any sort of consensus among,So the apparent reaction at that meeting was not necessarily representative of any sort of consensus among Wilkinsburg residents .
pcc_eng_03_047.8306_x0758643_4:12-13-14,necessarily_representative,representative,not_necessarily_representative,necessarily,of the respective authors and is not necessarily representative of real democracy bristol .,Each article expresses the ideas of the respective authors and is not necessarily representative of Real Democracy Bristol .
pcc_eng_09_039.7110_x0626514_02:4-5-6,necessarily_representative,representative,not_necessarily_representative,necessarily,my characters are not necessarily representative of the communities in which they,"My characters are not necessarily representative of the communities in which they live , and I will not hesitate to make them Armenian or Catholic or Pakistani , even if they 're not portrayed as perfectly emblematic of Armenians , Catholics or Pakistanis as a whole ."
pcc_eng_22_006.8978_x0095081_30:7-8-9,necessarily_representative,representative,not_necessarily_representative,necessarily,views expressed on this site are not necessarily representative of the views of giles mc,Views expressed on this site are not necessarily representative of the views of Giles Mc Neill .
pcc_eng_23_037.4066_x0588215_53:18-19-20,necessarily_representative,representative,not_necessarily_representative,necessarily,those commenting on the blog are not necessarily representative of our views either .,"And as far as that goes , the views expressed by those commenting on the blog are not necessarily representative of our views either ."
pcc_eng_09_090.8293_x1453472_13:3-4-5,necessarily_representative,representative,not_necessarily_representative,necessarily,that 's not necessarily representative of whether the role fits you,"That 's not necessarily representative of whether the role fits you or not , but rather how you react to the writing and the piece as a whole ."
pcc_eng_27_027.8893_x0434352_034:20-21-22,necessarily_representative,representative,not_necessarily_representative,necessarily,"year at a single course , not necessarily representative of how a player plays overall","The league system could dramatically increase the number of rated rounds in a year at a single course , not necessarily representative of how a player plays overall ( just how they play on that one course ) ."
pcc_eng_24_021.3862_x0329271_08:4-5-6,necessarily_representative,representative,not_necessarily_representative,necessarily,but i am not necessarily representative of the consumer market .,But I am not necessarily representative of the consumer market .
pcc_eng_14_001.8773_x0014307_09:38-39-40,necessarily_representative,representative,not_necessarily_representative,necessarily,actually our interpretation of events and not necessarily representative of reality .,"The challenge here is for us to recognise what we are thinking , when we are thinking it and by taking notice we can then understand that our thoughts are just actually our interpretation of events and not necessarily representative of reality ."
pcc_eng_29_098.6716_x1578038_16:4-5-6,necessarily_representative,representative,not_necessarily_representative,necessarily,these findings are not necessarily representative of the whole country .,These findings are not necessarily representative of the whole country .
pcc_eng_14_033.4755_x0524643_21:4-5-6,necessarily_representative,representative,not_necessarily_representative,necessarily,the testimonials are not necessarily representative of all of those who will,The testimonials are not necessarily representative of all of those who will use our leads and / or services .
pcc_eng_29_037.5350_x0589619_208:15-17-18,necessarily_representative,representative,not_necessarily_representative,necessarily,rents are available and may not be necessarily representative of the housing stock and market,"He recommends using only rents , even if few rents are available and may not be necessarily representative of the housing stock and market ."
pcc_eng_22_084.9008_x1356117_40:31-32-33,necessarily_representative,representative,not_necessarily_representative,necessarily,against all proposed legislation is therefore not necessarily representative of a nota vote .,"So the biggest issue here is that representatives are not exact proxies for legislation , and that considering a NOTA vote as a vote against all proposed legislation is therefore not necessarily representative of a NOTA vote ."
pcc_eng_13_004.1910_x0051457_12:10-11-12,necessarily_representative,representative,not_necessarily_representative,necessarily,by one of our volunteers is not necessarily representative of the policies or practices of,Any opinion expressed by one of our volunteers is not necessarily representative of the policies or practices of the society as a whole .
pcc_eng_08_105.8876_x1698315_26:12-13-14,necessarily_representative,representative,not_necessarily_representative,necessarily,"more negative mood , they are not necessarily representative of retail as a whole .","While their fortunes reflect a more negative mood , they are not necessarily representative of retail as a whole . """
pcc_eng_08_100.2922_x1607670_064:2-3-4,necessarily_representative,representative,not_necessarily_representative,necessarily,"while not necessarily representative of democratic voters , progressive pundits","While not necessarily representative of Democratic voters , progressive pundits and journalists increasingly speak a dialect of ethical cosmopolitanism or globalism -- the idea that it is unjust to discriminate in favor of one 's fellow nationals against citizens of foreign countries ."
pcc_eng_17_084.1788_x1344171_26:4-5-6,necessarily_representative,representative,not_necessarily_representative,necessarily,the people are not necessarily representative of their governments decisions .,The people are not necessarily representative of their governments decisions .
