hit_id,bigram_lower,adv_form_lower,adj_form_lower,all_forms_lower,text_window,token_str
pcc_eng_00_087.8554_x1404281_015:11-12,longer_historical,longer,historical,(+)_longer_historical,'s standards should be seen in a longer historical perspective .,Gumbinger says today 's standards should be seen in a longer historical perspective .
pcc_eng_16_104.3099_x1672193_115:3-4,longer_historical,longer,historical,(+)_longer_historical,over a longer historical period changes in u.s. union strength,Over a longer historical period changes in U.S. union strength show little correlation with middle - class income shares .
pcc_eng_14_024.7173_x0383139_021:32-33,longer_historical,longer,historical,(+)_longer_historical,the added twists of that period 's longer historical narrative in ireland .,"Instead , we are immersed in four years of remembering the Great War of 1914 - 1918 a hundred years on , with all the added twists of that period 's longer historical narrative in Ireland ."
pcc_eng_21_022.4218_x0345941_57:16-17,longer_historical,longer,historical,(+)_longer_historical,fail to celebrate success and lose a longer historical view of how the world has,"difficulty of the work , too often we fail to celebrate success and lose a longer historical view of how the world has changed for the better ."
pcc_eng_13_015.3376_x0231603_27:12-13,longer_historical,longer,historical,(+)_longer_historical,"closing of the frontier , counties with longer historical frontier experience exhibit more prevalent individualism","Many decades after the closing of the frontier , counties with longer historical frontier experience exhibit more prevalent individualism and opposition to redistribution and regulation ."
pcc_eng_27_008.1691_x0115401_1:13-14,longer_historical,longer,historical,(+)_longer_historical,"this summer , this video takes the longer historical view .","While temperatures have been blistering this summer , this video takes the longer historical view ."
pcc_eng_27_105.5635_x1691420_089:18-19,longer_historical,longer,historical,(+)_longer_historical,"and the various zones in both a longer historical continuum with colonial practices , while","The following excerpt is an attempt at situating the wall and the various zones in both a longer historical continuum with colonial practices , while also reflecting on the settler-colonial specificities of their present form ."
pcc_eng_13_087.6956_x1401159_23:3-4,longer_historical,longer,historical,(+)_longer_historical,there is longer historical precedence for this in the traditional,There is longer historical precedence for this in the traditional Japanese way simply known as do .
pcc_eng_11_038.1037_x0600596_13:42-43,longer_historical,longer,historical,(+)_longer_historical,sound comparison of normal conditions over a longer historical period ...,The massive remote sensing archives at the USGS Earth Resources Observation and Science Center ( USGS - EROS ) supply historical satellite data from the last 20 years that are critical in establishing a sound comparison of normal conditions over a longer historical period ...
