hit_id,adv_form_lower,adj_form_lower,bigram_lower,neg_form_lower,all_forms_lower,text_window,token_str
pcc_eng_09_089.6403_x1434282_019:23-24-25,necessarily,indicative,necessarily_indicative,not,not_necessarily_indicative,score on any one title is not necessarily indicative of a deliberate effort to remove,"NB - the Bechdel Test is useful for showing overall gender bias , and a low score on any one title is not necessarily indicative of a deliberate effort to remove women , nor is it a comment on the quality of the title or the individual portrayal of women characters ."
pcc_eng_00_067.3431_x1072362_83:4-5-6,necessarily,indicative,necessarily_indicative,not,not_necessarily_indicative,Past performance is not necessarily indicative of future returns .,Past performance is not necessarily indicative of future returns .
pcc_eng_01_092.4010_x1477823_39:22-23-24,necessarily,indicative,necessarily_indicative,not,not_necessarily_indicative,or adoption of ptc software is not necessarily indicative of the timing or amount of,"Get more information at The announcement of a customer 's selection , implementation , deployment or adoption of PTC software is not necessarily indicative of the timing or amount of revenue therefrom or of PTC 's overall revenue for any particular period ."
pcc_eng_25_009.3045_x0134450_37:4-5-6,necessarily,indicative,necessarily_indicative,not,not_necessarily_indicative,this research is not necessarily indicative of the population as a whole,"This research is not necessarily indicative of the population as a whole ; in fact , it is probably an underestimate ."
pcc_eng_18_011.6927_x0173116_4:14-15-16,necessarily,indicative,necessarily_indicative,not,not_necessarily_indicative,purposes only ; past performance is not necessarily indicative of future results .,Any references to performance are for illustrative purposes only ; past performance is not necessarily indicative of future results .
pcc_eng_15_092.2739_x1475275_168:4-5-6,necessarily,indicative,necessarily_indicative,not,not_necessarily_indicative,and that 's not necessarily indicative of that person 's actual personality,"And that 's not necessarily indicative of that person 's actual personality -- as in what 's this guy or gal actually like -- but they do have that role to play on camera , on record , and so forth ."
pcc_eng_00_033.7582_x0529418_72:4-5-6,necessarily,indicative,necessarily_indicative,not,not_necessarily_indicative,so it 's not necessarily indicative that coffee is n't welcoming to,So it 's not necessarily indicative that coffee is n't welcoming to women ; the competition scene just requires people who are very confident .
pcc_eng_06_078.6094_x1254991_26:17-18-19,necessarily,indicative,necessarily_indicative,not,not_necessarily_indicative,"2008 , though that figure is not necessarily indicative of election day turnout .","Absentee voting already is ahead of where it was in 2008 , though that figure is not necessarily indicative of Election Day turnout ."
pcc_eng_18_096.3790_x1544860_34:08-09-10,necessarily,indicative,necessarily_indicative,not,not_necessarily_indicative,performance of indicators or methodology are not necessarily indicative of future results .,Past performance of indicators or methodology are not necessarily indicative of future results .
pcc_eng_18_034.9971_x0550330_16:22-23-24,necessarily,indicative,necessarily_indicative,not,not_necessarily_indicative,"the past , past results are not necessarily indicative of future results .","GOVERNMENT REGULATIONS REQUIRE DISCLOSURE OF THE FACT THAT WHILE THESE METHODS MAY HAVE WORKED IN THE PAST , PAST RESULTS ARE NOT NECESSARILY INDICATIVE OF FUTURE RESULTS ."
pcc_eng_25_001.6332_x0010299_10:12-14-15,necessarily,indicative,necessarily_indicative,not,not_necessarily_indicative,trading procedure or methodology is not really necessarily indicative of future outcomes .,The past overall performance of any trading procedure or methodology is not really necessarily indicative of future outcomes .
nyt_eng_20000517_0438_20:20-21-22,necessarily,indicative,necessarily_indicative,not,not_necessarily_indicative,the alternate plans ' performance is not necessarily indicative of how well a proposed system,even the GAO report warns that `` it is important to note that the Alternate Plans ' performance is not necessarily indicative of how well a proposed system of individual accounts within Social Security might perform . ''
pcc_eng_19_086.0859_x1374989_46:09-10-11,necessarily,indicative,necessarily_indicative,not,not_necessarily_indicative,"that its only one lap and not necessarily indicative of race pace , but still","I realize that its only one lap and not necessarily indicative of race pace , but still ??"
pcc_eng_26_034.3756_x0539529_1292:12-13-14,necessarily,indicative,necessarily_indicative,not,not_necessarily_indicative,allocated to each loan category is not necessarily indicative of future losses in any particular,The allowance for loan losses allocated to each loan category is not necessarily indicative of future losses in any particular category .
pcc_eng_09_037.7084_x0594193_29:12-13-14,necessarily,indicative,necessarily_indicative,not,not_necessarily_indicative,"look at statistical data , while not necessarily indicative of the future , there 's","And if you like to look at statistical data , while not necessarily indicative of the future , there 's evidence that with time , the market goes north , no matter which party is in office ."
nyt_eng_20000112_0376_19:18-19-20,necessarily,indicative,necessarily_indicative,not,not_necessarily_indicative,"act of evasion : it is not necessarily indicative of wrongdoing , but it is","`` Headlong flight _ wherever it occurs _ is the consummate act of evasion : it is not necessarily indicative of wrongdoing , but it is certainly suggestive of such , '' he said ."
pcc_eng_14_096.0374_x1536500_148:4-5-6,necessarily,indicative,necessarily_indicative,not,not_necessarily_indicative,PAST RESULTS ARE NOT NECESSARILY INDICATIVE OF FUTURE RESULTS .,PAST RESULTS ARE NOT NECESSARILY INDICATIVE OF FUTURE RESULTS .
pcc_eng_23_038.9389_x0612917_19:19-20-21,necessarily,indicative,necessarily_indicative,not,not_necessarily_indicative,"or "" corridors "" ) is not necessarily indicative of mineralization on the syndicate 's","( See : Management cautions that mineralization present on proximal properties ( or "" corridors "" ) is not necessarily indicative of mineralization on the Syndicate 's Property ."
pcc_eng_22_077.6997_x1239658_2:10-11-12,necessarily,indicative,necessarily_indicative,not,not_necessarily_indicative,numerical diversity of these applicants is not necessarily indicative of the strength of their candidacies,"Even if the numerical diversity of these applicants is not necessarily indicative of the strength of their candidacies , this number has come to seem too small to represent some "" other "" applicant grouping in Harvard 's admissions office that has yet to be revealed , as has been hoped might be the situation ."
pcc_eng_28_077.4646_x1236830_36:5-6-7,necessarily,indicative,necessarily_indicative,not,not_necessarily_indicative,remember that price is not necessarily indicative of quality and not all the,Remember that price is not necessarily indicative of quality and not all the best companies are the most expensive .
pcc_eng_26_097.2473_x1556142_41:10-11-12,necessarily,indicative,necessarily_indicative,not,not_necessarily_indicative,in germany and in france is not necessarily indicative of what you see everywhere .,What you see in Germany and in France is not necessarily indicative of what you see everywhere .
pcc_eng_14_033.9250_x0531931_12:17-18-19,necessarily,indicative,necessarily_indicative,not,not_necessarily_indicative,"years , and past performance is not necessarily indicative of future results , the historical","While these lows do n't occur like clockwork every four years , and past performance is not necessarily indicative of future results , the historical record is rather impressive ."
pcc_eng_27_036.1982_x0568840_51:5-6-7,necessarily,indicative,necessarily_indicative,not,not_necessarily_indicative,""" the results are not necessarily indicative of happens when the patient goes",""" The results are not necessarily indicative of happens when the patient goes back into the community setting ."
pcc_eng_21_091.9284_x1469445_081:11-12-13,necessarily,indicative,necessarily_indicative,not,not_necessarily_indicative,any trading system or methodology is not necessarily indicative of future results ripple is an,"The past performance of any trading system or methodology is not necessarily indicative of future results Ripple is an open-source digital payment network , and it 's already being used by some of the world 's largest banks - such as the bank of Tokyo and Santandar ."
pcc_eng_28_012.2281_x0181852_057:44-45-46,necessarily,indicative,necessarily_indicative,not,not_necessarily_indicative,"to assess causes and motivations , not necessarily indicative of a national sampling . )","Out of the 1050 pastors we surveyed during two pastors conferences held in Pasadena , California , 825 , or 78 % ( 326 in 2005 and 499 in 2006 , This is a small local sampling to assess causes and motivations , not necessarily indicative of a national sampling . ) said they were forced to resign from a church at least once ."
pcc_eng_08_076.7737_x1226884_6:20-21-22,necessarily,indicative,necessarily_indicative,not,not_necessarily_indicative,"a few seconds of gameplay , not necessarily indicative of the features of the finished","But do n't panic just yet , GT fans -- this is just a few seconds of gameplay , not necessarily indicative of the features of the finished game ."
pcc_eng_11_002.3914_x0022641_22:4-5-6,necessarily,indicative,necessarily_indicative,not,not_necessarily_indicative,but it is not necessarily indicative of the employment status of many,"But it is not necessarily indicative of the employment status of many of these workers during the rest of the month , because many unemployment stints are quite short ."
