hit_id,colloc,adv,adj,sent_text,sent_id,adv_index
nyt_eng_19951223_0004_44:12,still_ugly,still,ugly,"-LBQ-  No matter if he wins or loses , he 's still ugly .  -RDQ-",nyt_eng_19951223_0004_44,12
nyt_eng_19951225_0225_1:9,as_naked,as,naked,Probably no bourse in the world is quite as naked about money worship as the Johannesburg Stock Exchange .,nyt_eng_19951225_0225_1,9
nyt_eng_19951226_0135_1:9,as_naked,as,naked,Probably no bourse in the world is quite as naked about money worship as the Johannesburg Stock Exchange .,nyt_eng_19951226_0135_1,9
nyt_eng_19951228_0015_4:45,as_important,as,important,"As the Hawkeyes and Washington Huskies narrow their sights from El Paso 's side attractions to tomorrow 's Sun Bowl game , it appears that no factor _ even the injuries that have scratched UW defenders Lawyer Milloy and David Richie _ will be as important as the teams ' comparative quickness and speed .",nyt_eng_19951228_0015_4,45
nyt_eng_19951228_0289_35:9,as_painful,as,painful,"But next to Garcia , no passing was as painful to fans as that of Selena , the Latin-pop singer gunned down by her former fan club president .",nyt_eng_19951228_0289_35,9
nyt_eng_19951230_0148_36:4,too_obscure,too,obscure,"No agency is too obscure , no detail too small .",nyt_eng_19951230_0148_36,4
nyt_eng_19951230_0238_4:5,too_small,too,small,"-LBQ-  No job is too small in float making ,  -RDQ-  Grace Reo , 39 , of North Hollywood in Los Angeles said Saturday as she sat  -LBQ-  prepping  -RDQ-  silver leaf foliage to be glued to a giant lion featured on the  -LBQ-  Animals are Awesome  -RDQ-  float , sponsored by the Automobile Club of Southern California .",nyt_eng_19951230_0238_4,5
nyt_eng_19960101_0287_24:7,immediately_available,immediately,available,"But if no patrol car is immediately available , an overhead television camera , which constantly records an image of all cars entering the highway , separates out a special shot of the violator , including an enhanced close-up of the rear license plate .",nyt_eng_19960101_0287_24,7
nyt_eng_19960102_0309_6:8,too_minor,too,minor,"Under zero tolerance , no infraction is too minor for police action _ not public urination , not trespassing , not even double parking .",nyt_eng_19960102_0309_6,8
nyt_eng_19960102_0365_13:11,always_safe,always,safe,-LBQ-  Market conditions change and that means no investment is always safe .  -RDQ-,nyt_eng_19960102_0365_13,11
nyt_eng_19960104_0229_22:30,too_glaring,too,glaring,They 're betting America and its allies will be loath to crack down on attempts to whittle away at the Dayton accord as long as no single infraction is too glaring .,nyt_eng_19960104_0229_22,30
nyt_eng_19960111_0151_22:8,so_honored,so,honored,But no living French painter has been so honored .,nyt_eng_19960111_0151_22,8
nyt_eng_19960124_0325_63:5,as_big,as,big,Yet no story is as big as the team .,nyt_eng_19960124_0325_63,5
nyt_eng_19960124_0367_30:8,far_preferable,far,preferable,"-LBQ-  No deal on those issues was far preferable to a bad deal ,  -RDQ-  said Rep. Floyd Spence , the South Carolina Republican who leads the National Security Committee .",nyt_eng_19960124_0367_30,8
nyt_eng_19960125_0037_18:6,yet_available,yet,available,Hazen said no details are yet available on product or service changes customers may see .,nyt_eng_19960125_0037_18,6
nyt_eng_19960125_0189_19:5,as_exposed,as,exposed,"No other company is as exposed to Fokker as Shorts , which supplies wing slots for Fokker 's F70 and F100 jetliners .",nyt_eng_19960125_0189_19,5
nyt_eng_19960125_0312_42:4,too_trivial,too,trivial,No detail is too trivial .,nyt_eng_19960125_0312_42,4
nyt_eng_19960125_0317_55:14,now_worth,now,worth,And no wonder _ the station he bought for $ 204 million is now worth $ 450 million .,nyt_eng_19960125_0317_55,14
nyt_eng_19960126_0191_6:5,immediately_available,immediately,available,No further details were immediately available .,nyt_eng_19960126_0191_6,5
nyt_eng_19960126_0196_6:5,immediately_available,immediately,available,No further details were immediately available .,nyt_eng_19960126_0196_6,5
nyt_eng_19960127_0201_45:4,too_cumbersome,too,cumbersome,"No task was too cumbersome or difficult , and before long she was juggling the sensitive and complex issues involved in raising money to keep a healthy political ambition alive .",nyt_eng_19960127_0201_45,4
nyt_eng_19960131_0251_4:5,immediately_available,immediately,available,No other details were immediately available .,nyt_eng_19960131_0251_4,5
nyt_eng_19960131_0655_1:12,so_jaunty,so,jaunty,There was a time when no place in town was quite so jaunty as State Street on a Saturday night .,nyt_eng_19960131_0655_1,12
nyt_eng_19960201_0383_11:12,as_qualified,as,qualified,"And when you think about it , no actor is quite as qualified as Danson to stand both really tall and really small , as he does in  -LBQ-  Gulliver .  -RDQ-",nyt_eng_19960201_0383_11,12
nyt_eng_19960202_0191_5:12,embarrassingly_widespread,embarrassingly,widespread,No doubt that means ignorance about these two fine states is embarrassingly widespread .,nyt_eng_19960202_0191_5,12
nyt_eng_19960204_0150_17:45,as_bitter,as,bitter,"On the crumbling sidewalks of Kabul , in the overcrowded hospital wards and at the brick-oven bakeries that face clamoring crowds at first light each day , there is an angry consensus that no time since the Communist coup in April 1978 has been as bitter as now .",nyt_eng_19960204_0150_17,45
nyt_eng_19960205_0760_3:22,too_bitter,too,bitter,"If winter must be endured in the city , then let it be somewhere like Paris , where no day is too bitter for celebration .",nyt_eng_19960205_0760_3,22
nyt_eng_19960209_0503_22:34,very_creative,very,creative,"Cardwell had written ,  -LBQ-  The proper indifference of the historian of technology to the nationality of particular inventors or technologists has tended to conceal the important fact that no nation has been very creative for more than an historically short period .  -RDQ-",nyt_eng_19960209_0503_22,34
nyt_eng_19960210_0053_23:34,so_overfilmed,so,overfilmed,"And problems with a software contract have held up completion of a replacement computerized system intended to track permit locations , flag conflicts and special conditions and ensure that no area is being so overfilmed as to create neighborhood protests , Cluff said .",nyt_eng_19960210_0053_23,34
nyt_eng_19960211_0184_19:7,as_successful,as,successful,"No performing arts institution has been as successful at developing a national , and increasingly an international audience , as the New York Metropolitan Opera .",nyt_eng_19960211_0184_19,7
nyt_eng_19960213_0216_4:6,as_daunting,as,daunting,"But no challenge was quite as daunting as the one he was to undertake in 1992 , when he agreed to become the co-chairman , along with former U.S. Secretary of State Cyrus Vance , to the International Conference on the former Yugoslavia that the European Community and the United Nations had created to look at the appalling tragedy fast unfolding in the Balkans .",nyt_eng_19960213_0216_4,6
nyt_eng_19960213_0575_33:12,too_great,too,great,"As the Gulf War so starkly demonstrated , no risk is too great _ and no political compromise too embarrassing _ when the payoff involves a stake in the phenomenally lucrative oil trade .",nyt_eng_19960213_0575_33,12
nyt_eng_19960213_0575_6:6,profoundly_beset,profoundly,beset,"No single country is more profoundly beset with the full range of these crises than Turkey , a nation of 60 million caught amid a bewildering array of rival influences .",nyt_eng_19960213_0575_6,6
nyt_eng_19960216_0378_33:32,as_cheap,as,cheap,"Here 's one tip from Parikh that might keep you from crying when you start adding up expenses  -COL-   -LBQ-  No home decorating task , however large or small , is as cheap as you first think .",nyt_eng_19960216_0378_33,32
nyt_eng_19960220_0818_13:29,as_devastating,as,devastating,"Ms. Pirro , who has been lobbying the state Legislature to pass a bill increasing the penalties for bias-related crimes , said ,  -LBQ-  No other crime is as devastating because the victim does not know who has targeted them and whether they will be targeted again .  -RDQ-",nyt_eng_19960220_0818_13,29
nyt_eng_19960221_0729_1:16,quite_enough,quite,enough,"For Richard Holbrooke , a man for whom no amount of adulation can ever be quite enough , Wednesday was probably as good as it gets .",nyt_eng_19960221_0729_1,16
nyt_eng_19960223_0690_54:4,too_big,too,big,"No problem is too big in the Refreshments ' world that it ca n't be fixed with another round , preferably at a bar in Mexico .",nyt_eng_19960223_0690_54,4
nyt_eng_19960226_0354_18:8,politically_intense,politically,intense,"No place on the planet is more politically intense than Jerusalem , and the contrast with America , even in an election year , is sharp .",nyt_eng_19960226_0354_18,8
nyt_eng_19960227_0163_18:6,as_sophisticated,as,sophisticated,No computer game can be as sophisticated and unpredictable as another human being .,nyt_eng_19960227_0163_18,6
nyt_eng_19960227_0287_1:9,as_loaded,as,loaded,Perhaps no word in the English language is as loaded as the word  -LBQ-  home .  -RDQ-,nyt_eng_19960227_0287_1,9
nyt_eng_19960228_0133_7:4,immediately_available,immediately,available,No detail was immediately available on who bought the state 's stake .,nyt_eng_19960228_0133_7,4
nyt_eng_19960301_0556_2:36,as_broad,as,broad,"While more than a dozen other states are exploring steps designed to coordinate services better , in some cases by turning parts of their child welfare operations over to private companies , no plan is as broad as the plan supported by a top child welfare official in New Jersey .",nyt_eng_19960301_0556_2,36
nyt_eng_19960303_0155_13:7,so_fond,so,fond,No other top 10 contender is so fond of odd meters or mid-song shifts of style .,nyt_eng_19960303_0155_13,7
nyt_eng_19960303_0261_13:15,already_boundless,already,boundless,But no matter  -COL-  both his fame and the gratitude of his employees is already boundless .,nyt_eng_19960303_0261_13,15
nyt_eng_19960306_0260_19:28,so_fond,so,fond,"In a review of the Academy concert , Jon Pareles of The Times said of Sting 's new material ,  -LBQ-  No other top 10 contender is so fond of odd meters or mid-song shifts of style .  -RDQ-",nyt_eng_19960306_0260_19,28
nyt_eng_19960307_0315_3:8,virtually_identical,virtually,identical,No matter that the vehicles will be virtually identical to the new cars that now comprise Alamo 's fleet .,nyt_eng_19960307_0315_3,8
nyt_eng_19960308_0440_54:8,as_good,as,good,"No other deals on Wall Street are as good as mine , none .",nyt_eng_19960308_0440_54,8
nyt_eng_19960309_0197_5:19,so_active,so,active,"Of all the nation 's officials who have embraced the welfare-revamping issue , perhaps no other has been so active as John Engler , Michigan 's second-term Republican governor , who has played a central role in federal lawmakers ' own efforts to dismantle the current system .",nyt_eng_19960309_0197_5,19
nyt_eng_19960310_0151_28:6,as_divisive,as,divisive,Perhaps no issue has been as divisive as outsourcing _ or shifting work to outside companies .,nyt_eng_19960310_0151_28,6
nyt_eng_19960315_0084_12:6,immediately_available,immediately,available,No other financial details were immediately available .,nyt_eng_19960315_0084_12,6
nyt_eng_19960321_0334_2:27,immediately_available,immediately,available,"Jim Hagedon , a spokesman for GM 's Delphi Chassis subsidiary in Dayton , Ohio , where the strike occurred , said no further details were immediately available .",nyt_eng_19960321_0334_2,27
nyt_eng_19960321_0353_2:27,immediately_available,immediately,available,"Jim Hagedon , a spokesman for GM 's Delphi Chassis subsidiary in Dayton , Ohio , where the strike occurred , said no further details were immediately available .",nyt_eng_19960321_0353_2,27
nyt_eng_19960325_0049_16:23,ever_likely,ever,likely,"There is , of course , a lot more to creating films or stories and no little bit of computer software is ever likely to teach everything .",nyt_eng_19960325_0049_16,23
nyt_eng_19960326_0323_18:8,currently_available,currently,available,Most also know that no vaccine is currently available to protect a person from getting AIDS .,nyt_eng_19960326_0323_18,8
nyt_eng_19960326_0744_9:21,that_error-free,that,error-free,"They often demanded to see his birth certificate , figuring no child could be that focused , that skilled , that error-free , at age 5 .",nyt_eng_19960326_0744_9,21
nyt_eng_19960406_0274_78:20,as_intelligent,as,intelligent,"It is also safe to say , Fox adds , that no other criminal in modern history has been as intelligent as the Unabomber  -COL-   -LBQ-  He found his niche _ control , power and superiority _ and was convinced what he knew , he knew better than anyone else ...",nyt_eng_19960406_0274_78,20
nyt_eng_19960408_0659_5:27,too_small,too,small,"When it comes to Taiwan 's campaign to win friends , influence people , and get its way in the United States , no gesture is too small to make , no potential supporter too insignificant to pursue .",nyt_eng_19960408_0659_5,27
nyt_eng_19960409_0224_14:5,completely_empty,completely,empty,No night is ever completely empty of Capella .,nyt_eng_19960409_0224_14,5
nyt_eng_19960410_0261_7:6,directly_relevant,directly,relevant,-LBQ-  No statistical indicator is directly relevant except what the Bundesbank makes of it .,nyt_eng_19960410_0261_7,6
nyt_eng_19960411_0306_14:7,too_obvious,too,obvious,"McCurry knows that no pun is too obvious for the members of the White House press _ the  -LBQ-  moths ,  -RDQ-  as he calls them , who are drawn to any meager gleam of news , wit , or gossip .",nyt_eng_19960411_0306_14,7
nyt_eng_19960416_0670_24:4,too_hot,too,hot,"No controversy was too hot , no issue taboo , no joke too quirky , as Kelley , who wrote 61 of the 88 episodes himself , working in longhand on a yellow legal pad , put the Brock family and the town of Rome in a surreal tizzy week after week .",nyt_eng_19960416_0670_24,4
nyt_eng_19960420_0200_25:16,too_strange,too,strange,"In a city that has come to live by its loopholes , no argument is too strange , no justification too arcane .",nyt_eng_19960420_0200_25,16
nyt_eng_19960423_0032_6:9,as_physical,as,physical,"No opponent Chicago encounters this postseason will be as physical as Pat Riley 's vice squad in Miami , which , behind Alonzo Mourning and designated hackers like Keith Askins , figures to pound on the stars of Phil Jackson 's tri-ring circus .",nyt_eng_19960423_0032_6,9
nyt_eng_19960423_0092_4:5,immediately_available,immediately,available,No further details were immediately available .,nyt_eng_19960423_0092_4,5
nyt_eng_19960424_0001_6:10,immediately_available,immediately,available,No specific dates for his tours of service were immediately available .,nyt_eng_19960424_0001_6,10
nyt_eng_19960424_0033_4:5,immediately_available,immediately,available,No cost estimates were immediately available .,nyt_eng_19960424_0033_4,5
nyt_eng_19960424_0980_24:16,too_old,too,old,"-LBQ-  But there no reason to rule yourself out because you think your organs are too old ,  -RDQ-  she said .",nyt_eng_19960424_0980_24,16
nyt_eng_19960426_0527_15:14,too_steep,too,steep,"Judging from all the fanfare the rock got yesterday , no price was too steep to pay , given that it belonged to Jackie-O . Al Lippert made the winning bid of a whopping $ 2.58 million .",nyt_eng_19960426_0527_15,14
nyt_eng_19960427_0367_40:4,really_unheard,really,unheard,No licenses is really unheard of .  -RDQ-,nyt_eng_19960427_0367_40,4
nyt_eng_19960429_0643_12:5,too_small,too,small,No cultural detail is too small to find its way into one of these treks .,nyt_eng_19960429_0643_12,5
nyt_eng_19960429_0873_4:5,so_large,so,large,No other democracy is so large and so diverse .,nyt_eng_19960429_0873_4,5
nyt_eng_19960501_0168_38:15,thoroughly_comfortable,thoroughly,comfortable,"Folklorist W. D. Weatherford explains humor 's efficacy  -COL-   -LBQ-  No master could be thoroughly comfortable around a sullen slave ; and , conversely , a master , unless he was utterly humorless , could not overwork or brutally treat a jolly fellow , one who could make him laugh .  -RDQ-",nyt_eng_19960501_0168_38,15
nyt_eng_19960505_0005_10:5,so_fortunate,so,fortunate,No pitcher would be so fortunate during the evening .,nyt_eng_19960505_0005_10,5
nyt_eng_19960506_0570_17:4,too_ridiculous,too,ridiculous,No case is too ridiculous to be reported in the media .,nyt_eng_19960506_0570_17,4
nyt_eng_19960506_0818_6:5,as_divisive,as,divisive,"But no plank is as divisive as abortion , and there are no signs the fight will go away soon .",nyt_eng_19960506_0818_6,5
nyt_eng_19960508_0319_9:12,too_high,too,high,Ten points went to mega-hawks for whom no interest rate is too high .,nyt_eng_19960508_0319_9,12
nyt_eng_19960511_0445_10:18,too_small,too,small,"That success is due in large part to tight control on costs , and no cost is too small to be scrutinized .",nyt_eng_19960511_0445_10,18
nyt_eng_19960511_0690_11:4,so_wrong,so,wrong,"No idea is so wrong , dumb or dangerous as one that settles down to live in a mind without the conscious permission of the mind 's owner .",nyt_eng_19960511_0690_11,4
nyt_eng_19960517_0663_7:23,so_foolish,so,foolish,"But the good George is on the verge of winning out over the bad George , although no veteran Karl-watcher would be so foolish as to wager a paycheck on the outcome .",nyt_eng_19960517_0663_7,23
nyt_eng_19960518_0203_5:9,yet_available,yet,available,Binh said no details on the arrangement were yet available .,nyt_eng_19960518_0203_5,9
nyt_eng_19960519_0326_29:8,again_likely,again,likely,"No reader of Ms. Miller is ever again likely to think that Arabs are closer to one another , let alone Iranians , than Sicilians are to Finns .",nyt_eng_19960519_0326_29,8
nyt_eng_19960520_0382_8:10,anywhere_close,anywhere,close,"Despite all the progress , no car maker is anywhere close to mass-producing the cars .",nyt_eng_19960520_0382_8,10
nyt_eng_19960526_0158_69:24,far_different,far,different,Republicans are eager to saddle a Democratic administration with the baggage of arms deals with Iran _ no matter if the circumstances are far different from 1986 .,nyt_eng_19960526_0158_69,24
nyt_eng_19960526_0554_14:25,as_aggressive,as,aggressive,"Many states across the country have been ordered by their senior judges to revamp their school funding formulas , but no court has been as aggressive as New Jersey 's .",nyt_eng_19960526_0554_14,25
nyt_eng_19960527_0399_38:17,too_great,too,great,"His attitude is defiant , and that attitude makes his teammates believe that no deficit is too great , and that no challenge is impossible .",nyt_eng_19960527_0399_38,17
nyt_eng_19960530_0678_29:4,too_small,too,small,No detail is too small .,nyt_eng_19960530_0678_29,4
nyt_eng_19960531_0627_83:9,so_emblematic,so,emblematic,"For many proud residents , no episode was so emblematic as the company 's confrontation with Joan of Arc , the Maid of Orleans and the city 's patron saint .",nyt_eng_19960531_0627_83,9
nyt_eng_19960601_0132_12:26,too_grotesque,too,grotesque,"And in the swirl of events leading to France 's first outright military intervention in this country , suddenly no charges against the emperor were too grotesque .",nyt_eng_19960601_0132_12,26
nyt_eng_19960603_0714_14:8,sadly_dramatic,sadly,dramatic,No effect of iodine deficiency is more sadly dramatic than cretinism .,nyt_eng_19960603_0714_14,8
nyt_eng_19960607_0022_20:22,ever_safe,ever,safe,Why would anyone go into the fruit-stand business after a thousand Hollywood car chases have proved that no fruit stand is ever safe ?,nyt_eng_19960607_0022_20,22
nyt_eng_19960607_0060_3:4,too_great,too,great,No impediment is too great .,nyt_eng_19960607_0060_3,4
nyt_eng_19960607_0303_3:4,too_great,too,great,No impediment is too great .,nyt_eng_19960607_0303_3,4
nyt_eng_19960607_0711_7:11,too_minor,too,minor,"And in this political drama , no office is apparently too minor to be included .",nyt_eng_19960607_0711_7,11
nyt_eng_19960624_0236_16:4,too_small,too,small,No task is too small to be considered unwelcome .,nyt_eng_19960624_0236_16,4
nyt_eng_19960625_0615_12:10,as_good,as,good,The company has said that no alternative offer is as good .,nyt_eng_19960625_0615_12,10
nyt_eng_19960626_0594_33:8,truly_alone,truly,alone,And no romantic couple can ever be truly alone together .,nyt_eng_19960626_0594_33,8
nyt_eng_19960628_0362_23:5,immediately_available,immediately,available,No further details were immediately available on either sale .,nyt_eng_19960628_0362_23,5
nyt_eng_19960629_0332_4:32,even_close-to-great,even,close-to-great,"Every team but two _ the Jets , of course , and the Browns after the Art Modell treachery _ could beat any other team , no team was great or even close-to-great , and on any given Sunday even the Bengals could look respectable .",nyt_eng_19960629_0332_4,32
nyt_eng_19960630_0478_18:6,as_synonymous,as,synonymous,Perhaps no other institution is as synonymous with black empowerment as the black church .,nyt_eng_19960630_0478_18,6
nyt_eng_19960702_0300_12:12,as_wrenching,as,wrenching,"None stayed as long as Barbara , and no departure was as wrenching as Barbara 's would be in 1969 .",nyt_eng_19960702_0300_12,12
nyt_eng_19960703_0330_23:9,as_generous,as,generous,No architect of his generation has been remotely as generous to younger architects .,nyt_eng_19960703_0330_23,9
nyt_eng_19960703_0369_35:4,truly_satisfactory,truly,satisfactory,No answer is truly satisfactory .,nyt_eng_19960703_0369_35,4
nyt_eng_19960704_0472_14:11,as_dominant,as,dominant,"-LBQ-  No media outlet , including KMOX , can be as dominant today as it used to be with so many sources of information that did n't exist even five years ago .  -RDQ-",nyt_eng_19960704_0472_14,11
nyt_eng_19960705_0009_92:10,too_great,too,great,The Rockies won last year because no deficit was too great .,nyt_eng_19960705_0009_92,10
nyt_eng_19960707_0034_10:5,as_delicate,as,delicate,"And no subject is as delicate as opposition to the ruling family and its protector , the United States .",nyt_eng_19960707_0034_10,5
nyt_eng_19960712_0094_21:11,completely_theft-proof,completely,theft-proof,"Hazelbaker points out , however , that no system is completely theft-proof .",nyt_eng_19960712_0094_21,11
nyt_eng_19960714_0170_28:10,all_right,all,right,"No matter what someone does outside of sports is all right , as long as they do something nice inside sports ?  -RDQ-",nyt_eng_19960714_0170_28,10
nyt_eng_19960716_0042_1:8,as_dependable,as,dependable,No starting staff in baseball has been as dependable as the Rangers ' five-man rotation .,nyt_eng_19960716_0042_1,8
nyt_eng_19960718_0045_1:10,as_meaningful,as,meaningful,No other game in the 1996 season may be as meaningful as this one .,nyt_eng_19960718_0045_1,10
nyt_eng_19960721_0175_9:11,universally_acclaimed,universally,acclaimed,"Certainly , no production this year so far has been universally acclaimed by public and critics alike ; no innovative director has arrived to shake things up as , say , Peter Brooke or Pina Bausch once did , and , perhaps most alarmingly , no new French playwright has made a mark on a forum that is designed to hear fresh voices and ideas .",nyt_eng_19960721_0175_9,11
nyt_eng_19960724_0338_24:31,too_great,too,great,"To keep up with my Olympic obligations , I 've had to stay home to watch  -LBQ-  Wheel  -RDQ-  in its temporary afternoon time slot , but no sacrifice is too great for The Cause .",nyt_eng_19960724_0338_24,31
nyt_eng_19960801_0336_2:7,closely_watched,closely,watched,No Dole decision will be more closely watched than the choice of his running mate .,nyt_eng_19960801_0336_2,7
nyt_eng_19960801_0337_2:7,closely_watched,closely,watched,No Dole decision will be more closely watched than the choice of his running mate .,nyt_eng_19960801_0337_2,7
nyt_eng_19960801_0338_2:7,closely_watched,closely,watched,No Dole decision will be more closely watched than the choice of his running mate .,nyt_eng_19960801_0338_2,7
nyt_eng_19960802_0181_2:7,closely_watched,closely,watched,No Dole decision will be more closely watched than the choice of his running mate .,nyt_eng_19960802_0181_2,7
nyt_eng_19960802_0192_2:7,closely_watched,closely,watched,No Dole decision will be more closely watched than the choice of his running mate .,nyt_eng_19960802_0192_2,7
nyt_eng_19960805_0133_16:8,as_adamant,as,adamant,"No group of Christian conservatives has been as adamant or influential on race as Promise Keepers , the men 's revival ministry founded by Bill McCartney , the former football coach at the University of Colorado .",nyt_eng_19960805_0133_16,8
nyt_eng_19960808_0314_11:23,even_close,even,close,But measured against our competition _ meaning every other country in the world _ no other nation of size except Japan is even close .,nyt_eng_19960808_0314_11,23
nyt_eng_19960808_0392_34:5,too_trivial,too,trivial,-LBQ-  No issue was too trivial for Mrs. Reagan to drive me crazy over .  -RDQ-,nyt_eng_19960808_0392_34,5
nyt_eng_19960812_0109_12:5,too_great,too,great,No effort would be too great to hush things up and maintain order .,nyt_eng_19960812_0109_12,5
nyt_eng_19960812_0668_24:5,ever_easy,ever,easy,"-LBQ-  No deal is ever easy ,  -RDQ-  Smith said Monday .",nyt_eng_19960812_0668_24,5
nyt_eng_19960814_0363_19:12,too_great,too,great,"As they taught me in journalism school , no sacrifice is too great in the service of source-building .",nyt_eng_19960814_0363_19,12
nyt_eng_19960818_0198_8:15,ever_easy,ever,easy,So what is it about the Mariners and this rivalry ? No game is ever easy .,nyt_eng_19960818_0198_8,15
