hit_id,colloc,adv,adj,sent_text,sent_id,adv_index
nyt_eng_19950514_0030_112:6,directly_responsible,directly,responsible,But no U.S. agency is directly responsible for monitoring public health beyond U.S. borders .,nyt_eng_19950514_0030_112,6
nyt_eng_19950516_0179_23:6,completely_satisfying,completely,satisfying,-LBQ-  No one form is completely satisfying .,nyt_eng_19950516_0179_23,6
nyt_eng_19950519_0022_24:25,ever_safe,ever,safe,Macfarlane pounced on the first pitch after that called third strike as if to send a message to Poole that perhaps no pitcher is ever safe against the Red Sox lineup .,nyt_eng_19950519_0022_24,25
nyt_eng_19950529_0133_5:4,ever_available,ever,available,No specimens were ever available for study .,nyt_eng_19950529_0133_5,4
nyt_eng_19950606_0409_12:6,as_progressive,as,progressive,"No form of taxation is as progressive as the income tax , Archer said .",nyt_eng_19950606_0409_12,6
nyt_eng_19950607_0052_12:5,as_sensitive,as,sensitive,No denomination should be as sensitive to government intrusion into religion as Baptists .,nyt_eng_19950607_0052_12,5
nyt_eng_19950608_0183_36:4,so_traumatic,so,traumatic,No calamity is so traumatic that it ca n't be mended within the space of 48 tidy minutes .,nyt_eng_19950608_0183_36,4
nyt_eng_19950609_0275_17:12,sufficiently_diversified,sufficiently,diversified,"I 've never been one to believe that no portfolio is sufficiently diversified unless it contains an international element , and remember , the three Fidelity Growth funds you own already have 6 percent to 10 percent of their assets in foreign holdings .",nyt_eng_19950609_0275_17,12
nyt_eng_19950609_0301_22:21,as_promising,as,promising,Companies say they are clamoring to get a piece of the action because no crop of movies has ever been as promising .,nyt_eng_19950609_0301_22,21
nyt_eng_19950612_0373_1:5,as_fragile,as,fragile,"No art form is as fragile as ballet , where a career can snap along with an Achilles ' tendon and a masterwork can be lost with its choreographer 's passing .",nyt_eng_19950612_0373_1,5
nyt_eng_19950613_0165_19:17,so_disastrous,so,disastrous,-LBQ-  Uncle Tom 's Cabin was the first evidence to America that no hurricane can be so disastrous to a country as a ruthlessly humanitarian woman .  -RDQ-,nyt_eng_19950613_0165_19,17
nyt_eng_19950615_0298_27:11,so_unflappable,so,unflappable,"No teen-ager , and not many adults , would be so unflappable about something so important .",nyt_eng_19950615_0298_27,11
nyt_eng_19950617_0058_11:4,yet_available,yet,available,"No figures are yet available , but anecdotal evidence indicates that people are treating  -LBQ-  Rob Roy  -RDQ-  and  -LBQ-  Braveheart  -RDQ-  as extended travel brochures .",nyt_eng_19950617_0058_11,4
nyt_eng_19950618_0085_17:4,immediately_available,immediately,available,No information was immediately available about survivors .,nyt_eng_19950618_0085_17,4
nyt_eng_19950619_0136_24:10,too_serious,too,serious,No question Nunn is always about serious business _ too serious for some .,nyt_eng_19950619_0136_24,10
nyt_eng_19950621_0414_6:10,that_important,that,important,"-LBQ-  As technology expands , no one option is that important .  -RDQ-",nyt_eng_19950621_0414_6,10
nyt_eng_19950624_0212_7:16,terribly_important,terribly,important,"The implication is that reputation does not count for much , that no issue is terribly important , no principle really worth defending , that the lust for power gives license to defame , and that talking scurrilous trash has no penalty .",nyt_eng_19950624_0212_7,16
nyt_eng_19950624_0224_11:24,remotely_likely,remotely,likely,But it is equally clear that the Iraqi leader has successfully put down the revolt and that no organized move against him is remotely likely .,nyt_eng_19950624_0224_11,24
nyt_eng_19950626_0048_18:14,yet_available,yet,available,"No details of how the two companies will work out sales arrangements are yet available , Tanaka said .",nyt_eng_19950626_0048_18,14
nyt_eng_19950626_0587_11:4,as_memorable,as,memorable,"No scene is as memorable as Michael 's father preparing his horrified son at the St. Louis airport for the high level of crime , smoke and international espionage to be found on the streets of big-city London _ unless it 's the one in which a shocked Kat witnesses a profanity-ridden altercation in her New York neighborhood .",nyt_eng_19950626_0587_11,4
nyt_eng_19950628_0699_31:7,so_powerful,so,powerful,-LBQ-  No government should ever be so powerful to differentiate between the two .  -RDQ-,nyt_eng_19950628_0699_31,7
nyt_eng_19950703_0153_21:8,mildly_positive,mildly,positive,"-LBQ-  No change in rates would be mildly positive for the dollar ,  -RDQ-  said Paul Hammett , an economist at Banque Paribas .",nyt_eng_19950703_0153_21,8
nyt_eng_19950706_0153_15:5,immediately_available,immediately,available,No further information was immediately available .,nyt_eng_19950706_0153_15,5
nyt_eng_19950706_0431_35:24,too_brazen,too,brazen,"-LBQ-  In Republican America , where lobbyists write the laws and government handouts go to powerful special interests , no tax break is too brazen , no shelter too shameless , for their privileged patrons ,  -RDQ-  he said .",nyt_eng_19950706_0431_35,24
nyt_eng_19950712_0287_12:7,as_surprised,as,surprised,"No doubt , Alfie was just as surprised to see them , but he hopped right into their car and showed them the way home .",nyt_eng_19950712_0287_12,7
nyt_eng_19950715_0069_29:7,so_tenacious,so,tenacious,Experts say no other addiction is so tenacious .,nyt_eng_19950715_0069_29,7
nyt_eng_19950717_0574_23:17,noticeably_pregnant,noticeably,pregnant,"-LRB- Lest anyone get the wrong idea , it should be noted no contestant has been noticeably pregnant since 1924 , and the rules are different now . -RRB-",nyt_eng_19950717_0574_23,17
nyt_eng_19950718_0475_11:23,as_drastic,as,drastic,Asked why the sciences have survived despite similar complaints and budget cuts in the past Vest said no cut has ever been as drastic as the one proposed by this Congress .,nyt_eng_19950718_0475_11,23
nyt_eng_19950720_0084_14:11,longer_possible,longer,possible,"As Nunn points out , no just solution is any longer possible without resort to a massive infusion of NATO and U.S. military force .",nyt_eng_19950720_0084_14,11
nyt_eng_19950722_0075_5:16,very_good,very,good,"-LBQ-  There was no baseball team then , no hockey and the Nuggets were n't very good .  -RDQ-",nyt_eng_19950722_0075_5,16
nyt_eng_19950728_0093_28:19,so_disastrous,so,disastrous,-LBQ-  ` Uncle Tom 's Cabin ' was the first evidence to America that no hurricane can be so disastrous to a country as a ruthlessly humanitarian woman .  -RDQ-,nyt_eng_19950728_0093_28,19
nyt_eng_19950728_0307_17:7,that_shy,that,shy,No other team has been nearly that shy to give away the ball .,nyt_eng_19950728_0307_17,7
nyt_eng_19950728_0346_11:9,too_high,too,high,"It is widely believed that no price is too high for many tech stocks , simply because technology is in the process of transforming every human activity .",nyt_eng_19950728_0346_11,9
nyt_eng_19950728_0346_13:23,too_high,too,high,"To a contrarian , it is reminiscent of the belief 15 years ago that inflation would never stop and no price was too high for an oil stock .",nyt_eng_19950728_0346_13,23
nyt_eng_19950728_0475_30:14,so_lucrative,so,lucrative,"But , they say , no other ostensibly legitimate Mafia business has been so lucrative as garbage disposal .",nyt_eng_19950728_0475_30,14
nyt_eng_19950731_0064_6:6,yet_available,yet,available,"While no specific figure was yet available , he said the company should n't have to take any charges related to the delay .",nyt_eng_19950731_0064_6,6
nyt_eng_19950731_0328_23:6,that_good,that,good,"No other CBS pilot is that good _ but then , except for  -LBQ-  Murder One ,  -RDQ-  ABC 's 22-week Steven Bochco melodrama , neither is any other network pilot .",nyt_eng_19950731_0328_23,6
nyt_eng_19950801_0304_8:10,too_silly,too,silly,"-LBQ-  We have a rule that no idea is too silly ,  -RDQ-  said Tom Rothman , 40 , the president of Fox Searchlight .",nyt_eng_19950801_0304_8,10
nyt_eng_19950803_0124_6:8,immediately_available,immediately,available,No other details on the bids were immediately available .,nyt_eng_19950803_0124_6,8
nyt_eng_19950803_0266_6:8,immediately_available,immediately,available,No other details on the bids were immediately available .,nyt_eng_19950803_0266_6,8
nyt_eng_19950805_0242_23:5,as_eager,as,eager,"No community may be as eager as Gilbert , the fastest-growing spot in the state , to start counting people .",nyt_eng_19950805_0242_23,5
nyt_eng_19950809_0471_11:12,too_big,too,big,"In all their years at the News-Press , no story was too big or too small for the brothers .",nyt_eng_19950809_0471_11,12
nyt_eng_19950811_0119_37:15,too_personal,too,personal,"She promises her audiences , whether young or old , that no question is too personal .",nyt_eng_19950811_0119_37,15
nyt_eng_19950811_0459_9:10,actually_due,actually,due,"A month later , it said no distribution was actually due , blaming the mistake on a  -LBQ-  manual mathematical error .  -RDQ-",nyt_eng_19950811_0459_9,10
nyt_eng_19950812_0118_8:5,too_routine,too,routine,"No music-blasting speaker is too routine for Dallas , and every untoward intrusion of sound is a subject for investigation .",nyt_eng_19950812_0118_8,5
nyt_eng_19950813_0209_10:7,too_small,too,small,"No detail of the Dead is too small to merit a place on the Web , and thanks to the inexpensive Internet facilities at colleges and universities , Deadheads have plenty of computer capacity for their huge files .",nyt_eng_19950813_0209_10,7
nyt_eng_19950813_0230_11:8,ever_safe,ever,safe,"And he proved that no lead is ever safe , no matter who has it .",nyt_eng_19950813_0230_11,8
nyt_eng_19950814_0659_2:4,ever_safe,ever,safe,No lead is ever safe _ ever _ and the concept of a comfort zone is nonexistent .,nyt_eng_19950814_0659_2,4
nyt_eng_19950815_0011_2:4,ever_safe,ever,safe,No lead is ever safe _ ever _ and the concept of a comfort zone is non existent .,nyt_eng_19950815_0011_2,4
nyt_eng_19950816_0322_1:20,really_settled,really,settled,The most salient fact of modern American social history is that no issue involving race or gender is ever really settled .,nyt_eng_19950816_0322_1,20
nyt_eng_19950817_0266_4:5,immediately_available,immediately,available,No other details were immediately available .,nyt_eng_19950817_0266_4,5
nyt_eng_19950818_0245_20:10,too_big,too,big,Totty sets out to prove that no challenge is too big for a too small pig .,nyt_eng_19950818_0245_20,10
nyt_eng_19950819_0067_9:5,as_thoughtful,as,thoughtful,No other Yankee is as thoughtful with the news media .,nyt_eng_19950819_0067_9,5
nyt_eng_19950819_0093_12:22,commercially_available,commercially,available,Union officials say that they are proud of not doing any worse with equipment so old that no spare parts are commercially available and neither the manufacturer nor third-party vendors will service it .,nyt_eng_19950819_0093_12,22
nyt_eng_19950820_0233_17:32,too_wide,too,wide,"Officially , as Attorney General Janet Reno said this month while announcing the arrest of a Jordanian in connection with the 1993 World Trade Center bombing ,  -LBQ-  no ocean is too wide , no distance too far , no time period too long and no effort too great to make those who kill or injure Americans immune from the U.S. justice system .  -RDQ-",nyt_eng_19950820_0233_17,32
nyt_eng_19950828_0620_26:22,too_large,too,large,"But Tejera said the merger of Chase and Chemical , already among the nation 's biggest , proves no bank is too large to find a partner .",nyt_eng_19950828_0620_26,22
nyt_eng_19950829_0233_31:4,so_important,so,important,No tradition is so important that it wo n't change with the times .,nyt_eng_19950829_0233_31,4
nyt_eng_19950830_0154_2:5,too_big,too,big,"-LBQ-  No challenge is too big for Veronica ,  -RDQ-  says Juanita P. Baranco , a 15-year friend and co-owner of the Baranco Automotive Group .",nyt_eng_19950830_0154_2,5
nyt_eng_19950906_0107_3:5,immediately_available,immediately,available,No further details were immediately available .,nyt_eng_19950906_0107_3,5
nyt_eng_19950906_0109_2:5,immediately_available,immediately,available,No further details were immediately available .,nyt_eng_19950906_0109_2,5
nyt_eng_19950906_0112_6:7,immediately_available,immediately,available,"No further details from Volkswagen were immediately available , although the company said it will isssue a further statement later in the day .",nyt_eng_19950906_0112_6,7
nyt_eng_19950906_0321_13:6,easily_deconstructed,easily,deconstructed,But no human is so easily deconstructed .,nyt_eng_19950906_0321_13,6
nyt_eng_19950915_0590_32:47,even_inappropriate,even,inappropriate,"That was what Sadri Krasniqi was doing in the gymnasium that day six years ago , Halpern told the court _ petting and caressing his little girl in a way that had absolutely no sexual context and which he had absolutely no idea was wrong or even inappropriate here .",nyt_eng_19950915_0590_32,47
nyt_eng_19950916_0232_13:5,20-2_good,20-2,good,"No baseball team is 20-2 good , not really , not ever .",nyt_eng_19950916_0232_13,5
nyt_eng_19950917_0015_14:23,as_good,as,good,No team the Eagles will face the remainder of the season _ and that includes Miami and Notre Dame _ will be as good as Michigan or Ohio State .,nyt_eng_19950917_0015_14,23
nyt_eng_19950919_0028_33:5,remotely_interested,remotely,interested,But no fan was remotely interested in what was happening on the field by that time .,nyt_eng_19950919_0028_33,5
nyt_eng_19950920_0666_11:40,even_close,even,close,"For one thing , the Senate and House bills now awaiting a reconciling of their differences both have blanket requirements that the states get at least 50 percent of welfare recipients into full-time jobs , but no state is even close to that goal with current programs intended to move welfare recipients into jobs programs .",nyt_eng_19950920_0666_11,40
nyt_eng_19950921_0458_14:36,commercially_viable,commercially,viable,"But realistically the NC-17 -LRB- as was its predecessor , the X -RRB- has been the kiss of death because up to now studios and distributors have maintained that no film with that rating is commercially viable .",nyt_eng_19950921_0458_14,36
nyt_eng_19950922_0251_59:4,neal_low,neal,low,No more is Neal low when he looks at the depth chart .,nyt_eng_19950922_0251_59,4
nyt_eng_19950922_0314_11:7,as_aggressive,as,aggressive,"Perhaps no other bank has been as aggressive in taking advantage of the whittling away of barriers to interstate banking as NationsBank Corp. , another North Carolina giant that was the lead backer of the law that ends state barriers .",nyt_eng_19950922_0314_11,7
nyt_eng_19950923_0143_28:20,too_obscure,too,obscure,"The homeless man may have only been reciting what he heard on the radio , but no lead is too obscure at this point .",nyt_eng_19950923_0143_28,20
nyt_eng_19950925_0022_16:12,too_big,too,big,"You saw three straight wins in which no Oakland lead was too big , no Oakland pitcher was safe and no eardrum was unrung .",nyt_eng_19950925_0022_16,12
nyt_eng_19950927_0001_40:10,too_high,too,high,I 've heard people say that no price is too high for a stadium .,nyt_eng_19950927_0001_40,10
nyt_eng_19951004_0519_33:18,as_disputed,as,disputed,"And in a discussion of overpopulation , Fox notes that  -LBQ-  no other Catholic Church teaching is as disputed as its stand on birth control .",nyt_eng_19951004_0519_33,18
nyt_eng_19951005_0610_5:4,too_small,too,small,"No detail is too small , from the changing color of security stickers to the exact definition of an antiphon .",nyt_eng_19951005_0610_5,4
nyt_eng_19951006_0028_56:12,very_conservative,very,conservative,"-LBQ-  No question , the last two weeks we 've been very conservative ,  -RDQ-  Baylor coach Chuck Reedy said .",nyt_eng_19951006_0028_56,12
nyt_eng_19951010_0507_6:9,particularly_sensitive,particularly,sensitive,"The  -LBQ-  no ground rules  -RDQ-  issue is particularly sensitive in light of the ABC interview with Michael Jackson earlier this summer , when the pop star was granted a number of concessions by the network , including airing what was regarded as a Jackson  -LBQ-  infomercial  -RDQ-  and changing lighting to suit Jackson .",nyt_eng_19951010_0507_6,9
nyt_eng_19951011_0427_4:13,as_poignant,as,poignant,"But in these ecologically trying times , perhaps no design problem is as poignant as the quest for the perfect toilet .",nyt_eng_19951011_0427_4,13
nyt_eng_19951014_0243_35:6,too_conservative,too,conservative,No question he 'd been too conservative .,nyt_eng_19951014_0243_35,6
nyt_eng_19951017_0074_32:9,actually_due,actually,due,The report added that no such money was actually due .,nyt_eng_19951017_0074_32,9
nyt_eng_19951022_0142_16:17,too_obvious,too,obvious,"Although there are plenty of good gags , it sometimes seems as if no routine is too obvious or irrelevant to be met at the Lapin Agile .",nyt_eng_19951022_0142_16,17
nyt_eng_19951022_0210_30:6,readily_available,readily,available,"Although no national statistics are readily available , admissions offices at the most competitive universities , including Stanford , Harvard and the Massachusetts Institute of Technology , all report that more and more of the nation 's most demanding high schools no longer rank seniors .",nyt_eng_19951022_0210_30,6
nyt_eng_19951023_0795_20:18,entirely_safe,entirely,safe,"As for the new meeting site , when it comes to the Chinese , no place is entirely safe .",nyt_eng_19951023_0795_20,18
nyt_eng_19951023_0808_7:6,immediately_available,immediately,available,"She said no details were immediately available regarding the appeal , which was being filed late Monday .",nyt_eng_19951023_0808_7,6
nyt_eng_19951024_0224_15:7,currently_available,currently,available,"While no other effective rinses are currently available for eliminating bacteria from beef and poultry , several companies are working on competing products .",nyt_eng_19951024_0224_15,7
nyt_eng_19951025_0356_10:7,as_open,as,open,"Although no other politician has been as open as Walden in warning the Europeans that their comfortable existence is threatened , alarm signals have , nonetheless , started ringing .",nyt_eng_19951025_0356_10,7
nyt_eng_19951025_0485_94:9,so_naive,so,naive,"No black person , though , should be so naive or so disingenuous as to tell whites and Jews that they should not fear Minister Farrakhan and his apparent hatred of them .",nyt_eng_19951025_0485_94,9
nyt_eng_19951026_0401_10:4,too_grisly,too,grisly,"No description is too grisly to include _ kicks to the head of Tsarevich Alexis before the child is shot directly in the ear , twice ; drunken peasants sordidly groping the mutilated bodies of the czarina and her daughters before pitching them into their common grave .",nyt_eng_19951026_0401_10,4
nyt_eng_19951027_0488_8:8,clearly_attributable,clearly,attributable,"-LBQ-  No cases of HIV transmission are clearly attributable only to saliva  -RDQ-  and there have been a number of reports of bites from people infected with HIV that did not spread the infection , according to the federal Centers for Disease Control and Prevention in Atlanta .",nyt_eng_19951027_0488_8,8
nyt_eng_19951028_0069_11:30,so_cavalier,so,cavalier,"The suspicion is strong , though , that one day , when the city 's Muslim population has reached a critical mass , no New York politician will be so cavalier about tossing out any Arab , even an Arafat .",nyt_eng_19951028_0069_11,30
nyt_eng_19951029_0006_13:32,as_easy,as,easy,"Spotted at the UCLA game Saturday were Super Dave Osborne , a role model for attention-grabbers ; Gil Garcetti , who served as a reminder to UCLA that no confrontation is as easy as it seems , and two local weathermen , Fritz Coleman and Dallas Raines , who could n't help but notice a warming trend around Westwood .",nyt_eng_19951029_0006_13,32
nyt_eng_19951029_0078_18:10,so_uncongenial,so,uncongenial,"No other city , no subject , is quite so uncongenial to artistic interpretation .",nyt_eng_19951029_0078_18,10
nyt_eng_19951030_0645_30:15,ever_likely,ever,likely,The results had mixed reviews from musicians and Voss conceded that no computer is ever likely to produce a Beethoven sonata .,nyt_eng_19951030_0645_30,15
nyt_eng_19951030_0837_21:38,usually_enough,usually,enough,"This is the emotion that makes me want to travel All places , no matter where , no matter what , are worth visiting In travel , as in many other experiences in life , once is usually enough The existence of the unknown was the wellspring of my dreams .  -RDQ-",nyt_eng_19951030_0837_21,38
nyt_eng_19951103_0315_20:8,so_low-profile,so,low-profile,No major sports hero emeritus was ever so low-profile .,nyt_eng_19951103_0315_20,8
nyt_eng_19951104_0180_49:4,so_wrong,so,wrong,No pundits are so wrong as those that dare predict a fighter 's next bout .,nyt_eng_19951104_0180_49,4
nyt_eng_19951104_0240_45:9,as_difficult,as,difficult,But no political chore in those years was as difficult as winning over some of the American Jews who thought he should have been more reluctant to grasp Arafat 's hand .,nyt_eng_19951104_0240_45,9
nyt_eng_19951107_0271_60:20,as_beautiful,as,beautiful,"Could n't we find another spot ? They had looked , he said , and no other spot was as beautiful .",nyt_eng_19951107_0271_60,20
nyt_eng_19951108_0141_6:6,so_large,so,large,Surely no pearl could be so large .,nyt_eng_19951108_0141_6,6
nyt_eng_19951109_0329_27:13,too_high,too,high,Both sales had moments when it seemed as though no price was too high .,nyt_eng_19951109_0329_27,13
nyt_eng_19951112_0242_29:9,too_small,too,small,"Financial planner Jane King says no amount is too small  -COL-   -LBQ-  If you 're about to write a check for $ 100 and you can give two shares instead , it 's a no-brainer .  -RDQ-",nyt_eng_19951112_0242_29,9
nyt_eng_19951112_0375_16:6,as_popular,as,popular,"But no alibi will be as popular this week as the supposed ineptitude of Switzer , just two dimensions away from being a perfect dart board .",nyt_eng_19951112_0375_16,6
nyt_eng_19951116_0447_3:19,as_subject,as,subject,"No one hates to be categorized more than musicians , but probably no other group of artists is as subject to being pigeonholed _ or as adversely affected by it .",nyt_eng_19951116_0447_3,19
nyt_eng_19951117_0048_6:13,immediately_available,immediately,available,No estimate on the portion that Los Angeles schools would receive was immediately available .,nyt_eng_19951117_0048_6,13
nyt_eng_19951117_0567_60:13,too_small,too,small,Teams of executives fanned out across the state ; no audience was too small for the treatment .,nyt_eng_19951117_0567_60,13
nyt_eng_19951118_0180_15:19,that_quick,that,quick,"-LBQ-  The puck must have gone in with one second left because no timekeeper in the league is that quick ,  -RDQ-  said Ron Wilson , the coach of the Ducks .",nyt_eng_19951118_0180_15,19
nyt_eng_19951118_0241_15:33,so_exciting,so,exciting,"In 1982 , Kerr asked ,  -LBQ-  Has anyone seen hide or hair of the Pulitzer-Prize-winning Charles Gordone , whose ` No Place To Be Somebody ' was once _ once _ so exciting ?  -RDQ-",nyt_eng_19951118_0241_15,33
nyt_eng_19951119_0109_7:6,much_different,much,different,In 1800 no press was much different from Gutenberg 's 350 years earlier _ hand operated and fed one sheet of paper at time .,nyt_eng_19951119_0109_7,6
nyt_eng_19951128_0107_1:9,so_subject,so,subject,Probably no essential part of a computer is so subject to personal taste as the keyboard ; there are all kinds of keyboards for all kinds of people .,nyt_eng_19951128_0107_1,9
nyt_eng_19951128_0590_12:6,too_reclusive,too,reclusive,"Obviously no famous person is too reclusive , forgotten or overexposed to play themselves for a few minutes .",nyt_eng_19951128_0590_12,6
nyt_eng_19951128_0671_25:46,currently_available,currently,available,"Even if China improved the efficiency of all of its electric power plants , much of the coal burned in China is consumed in small industrial and municipal boilers and in millions of cooking stoves and household heaters , for which no alternative fuels are currently available .",nyt_eng_19951128_0671_25,46
nyt_eng_19951130_0458_12:15,still_ephemeral,still,ephemeral,"But no matter what the tools , much of what is being enshrined is still ephemeral  -COL-  performances that exist fully only in the moment of their execution .",nyt_eng_19951130_0458_12,15
nyt_eng_19951201_0269_34:4,too_extreme,too,extreme,No act was too extreme to  -LBQ-  do good for the Jews .  -RDQ-,nyt_eng_19951201_0269_34,4
nyt_eng_19951203_0146_22:4,too_narrow,too,narrow,No question is too narrow .,nyt_eng_19951203_0146_22,4
nyt_eng_19951213_0733_40:23,too_small,too,small,"Was it false ? Yes , most of the best scuttlebutt is , but as Stackhouse quickly realized , no mistake is too small when you are the Next Michael Jordan .",nyt_eng_19951213_0733_40,23
nyt_eng_19951219_0132_39:6,pretty_confident,pretty,confident,"No matter , I 'm pretty confident the party line would have sounded about like Mindy Dow had earlier .",nyt_eng_19951219_0132_39,6
nyt_eng_19951220_0300_30:4,as_celebratory,as,celebratory,No drink is as celebratory as a flute of champagne .,nyt_eng_19951220_0300_30,4
nyt_eng_19951221_0351_5:22,so_base,so,base,"From my own research in once-classified documents , I learned that when it came to Cold Warfare , no deed was so base , no measure so vile , that it would not win approval from President Harry S. Truman and his advisors .",nyt_eng_19951221_0351_5,22
nyt_eng_19951221_0549_33:4,too_big,too,big,"No assignment is too big , either .",nyt_eng_19951221_0549_33,4
nyt_eng_19951221_0570_35:20,too_high,too,high,"Love Canal and other high-profile hazardous waste sites created such public fear of hazardous waste that no price was too high for cleanup , he said .",nyt_eng_19951221_0570_35,20
