hit_id,colloc,adv,adj,sent_text,sent_id,adv_index
nyt_eng_19940707_0265_21:10,ethnically_homogeneous,ethnically,homogeneous,"Especially in Eastern Europe , where no country is ethnically homogeneous , efforts to exclude the other will only give pretexts to neighboring nationalists to protect their kin across the border -- or even lead to new Bosnias .",nyt_eng_19940707_0265_21,10
nyt_eng_19940710_0004_4:16,as_dreadful,as,dreadful,"And no team , at least going into World Cup ` 94 , has been as dreadful as Bulgaria  -COL-  0-10-6 in Cup play .",nyt_eng_19940710_0004_4,16
nyt_eng_19940710_0078_35:30,immediately_justified,immediately,justified,"Indeed , on Friday , Treasury Secretary Lloyd Bentsen said at the Group of Seven economic summit meeting in Naples that no interest rate increase by the Fed was immediately justified .",nyt_eng_19940710_0078_35,30
nyt_eng_19940711_0009_4:5,as_successful,as,successful,No country has been as successful in the past 40 years .,nyt_eng_19940711_0009_4,5
nyt_eng_19940712_0239_5:53,as_compelling,as,compelling,"Despite an orgy of hand-wringing about prurient interest and pretrial publicity , nothing in this case , no non-existent ski mask , no car chase , not even the damning and surely inadmissible 911 tape of Nicole Simpson begging for help as her enraged ex bellows in the background , has been as compelling as the preliminary hearing and the public scrutiny it has inspired .",nyt_eng_19940712_0239_5,53
nyt_eng_19940714_0186_13:8,completely_childproof,completely,childproof,"-LBQ-  Unfortunately , no lighter can be completely childproof .",nyt_eng_19940714_0186_13,8
nyt_eng_19940716_0132_11:13,so_generous,so,generous,"For another , Yuzhin says , no real lawyers would have been so generous with their time .",nyt_eng_19940716_0132_11,13
nyt_eng_19940725_0175_32:17,so_rigid,so,rigid,"The current political climate calls for long and harsh sentences , but no system should be so rigid that it prevents justice for the Skippers of this world .",nyt_eng_19940725_0175_32,17
nyt_eng_19940727_0037_3:26,too_trivial,too,trivial,"At thousands of computer terminals across the country , hackers , hacker wannabes , net vets and newbies are proving again that no issue is too trivial , or too taboo , for the information age 's ultimate party line .",nyt_eng_19940727_0037_3,26
nyt_eng_19940803_0063_19:6,as_good,as,good,"But no donated organ is as good as a healthy original , because patients must take lifelong anti- rejection drugs that can cause serious side effects , including liver and kidney damage , hypertension and higher risk for infection and lymphoma cancers .",nyt_eng_19940803_0063_19,6
nyt_eng_19940805_0011_2:5,fully_reliable,fully,reliable,"No single poll is fully reliable on its own , of course , but a look at some 30 different poll series reveals a remarkably vivid and consistent pattern  -COL-  a steady decline over the past ten years in American trust and friendliness towards Japan .",nyt_eng_19940805_0011_2,5
nyt_eng_19940805_0013_2:5,fully_reliable,fully,reliable,"No single poll is fully reliable on its own , of course , but a look at some 30 different poll series reveals a remarkably vivid and consistent pattern  -COL-  a steady decline over the past ten years in American trust and friendliness towards Japan .",nyt_eng_19940805_0013_2,5
nyt_eng_19940808_0057_28:14,ever_inviolate,ever,inviolate,Nothing saps a team 's self-esteem like the notion that no lead is ever inviolate .,nyt_eng_19940808_0057_28,14
nyt_eng_19940808_0234_2:5,fully_reliable,fully,reliable,"No single poll is fully reliable on its own , of course , but a look at some 30 different poll series reveals a remarkably vivid and consistent pattern  -COL-  a steady decline over the past ten years in American trust and friendliness towards Japan .",nyt_eng_19940808_0234_2,5
nyt_eng_19940808_0236_2:5,fully_reliable,fully,reliable,"No single poll is fully reliable on its own , of course , but a look at some 30 different poll series reveals a remarkably vivid and consistent pattern  -COL-  a steady decline over the past ten years in American trust and friendliness towards Japan .",nyt_eng_19940808_0236_2,5
nyt_eng_19940811_0207_33:4,ever_big,ever,big,"No lead is ever big enough , no deficit insurmountable .",nyt_eng_19940811_0207_33,4
nyt_eng_19940813_0208_15:16,immediately_available,immediately,available,"Troopers listed it as a possible overdose , but no official cause of death was immediately available .",nyt_eng_19940813_0208_15,16
nyt_eng_19940813_0220_14:10,deceivingly_devious,deceivingly,devious,Reality check reveals that no two things are as deceivingly devious as putting and middle age .,nyt_eng_19940813_0220_14,10
nyt_eng_19940814_0081_6:11,as_good,as,good,"No sequel , like Rocky or Rambo , is ever as good .  -RDQ-",nyt_eng_19940814_0081_6,11
nyt_eng_19940815_0102_29:5,cautiously_deferential,cautiously,deferential,No writers were more cautiously deferential to one another than William Faulkner and Ernest Hemingway .,nyt_eng_19940815_0102_29,5
nyt_eng_19940818_0131_33:6,as_cavalier,as,cavalier,"Maybe no mother-to-be would be as cavalier as Lola , but  -LBQ-  Cafe au Lait  -RDQ-  has a decency more profound than the sort required to settle simple questions of paternity .",nyt_eng_19940818_0131_33,6
nyt_eng_19940820_0177_63:8,that_powerful,that,powerful,"No leader , no government should be that powerful ,  -RDQ-  said xxxxxx .",nyt_eng_19940820_0177_63,8
nyt_eng_19940820_0201_10:12,highly_unlikely,highly,unlikely,"This time , there is no commissioner and binding arbitration is highly unlikely .",nyt_eng_19940820_0201_10,12
nyt_eng_19940829_0131_18:23,so_bad,so,bad,"A growing number of Republicans , however , have taken up the Reagan Dictum , which holds that no social problem is so bad that it ca n't be made still worse by an effort to solve it .",nyt_eng_19940829_0131_18,23
nyt_eng_19940901_0047_29:6,as_crucial,as,crucial,Probably no other factor is as crucial .,nyt_eng_19940901_0047_29,6
nyt_eng_19940902_0303_36:10,totally_audacious,totally,audacious,"Plotkin added ,  -LBQ-  No question , Barry is totally audacious .  -RDQ-",nyt_eng_19940902_0303_36,10
nyt_eng_19940904_0168_44:5,as_insistent,as,insistent,Perhaps no voice was as insistent as Hume 's .,nyt_eng_19940904_0168_44,5
nyt_eng_19940912_0340_19:36,too_drastic,too,drastic,"The experts also say that Bangladesh made a major commitment to promoting birth control early on , immediately after its independence in 1971 , when the government said that  -LBQ-  no civilized measure would be too drastic  -RDQ-  to keep the population , then 80 million , from rising beyond 150 million .",nyt_eng_19940912_0340_19,36
nyt_eng_19940913_0020_18:8,so_honored,so,honored,"In fact , no offensive player was so honored .",nyt_eng_19940913_0020_18,8
nyt_eng_19940913_0196_8:7,viscerally_analogous,viscerally,analogous,"Perhaps no other sport is so viscerally analogous to freedom , and the exhilaration it induces springs from the sensation that this freedom is a natural state of being .",nyt_eng_19940913_0196_8,7
nyt_eng_19940913_0471_27:7,totally_comparable,totally,comparable,"Although no two races are ever totally comparable , recent political history includes cases in which incumbents prevailed despite high disapproval ratings , largely by convincing voters that their opponents were unacceptable .",nyt_eng_19940913_0471_27,7
nyt_eng_19940914_0445_5:22,deeply_rooted,deeply,rooted,"Even through seven previous work stoppages in 22 years , baseball remained the national pastime because no other sport is as deeply rooted in America .",nyt_eng_19940914_0445_5,22
nyt_eng_19940917_0126_2:4,immediately_available,immediately,available,No details were immediately available on his discussions there .,nyt_eng_19940917_0126_2,4
nyt_eng_19940920_0287_13:4,too_foul,too,foul,No atrocity was too foul for the junta .,nyt_eng_19940920_0287_13,4
nyt_eng_19940920_0434_19:28,too_shameful,too,shameful,You know how major football powers like to schedule a certain number of non-conference home games they can count on as automatic victories ? No mismatch is too shameful in games like these .,nyt_eng_19940920_0434_19,28
nyt_eng_19940924_0193_9:7,immediately_available,immediately,available,"She said no cost estimate was immediately available for checking the immigration status of all 1.5 million students in the state 's community colleges , and their parents or guardians .",nyt_eng_19940924_0193_9,7
nyt_eng_19940929_0382_28:14,immediately_open,immediately,open,Hill has tended to be quick to head outside if no hole is immediately open .,nyt_eng_19940929_0382_28,14
nyt_eng_19941012_0154_27:11,as_intriguing,as,intriguing,"But in Powell 's case , no element is quite as intriguing as race .",nyt_eng_19941012_0154_27,11
nyt_eng_19941016_0109_2:17,even_close,even,close,Two new agencies dealing with the Mexican border lack general managers and no cleanup projects are even close to starting .,nyt_eng_19941016_0109_2,17
nyt_eng_19941022_0198_44:11,as_proud,as,proud,"No doubt , he said , his grandmother would be as proud of him earning a college degree as she would be of anything he accomplishes in football .",nyt_eng_19941022_0198_44,11
nyt_eng_19941025_0283_20:5,too_much,too,much,"-LBQ-  No challenge is too much for Lou Saban ,  -RDQ-  said Steinbrenner , who first met Saban in Cleveland in the late 1940s , when Saban played for the Browns and Steinbrenner helped run the city 's athletic programs .",nyt_eng_19941025_0283_20,5
nyt_eng_19941025_0430_9:11,as_important,as,important,"-LBQ-  Every game is important , but no game is as important as Nebraska .  -RDQ-",nyt_eng_19941025_0430_9,11
nyt_eng_19941028_0378_41:10,as_important,as,important,"Every game is important , but no game is as important as Nebraska .  -RDQ-",nyt_eng_19941028_0378_41,10
nyt_eng_19941031_0253_27:12,too_tough,too,tough,"He said , ` No way , lady , you 're too tough .  -RDQ-  '",nyt_eng_19941031_0253_27,12
nyt_eng_19941106_0187_19:23,yet_complete,yet,complete,"Potential owners from nearly all the areas are negotiating with local authorities to lease existing ball parks , but no deals are yet complete .",nyt_eng_19941106_0187_19,23
nyt_eng_19941107_0163_35:7,wantonly_maligned,wantonly,maligned,No chief executive has been more wantonly maligned than Clinton .,nyt_eng_19941107_0163_35,7
nyt_eng_19941116_0218_15:5,too_young,too,young,But no object is too young to escape Thaw 's eye .,nyt_eng_19941116_0218_15,5
nyt_eng_19941117_0061_29:5,as_daunting,as,daunting,"Certainly no challenges are as daunting as those she confronted in 1975 , when she defected from Czechoslovakia without the comfort of friends and family , or total command of the English language .",nyt_eng_19941117_0061_29,5
nyt_eng_19941122_0075_10:5,readily_available,readily,available,"No national statistics are readily available , but experts say that spending on college remedial education has increased two-fold to four-fold since the 1980s , an era marked by the diversity of people seeking higher education .",nyt_eng_19941122_0075_10,5
nyt_eng_19941125_0209_6:15,as_bumpy,as,bumpy,But a lot of it is probably just trigger-happy traders  -COL-  no economy is as bumpy as this market .,nyt_eng_19941125_0209_6,15
nyt_eng_19941128_0120_27:13,ever_complete,ever,complete,"She made me question -- and I found out no answer is ever complete , it is always a process .",nyt_eng_19941128_0120_27,13
nyt_eng_19941130_0120_1:9,very_happy,very,happy,"No surprise to learn Ivan Reitman is  -LBQ-  very happy  -RDQ-  with  -LBQ-  Junior ,  -RDQ-  his commercially triumphant reunion of Arnold Schwarzenegger and Danny DeVito .",nyt_eng_19941130_0120_1,9
nyt_eng_19941203_0088_18:5,even_close,even,close,No other passer is even close to Unitas 's record .,nyt_eng_19941203_0088_18,5
nyt_eng_19941204_0118_6:5,quickly_apparent,quickly,apparent,"No winners will be quickly apparent in the auction , in which the winning bids are expected to total somewhere between $ 3 billion and $ 15 billion .",nyt_eng_19941204_0118_6,5
nyt_eng_19941208_0198_23:15,as_smart,as,smart,"As the film 's confusing yet simple-minded denouement reveals , no characters here are as smart as their talk about milliseconds and prototypes makes them sound .",nyt_eng_19941208_0198_23,15
nyt_eng_19941212_0222_8:5,as_effective,as,effective,"No book could be as effective in showing real people using these highly animated , metaphoric and visual words -LRB- including my favorite , the M-shaped arches that signify McDonald 's -RRB- .",nyt_eng_19941212_0222_8,5
nyt_eng_19941218_0097_10:5,yet_available,yet,available,"No hard data are yet available about how this Christmas shopping season is faring but Wall Street analysts are estimating that sales will be up 6 percent to 8 percent , and profits somewhat less , over last year .",nyt_eng_19941218_0097_10,5
nyt_eng_19941218_0150_13:5,yet_available,yet,available,"No hard data are yet available about how this Christmas shopping season is faring but Wall Street analysts estimate that sales will be up 6 to 8 percent , and profits somewhat less , over those of last year .",nyt_eng_19941218_0150_13,5
nyt_eng_19941221_0378_13:42,too_humble,too,humble,"In prints , Lichtenstein 's mixings of high and low can be physical as well as visual , which is to say that he conveys popular images through a kind of popular art mechanics in which no method or material is too humble .",nyt_eng_19941221_0378_13,42
nyt_eng_19941228_0031_36:36,really_straight,really,straight,"If you 're asking about the longest straight stretch of road , AAA 's experts are n't willing to say , given that construction work is possible anytime , anywhere , and no road is really straight -- not even Alligator Alley -LRB- the stretch of I-75 between Golden Gate near Naples , on the west , and U.S. 27 near Weston , on the east -RRB- .",nyt_eng_19941228_0031_36,36
nyt_eng_19941229_0208_15:8,as_vulnerable,as,vulnerable,No European country of course would be as vulnerable as France .,nyt_eng_19941229_0208_15,8
nyt_eng_19950102_0211_57:15,ever_easy,ever,easy,-LBQ-  I always tell myself that every mistake costs money and no sale is ever easy .  -RDQ-,nyt_eng_19950102_0211_57,15
nyt_eng_19950103_0003_32:14,too_small,too,small,"Members of the press are granted equal opportunity ; no radio station is too small , no language barrier too great .",nyt_eng_19950103_0003_32,14
nyt_eng_19950103_0165_2:9,as_keen,as,keen,"No major city in the country has been as keen in razing its old buildings to make way for the new , say many in this city of glass and steel .",nyt_eng_19950103_0165_2,9
nyt_eng_19950103_0264_13:8,personally_liable,personally,liable,"No senator or representative would be  -LBQ-  personally liable for the payment of compensation ,  -RDQ-  the bill says .",nyt_eng_19950103_0264_13,8
nyt_eng_19950107_0123_1:6,as_controversial,as,controversial,"No other building has been as controversial as the Pep ` e-Fareri building , which the county leased in 1991 from Fareri and his partners as a new home for offices and data-processing equipment .",nyt_eng_19950107_0123_1,6
nyt_eng_19950111_0059_43:5,ever_necessary,ever,necessary,"Although no purchase is ever necessary to win , we would much rather give our prize money to a loyal friend and customer .",nyt_eng_19950111_0059_43,5
nyt_eng_19950112_0194_13:23,so_humble,so,humble,He appealed to the Walt Whitman strain in American culture  -COL-  the democratic desire to believe that no aspect of life is so humble that it ca n't become material for art .,nyt_eng_19950112_0194_13,23
nyt_eng_19950113_0294_45:14,somewhat_changed,somewhat,changed,"-LBQ-  No doubt , with a TV crew there , an argument is somewhat changed .",nyt_eng_19950113_0294_45,14
nyt_eng_19950117_0364_22:15,too_big,too,big,-LBQ-  The problem is we 've had school boards that thought no budget was too big .  -RDQ-,nyt_eng_19950117_0364_22,15
nyt_eng_19950117_0387_23:17,completely_free,completely,free,"No matter how the codes are improved , he said , no building will ever be completely free from risk from a big enough earthquake .",nyt_eng_19950117_0387_23,17
nyt_eng_19950119_0008_42:5,too_far-fetched,too,far-fetched,"No idea should be too far-fetched , no notion too wild .",nyt_eng_19950119_0008_42,5
nyt_eng_19950122_0163_12:5,too_minute,too,minute,No detail will be too minute .,nyt_eng_19950122_0163_12,5
nyt_eng_19950123_0005_26:5,too_old,too,old,No potential strikebreaker is too old or too far over the hill for these owners .,nyt_eng_19950123_0005_26,5
nyt_eng_19950124_0486_51:8,as_bad,as,bad,But no way the Chargers can be as bad as the Bears .,nyt_eng_19950124_0486_51,8
nyt_eng_19950129_0115_23:5,completely_safe,completely,safe,"No hiding place is completely safe , but people have to venture out in search of food and water , because there are no luxuries like plumbing or electricity .",nyt_eng_19950129_0115_23,5
nyt_eng_19950129_0165_7:31,too_high,too,high,"In a 1989 interview , the director Tony Palmer , who had just completed a documentary on Richard Burton , said of Philip Burton ,  -LBQ-  No praise can be too high for what he managed to do with this rather strange lad .  -RDQ-",nyt_eng_19950129_0165_7,31
nyt_eng_19950131_0390_7:4,too_small,too,small,"No detail is too small , no situation too trifling , no point too obscure .",nyt_eng_19950131_0390_7,4
nyt_eng_19950201_0327_24:5,yet_targeted,yet,targeted,"No specific programs are yet targeted but each campus is to rank programs by quality , cost , demand and centrality to the campus mission .",nyt_eng_19950201_0327_24,5
nyt_eng_19950203_0164_26:6,too_high,too,high,"There , no price is too high for the emperor 's clothes .",nyt_eng_19950203_0164_26,6
nyt_eng_19950204_0109_5:8,so_irregular,so,irregular,No matter that the bilateral dialogue is so irregular that the Chinese did not even bother to reply to an invitation last week to come to Washington to talk about the problems .,nyt_eng_19950204_0109_5,8
nyt_eng_19950217_0274_37:25,as_ugly,as,ugly,"Instead , she will make the witch the heroine of the story , because she knows that no emotion a witch feels can be as ugly as the savage pleasure and mob mentality of those on a witch hunt .",nyt_eng_19950217_0274_37,25
nyt_eng_19950223_0240_34:5,so_formidable,so,formidable,"-LBQ-  No problem is so formidable that you ca n't just walk away from it ,  -RDQ-  her mother says icily .",nyt_eng_19950223_0240_34,5
nyt_eng_19950224_0254_2:8,too_cruel,too,cruel,"So far no legislative assault has been too cruel , no budget cut too loathsome for the party that took control of Congress at the beginning of the year and has spent all its time since then stomping on the last dying embers of idealism and compassion in government .",nyt_eng_19950224_0254_2,8
nyt_eng_19950227_0043_2:8,too_cruel,too,cruel,"So far no legislative assault has been too cruel , no budget cut too loathsome for the party that took control of Congress at the beginning of the year and has spent all its time since then stomping on the last dying embers of idealism and compassion in government .",nyt_eng_19950227_0043_2,8
nyt_eng_19950304_0150_1:11,too_short,too,short,"In the hallways of Congress , no legislative provision is too short , no sentence too succinct , no word too insignificant to be manipulated by lobbyists for advantage .",nyt_eng_19950304_0150_1,11
nyt_eng_19950306_0124_1:11,too_short,too,short,"In the hallways of Congress , no legislative provision is too short , no sentence too succinct , no word too insignificant to be manipulated by lobbyists for advantage .",nyt_eng_19950306_0124_1,11
nyt_eng_19950309_0291_29:14,too_thorny,too,thorny,The film 's shallowness also contributes to the impression that no problem is too thorny to be solved by movie heroics .,nyt_eng_19950309_0291_29,14
nyt_eng_19950310_0493_5:5,immediately_available,immediately,available,No further information was immediately available .,nyt_eng_19950310_0493_5,5
nyt_eng_19950314_0052_44:5,completely_perfect,completely,perfect,"-LBQ-  No team is completely perfect ,  -RDQ-  conceded Tomjanovich ,  -LBQ-  but chemistry is what wins games .  -RDQ-",nyt_eng_19950314_0052_44,5
nyt_eng_19950314_0197_35:5,ever_definitive,ever,definitive,"-LBQ-  No biography is ever definitive  -COL-  there are many takes , and the more takes you have , the closer you get towards something like truth .",nyt_eng_19950314_0197_35,5
nyt_eng_19950315_0447_23:5,so_important,so,important,"-LBQ-  No party is so important that we will belong to it if it undermines us on this issue ,  -RDQ-  said Rep. Maxine Waters , D-Calif . , who was co-chairwoman of Clinton 's 1992 national campaign .",nyt_eng_19950315_0447_23,5
nyt_eng_19950315_0447_24:5,so_important,so,important,"-LBQ-  No president is so important that we will belong to him if he undermines us on this issue ,  -RDQ-  said Ms. Waters , who is black .",nyt_eng_19950315_0447_24,5
nyt_eng_19950316_0263_17:5,so_important,so,important,"-LBQ-  No party is so important that we will belong to it if it undermines us on this issue ,  -RDQ-  Waters emphasized .",nyt_eng_19950316_0263_17,5
nyt_eng_19950316_0263_18:5,so_important,so,important,-LBQ-  No president is so important that we will belong to him if he undermines us on this issue .  -RDQ-,nyt_eng_19950316_0263_18,5
nyt_eng_19950321_0166_31:50,too_heavy,too,heavy,"But the ADA proceeds from the unreasonable premise that equal access for the disabled -- which is defines so broadly as to include one-sixth of the population -- is a matter of  -LBQ-  civil rights ,  -RDQ-  and that to secure those rights , no cost or burden is too heavy to bear .",nyt_eng_19950321_0166_31,50
nyt_eng_19950321_0328_17:4,that_cruel,that,cruel,No god is that cruel .  -RDQ-,nyt_eng_19950321_0328_17,4
nyt_eng_19950326_0109_15:6,as_divisive,as,divisive,Probably no issue will be as divisive among Republicans as abortion .,nyt_eng_19950326_0109_15,6
nyt_eng_19950326_0122_7:8,quite_ordinary,quite,ordinary,No tale of two lovers is ever quite ordinary .,nyt_eng_19950326_0122_7,8
nyt_eng_19950327_0348_9:4,too_insignificant,too,insignificant,"No fragment is too insignificant , it seems .",nyt_eng_19950327_0348_9,4
nyt_eng_19950403_0561_8:29,reasonably_available,reasonably,available,"Before doing so , he said , his office  -LBQ-  will want to conclude that the process was fair and open and that no more advantageous arrangement was reasonably available .  -RDQ-",nyt_eng_19950403_0561_8,29
nyt_eng_19950404_0063_10:12,immediately_available,immediately,available,This is especially important in emergencies and when no phone is immediately available .,nyt_eng_19950404_0063_10,12
nyt_eng_19950405_0189_4:9,as_rife,as,rife,Perhaps no period in the recent past is as rife with myth as the 1960 's .,nyt_eng_19950405_0189_4,9
nyt_eng_19950405_0234_19:10,entirely_untainted,entirely,untainted,"In hindsight , no photography of the time was entirely untainted by the sins of documentary .",nyt_eng_19950405_0234_19,10
nyt_eng_19950407_0147_17:47,perfectly_reliable,perfectly,reliable,"Daniel Caine , the Newton tax attorney who invented Tax Cut , acknowledged that he and other developers must redouble their efforts to find and fix defects in their software , but he said they also should try harder to inform customers that no program is perfectly reliable .",nyt_eng_19950407_0147_17,47
nyt_eng_19950408_0059_36:10,morally_outraged,morally,outraged,"And to be fair , no producer was exactly morally outraged .",nyt_eng_19950408_0059_36,10
nyt_eng_19950409_0109_8:7,still_dirty,still,dirty,"No matter , New York is still dirty enough to feel out of control .",nyt_eng_19950409_0109_8,7
nyt_eng_19950412_0506_35:19,always_willing,always,willing,"So universal is the Hobie Cat community , that , no matter what the circumstance , everyone is always willing to assist .",nyt_eng_19950412_0506_35,19
nyt_eng_19950418_0147_25:8,as_tyrannical,as,tyrannical,No agency of the federal government is as tyrannical and arbitrary as the Internal Revenue Service .,nyt_eng_19950418_0147_25,8
nyt_eng_19950422_0153_9:32,totally_foolproof,totally,foolproof,"And as another expert , John T. Horn of Kroll Associates , a private security firm based in New York City , said in an interview  -COL-   -LBQ-  No system is totally foolproof .",nyt_eng_19950422_0153_9,32
nyt_eng_19950422_0182_15:13,as_aggressive,as,aggressive,"But as the St. Mellons case suggests , no nation has been as aggressive in employing genetic  -LBQ-  fingerprinting  -RDQ-  as Britain .",nyt_eng_19950422_0182_15,13
nyt_eng_19950428_0222_3:12,so_significant,so,significant,"We should have known that no event or situation could be so significant , so devastating , so overwhelmingly tragic that it would be off-limits to the relentless manipulation of politicians .",nyt_eng_19950428_0222_3,12
nyt_eng_19950504_0419_1:18,deeply_unsettled,deeply,unsettled,"In a France that approaches Sunday 's presidential runoff in political turmoil , no place is more deeply unsettled than Alsace , the prosperous region on the Rhine that likes to call itself  -LBQ-  the capital of 21st century Europe .  -RDQ-",nyt_eng_19950504_0419_1,18
nyt_eng_19950509_0118_18:11,as_fulfilling,as,fulfilling,I discovered that no story I might write could be as fulfilling as watching my babies learn to roll over or sit up or chew their tiny toes .,nyt_eng_19950509_0118_18,11
nyt_eng_19950509_0135_2:5,as_fascinating,as,fascinating,No outer-space adventure is as fascinating as the spatial dramas that take place right here on earth .,nyt_eng_19950509_0135_2,5
nyt_eng_19950509_0172_7:6,easily_discernible,easily,discernible,No spark of personality was easily discernible .,nyt_eng_19950509_0172_7,6
nyt_eng_19950511_0047_39:4,too_bizarre,too,bizarre,No conspiracy is too bizarre to have credence .,nyt_eng_19950511_0047_39,4
