hit_id,colloc,adv,adj,sent_text,sent_id,adv_index
nyt_eng_19970410_0190_4:23,as_popular,as,popular,"Of all stories familiar to American culture , no single tale outlining our obligation to protect and cherish the Earth has been as popular as the creation accounts of the Book of Genesis , the first book of scripture for Jews and Christians .",nyt_eng_19970410_0190_4,23
nyt_eng_19970414_0761_12:36,yet_visible,yet,visible,"Klein said any PSA level above zero in a man who has had his prostate completely removed is a signal the cancer has spread to bones or other organs , even if no tumor is yet visible by any other test .",nyt_eng_19970414_0761_12,36
nyt_eng_19970418_0256_26:8,as_good,as,good,No other industry in the world is as good at masking evil as the tobacco industry .,nyt_eng_19970418_0256_26,8
nyt_eng_19970418_0685_5:5,yet_available,yet,available,No exact figures are yet available .,nyt_eng_19970418_0685_5,5
nyt_eng_19970419_0040_55:12,so_grumpy,so,grumpy,How do people live like that ? No wonder Easterners are so grumpy .,nyt_eng_19970419_0040_55,12
nyt_eng_19970422_0851_5:7,completely_airtight,completely,airtight,"No arms control treaty can be completely airtight , but this agreement would sharply reduce the risks faced by U.S. troops in battle and by U.S. civilians vulnerable to terrorist attack .",nyt_eng_19970422_0851_5,7
nyt_eng_19970422_0853_10:5,too_menial,too,menial,-LBQ-  No task is too menial if you learn from it and grow .  -RDQ-,nyt_eng_19970422_0853_10,5
nyt_eng_19970426_0169_12:14,as_obsessed,as,obsessed,"-LBQ-  Thanks to the Puritans , no other civilization in history has been as obsessed with the idea of radical newness as America 's ,  -RDQ-  Hughes writes .",nyt_eng_19970426_0169_12,14
nyt_eng_19970428_0218_25:7,too_great,too,great,"They believed that no accomplishment was too great for American nature , and they considered it their mission to make history from the fruit of that nature _ American wine from grapes grown in American vineyards .",nyt_eng_19970428_0218_25,7
nyt_eng_19970505_0205_12:43,that_clear,that,clear,"Naively , one would assume that the officers at the top of the chain of command would issue the order to train the recruits into becoming well-honed killing machines and leave it at that _ no hanky-panky , no way , is that clear ! ?",nyt_eng_19970505_0205_12,43
nyt_eng_19970505_0495_32:13,ever_fast,ever,fast,"When working with digital images , it seems , no computer is ever fast or capacious enough .",nyt_eng_19970505_0495_32,13
nyt_eng_19970506_0386_15:11,potently_democratic,potently,democratic,No form of  -LBQ-  interactivity  -RDQ-  yet devised is more potently democratic .,nyt_eng_19970506_0386_15,11
nyt_eng_19970506_0516_48:4,too_minute,too,minute,"No detail was too minute for Besson , who said in the interview that he began at age 16 to imagine the world created in the film .",nyt_eng_19970506_0516_48,4
nyt_eng_19970510_0158_30:11,immediately_available,immediately,available,"No details of the arrest of the second suspect were immediately available , though Collins said it had occurred on a street in the same neighborhood at about the same time and also involved an armed man .",nyt_eng_19970510_0158_30,11
nyt_eng_19970513_0243_49:13,as_festive,as,festive,No city in North America _ maybe even the world _ is as festive in summer as Montreal .,nyt_eng_19970513_0243_49,13
nyt_eng_19970514_0328_7:14,acutely_sensitive,acutely,sensitive,"In the century-old battle between Jews and Arabs , no issue is as acutely sensitive as that of land .",nyt_eng_19970514_0328_7,14
nyt_eng_19970516_0540_9:5,immediately_available,immediately,available,No company executives were immediately available for comment .,nyt_eng_19970516_0540_9,5
nyt_eng_19970519_0354_48:6,as_intense,as,intense,-LBQ-  No other industry is as intense in its pressure .  -RDQ-,nyt_eng_19970519_0354_48,6
nyt_eng_19970519_0598_16:4,too_dramatic,too,dramatic,"No subject was too dramatic _ whether it be marital problems or child-rearing issues of unwed mothers _ for this show to look at , dissect and create a laugh , not a groan .",nyt_eng_19970519_0598_16,4
nyt_eng_19970521_0062_5:4,currently_available,currently,available,"No slots are currently available at La Guardia , making a DOT exemption necessary for ValuJet to add the route .",nyt_eng_19970521_0062_5,4
nyt_eng_19970522_0606_27:5,too_small,too,small,"-LBQ-  No loan is too small for us , and we do n't use the third-party lenders that bigger banks often do ,  -RDQ-  Ms. Bolden said .",nyt_eng_19970522_0606_27,5
nyt_eng_19970525_0001_8:9,too_great,too,great,"For Gallagher 's mother , no cost is too great .",nyt_eng_19970525_0001_8,9
nyt_eng_19970527_0280_49:9,so_hard,so,hard,No 200 wins ? His life should be so hard .,nyt_eng_19970527_0280_49,9
nyt_eng_19970529_0327_2:21,virtually_impossible,virtually,impossible,"And no wonder _ while its visual panache might seem perfect for film , the book 's episodic nature is virtually impossible to translate .",nyt_eng_19970529_0327_2,21
nyt_eng_19970611_0811_1:32,so_great,so,great,"For much of his 14 years in office as Europe 's longest-serving leader and most enduring political colossus , Germany 's Chancellor Helmut Kohl has behaved as if no crisis is so great that it can not be postponed a day or two while tempers cool and back-room deals are brokered .",nyt_eng_19970611_0811_1,32
nyt_eng_19970611_0913_20:5,ever_perfect,ever,perfect,"-LBQ-  No course is ever perfect ,  -RDQ-  said Rees Jones .",nyt_eng_19970611_0913_20,5
nyt_eng_19970616_0626_13:10,as_generous,as,generous,"But no other state , she said , is as generous in its medical payments for single adults , particularly those with drug and alcohol problems , and so has not needed to develop such a program for treating addicts .",nyt_eng_19970616_0626_13,10
nyt_eng_19970620_0731_57:8,so_useful,so,useful,"No paper at the conference was quite so useful as Stephen Sass 's newly published book ,  -LBQ-  The Promise of Private Pensions  -COL-  The First Hundred Years .  -RDQ-",nyt_eng_19970620_0731_57,8
nyt_eng_19970623_0450_53:13,as_vital,as,vital,"From drinking to bathing to irrigating crops , no organic element is as vital to human existence as the clear , tasteless fluid .",nyt_eng_19970623_0450_53,13
nyt_eng_19970624_0361_25:11,completely_safe,completely,safe,"Still , Dziedzic said , no GM production jobs are completely safe .",nyt_eng_19970624_0361_25,11
nyt_eng_19970624_0562_40:5,fully_effective,fully,effective,No one drug is fully effective and the organism readily develops resistance to antibiotics .,nyt_eng_19970624_0562_40,5
nyt_eng_19970624_0690_8:10,as_skilled,as,skilled,"Perhaps no composer between those two M 's was as skilled at intertwining voices , meanings and emotions in operatic ensembles and duets , though Monteverdi , in  -LBQ-  Orpheus ,  -RDQ-  was at the beginning of his operatic development , and Mozart , in  -LBQ-  Cosi ,  -RDQ-  at the summit .",nyt_eng_19970624_0690_8,10
nyt_eng_19970627_0061_38:7,notoriously_tough,notoriously,tough,No longer Rook  -COL-  Fitch is notoriously tough on rookies and Clippers second-year forward Lorenzen Wright appeared at the press conference to meet his new teammate and enshrine him with the season-long title of ` Rook . ',nyt_eng_19970627_0061_38,7
nyt_eng_19970627_0730_30:22,as_fair,as,fair,"-LBQ-  No other group , not even the Supreme Court of the United States ,  -RDQ-  he boomed ,  -LBQ-  is as fair and as wise as the great boxing officials of the great state of Nevada .",nyt_eng_19970627_0730_30,22
nyt_eng_19970702_0246_13:5,as_effective,as,effective,No other company is as effective at relieving population pressure .,nyt_eng_19970702_0246_13,5
nyt_eng_19970717_0689_9:55,as_aggravating,as,aggravating,"On a course noted for lengthy , contentious par 4s , particularly when the wind is in your face _  -LBQ-  There were about six par 5s on the back nine ,  -RDQ-  said Jack Nicklaus after Thursday 's opening round of the 126th British Open _ no hole at Royal Troon can be as aggravating as No. 8 , the 126-yard par 3 known as  -LBQ-  The Postage Stamp .  -RDQ-",nyt_eng_19970717_0689_9,55
nyt_eng_19970719_0046_25:15,so_widespread,so,widespread,"No matter what the cause , concern over the crash of Flight 800 is so widespread a year later that news organizations are conducting polls of the kind usually used in the New Hampshire primary .",nyt_eng_19970719_0046_25,15
nyt_eng_19970719_0137_6:9,too_outlandish,too,outlandish,"For some of them , no claim is too outlandish in defense of their cause  -COL-  proving that tax cuts are the elixir for extraordinary economic growth .",nyt_eng_19970719_0137_6,9
nyt_eng_19970724_0083_6:5,immediately_available,immediately,available,No further details were immediately available .,nyt_eng_19970724_0083_6,5
nyt_eng_19970727_0178_20:12,too_purple,too,purple,"He lamented a climate in which  -LBQ-  no epithet has been too purple , no metaphor too exaggerated .  -RDQ-",nyt_eng_19970727_0178_20,12
nyt_eng_19970728_0386_21:7,too_big,too,big,"-LBQ-  They think no lead is too big ,  -RDQ-  said Collins , who came to Anaheim after being fired from the Houston Astros managing job after last season .",nyt_eng_19970728_0386_21,7
nyt_eng_19970729_0179_13:4,as_strict,as,strict,"No state is as strict as New Jersey , which has a mandatory program that closes the beaches whenever a bacterial standard is exceeded .",nyt_eng_19970729_0179_13,4
nyt_eng_19970730_0054_5:9,immediately_available,immediately,available,No comparative figures for the year-ago period were immediately available .,nyt_eng_19970730_0054_5,9
nyt_eng_19970731_0421_18:8,reassuringly_familiar,reassuringly,familiar,No group of characters could be more reassuringly familiar .,nyt_eng_19970731_0421_18,8
nyt_eng_19970804_0119_20:17,as_nuanced,as,nuanced,"No painting , of course _ even the originals on display there _ can ever be as nuanced and full as the thing painted .",nyt_eng_19970804_0119_20,17
nyt_eng_19970806_0299_4:5,immediately_available,immediately,available,No further details were immediately available .,nyt_eng_19970806_0299_4,5
nyt_eng_19970809_0043_2:4,immediately_available,immediately,available,"No details were immediately available of the agreement , which removes for the time being the threat of a strike at the plant , AP said .",nyt_eng_19970809_0043_2,4
nyt_eng_19970809_0137_24:11,completely_secret,completely,secret,"No location , especially in small towns , is ever completely secret _ one Florida shelter received a bomb threat from a husband who said he knew its location because he had lived there as a child with his abused mother _ but some shelters move as soon as the staff thinks too many people know where it is .",nyt_eng_19970809_0137_24,11
nyt_eng_19970812_0740_4:6,immediately_available,immediately,available,No cause of death was immediately available .,nyt_eng_19970812_0740_4,6
nyt_eng_19970816_0187_24:4,ultimately_realistic,ultimately,realistic,No art is ultimately realistic .,nyt_eng_19970816_0187_24,4
nyt_eng_19970819_0511_23:31,very_comfortable,very,comfortable,"-LBQ-  I do n't care how liberal your parents are , or how many drugs they may have done as hippies ,  -RDQ-  Minnie said ,  -LBQ-  no kids are very comfortable talking with their parents about drugs .  -RDQ-",nyt_eng_19970819_0511_23,31
nyt_eng_19970821_0592_5:5,immediately_available,immediately,available,No other details were immediately available .,nyt_eng_19970821_0592_5,5
nyt_eng_19970821_0721_8:5,as_strict,as,strict,No other industry is as strict as we are .  -RDQ-,nyt_eng_19970821_0721_8,5
nyt_eng_19970823_0060_6:29,immediately_available,immediately,available,"An Iranian women 's group extended the invitation to the Americans , who include at least five well-known academics active in public life , though no names were immediately available , the report said , without citing sources .",nyt_eng_19970823_0060_6,29
nyt_eng_19970826_0045_25:6,too_important,too,important,No obligation or commitment is too important .,nyt_eng_19970826_0045_25,6
nyt_eng_19970827_0435_2:7,too_small,too,small,"Walter demonstrated that no expense is too small for scrutiny a few months ago when he bought a pack of breath mints at a New York hotel gift shop , accompanied by Oppenheimer &amp; Co. analyst Michael Krensavage .",nyt_eng_19970827_0435_2,7
nyt_eng_19970828_0256_44:6,plain_average,plain,average,No season has ever been plain average .,nyt_eng_19970828_0256_44,6
nyt_eng_19970830_0155_45:12,too_scared,too,scared,"And no matter how illogical , many conservative investors are simply too scared to invest at all without the insurance features offered by variable annuities .",nyt_eng_19970830_0155_45,12
nyt_eng_19970902_0280_18:16,clearly_superior,clearly,superior,"The flat revolution is taking many forms , and so far no one system is clearly superior for all applications .",nyt_eng_19970902_0280_18,16
nyt_eng_19970902_0576_4:21,as_unreal,as,unreal,"-LBQ-  Unreal city ,  -RDQ-  wrote T.S. Eliot of yellow-fogged London , but no city in modern times was ever as unreal as this one .",nyt_eng_19970902_0576_4,21
nyt_eng_19970903_0511_26:12,as_self-confident,as,self-confident,"By the beginning of the 20th century , no nation was as self-confident as America or as arrogant , and the hubris was only reinforced by the rise at this very time of a new professional managerial class that devoutly believed in science , rationality and expertise , concepts through which it sought to perfect the world .",nyt_eng_19970903_0511_26,12
nyt_eng_19970903_0540_30:5,so_big,so,big,"But no statement is so big that it can not be effectively retracted a page later  -COL-   -LBQ-  In conductor-producer teams , it is often difficult to determine which is the more creative influence .  -RDQ-",nyt_eng_19970903_0540_30,5
nyt_eng_19970903_0821_22:31,as_complicated,as,complicated,"No relationship of Diana 's _ not the one with her divorced husband , not the one with Buckingham Palace , not the one with her dead suitor _ was as complicated as the relationship between Diana and the British press .",nyt_eng_19970903_0821_22,31
nyt_eng_19970904_0363_15:33,too_grisly,too,grisly,"And Zane knows just the person for the job , a rotund thug and neighborhood drug dealer known as JoJo the Junkie -LRB- Macky Aquilino -RRB- , for whom no task is too grisly , provided the price is right .",nyt_eng_19970904_0363_15,33
nyt_eng_19970910_0728_20:4,too_small,too,small,No job was too small for him .,nyt_eng_19970910_0728_20,4
nyt_eng_19970912_0022_25:4,ever_secure,ever,secure,"No manager is ever secure under owner George Steinbrenner , who has made 20 managerial changes in 24 years , and the Yankees appear in trouble as the playoffs approach .",nyt_eng_19970912_0022_25,4
nyt_eng_19970913_0068_39:17,too_far-reaching,too,far-reaching,"And , in what has at times felt like mass hysteria , no suggestion has been too far-reaching .",nyt_eng_19970913_0068_39,17
nyt_eng_19970913_0123_34:24,too_small,too,small,A  -COL-  The process of job-hunting is so scary and stressful that no question _ even one about periods and spaces _ is too small to consider .,nyt_eng_19970913_0123_34,24
nyt_eng_19970913_0200_28:9,as_ferocious,as,ferocious,The Jets figure that no defense could be as ferocious as the Bills ' last week .,nyt_eng_19970913_0200_28,9
nyt_eng_19970917_0010_11:13,too_small,too,small,"The battle is waged in the minds , and no edge is too small .",nyt_eng_19970917_0010_11,13
nyt_eng_19970917_0297_5:4,too_strong,too,strong,No words are too strong _ nor any action too outrageous _ for British Columbia 's feisty Premier Glen Clark .,nyt_eng_19970917_0297_5,4
nyt_eng_19970917_0324_2:4,too_strong,too,strong,No words are too strong _ nor any action too outrageous _ for British Columbia 's feisty Premier Glen Clark .,nyt_eng_19970917_0324_2,4
nyt_eng_19970918_0201_26:8,brilliantly_golden,brilliantly,golden,"No pilsner in the world is so brilliantly golden , so aromatic or characterful as the original from the Czech city of Pulsion .",nyt_eng_19970918_0201_26,8
nyt_eng_19970918_0578_3:5,immediately_available,immediately,available,No other details were immediately available .,nyt_eng_19970918_0578_3,5
nyt_eng_19970922_0199_19:5,as_willing,as,willing,No tobacco executive is as willing as Broughton to discuss differences within the industry .,nyt_eng_19970922_0199_19,5
nyt_eng_19970924_0381_10:8,as_dynamic,as,dynamic,"No area of the economy has been as dynamic this decade as exports , which more than doubled between 1992 and 1996 .",nyt_eng_19970924_0381_10,8
nyt_eng_19970930_0625_18:9,so_photogenic,so,photogenic,"But no matter  -COL-  the young women are so photogenic , and the environment is such an easy target .",nyt_eng_19970930_0625_18,9
nyt_eng_19971006_0838_36:5,as_big,as,big,"No October game is as big as the hype this one got , but now only one team can claim to be undefeated , while last night 's losers will hope for a rematch in January .",nyt_eng_19971006_0838_36,5
nyt_eng_19971008_0756_26:4,yet_available,yet,available,"No ratings are yet available for the Woodward trial , according to Lynn Rosenstrach , Court TV 's vice president for media relations .",nyt_eng_19971008_0756_26,4
nyt_eng_19971009_0765_22:4,yet_available,yet,available,No figures are yet available for media buys on cable TV and Eastern Washington stations .,nyt_eng_19971009_0765_22,4
nyt_eng_19971016_0038_23:41,as_abused,as,abused,"While the fate of any one player , particularly one who will be 35 , is n't sufficient reason to alter a strategy , Selig overlooked a more fundamental point  -COL-  No fans of any big-time American sport have been as abused as baseball 's .",nyt_eng_19971016_0038_23,41
nyt_eng_19971016_0227_31:7,widely_popular,widely,popular,"No matter , the idea is widely popular and seems fair .",nyt_eng_19971016_0227_31,7
nyt_eng_19971020_0322_45:8,so_developed,so,developed,No other country in Latin America is so developed .  -RDQ-,nyt_eng_19971020_0322_45,8
nyt_eng_19971021_0822_21:7,as_star-crossed,as,star-crossed,"Probably no television teen-ager has been as star-crossed in his sexual exploration as Xander , Buffy 's male pal .",nyt_eng_19971021_0822_21,7
nyt_eng_19971022_0022_4:4,as_well-known,as,well-known,No name is as well-known in northern Ohio as his .,nyt_eng_19971022_0022_4,4
nyt_eng_19971023_0875_1:16,as_compelling,as,compelling,Here 's what 's really wrong with baseball  -COL-  No World Series game had been as compelling as the taut and pungent rage expressed by Jim Leyland before Thursday night 's game between his Florida team and Cleveland .,nyt_eng_19971023_0875_1,16
nyt_eng_19971024_0043_1:18,as_compelling,as,compelling,"Here 's what 's really wrong with baseball  -COL-  No game in this World Series has been as compelling as the taut and pungent rage expressed by Jim Leyland before Thursday night 's latest marathon , an 8-7 victory by his Florida team over Cleveland .",nyt_eng_19971024_0043_1,18
nyt_eng_19971028_0011_3:12,economically_powerful,economically,powerful,"-LBQ-  It 's a global downward spiral and no government is economically powerful enough to stop it ,  -RDQ-  said Shinji Ide , general manager at Yamaichi Investment Trust Management Co. which handles 4.73 trillion yen -LRB- $ 38 billion -RRB- in securities .",nyt_eng_19971028_0011_3,12
nyt_eng_19971028_0033_3:12,economically_powerful,economically,powerful,"-LBQ-  It 's a global downward spiral and no government is economically powerful enough to stop it ,  -RDQ-  said Shinji Ide , general manager at Yamaichi Investment Trust Management Co. , which handles 4.73 trillion yen -LRB- $ 38 billion -RRB- in securities .",nyt_eng_19971028_0033_3,12
nyt_eng_19971028_0060_3:12,economically_powerful,economically,powerful,"-LBQ-  It 's a global downward spiral and no government is economically powerful enough to stop it ,  -RDQ-  said Shinji Ide , general manager at Yamaichi Investment Trust Management Co. , which handles 4.73 trillion yen -LRB- $ 38 billion -RRB- in securities .",nyt_eng_19971028_0060_3,12
nyt_eng_19971029_0031_57:12,too_great,too,great,"But they have inherited a legacy , and no expectation is too great .",nyt_eng_19971029_0031_57,12
nyt_eng_19971029_0325_17:5,even_close,even,close,No other senator is even close to producing comprehensive tobacco legislation .,nyt_eng_19971029_0325_17,5
nyt_eng_19971029_0783_5:26,so_cooperative,so,cooperative,"In fact , Breuer told the Senate Governmental Affairs Committee , no other entity  -LBQ-  in the history of this Republic  -RDQ-  has ever been so cooperative with investigators .",nyt_eng_19971029_0783_5,26
nyt_eng_19971031_0549_40:33,completely_normal,completely,normal,"-LBQ-  Human rights is key to the American value system ,  -RDQ-  Secretary of State Madeleine Albright said during Jiang 's visit ,  -LBQ-  and no relationship with any country can be completely normal until that is worked out .  -RDQ-",nyt_eng_19971031_0549_40,33
nyt_eng_19971104_0265_12:11,as_short,as,short,"-LBQ-  No equipment cycle that we can remember has been as short ,  -RDQ-  he said .",nyt_eng_19971104_0265_12,11
nyt_eng_19971106_0565_43:31,completely_safe,completely,safe,"The Bosnians , despite their modest numbers , carry a profound message  -COL-  If genocide can erupt in a seemingly contemporary Western country such as Yugoslavia , no society is completely safe .",nyt_eng_19971106_0565_43,31
nyt_eng_19971110_0556_8:22,too_far-fetched,too,far-fetched,"This legal sideshow , in fact , may reflect a desperate feeling within the investigative team that no gambit now is too far-fetched to avoid admitting the probe is coming up empty-handed .",nyt_eng_19971110_0556_8,22
nyt_eng_19971115_0229_24:10,as_successful,as,successful,"Perhaps no player on the PGA Tour has been as successful with such a casual approach to the game as Lietzke , who has earned $ 5.8 million and won 13 times over his 23-year professional career despite playing and practicing far less than his money-winning peers .",nyt_eng_19971115_0229_24,10
nyt_eng_19971117_0042_16:10,as_successful,as,successful,"Perhaps no player on the PGA Tour has been as successful with such a casual approach to the game as Lietzke , who has earned $ 5.8 million and won 13 times over his 23-year professional career despite playing and practicing far less than his money-winning peers .",nyt_eng_19971117_0042_16,10
nyt_eng_19971117_0057_2:4,too_small,too,small,"No win is too small , or ever close to being underappreciated .",nyt_eng_19971117_0057_2,4
nyt_eng_19971117_0725_12:4,too_great,too,great,"No bombast is too great for Ms. Dion ; she may hold back for a verse or two , breathy and hesitant , but by the time the chorus arrives , she rises to steely swoops and grand sobs .",nyt_eng_19971117_0725_12,4
nyt_eng_19971118_0346_68:24,too_large,too,large,"He helps each piece find its own , one that feels right , and no matter if the figurative pieces are all far too large for the chairs or houses .",nyt_eng_19971118_0346_68,24
nyt_eng_19971119_0054_15:5,too_restrictive,too,restrictive,"No law can be too restrictive and no cost too high if only one life can be saved , say our smart guardians .",nyt_eng_19971119_0054_15,5
nyt_eng_19971119_0054_22:5,too_high,too,high,But no cost is too high when it comes to safety regulations .,nyt_eng_19971119_0054_22,5
nyt_eng_19971119_0075_25:9,bit_unsettling,bit,unsettling,"No wonder , then , it was a bit unsettling to learn that the Indians left him unprotected .",nyt_eng_19971119_0075_25,9
nyt_eng_19971122_0153_30:9,too_small,too,small,"From Gasoline to Vests , No Detail Is Too Small",nyt_eng_19971122_0153_30,9
nyt_eng_19971124_0249_17:20,yet_available,yet,available,"The drug will be available sometime in 1998 after the DEA certifies it , and no pricing information is yet available , Knoll officials said .",nyt_eng_19971124_0249_17,20
nyt_eng_19971124_0888_11:19,immediately_available,immediately,available,"The Mexican government was debating whether to make a statement about the cancellation , though no comment was immediately available about the bilateral skirmish , said Esmeralda Reyna , a Mexican spokeswoman .",nyt_eng_19971124_0888_11,19
nyt_eng_19971125_0528_6:4,too_great,too,great,No sacrifice is too great .,nyt_eng_19971125_0528_6,4
nyt_eng_19971126_0441_20:26,sufficiently_strong,sufficiently,strong,"-LBQ-  In America ,  -RDQ-  writes Brooks ,  -LBQ-  with its deeply imprinted business ethic , no inherent stabilizer , moral or practical , is sufficiently strong in and of itself to support the turning away of new business when competitors are taking it in .",nyt_eng_19971126_0441_20,26
nyt_eng_19971128_0227_15:15,immediately_available,immediately,available,A UPS representative at the company 's Atlanta headquarters said no company official was immediately available to comment on the lawsuit .,nyt_eng_19971128_0227_15,15
nyt_eng_19971201_0537_18:4,too_daunting,too,daunting,"No rigor was too daunting for me , no brunch too fattening , no sauna too hot , no massage too relaxing .",nyt_eng_19971201_0537_18,4
nyt_eng_19971202_0045_29:5,as_explosive,as,explosive,Perhaps no issue is as explosive as the role of developing nations .,nyt_eng_19971202_0045_29,5
nyt_eng_19971203_0091_8:13,too_big,too,big,"The lower ratings also reflect a growing sense that no company is too big to escape trouble after the collapse last month of Yamaichi Securities Co. , the nation 's fourth-largest securities house , Sanyo Securities Co. , one of the 10 largest brokerages , and Hokkaido Takushoku Bank Ltd. , a nationwide lender .",nyt_eng_19971203_0091_8,13
nyt_eng_19971204_0529_37:6,too_great,too,great,No challenge in M&amp;A is too great .,nyt_eng_19971204_0529_37,6
nyt_eng_19971209_0461_4:5,immediately_available,immediately,available,No further information was immediately available .,nyt_eng_19971209_0461_4,5
