hit_id,adv_form_lower,adj_form_lower,bigram_lower,neg_form_lower,all_forms_lower,text_window,token_str
pcc_eng_25_083.0387_x1327858_16:14-15-16,terribly,special,terribly_special,n't,n't_terribly_special,"example , the bush boys are n't terribly special in their mixture of sects of","Though they act as a high- profile example , the Bush boys are n't terribly special in their mixture of sects of Christianity ."
pcc_eng_19_071.8832_x1144882_37:5-6-7,terribly,special,terribly_special,not,not_terribly_special,"the special effects are not terribly special , though les bowie - hammer","The special effects are not terribly special , though Les Bowie - Hammer 's top effects man for many years - performed miracles on the tiny budget , but Wordsworth 's shambling pathetic performance is memorable , and the film put the studio back on its feet and encouraged it to follow -on with many more man-into-monster movies , including the direct sequels Quatermass II ( 1957 ) and Quatermass And The Pit ( 1967 ) ."
pcc_eng_22_004.2037_x0051958_047:7-8-9,terribly,special,terribly_special,not,not_terribly_special,the chunky sauce was good but not terribly special .,The chunky sauce was good but not terribly special .
pcc_eng_11_064.8935_x1034009_12:15-16-17,terribly,special,terribly_special,nothing,nothing_terribly_special,"'s real , but there 's nothing terribly special or spectacular about it , """,""" It 's a full moon and it 's real , but there 's nothing terribly special or spectacular about it , "" he said ."
apw_eng_20081121_0065_2:12-13-14,terribly,special,terribly_special,nothing,nothing_terribly_special,"to please but , sadly , nothing terribly special : girl finds dog , girl","it 's sweet and eager to please but , sadly , nothing terribly special : Girl finds dog , girl loses dog , girl gets dog back ."
pcc_eng_20_002.3380_x0021445_17:1-2-3,terribly,special,terribly_special,nothing,nothing_terribly_special,"nothing terribly special about this , but it 's","Nothing terribly special about this , but it 's good to know attachments are an option ."
pcc_eng_16_030.6716_x0480223_22:08-09-10,terribly,special,terribly_special,nothing,nothing_terribly_special,"thought this soup was ok , nothing terribly special .","I thought this soup was ok , nothing terribly special ."
