hit_id,adv_form_lower,adj_form_lower,bigram_lower,neg_form_lower,all_forms_lower,text_window,token_str
pcc_eng_21_097.6955_x1562139_021:25-26-27,terribly,surprising,terribly_surprising,not,not_terribly_surprising,"psych , "" perhaps it 's not terribly surprising ( we submit our observation based","Of course , on the other hand , when you consider the utter amusement offered up by "" Psych , "" perhaps it 's not terribly surprising ( we submit our observation based on the fact that "" West Wing "" ran seven seasons and this is the eighth for "" Psych , "" not an episode count ) ."
pcc_eng_04_101.8388_x1629079_31:17-18-19,terribly,surprising,terribly_surprising,not,not_terribly_surprising,of the pic's weekend gross -- not terribly surprising considering the 100- year- old history,"Over - 25 auds , however , represented 59 % of the pic's weekend gross -- not terribly surprising considering the 100- year- old history of Edgar Rice Burroughs ' original John Carter character ."
pcc_eng_24_027.7324_x0432291_12:1-2-3,terribly,surprising,terribly_surprising,not,not_terribly_surprising,not terribly surprising about the lack of a woman,Not terribly surprising about the lack of a woman .
pcc_eng_21_067.9778_x1082388_19:5-6-7,terribly,surprising,terribly_surprising,not,not_terribly_surprising,i suppose it 's not terribly surprising that a geek who loves to,I suppose it 's not terribly surprising that a geek who loves to travel also has a fondness for maps .
pcc_eng_15_093.4870_x1495009_11:5-6-7,terribly,surprising,terribly_surprising,not,not_terribly_surprising,"however , that 's not terribly surprising since it was our third most","However , that 's not terribly surprising since it was our third most trendy puppy name last year , which we suspect has something to do withthe popularity of the Luna Lovegood character in the Harry Potterbooks and movies ."
pcc_eng_03_084.6071_x1353877_008:10-11-12,terribly,surprising,terribly_surprising,not,not_terribly_surprising,it 's it 's it 's not terribly surprising you know election we have a,You know if it 's it 's it 's not terribly surprising you know election we have a fiscal session that we .
nyt_eng_20000404_0301_20:27-28-29,terribly,surprising,terribly_surprising,not,not_terribly_surprising,said that the volatility is ` not terribly surprising . '',"Michael Beindorff , president and chief operating officer of PlanetrX.com , an online pharmacy based in South San Francisco , said that the volatility is ` not terribly surprising . ''"
pcc_eng_07_051.7317_x0820210_063:12-13-14,terribly,surprising,terribly_surprising,not,not_terribly_surprising,"through camp , so it 's not terribly surprising that he did n't make the","Mijares has been struggling all through camp , so it 's not terribly surprising that he did n't make the team ."
pcc_eng_03_010.0131_x0145784_30:15-16-17,terribly,surprising,terribly_surprising,not,not_terribly_surprising,"while not precisely expected , is not terribly surprising .","But it 's also because this outcome , while not precisely expected , is not terribly surprising ."
pcc_eng_05_093.1749_x1491303_036:5-6-7,terribly,surprising,terribly_surprising,not,not_terribly_surprising,This win is actually not terribly surprising .,This win is actually not terribly surprising .
pcc_eng_24_023.3057_x0360515_20:3-5-6,terribly,surprising,terribly_surprising,not,not_terribly_surprising,this should not be terribly surprising as an immediate reaction .,This should not be terribly surprising as an immediate reaction .
pcc_eng_14_090.4201_x1445355_08:7-8-9,terribly,surprising,terribly_surprising,not,not_terribly_surprising,"five of these contain advanced but not terribly surprising content , but one chapter is","Five of these contain advanced but not terribly surprising content , but one chapter is an outlier ."
pcc_eng_15_092.9013_x1485391_15:3-4-5,terribly,surprising,terribly_surprising,not,not_terribly_surprising,though perhaps not terribly surprising from a department in which the,"Though perhaps not terribly surprising from a Department in which the chief , Commissioner Cherie Berry , has made cozying up to business her most visible priority ( and in a "" right - to - work "" state that is already unfriendly to labor in numerous ways ) , the response remains extremely disappointing - especially in light of the demonstrably inhumane conditions that so many farmworkers must endure ."
pcc_eng_14_038.5399_x0606448_04:3-4-5,terribly,surprising,terribly_surprising,not,not_terribly_surprising,it 's not terribly surprising that public reaction to the prospect,It 's not terribly surprising that public reaction to the prospect of an Arab nation with links to terrorists managing six major American harbors stimulated an overwhelmingly negative response from voters .
pcc_eng_14_038.5376_x0606409_59:6-7-8,terribly,surprising,terribly_surprising,not,not_terribly_surprising,"given this , it 's not terribly surprising that shooting guards and small forwards","Given this , it 's not terribly surprising that shooting guards and small forwards , of which there are 19 on the list , but only five in the top 30 , are punished by the metric ."
pcc_eng_20_089.2752_x1426192_19:3-4-5,terribly,surprising,terribly_surprising,not,not_terribly_surprising,"it 's not terribly surprising , then , that pinterest has","It 's not terribly surprising , then , that Pinterest has thrown its proverbial hat into the ring ."
pcc_eng_03_087.5339_x1401275_20:48-49-50,terribly,surprising,terribly_surprising,not,not_terribly_surprising,"of the electorate , which is not terribly surprising given what i 've been suggesting","In New Jersey , for example , the 18 - 29 age cohort voted for Corzine by a fairly decent majority of 57 % -- the only cohort to give him a majority ( granted that cohort only represented 9 % of the electorate , which is not terribly surprising given what I 've been suggesting the past two days ) ."
pcc_eng_00_062.0183_x0986441_01:3-4-5,terribly,surprising,terribly_surprising,not,not_terribly_surprising,"it was not terribly surprising that romney would , on the","It was not terribly surprising that Romney would , on the eve of the election , toss aside the antiabortion positions he cultivated during the Republican primaries ; lately , he has reversed himself more often than a parking - lot attendant ."
pcc_eng_15_009.4319_x0136213_06:6-7-8,terribly,surprising,terribly_surprising,not,not_terribly_surprising,that 's why it 's not terribly surprising that the new york post is,That 's why it 's not terribly surprising that the New York Post is reporting that ESPN baseball analyst Steve Phillips has been making some really bad calls in his personal life .
pcc_eng_08_107.7940_x1729076_04:3-4-5,terribly,surprising,terribly_surprising,not,not_terribly_surprising,"that 's not terribly surprising , but the limited scope of","That 's not terribly surprising , but the limited scope of the attack is ."
pcc_eng_13_087.8953_x1404395_071:10-11-12,terribly,surprising,terribly_surprising,not,not_terribly_surprising,"that counts as disappointing , if not terribly surprising , pittsburgh steelers reserve offensive tackle","In a move that counts as disappointing , if not terribly surprising , Pittsburgh Steelers reserve offensive tackle Ryan Harris has announced his retirement ."
pcc_eng_21_024.5587_x0380670_23:3-4-5,terribly,surprising,terribly_surprising,nothing,nothing_terribly_surprising,"Again , nothing terribly surprising here .","Again , nothing terribly surprising here ."
