hit_id,adv_form_lower,adj_form_lower,bigram_lower,neg_form_lower,all_forms_lower,text_window,token_str
pcc_eng_12_069.5595_x1107704_06:11-13-14,terribly,helpful,terribly_helpful,n't,n't_terribly_helpful,"today programme that it was n't "" terribly helpful at this stage to talk about","May told BBC Radio 4's Today programme that it was n't "" terribly helpful at this stage to talk about equal threats , or not "" ."
pcc_eng_07_058.8045_x0934306_22:14-16-17,terribly,helpful,terribly_helpful,n't,n't_terribly_helpful,bow ... but that would n't be terribly helpful in protection ... pretty sure that,I really want to learn to shoot a bow ... but that would n't be terribly helpful in protection ... pretty sure that just stemmed from my hunger games infatuation * cough *
pcc_eng_08_106.7603_x1712487_15:11-12-13,terribly,helpful,terribly_helpful,n't,n't_terribly_helpful,classification system of central bankers is n't terribly helpful in that world .,The old bird- based classification system of central bankers is n't terribly helpful in that world .
pcc_eng_02_080.0689_x1278508_39:08-09-10,terribly,helpful,terribly_helpful,n't,n't_terribly_helpful,called the hospital and they were n't terribly helpful in trying to figure out how,"I called the hospital and they were n't terribly helpful in trying to figure out how it got routed to me as it did , but instructed me to simply discard the message ."
pcc_eng_25_039.4205_x0621872_06:15-16-17,terribly,helpful,terribly_helpful,n't,n't_terribly_helpful,", red with meat ' is n't terribly helpful when you 're dealing with the","The old mantra of ' white with fish , red with meat ' is n't terribly helpful when you 're dealing with the more complex , layered flavours of Indian cuisine , and where the individual interpretation of a dish might bring different nuances of flavour from one region to another ."
pcc_eng_01_061.9219_x0985464_77:17-18-19,terribly,helpful,terribly_helpful,n't,n't_terribly_helpful,"and the joking descriptions above are n't terribly helpful ) , but i think it","I ca n't remember the three we did exactly ( and the joking descriptions above are n't terribly helpful ) , but I think it was something like blindfolded hopscotch , stacking soda cans into a tower , and a bizarre version of Twister ."
pcc_eng_09_035.1759_x0553339_25:28-29-30,terribly,helpful,terribly_helpful,n't,n't_terribly_helpful,the nyt on the matter is n't terribly helpful . [ nyt ],"So hopefully there 's more to this than Sony 's letting on , but Apple 's "" no comment "" to the NYT on the matter is n't terribly helpful . [ NYT ]"
pcc_eng_12_069.5459_x1107475_125:14-16-17,terribly,helpful,terribly_helpful,n't,n't_terribly_helpful,the wolves ' schedule has n't been terribly helpful ; minnesota finally gets to face,"It must be said , though , that the Wolves ' schedule has n't been terribly helpful ; Minnesota finally gets to face three sub -.500 teams this week after just one so far this month ( 14 - 15 Detroit ) ."
pcc_eng_05_036.8774_x0581017_18:19-21-22,terribly,helpful,terribly_helpful,n't,n't_terribly_helpful,england ) but he has n't been terribly helpful .,I have been in touch with the editor via email ( he's in England ) but he has n't been terribly helpful .
pcc_eng_15_009.3641_x0135157_16:5-6-7,terribly,helpful,terribly_helpful,n't,n't_terribly_helpful,i realize this is n't terribly helpful when you 're a homeschooling parent,I realize this is n't terribly helpful when you 're a homeschooling parent trying to figure out your own plan .
pcc_eng_15_049.8836_x0790365_12:6-7-8,terribly,helpful,terribly_helpful,n't,n't_terribly_helpful,the companies directly involved were n't terribly helpful .,The companies directly involved were n't terribly helpful .
pcc_eng_20_030.2223_x0472458_4:4-5-6,terribly,helpful,terribly_helpful,n't,n't_terribly_helpful,their websites are n't terribly helpful so i am hoping someone can,Their websites are n't terribly helpful so I am hoping someone can tell me which store is better .
pcc_eng_21_098.6827_x1578164_05:5-6-7,terribly,helpful,terribly_helpful,n't,n't_terribly_helpful,"phenomenal magical power is n't terribly helpful when wielded without restraint , or","Phenomenal magical power is n't terribly helpful when wielded without restraint , or at least that 's the lesson in the new trailer for The Wise Grandson ( known in Japan as Kenja no Mago ) , an upcoming TV anime based on the series of isekai fantasy light novels written by Tsuyoshi Yoshioka and illustrated by Seiji Kikuchi about a young man who is reborn in a new world with incredible sorcery skills but zero common sense ."
pcc_eng_00_074.6651_x1190931_9:10-11-12,terribly,helpful,terribly_helpful,n't,n't_terribly_helpful,", knowing the split percentages is n't terribly helpful .","Until that occurs , knowing the split percentages is n't terribly helpful ."
pcc_eng_09_038.5176_x0607150_49:10-11-12,terribly,helpful,terribly_helpful,n't,n't_terribly_helpful,rate or state of change is n't terribly helpful .,Quibbling about the rate or state of change is n't terribly helpful .
pcc_eng_22_089.8610_x1436299_036:07-09-10,terribly,helpful,terribly_helpful,neither,neither_terribly_helpful,"that , i felt that neither was terribly helpful in teaching me real world ,","Beyond that , I felt that neither was terribly helpful in teaching me real world , specific skills that I 'd actually use in the workplace ."
pcc_eng_03_039.5346_x0624268_080:11-13-14,terribly,helpful,terribly_helpful,neither,neither_terribly_helpful,think the problem is that neither are terribly helpful and that is why we have,"( Mr King ) I think the problem is that neither are terribly helpful and that is why we have the problem with the imbalances because what we have been able to do reasonably successfully is to maintain an overall balance in the economy , that is not a problem ."
pcc_eng_08_051.2484_x0813401_30:04-09-10,terribly,helpful,terribly_helpful,none,none_terribly_helpful,For some reason none of them are too terribly helpful .,For some reason none of them are too terribly helpful .
pcc_eng_10_021.4275_x0330005_81:04-10-11,terribly,helpful,terribly_helpful,none,none_terribly_helpful,"Of course , none of these recommendations will be terribly helpful for a pet in","Of course , none of these recommendations will be terribly helpful for a pet in the advanced stages of cognitive decline , which is why it 's so important to diagnose and begin treating the problem as early as possible ."
pcc_eng_01_104.4570_x1671906_16:11-12-13,terribly,helpful,terribly_helpful,not,not_terribly_helpful,"for parents , but it 's not terribly helpful .","Kik offers a guide for parents , but it 's not terribly helpful ."
pcc_eng_27_059.5539_x0946452_087:19-20-21,terribly,helpful,terribly_helpful,not,not_terribly_helpful,and the attributes you list are not terribly helpful .,"Essentially , I 'm not sure you have a clear definition , and the attributes you list are not terribly helpful ."
pcc_eng_04_073.1429_x1165190_08:24-26-27,terribly,helpful,terribly_helpful,not,not_terribly_helpful,danish - english dictionaries are not always terribly helpful to kierkegaard scholars .,"Even Danes complain that his Danish is so old fashioned it is hard to understand , so contemporary Danish - English dictionaries are not always terribly helpful to Kierkegaard scholars ."
pcc_eng_15_043.0611_x0680032_30:1-2-3,terribly,helpful,terribly_helpful,not,not_terribly_helpful,not terribly helpful from a certainty point of view,"Not terribly helpful from a certainty point of view , but sometimes a reality if the law is to respond appropriately to complex questions of shades and degrees ."
pcc_eng_13_038.8419_x0611864_165:26-27-28,terribly,helpful,terribly_helpful,not,not_terribly_helpful,"i have tried but rate as not terribly helpful , because i find manual shifting","Our "" Lounge "" model convertible comes with a six speed automatic gearbox with an optional manual shifter which I have tried but rate as not terribly helpful , because I find manual shifting without a clutch to be a little off putting ."
apw_eng_20020119_0113_23:20-22-23,terribly,helpful,terribly_helpful,not,not_terribly_helpful,"iran has in some cases not been terribly helpful , '' franks told reporters .","`` There has been a perception among several of the leaders inside Afghanistan that Iran has in some cases not been terribly helpful , '' Franks told reporters ."
pcc_eng_05_035.9254_x0565726_12:3-4-5,terribly,helpful,terribly_helpful,not,not_terribly_helpful,"Sorry , not terribly helpful .","Sorry , not terribly helpful ."
pcc_eng_23_081.1963_x1295826_05:27-29-30,terribly,helpful,terribly_helpful,not,not_terribly_helpful,"well - intentioned , may not be terribly helpful .","And when the two things are combined , then you 're bound to get all kinds of advice that , however well - intentioned , may not be terribly helpful ."
pcc_eng_16_087.6310_x1402209_05:22-23-24,terribly,helpful,terribly_helpful,not,not_terribly_helpful,"said the information could be "" not terribly helpful "" and "" a bit misleading","But Ros Altmann , an independent pensions expert and a former Downing Street adviser , said the information could be "" not terribly helpful "" and "" a bit misleading "" unless the figures are regularly revised over the course of someone 's retirement to take account of any life changes and backed up by detailed guidance ."
pcc_eng_03_001.0253_x0000424_24:32-33-34,terribly,helpful,terribly_helpful,not,not_terribly_helpful,"bordering on rude , after that not terribly helpful .","It has taken them several days to respond en route for every e-mail I 've sent after that their replies have invariably bot curt , bordering on rude , after that not terribly helpful ."
pcc_eng_14_008.0741_x0114194_10:21-22-23,terribly,helpful,terribly_helpful,not,not_terribly_helpful,speaks english and not german ( not terribly helpful for us ) and so we,We got to hear of a dentist in the nearby large town who actually speaks English and not German ( not terribly helpful for us ) and so we decided we really ought to go .
pcc_eng_19_056.8642_x0901604_013:3-4-5,terribly,helpful,terribly_helpful,not,not_terribly_helpful,this is not terribly helpful in the case of a long-lived,This is not terribly helpful in the case of a long-lived and long-reigning monarch .
pcc_eng_02_001.3940_x0006414_06:15-16-17,terribly,helpful,terribly_helpful,not,not_terribly_helpful,my description of free verse is not terribly helpful .,It has been brought to my attention that my description of free verse is not terribly helpful .
pcc_eng_22_057.9306_x0920274_24:26-27-28,terribly,helpful,terribly_helpful,not,not_terribly_helpful,"of provision is best are "" not terribly helpful "" .","But the report stops short of recommending any single route into teaching , adding that debates over which form of provision is best are "" not terribly helpful "" ."
pcc_eng_22_085.2335_x1361449_23:21-22-23,terribly,helpful,terribly_helpful,not,not_terribly_helpful,"stop behind the bus , but not terribly helpful in picking up an approaching vehicle","This view is more than adequate to perceive vehicles that have come to a stop behind the bus , but not terribly helpful in picking up an approaching vehicle perhaps a thousand feet behind it ( assuming that the road segment behind the bus was straight for 1000 feet ) - much less where part of this road segment was curved :"
pcc_eng_29_009.6519_x0139866_40:19-20-21,terribly,helpful,terribly_helpful,not,not_terribly_helpful,"historic "" , but they are not terribly helpful with details as to how historic","Websites , usually connected with the Sahara , describe it as "" historic "" , but they are not terribly helpful with details as to how historic ."
pcc_eng_13_082.2892_x1313958_053:11-12-13,terribly,helpful,terribly_helpful,not,not_terribly_helpful,"with a very nice , but not terribly helpful man who was unable to give","I called and spoke with a very nice , but not terribly helpful man who was unable to give me any information other than I should expect my letter in the beginning of June ."
pcc_eng_29_043.2978_x0683248_33:12-13-14,terribly,helpful,terribly_helpful,not,not_terribly_helpful,"'s a guarantee , it 's not terribly helpful .","However , and unless it 's a guarantee , it 's not terribly helpful ."
pcc_eng_03_039.8242_x0628978_18:26-27-28,terribly,helpful,terribly_helpful,not,not_terribly_helpful,"on national television , which was not terribly helpful to say the least .","DPM , the Senate sponsor , eventually declared that we had a welfare crisis not a health care crisis on national television , which was not terribly helpful to say the least ."
pcc_eng_13_084.9161_x1356528_08:08-09-10,terribly,helpful,terribly_helpful,not,not_terribly_helpful,"first piece of advice is probably not terribly helpful to most people , but it","This first piece of advice is probably not terribly helpful to most people , but it really helps if you 've looked at everything that you are trying to revise already during the year ."
pcc_eng_28_021.9696_x0338742_33:5-6-7,terribly,helpful,terribly_helpful,not,not_terribly_helpful,""" The notification was not terribly helpful .",""" The notification was not terribly helpful ."
pcc_eng_03_001.0253_x0000424_37:28-29-30,terribly,helpful,terribly_helpful,not,not_terribly_helpful,", bordering on rude , and not terribly helpful .","It has taken them several days to respond to all e-mail I 've sent and their replies have invariably been abrupt , bordering on rude , and not terribly helpful ."
pcc_eng_12_072.7363_x1158906_15:3-4-5,terribly,helpful,terribly_helpful,not,not_terribly_helpful,it 's not terribly helpful to simply report the high death,It 's not terribly helpful to simply report the high death toll without digging deeper .
pcc_eng_27_035.7729_x0561866_19:3-4-5,terribly,helpful,terribly_helpful,not,not_terribly_helpful,"It 's not terribly helpful . ""","It 's not terribly helpful . """
pcc_eng_18_008.1510_x0115754_19:1-2-3,terribly,helpful,terribly_helpful,not,not_terribly_helpful,Not terribly helpful in computer science,Not terribly helpful in computer science
pcc_eng_13_031.0721_x0486336_05:19-20-21,terribly,helpful,terribly_helpful,not,not_terribly_helpful,number of interviews as excessive and not terribly helpful for the matters at hand .,"In its most recent filing issued last week , Intel portrays this number of interviews as excessive and not terribly helpful for the matters at hand ."
pcc_eng_11_063.3390_x1008854_04:7-8-9,terribly,helpful,terribly_helpful,not,not_terribly_helpful,"the reasons are myriad , but not terribly helpful .","The reasons are myriad , but not terribly helpful ."
pcc_eng_26_093.7657_x1500147_238:12-13-14,terribly,helpful,terribly_helpful,not,not_terribly_helpful,", i think , positivism is not terribly helpful .","So far was wargaming goes , I think , positivism is not terribly helpful ."
nyt_eng_20070126_0172_19:20-21-22,terribly,helpful,terribly_helpful,not,not_terribly_helpful,and dad was not -lrb- and not terribly helpful if your parents are still living,but that rule needs to be stretched if you are fit and active and dad was not -LRB- and not terribly helpful if your parents are still living -RRB- .
pcc_eng_08_075.1040_x1199825_45:3-4-5,terribly,helpful,terribly_helpful,not,not_terribly_helpful,"that 's not terribly helpful though , if you 're dead","That 's not terribly helpful though , if you 're dead set on writing a story that is going to be told across synchronous platforms ."
pcc_eng_08_079.3035_x1267941_10:6-8-9,terribly,helpful,terribly_helpful,not,not_terribly_helpful,"again , this will probably not be terribly helpful to anyone who is looking to","Again , this will probably not be terribly helpful to anyone who is looking to do any serious music creation ."
pcc_eng_09_033.0731_x0519195_39:24-25-26,terribly,helpful,terribly_helpful,not,not_terribly_helpful,"my blog is labeled misc. :) not terribly helpful , huh ?","I 've tried to keep my tags to a minimum , but I think a third of my blog is labeled Misc. :) not terribly helpful , huh ?"
pcc_eng_27_035.1978_x0552558_06:11-12-13,terribly,helpful,terribly_helpful,not,not_terribly_helpful,the people at the stations are not terribly helpful .,You must ask as the people at the stations are not terribly helpful .
pcc_eng_11_010.1767_x0148557_47:42-43-44,terribly,helpful,terribly_helpful,not,not_terribly_helpful,"vice versa* ) , that is not terribly helpful , since i do n't even","If Jesus 's political views match the Republican Party of 2100 ( where some of the political stances are probably along the lines of ' why are you arguing about that ' to us and vice versa* ) , that is not terribly helpful , since I do n't even know what those people believe ."
pcc_eng_16_057.8415_x0920206_16:1-2-3,terribly,helpful,terribly_helpful,not,not_terribly_helpful,Not terribly helpful .,Not terribly helpful .
nyt_eng_20000321_0230_16:23-25-26,terribly,helpful,terribly_helpful,not,not_terribly_helpful,an extreme statement '' and not `` terribly helpful to trying to reach a consensus,"Rep. Henry Hyde of Illinois , chairman of the House Judiciary Committee , said `` it 's an extreme statement '' and not `` terribly helpful to trying to reach a consensus on a very difficult issue . ''"
pcc_eng_26_092.6028_x1481535_6:5-6-7,terribly,helpful,terribly_helpful,not,not_terribly_helpful,Sorry if that 's not terribly helpful .,Sorry if that 's not terribly helpful .
pcc_eng_02_004.9044_x0062981_27:5-6-7,terribly,helpful,terribly_helpful,not,not_terribly_helpful,"i think those are not terribly helpful , pigeon-holing someone as having this","I think those are not terribly helpful , pigeon-holing someone as having this philosophy or that philosophy , "" Gorsuch said during his confirmation hearing , according to an online transcript of the event ."
pcc_eng_25_080.1017_x1280572_1:3-4-5,terribly,helpful,terribly_helpful,not,not_terribly_helpful,it 's not terribly helpful to see the person or group,It 's not terribly helpful to see the person or group you 're talking to in crystal - clear video if you ca n't make out what they 're saying .
pcc_eng_15_015.2462_x0229919_052:15-16-17,terribly,helpful,terribly_helpful,not,not_terribly_helpful,is just whining and it 's not terribly helpful .,Complaining that is n't backed up by action is just whining and it 's not terribly helpful .
pcc_eng_05_008.4263_x0120564_086:6-7-8,terribly,helpful,terribly_helpful,not,not_terribly_helpful,needless to say he was not terribly helpful .,Needless to say he was not terribly helpful .
pcc_eng_01_044.9908_x0710700_10:13-14-15,terribly,helpful,terribly_helpful,not,not_terribly_helpful,want to cry but that 's not terribly helpful .,Looking at my spreadsheet makes me want to cry but that 's not terribly helpful .
pcc_eng_18_048.4269_x0767635_083:08-09-10,terribly,helpful,terribly_helpful,not,not_terribly_helpful,in - laws were local but not terribly helpful with raising the kids .,Her in - laws were local but not terribly helpful with raising the kids .
pcc_eng_09_099.7564_x1597840_104:6-7-8,terribly,helpful,terribly_helpful,not,not_terribly_helpful,"i know , it 's not terribly helpful of me , is it ?","I know , it 's not terribly helpful of me , is it ?"
