hit_id,adv_form_lower,adj_form_lower,bigram_lower,neg_form_lower,all_forms_lower,text_window,token_str
pcc_eng_14_002.3265_x0021569_05:08-10-11,terribly,surprising,terribly_surprising,n't,n't_terribly_surprising,"this , and that should n't be terribly surprising .","Reality echoes this , and that should n't be terribly surprising ."
pcc_eng_01_031.2719_x0489236_1248:39-40-41,terribly,surprising,terribly_surprising,n't,n't_terribly_surprising,in the top ten rounds is n't terribly surprising .,"He was on the Johnny Bench Award Watch List a couple years in a row and has always been on various conference and regional teams , so that he ended up taken in the top ten rounds is n't terribly surprising ."
pcc_eng_01_040.7046_x0641599_16:22-23-24,terribly,surprising,terribly_surprising,n't,n't_terribly_surprising,"and summer , so it was n't terribly surprising to see those contracts rally monday","However , traders rather obviously believe the market will turn decidedly higher during late spring and summer , so it was n't terribly surprising to see those contracts rally Monday ."
pcc_eng_12_061.9454_x0985601_07:28-29-30,terribly,surprising,terribly_surprising,n't,n't_terribly_surprising,to record an acoustic ep is n't terribly surprising .,"Though the Georgia natives are most well -known for their swaggering , powerful Southern rock - indebted sound , their choice to record an acoustic EP is n't terribly surprising ."
pcc_eng_11_008.3077_x0118246_13:4-5-6,terribly,surprising,terribly_surprising,n't,n't_terribly_surprising,my sadness was n't terribly surprising to anyone who knew these things,"My sadness was n't terribly surprising to anyone who knew these things -- although sometimes I also flew into an irrational , uncontrollable rage , and sometimes I just could n't feel anything at all -- but it went beyond something situational and deeper into a constant , throbbing malaise ."
pcc_eng_16_028.0921_x0438606_75:33-34-35,terribly,surprising,terribly_surprising,n't,n't_terribly_surprising,"lucques , which i suppose is n't terribly surprising given their common lineage .","Chef Mills seems to be off to a fine start here , and the food at Tavern actually reminded me quite a bit of that at Lucques , which I suppose is n't terribly surprising given their common lineage ."
pcc_eng_21_019.6568_x0301268_044:21-23-24,terribly,surprising,terribly_surprising,n't,n't_terribly_surprising,"patent side , it would n't be terribly surprising if they did so as well","Given CAFC 's history as exceptionally supportive of locking up knowledge and information on the patent side , it would n't be terribly surprising if they did so as well on the copyright side ( side note : while , normally , copyright cases should travel up the local appeals court route , since this case started as a patent case , even though it ended up as a copyright case , apparently the appeal still goes to CAFC , the court that hears all patent appeals ) ."
pcc_eng_02_007.4824_x0104648_24:3-4-5,terribly,surprising,terribly_surprising,n't,n't_terribly_surprising,this is n't terribly surprising when one considers that i adapted,This is n't terribly surprising when one considers that I adapted this recipe when I was in the fifth grade .
pcc_eng_23_093.6536_x1497452_06:08-10-11,terribly,surprising,terribly_surprising,n't,n't_terribly_surprising,", i suppose it should n't be terribly surprising .","I mean , I suppose it should n't be terribly surprising ."
pcc_eng_20_049.3265_x0780578_056:17-18-19,terribly,surprising,terribly_surprising,n't,n't_terribly_surprising,"of those surveyed , which is n't terribly surprising .","It was given as the main reason by 62 % of those surveyed , which is n't terribly surprising ."
pcc_eng_12_035.2706_x0554338_19:43-45-46,terribly,surprising,terribly_surprising,n't,n't_terribly_surprising,"faced lie , it would n't be terribly surprising if they were enriched among politicians","And while no studies have been done on our political class , given that psychopaths are deceitful , narcissistic backstabbers who never take blame and do n't get embarrassed , even when caught in a bald - faced lie , it would n't be terribly surprising if they were enriched among politicians as well ."
pcc_eng_21_013.0778_x0194994_26:08-09-10,terribly,surprising,terribly_surprising,n't,n't_terribly_surprising,"our themed strategies , it was n't terribly surprising to see our ultra-defensive sky is","Among our themed strategies , it was n't terribly surprising to see our ultra-defensive Sky Is Falling Portfolio turn in a positive performance while the majority struggled to stay in green territory ; among the worst performers were the High Tech Portfolio and the Energy Bull Portfolio as weakness in both of these sectors was quite pronounced throughout the week ."
pcc_eng_14_002.1689_x0019012_147:3-4-5,terribly,surprising,terribly_surprising,n't,n't_terribly_surprising,That was n't terribly surprising .,That was n't terribly surprising .
pcc_eng_02_086.3981_x1380618_07:20-21-22,terribly,surprising,terribly_surprising,n't,n't_terribly_surprising,"personae non gratae , which is n't terribly surprising given teigen 's liberal views and","First up : "" Make America Great Again "" supporters have been deemed personae non gratae , which is n't terribly surprising given Teigen 's liberal views and the fact that she herself has been blocked by President Trump ."
pcc_eng_13_095.4458_x1526377_23:3-4-5,terribly,surprising,terribly_surprising,n't,n't_terribly_surprising,This is n't terribly surprising .,This is n't terribly surprising .
pcc_eng_20_003.6538_x0042567_04:3-4-5,terribly,surprising,terribly_surprising,n't,n't_terribly_surprising,"this is n't terribly surprising , really : rationality has never","This is n't terribly surprising , really : rationality has never been a match for rhetoric in our culture of 24 - hour news cycles ."
pcc_eng_25_006.6739_x0092171_51:07-09-10,terribly,surprising,terribly_surprising,n't,n't_terribly_surprising,"one hand , it would n't be terribly surprising if the first round became wall","On one hand , it would n't be terribly surprising if the first round became Wall 's springboard to the next tier of superstars ."
pcc_eng_28_034.0240_x0534005_04:4-5-6,terribly,surprising,terribly_surprising,n't,n't_terribly_surprising,these issues are n't terribly surprising considering the nexus 7 is a,"These issues are n't terribly surprising considering the Nexus 7 is a budget device that sells for only $ 199 and $ 249 for the 8GB and 16GB models , respectively ."
pcc_eng_18_007.2125_x0100499_2:18-20-21,terribly,surprising,terribly_surprising,n't,n't_terribly_surprising,"laffaye , but it would n't be terribly surprising if jason alexander showed up at","There 's no Steve Wiebe / Billy Mitchell rivalry between Smith and Laffaye , but it would n't be terribly surprising if Jason Alexander showed up at the software engineer 's Virginia home ."
pcc_eng_16_054.8068_x0870810_09:4-5-6,terribly,surprising,terribly_surprising,n't,n't_terribly_surprising,so it is n't terribly surprising that his app was locked out,"So it is n't terribly surprising that his app was locked out , but Gary hopes to come to an agreement with the picture - sharing giant ."
pcc_eng_20_016.1013_x0243837_20:4-5-6,terribly,surprising,terribly_surprising,n't,n't_terribly_surprising,"this probably is n't terribly surprising , if you read with any","This probably is n't terribly surprising , if you read with any regularity ."
pcc_eng_02_033.6374_x0528288_18:31-33-34,terribly,surprising,terribly_surprising,n't,n't_terribly_surprising,"sir alec , it would n't be terribly surprising .","Seeing how Tinker , Tailor , Soldier , Spy is also a remake , and that Oldman 's character was played in the original by Sir Alec , it would n't be terribly surprising ."
pcc_eng_07_055.8621_x0886731_10:08-10-11,terribly,surprising,terribly_surprising,n't,n't_terribly_surprising,"common-sense perspective , this should n't be terribly surprising ; it 's darker under dense","From a common-sense perspective , this should n't be terribly surprising ; it 's darker under dense canopy than it would be if you were standing on top of the trees , because visible light does n't make it through ."
pcc_eng_24_071.6162_x1142220_15:4-5-6,terribly,surprising,terribly_surprising,n't,n't_terribly_surprising,that response was n't terribly surprising to the folks here at pe,That response was n't terribly surprising to the folks here at PE Hub .
pcc_eng_21_097.2783_x1555486_13:42-43-44,terribly,surprising,terribly_surprising,n't,n't_terribly_surprising,based on one specific version is n't terribly surprising .,"Superhero movies usually like to mix and match elements from different areas of a property 's history rather than directly adapt a story or character , so to hear that this Apocalypse wo n't be based on one specific version is n't terribly surprising ."
pcc_eng_28_015.7505_x0238848_11:14-15-16,terribly,surprising,terribly_surprising,n't,n't_terribly_surprising,"the dollar drop , it was n't terribly surprising to see beans and meal rise","When combined with the bullish aspects of the dollar drop , it was n't terribly surprising to see beans and meal rise this morning ."
pcc_eng_07_106.6523_x1707553_68:20-21-22,terribly,surprising,terribly_surprising,n't,n't_terribly_surprising,through a social media site is n't terribly surprising provided their affinity for web- based,"As for the Taliban , the fact that their taking shots at NATO through a social media site is n't terribly surprising provided their affinity for web- based propaganda , including their site "" Islamic Emirate of Afghanistan , "" a website that posts messages , battlefield reports and propaganda for the Taliban ."
pcc_eng_24_028.4296_x0443549_09:4-5-6,terribly,surprising,terribly_surprising,n't,n't_terribly_surprising,this decision is n't terribly surprising as china is critical to the,This decision is n't terribly surprising as China is critical to the company 's future as NEVS has recently signed a $ 1 billion deal with China Volant Industry Co. ( Volinco ) and a $ 12 billion deal with China's Panda New Energy .
pcc_eng_00_064.6421_x1028951_12:18-19-20,terribly,surprising,terribly_surprising,n't,n't_terribly_surprising,tack this secondary story took was n't terribly surprising .,After last week 's flirtation with the blonde FBI gal the tack this secondary story took was n't terribly surprising .
pcc_eng_26_086.7771_x1387076_32:19-21-22,terribly,surprising,terribly_surprising,n't,n't_terribly_surprising,"few years , this should n't be terribly surprising .","And I think if you 've looked at the data over the last few years , this should n't be terribly surprising ."
pcc_eng_03_091.3291_x1462629_17:5-6-7,terribly,surprising,terribly_surprising,n't,n't_terribly_surprising,"Well , this was n't terribly surprising , was it ?","Well , this was n't terribly surprising , was it ?"
pcc_eng_27_057.7239_x0916890_13:7-8-9,terribly,surprising,terribly_surprising,n't,n't_terribly_surprising,"in one sense , it was n't terribly surprising for a historian to recommend to","In one sense , it was n't terribly surprising for a historian to recommend to another historian to ditch the article format for the more comfortable confines of a book ."
nyt_eng_19961003_0440_13:05-09-10,terribly,surprising,terribly_surprising,none,none_terribly_surprising,"as I said , none of this was terribly surprising ; most civil libertarians","as I said , none of this was terribly surprising ; most civil libertarians , within and without the ACLU , have been deeply disillusioned with Clinton for some time ."
pcc_eng_16_087.4091_x1398683_164:1-6-7,terribly,surprising,terribly_surprising,none,none_terribly_surprising,"none of this should be terribly surprising , since it is increasingly clear","None of this should be terribly surprising , since it is increasingly clear that Donald Trump , whose actual net worth is unclear , was completely comfortable making money from blatant fraud ."
pcc_eng_07_101.6203_x1626249_044:08-12-13,terribly,surprising,terribly_surprising,none,none_terribly_surprising,"window dressing , and none of this is terribly surprising - especially that National","This is about window dressing , and none of this is terribly surprising - especially that National is diversifying itself ."
pcc_eng_01_099.0142_x1584591_003:12-13-14,terribly,surprising,terribly_surprising,not,not_terribly_surprising,"new media , it 's probably not terribly surprising to anyone that i discovered this","This being the age of new media , it 's probably not terribly surprising to anyone that I discovered this bit of news via my Facebook feed ( with Lisa Goldman having the dubious distinction of being the bearer of such tidings , since her status update was the first one I read ) ."
pcc_eng_13_038.5467_x0607138_092:20-21-22,terribly,surprising,terribly_surprising,not,not_terribly_surprising,"former mizner trail golf course was not terribly surprising , even if the case for","Last Thursday 's Palm Beach County Commission vote to approve development on the former Mizner Trail Golf Course was not terribly surprising , even if the case for development was n't strong ."
pcc_eng_test_2.02918_x20781_11:3-4-5,terribly,surprising,terribly_surprising,not,not_terribly_surprising,It 's not terribly surprising .,It 's not terribly surprising .
pcc_eng_14_087.1508_x1392465_28:7-8-9,terribly,surprising,terribly_surprising,not,not_terribly_surprising,"to see why the results are not terribly surprising , checkout this version of the","To see why the results are not terribly surprising , checkout this version of the Cubs schedule ( which is from the team 's site ) :"
pcc_eng_15_012.9851_x0193387_09:3-4-5,terribly,surprising,terribly_surprising,not,not_terribly_surprising,it 's not terribly surprising that nissan is hoping to drum,It 's not terribly surprising that Nissan is hoping to drum up more Leaf sales .
pcc_eng_29_002.5155_x0024377_39:3-4-5,terribly,surprising,terribly_surprising,not,not_terribly_surprising,it 's not terribly surprising to me especially after what sennett,It 's not terribly surprising to me especially after what Sennett told Consequence Of Sound back in April .
pcc_eng_17_073.2940_x1168275_07:16-17-18,terribly,surprising,terribly_surprising,not,not_terribly_surprising,"the internet , so it is not terribly surprising that they would embrace a therapy",""" Most teens eat , sleep , and breathe the Internet , so it is not terribly surprising that they would embrace a therapy delivered in this way , "" she says ."
pcc_eng_22_050.6494_x0802241_03:24-25-26,terribly,surprising,terribly_surprising,not,not_terribly_surprising,might be interesting to read but not terribly surprising .,"Under ordinary circumstances , a Washington Monthly symposium calling for an end to the Republican congressional majority might be interesting to read but not terribly surprising ."
pcc_eng_26_039.4651_x0621952_060:4-5-6,terribly,surprising,terribly_surprising,not,not_terribly_surprising,"so it 's not terribly surprising that , even back in 1979","So it 's not terribly surprising that , even back in 1979 , Monty Python 's Life of Brian inspired intense protests and outrage around the world ."
pcc_eng_16_081.9891_x1310713_28:3-4-5,terribly,surprising,terribly_surprising,not,not_terribly_surprising,"it 's not terribly surprising , then , that we 're","It 's not terribly surprising , then , that we 're seeing less of that kind of employment ."
pcc_eng_00_011.8633_x0175452_17:12-13-14,terribly,surprising,terribly_surprising,not,not_terribly_surprising,on the standalone model is also not terribly surprising .,The $ 500 price tag on the standalone model is also not terribly surprising .
pcc_eng_20_088.0723_x1406667_3:18-19-20,terribly,surprising,terribly_surprising,not,not_terribly_surprising,time about this but it 's not terribly surprising if this turns out to be,There has been no official announcement by any party at this time about this but it 's not terribly surprising if this turns out to be true .
pcc_eng_21_098.5256_x1575596_01:4-5-6,terribly,surprising,terribly_surprising,not,not_terribly_surprising,it is likely not terribly surprising that surfers like to party .,It is likely not terribly surprising that surfers like to party .
pcc_eng_16_084.0158_x1343768_08:4-5-6,terribly,surprising,terribly_surprising,not,not_terribly_surprising,The results were not terribly surprising .,The results were not terribly surprising .
pcc_eng_08_102.6137_x1645247_11:27-28-29,terribly,surprising,terribly_surprising,not,not_terribly_surprising,"90 years ) , it 's not terribly surprising that a number of studies examining","Since 104 new stadiums and arenas were built between 1990 and 2010 ( compared to just 130 in the preceding 90 years ) , it 's not terribly surprising that a number of studies examining the economic impact on property values have been conducted over the last ten years ."
pcc_eng_22_074.8453_x1193495_03:1-2-3,terribly,surprising,terribly_surprising,not,not_terribly_surprising,"not terribly surprising , as younger highland partners like","Not terribly surprising , as younger Highland partners like Sean Dalton and Peter Bell have been taking on more managerial responsibilities over the past two years ."
pcc_eng_01_095.1256_x1522014_03:6-7-8,terribly,surprising,terribly_surprising,not,not_terribly_surprising,"mind you , this is not terribly surprising -- when canadian customs started seizing","Mind you , this is not terribly surprising -- when Canadian customs started seizing our laptops and cameras at the border a couple years back , we kinda figured the snoop was on ."
pcc_eng_10_020.9242_x0321951_19:4-5-6,terribly,surprising,terribly_surprising,not,not_terribly_surprising,""" it 's not terribly surprising , but it is really disappointing",""" It 's not terribly surprising , but it is really disappointing that they 're going to challenge what I think is a really clear and overwhelming decision by the community , "" said Dylan Voorhees , director of the Clean Energy and Global Warming project for the Natural Resources Council of Maine ."
pcc_eng_24_077.9395_x1244582_01:2-3-4,terribly,surprising,terribly_surprising,not,not_terribly_surprising,t's not terribly surprising that microsoft could n't muscle its,t's not terribly surprising that Microsoft could n't muscle its way into Kindle-owners ' hearts with its ebook efforts -- but what 's happening next is a bit of a surprise .
pcc_eng_12_064.2684_x1022889_19:7-8-9,terribly,surprising,terribly_surprising,not,not_terribly_surprising,"given the incentives , it is not terribly surprising that the lp continually nominates corrupt","Given the incentives , it is not terribly surprising that the LP continually nominates corrupt / incompetent / just-plain-goofy candidates ."
pcc_eng_15_093.5355_x1495781_028:3-4-5,terribly,surprising,terribly_surprising,not,not_terribly_surprising,This is not terribly surprising .,This is not terribly surprising .
pcc_eng_28_039.3307_x0619901_10:5-6-7,terribly,surprising,terribly_surprising,not,not_terribly_surprising,"these findings , while not terribly surprising , particularly when considering how the","These findings , while not terribly surprising , particularly when considering how the rapid advances in mobile technology have made ' working from anywhere ' a possibility and reality for so many of us , also raise some important issues for organizations or leaders that are supporting or offering telework to their teams ."
pcc_eng_14_007.4544_x0104290_02:4-5-6,terribly,surprising,terribly_surprising,not,not_terribly_surprising,so it 's not terribly surprising that nipplegasms or breastgasms are a,So it 's not terribly surprising that nipplegasms or breastgasms are a successful way to reach climax .
pcc_eng_10_029.5881_x0462143_15:11-12-13,terribly,surprising,terribly_surprising,not,not_terribly_surprising,"disappointment , but the outcome is not terribly surprising , "" he said .",""" It is a disappointment , but the outcome is not terribly surprising , "" he said ."
pcc_eng_11_012.1045_x0179516_32:6-7-8,terribly,surprising,terribly_surprising,not,not_terribly_surprising,"that , alone , is not terribly surprising .","That , alone , is not terribly surprising ."
pcc_eng_26_009.6253_x0139361_56:27-28-29,terribly,surprising,terribly_surprising,not,not_terribly_surprising,"human experience is universal "" - not terribly surprising from a museum that is trying","The show is very much a propaganda piece for the British Museum - "" oh , history is universal , human experience is universal "" - not terribly surprising from a museum that is trying to hold onto their colonial spoils ."
pcc_eng_02_040.1652_x0633728_05:4-5-6,terribly,surprising,terribly_surprising,not,not_terribly_surprising,the results are not terribly surprising but interesting none the less .,The results are not terribly surprising but interesting none the less .
pcc_eng_24_071.1046_x1134021_150:22-23-24,terribly,surprising,terribly_surprising,not,not_terribly_surprising,contrast with jerry and it 's not terribly surprising that emma finds jerry the more,"At the beginning of the story , his naturally rather dour character makes a great contrast with Jerry and it 's not terribly surprising that Emma finds Jerry the more attractive prospect ."
pcc_eng_05_031.1179_x0487924_31:3-4-5,terribly,surprising,terribly_surprising,not,not_terribly_surprising,"it was not terribly surprising , nor was it the end","It was not terribly surprising , nor was it the end of the world , although it rather felt like it at the time ."
pcc_eng_13_039.2462_x0618395_11:3-5-6,terribly,surprising,terribly_surprising,not,not_terribly_surprising,it would not be terribly surprising if it takes as long as,It would not be terribly surprising if it takes as long as two more seasons for Miss Asada to fully be able to reap the benefits of her labors .
pcc_eng_03_081.8649_x1309531_17:3-4-5,terribly,surprising,terribly_surprising,not,not_terribly_surprising,it 's not terribly surprising that intel ( nasdaq : intc,It 's not terribly surprising that Intel ( NASDAQ : INTC ) managed to find a bottom last week .
pcc_eng_26_094.9685_x1519625_01:30-31-32,terribly,surprising,terribly_surprising,not,not_terribly_surprising,"the announcement of scribblenauts while perhaps not terribly surprising , is still nonetheless welcome .","In retrospect , it should have seemed like the perfect fit and by proxy something that we should have expected so really , the announcement of Scribblenauts while perhaps not terribly surprising , is still nonetheless welcome ."
pcc_eng_25_032.0575_x0502702_06:5-6-7,terribly,surprising,terribly_surprising,not,not_terribly_surprising,"so , it 's not terribly surprising that we frequently hear "" death","So , it 's not terribly surprising that we frequently hear "" Death To America ! "" chants from resentful Iranians , especially when they are encouraged to do so by their political leaders ."
pcc_eng_04_100.0978_x1601019_05:09-10-11,terribly,surprising,terribly_surprising,not,not_terribly_surprising,"moira had an interesting ( and not terribly surprising ) reaction to the arrow ,","Well , Moira had an interesting ( and not terribly surprising ) reaction to the Arrow , we find out more about the island , and someone else learns the secret ...."
pcc_eng_26_006.9100_x0095231_020:4-5-6,terribly,surprising,terribly_surprising,not,not_terribly_surprising,"this purchase is not terribly surprising , since facebook has been known","This purchase is not terribly surprising , since Facebook has been known to purchase existing software , like Instagram and Whats App , as opposed to developing their own applications in-house ."
pcc_eng_08_076.9677_x1229986_32:5-6-7,terribly,surprising,terribly_surprising,not,not_terribly_surprising,"Interesting news , but not terribly surprising .","Interesting news , but not terribly surprising ."
apw_eng_19981120_1335_21:08-09-10,terribly,surprising,terribly_surprising,not,not_terribly_surprising,o'meara won the award friday was not terribly surprising _ nor was the manner in,that O'Meara won the award Friday was not terribly surprising _ nor was the manner in which he accepted the award .
pcc_eng_18_031.8958_x0500058_06:7-8-9,terribly,surprising,terribly_surprising,not,not_terribly_surprising,"as a result , it 's not terribly surprising that ea and bioware recently announced","As a result , it 's not terribly surprising that EA and Bioware recently announced that they were joining forces with Green Ronin to work on a pen-and - paper adaptation of Dragon Age : Origins ."
pcc_eng_05_095.6152_x1530760_02:5-6-7,terribly,surprising,terribly_surprising,not,not_terribly_surprising,that in itself is not terribly surprising for the internet search giant .,That in itself is not terribly surprising for the Internet search giant .
pcc_eng_02_087.1592_x1393024_39:5-6-7,terribly,surprising,terribly_surprising,not,not_terribly_surprising,knowing that it 's not terribly surprising that senators are not too eager,Knowing that it 's not terribly surprising that Senators are not too eager to abolish filibuster - they would be giving away a lot of influence with it !
pcc_eng_12_034.2598_x0538167_39:3-4-5,terribly,surprising,terribly_surprising,not,not_terribly_surprising,revolutions are not terribly surprising in cases like these .,Revolutions are not terribly surprising in cases like these .
pcc_eng_12_008.6117_x0123133_12:4-5-6,terribly,surprising,terribly_surprising,not,not_terribly_surprising,""" it is not terribly surprising that whites subjectively perceive discrimination against",""" It is not terribly surprising that whites subjectively perceive discrimination against members of their own group as an especially significant and growing problem , even though , objectively speaking , bias against blacks is far more pervasive , problematic and ill-intentioned , "" he said ."
