hit_id,adv_form_lower,adj_form_lower,bigram_lower,neg_form_lower,all_forms_lower,text_window,token_str
pcc_eng_26_090.3280_x1444672_06:08-09-10,exactly,new,exactly_new,not,not_exactly_new,concept of flexible digital displays is not exactly new but working flexible displays are few,The concept of flexible digital displays is not exactly new but working flexible displays are few and far between .
nyt_eng_20060627_0055_34:5-6-7,exactly,new,exactly_new,not,not_exactly_new,Casual games themselves are not exactly new .,Casual games themselves are not exactly new .
apw_eng_19980220_1131_23:6-7-8,exactly,new,exactly_new,not,not_exactly_new,"for a new recording -lrb- not exactly new to the music business , though","for a new recording -LRB- not exactly new to the music business , though , as she 's been writing songs and singing from the age of 17 -RRB- , this would have been enough to kill her enthusiasm and faith in the music industry ."
pcc_eng_24_081.4989_x1302028_17:6-7-8,exactly,new,exactly_new,not,not_exactly_new,but the american system is not exactly new to impeachment .,But the American system is not exactly new to impeachment .
pcc_eng_18_008.5957_x0122934_04:6-7-8,exactly,new,exactly_new,not,not_exactly_new,"the way you fight is not exactly new , but very well implemented ,","The way you fight is not exactly new , but very well implemented , the moves are done very well ."
apw_eng_20081215_0013_26:21-22-23,exactly,new,exactly_new,not,not_exactly_new,"not the outer wrapper -- while not exactly new , is a fine one .","the show 's ultimate message -- it 's what 's inside that counts , not the outer wrapper -- while not exactly new , is a fine one ."
pcc_eng_22_052.4329_x0830917_32:3-4-5,exactly,new,exactly_new,not,not_exactly_new,"well , not exactly new , but they are merging with","Well , not exactly new , but they are merging with the Drapac organization ."
pcc_eng_11_067.0952_x1069777_35:15-16-17,exactly,new,exactly_new,not,not_exactly_new,"bumpy as the second bus was not exactly new , but we managed to sleep","The proceeding eight hour ride was a bit bumpy as the second bus was not exactly new , but we managed to sleep some hours ."
pcc_eng_17_053.6151_x0850109_16:08-09-10,exactly,new,exactly_new,not,not_exactly_new,"' tony ' is offering is not exactly new , especially if you frequent sites","What ' Tony ' is offering is not exactly new , especially if you frequent sites such as Howard Forums or Red Flag Deals ."
pcc_eng_16_089.7558_x1437038_21:6-7-8,exactly,new,exactly_new,not,not_exactly_new,"dishwashers , however , are not exactly new .","Dishwashers , however , are not exactly new ."
