hit_id,category,colloc,adv,adj,sent_text,sent_id,adv_index,json_source,prev_sent,next_sent,label,status
apw_eng_20100312_0914_8:8,neg-ext-subj,reportedly_able,reportedly,able,"At the time , no one was reportedly able to identify him , said the Jon Anza Collective , a committee organized after his disappearance .",apw_eng_20100312_0914_8,8,apw_eng_201003,"French officials told Anza 's family that he had fallen ill on a street on April 29 and was taken to a hospital in Toulouse , where he died May 11 .","The family was told that the body remained in the morgue since then , the collective said , confirming a report that appeared in Le Parisien newspaper .",apw_eng_20100312_0914_8:8_discard,discard
apw_eng_19990522_0918_11:5,neg-ext-subj,yet_sure,yet,sure,But no one is yet sure whether entertainers or models sell better .,apw_eng_19990522_0918_11,5,apw_eng_199905,And their heirs are n't apparent .,"Last January , a death knell directive from leading fashion editor Linda Wells appeared in The New York Times  -COL-   -LBQ-  Nobody cares about models anymore .  -RDQ-",apw_eng_19990522_0918_11:5_discard,discard
apw_eng_19990521_1080_10:6,neg-ext-subj,really_ready,really,ready,-LBQ-  No one is ever really ready for a category 4 or 5 .  -RDQ-,apw_eng_19990521_1080_10,6,apw_eng_199905,"-LBQ-  Are you ready for a category 4 or 5 ,  -RDQ-  said Chip Patterson , chief of emergency preparedness for Jacksonville .","Hurricane experts and emergency management planners statewide wonder what would happen if their communities faced a storm as devastating as Andrew , which killed 26 people , left 160,000 homeless and caused an estimated damage of $ 25 billion .",apw_eng_19990521_1080_10:6_discard,discard
apw_eng_19990518_1199_10:6,neg-ext-subj,really_ready,really,ready,-LBQ-  No one is ever really ready for a category 4 or 5 .  -RDQ-,apw_eng_19990518_1199_10,6,apw_eng_199905,"-LBQ-  Are you ready for a category 4 or 5 ,  -RDQ-  said Chip Patterson , chief of emergency preparedness for Jacksonville .","Hurricane experts and emergency management planners statewide wonder what would happen if their communities faced a storm as devastating as Andrew , which killed 26 people , left 160,000 homeless and caused an estimated damage of dlrs 25 billion .",apw_eng_19990518_1199_10:6_discard,discard
apw_eng_19990513_1454_2:4,neg-ext-subj,quite_sure,quite,sure,"No one is quite sure why it 's happening , but it 's created the kind of excitement zoos lust for .",apw_eng_19990513_1454_2,4,apw_eng_199905,"The chimpanzees keep getting pregnant , even though all the males thought capable of breeding have had vasectomies .","-LBQ-  The zoo has never had this much publicity about anything ,  -RDQ-  zookeeper Vicki Bingaman said .",apw_eng_19990513_1454_2:4_discard,discard
apw_eng_19990513_1279_2:10,neg-ext-subj,terribly_surprised,terribly,surprised,It was even more remarkable that no one was terribly surprised with his 61 in the Byron Nelson Classic .,apw_eng_19990513_1279_2,10,apw_eng_199905,Tiger Woods found it strange that he could shoot a 29 after nine holes and not even be the best in his own threesome .,The pins looked like they belonged on the senior tour and young guns like Woods and 19-year-old Sergio Garcia took aim Thursday .,apw_eng_19990513_1279_2:10_discard,discard
apw_eng_20090616_1229_9:5,neg-ext-subj,very_sure,very,sure,"-LBQ-  No one is very sure where it will go next ,  -RDQ-  said Suzanne Maloney , an Iran expert at the Saban Center for Middle East Policy in Washington .",apw_eng_20090616_1229_9,5,apw_eng_200906,"For that to happen , the protests would almost certainly need to be sustained , spread to other cities and most importantly , attract enough clerical support to create high-level rifts .",But she says  -COL-   -LBQ-  They have forced the regime to take a step back .  -RDQ-,apw_eng_20090616_1229_9:5_discard,discard
apw_eng_20061007_0759_4:19,neg-ext-subj,immediately_available,immediately,available,A person who answered the phone at the offices of the Archdiocese of Puebla said no one was immediately available to comment on the charges .,apw_eng_20061007_0759_4,19,apw_eng_200610,"About 50 parishioners reportedly gathered outside the court building to support jailed priest Rafael Perez Sanchez , who was arrested Sept. 30 .",Mexican law does not permit bail for those accused of serious crimes ; rape is punishable by prison terms of 8 to 40 years .,apw_eng_20061007_0759_4:19_discard,discard
apw_eng_20070120_0456_8:8,neg-ext-subj,immediately_available,immediately,available,No one from Gorbachev 's foundation was immediately available for comment .,apw_eng_20070120_0456_8,8,apw_eng_200701,Azerbaijan gained independence in 1991 after the Soviet collapse .,The Web site was shut down later Saturday .,apw_eng_20070120_0456_8:8_discard,discard
apw_eng_20030315_0447_17:5,neg-ext-subj,ever_shy,ever,shy,-LBQ-  No one 's ever shy of expressing their true opinion to me because I 'm just an ordinary person .  -RDQ-,apw_eng_20030315_0447_17,5,apw_eng_200303,"-LBQ-  Viewers usually come up to me and give me an honest verdict , then I know if my work is coming over properly ,  -RDQ-  she once said .","Hird was made an Officer of the Order of the British Empire , or OBE , in 1983 and became a dame in 1993 .",apw_eng_20030315_0447_17:5_discard,discard
apw_eng_20070225_0419_30:5,neg-ext-subj,completely_innocent,completely,innocent,"-LBQ-  No one was completely innocent or completely guilty in Bosnia ,  -RDQ-  Nikolic said .",apw_eng_20070225_0419_30,5,apw_eng_200702,"-LBQ-  We can see that the Bosnians want to be treated only as victims , while the Serbs want their perceived innocence to be confirmed ,  -RDQ-  said political analyst Milan Nikolic .","-LBQ-  If the court issues a balanced verdict , it would perhaps be a basis for the establishment of mutual trust among Bosnians and Serbs there .  -RDQ-",apw_eng_20070225_0419_30:5_discard,discard
apw_eng_20081003_1256_33:12,neg-ext-subj,immediately_available,immediately,available,Berkshire Hathaway spokeswoman Jackie Wilson said Friday that no one was immediately available to discuss the AIG asset sale .,apw_eng_20081003_1256_33,12,apw_eng_200810,"Last week , during an interview with CNBC , billionaire investor Warren Buffett said his firm , Berkshire Hathaway Inc. , would be interested in acquiring a couple of AIG 's assets depending on what the company was willing to sell .","Buffett is out of town , she said .",apw_eng_20081003_1256_33:12_discard,discard
apw_eng_20081003_0797_30:12,neg-ext-subj,immediately_available,immediately,available,Berkshire Hathaway spokeswoman Jackie Wilson said Friday that no one was immediately available to discuss the AIG asset sale .,apw_eng_20081003_0797_30,12,apw_eng_200810,"Last week , during an interview with CNBC , billionaire investor Warren Buffett said his firm , Berkshire Hathaway Inc. , would be interested in acquiring a couple of AIG 's assets depending on what the company was willing to sell .","Buffett is out of town , she said .",apw_eng_20081003_0797_30:12_discard,discard
apw_eng_20040618_0018_49:5,neg-ext-subj,that_surprised,that,surprised,No one was all that surprised to see Haas in the lead .,apw_eng_20040618_0018_49,5,apw_eng_200406,Hale Irwin shot a 67 at Southern Hills in the first round in the 2001 U.S. Open .,"Even though he turned 50 last December , he has remained a regular on the PGA Tour and has played well enough to blend right in with guys young enough to be his son .",apw_eng_20040618_0018_49:5_discard,discard
apw_eng_19981214_0708_2:15,neg-ext-subj,quite_ready,quite,ready,"They came back with a simple , stark political truth _ no one is quite ready to cough up the money needed to expand Europe across former ideological and battle lines .",apw_eng_19981214_0708_2,15,apw_eng_199812,Poland and other EU candidate nations went to last weekend 's European Union summit in Vienna to find out when they could join up .,The 15-member EU decided to put off until March any decisions on accepting a handful of new members that would broaden its territory from the Atlantic to the Ukraine .,apw_eng_19981214_0708_2:15_discard,discard
apw_eng_19981214_0655_2:15,neg-ext-subj,quite_ready,quite,ready,"They came back with a simple , stark political truth _ no one is quite ready to cough up the money needed to expand Europe across former ideological and battle lines .",apw_eng_19981214_0655_2,15,apw_eng_199812,Poland and other EU candidate nations went to last weekend 's European Union summit in Vienna to find out when they could join up .,The 15-member EU decided to put off until March any decisions on accepting a handful of new members that would broaden its territory from the Atlantic to the Ukraine .,apw_eng_19981214_0655_2:15_discard,discard
apw_eng_19981214_0555_19:15,neg-ext-subj,quite_ready,quite,ready,"They came back with a simple , stark political truth _ no one is quite ready to cough up the money needed to expand Europe across former ideological and battle lines .",apw_eng_19981214_0555_19,15,apw_eng_199812,WARSAW _ Poland and other candidate nations went to last weekend 's European Union summit to find out when they could join up .,CENTRAL EUROPE-EU BLUES .,apw_eng_19981214_0555_19:15_discard,discard
apw_eng_19981213_0873_12:4,neg-ext-subj,quite_sure,quite,sure,No one is quite sure which choice they 'll make .,apw_eng_19981213_0873_12,4,apw_eng_199812,"The top negotiators could decide to meet this week , or they could decide to put the process back on the slow track and settle in front of their television sets Friday night to watch agent David Falk 's exhibition game from Atlantic City .","-LBQ-  It 's very clear we do n't have the basis for a deal between us , or anything even close ,  -RDQ-  Granik said .",apw_eng_19981213_0873_12:4_discard,discard
apw_eng_19971129_0809_38:9,neg-ext-subj,really_human,really,human,"No one in  -LBQ-  Alien Resurrection  -RDQ-  is really human , and in the end the film itself fails at humanity .",apw_eng_19971129_0809_38,9,apw_eng_199711,"The scene is poignant and has potential , but it , too , is lost in the film 's violent nihilism .","That , sadly , is almost appropriate  -COL-  Given the characters and themes it examines , it could hardly have succeeded .",apw_eng_19971129_0809_38:9_discard,discard
apw_eng_19971110_1034_26:5,neg-ext-subj,as_fresh,as,fresh,"-LBQ-  No one is as fresh as they were at the start of the year ,  -RDQ-  Hingis said .",apw_eng_19971110_1034_26,5,apw_eng_199711,Her loss to Raymond marked the first time this year in 15 tournaments she failed to reach the semis .,"-LBQ-  I was starting to get a little bit tired and not very pumped , motivated anymore .  -RDQ-",apw_eng_19971110_1034_26:5_discard,discard
apw_eng_20021106_0665_31:4,neg-ext-subj,immediately_available,immediately,available,No one was immediately available at Nigeria 's Foreign Ministry to explain Wednesday 's announcement .,apw_eng_20021106_0665_31,4,apw_eng_200211,"Nigeria , which normally takes the lead in West African peacekeeping , previously had been reported to have refused to contribute troops for Ivory Coast .",Diarra urged the two-day meeting to quickly agree which nation will lead the force and when it will be deployed .,apw_eng_20021106_0665_31:4_discard,discard
apw_eng_20021106_0554_18:4,neg-ext-subj,immediately_available,immediately,available,No one was immediately available at Nigeria 's Foreign Ministry to explain Wednesday 's announcement .,apw_eng_20021106_0554_18,4,apw_eng_200211,"Nigeria , which normally takes the lead in West African peacekeeping , previously had been reported to have refused to contribute troops for Ivory Coast .",Diarra urged the two-day meeting to quickly agree which nation will lead the force and when it will be deployed .,apw_eng_20021106_0554_18:4_discard,discard
apw_eng_20021106_0514_28:4,neg-ext-subj,immediately_available,immediately,available,No one was immediately available at Nigeria 's Foreign Ministry to explain Wednesday 's announcement .,apw_eng_20021106_0514_28,4,apw_eng_200211,"Nigeria , which normally takes the lead in West African peacekeeping , previously had been reported to have refused to contribute troops for Ivory Coast .",Diarra urged the two-day meeting to quickly agree which nation will lead the force and when it will be deployed .,apw_eng_20021106_0514_28:4_discard,discard
apw_eng_20021106_0137_3:13,neg-ext-subj,as_close,as,close,"-LBQ-  The queen said ` No one , Paul , has been as close to a member of my family as you have ,  -RDQ-  Burrell recalled , according to the paper , which reportedly paid 400,000 pounds -LRB- dlrs 620,000 -RRB- to interview him .",apw_eng_20021106_0137_3,13,apw_eng_200211,"The butler , quoted in Wednesday 's editions of the Daily Mirror newspaper , said the queen 's warning came during a three-hour meeting shortly after the death of his employer , Princess Diana .","-LBQ-  There are powers at work in this country which we have no knowledge about ,  -RDQ-  Burrell reportedly quoted the queen as saying .",apw_eng_20021106_0137_3:13_discard,discard
apw_eng_20020428_1002_5:21,neg-ext-subj,immediately_available,immediately,available,"It was unclear why the alleged miracles were linked to Rodriguez , and no one at the Catholic Church was immediately available for comment .",apw_eng_20020428_1002_5,21,apw_eng_200204,"The third , whose location was unknown , allegedly occurred two months ago .","In 1981 , Rodriguez was cited for interceding to cure a woman 's lung cancer in 1981 .",apw_eng_20020428_1002_5:21_discard,discard
apw_eng_20000415_0164_39:5,neg-ext-subj,quite_sure,quite,sure,"No one is really quite sure how many rats have invaded the city , but rodents have become more visible in recent weeks , crawling along major streets and foraging through piles of refuse .",apw_eng_20000415_0164_39,5,apw_eng_200004,trash pickup Saturday that highlighted growing health concerns about the province 's burgeoning rat population .,"Bernard Kouchner , the United Nations ' top administrator in Kosovo , warned that the problem would only get worse if people do not start disposing of trash properly .",apw_eng_20000415_0164_39:5_discard,discard
apw_eng_20000415_0089_2:5,neg-ext-subj,quite_sure,quite,sure,"No one is really quite sure how many rats have invaded the city , but rodents have become more visible in recent weeks , crawling along major streets and foraging through piles of refuse .",apw_eng_20000415_0089_2,5,apw_eng_200004,Kosovo 's leaders joined hundreds of people in a trash pickup Saturday that highlighted growing health concerns about the province 's burgeoning rat population .,"Bernard Kouchner , the United Nations ' top administrator in Kosovo , warned that the problem would only get worse if people do not start disposing of trash properly .",apw_eng_20000415_0089_2:5_discard,discard
apw_eng_20000404_0083_9:5,neg-ext-subj,that_stupid,that,stupid,"-RDQ-  No one is that stupid  -RDQ-  as to send DiCaprio to conduct a presidential interview for ABC News , Westin wrote .",apw_eng_20000404_0083_9,5,apw_eng_200004,"Murphy said that ABC News chief David Westin , who had found out after the fact , sent an e-mail Saturday assuring his colleagues that  -RDQ-  all roles of journalist must be played by journalists .  -RDQ-","He added that when the TV special airs on or around Earth Day on April 22 , DiCaprio 's White House segment might be found in the recycling bin .",apw_eng_20000404_0083_9:5_discard,discard
apw_eng_20050329_0209_4:8,neg-ext-subj,immediately_available,immediately,available,No one at the Meteorological Department was immediately available for comment .,apw_eng_20050329_0209_4,8,apw_eng_200503,Ijaz said authorities were still investigating .,,apw_eng_20050329_0209_4:8_discard,discard
apw_eng_19970321_0639_11:15,neg-ext-subj,immediately_available,immediately,available,An official at Prime Minister Jose Maria Aznar 's office said no one was immediately available to comment .,apw_eng_19970321_0639_11,15,apw_eng_199703,"The letter is to be published over the weekend in several top European papers , including the French paper Le Monde and the Italian daily La Repubblica , whose editors also signed the letter , El Pais said .","A Grupo Prisa spokeswoman said Aznar , whose Popular Party ousted the Socialists in last year 's elections but failed to win a parliamentary majority , has a grudge against Grupo Prisa because it threw its weight behind Gonzalez in the 1996 election campaign .",apw_eng_19970321_0639_11:15_discard,discard
apw_eng_19970321_0598_11:15,neg-ext-subj,immediately_available,immediately,available,An official at Prime Minister Jose Maria Aznar 's office said no one was immediately available to comment .,apw_eng_19970321_0598_11,15,apw_eng_199703,"The letter is to be published over the weekend in several top European papers , including the French paper Le Monde and the Italian daily La Repubblica , whose editors also signed the letter , El Pais said .","A Grupo Prisa spokeswoman said Aznar , whose Popular Party ousted the Socialists in last year 's elections but failed to win a parliamentary majority , has a grudge against Grupo Prisa .",apw_eng_19970321_0598_11:15_discard,discard
apw_eng_19960215_0577_7:14,neg-ext-subj,immediately_available,immediately,available,No one from either the consulate or the American Embassy in Islamabad was immediately available for comment .,apw_eng_19960215_0577_7,14,apw_eng_199602,"Several dozen police in riot gear have surrounded the consulate and police vehicles are parked outside the several entrances , say eyewitnesses .","Yunus , who has been in jail for the past 18 months , is a former legislator in Pakistan 's Parliament .",apw_eng_19960215_0577_7:14_discard,discard
apw_eng_20040205_0544_13:7,neg-ext-subj,immediately_available,immediately,available,No one at the bank was immediately available for comment Thursday .,apw_eng_20040205_0544_13,7,apw_eng_200402,"UBS has argued in the past the claims are groundless , citing reparations agreements from 1988 .","I.G. Farben employed an estimated 350,000 prisoners at its chemical factories during the war .",apw_eng_20040205_0544_13:7_discard,discard
apw_eng_20020927_0705_92:5,neg-ext-subj,even_close,even,close,No one else is even close .,apw_eng_20020927_0705_92,5,apw_eng_200209,INDIANAPOLIS _ Michael Schumacher is dominating practice the same way he has dominated the Formula One circuit all season .,Slug Sports-Auto Racing-USGP .,apw_eng_20020927_0705_92:5_discard,discard
apw_eng_20020918_0215_8:7,neg-ext-subj,immediately_available,immediately,available,No one at the federation was immediately available Wednesday to provide further details .,apw_eng_20020918_0215_8,7,apw_eng_200209,"Until the discrepancy is resolved , Karpin , 33 , will have the same status as Sociedad 's other three non-EU players _ Turkish forward Nihat Kahveci , Yugoslav striker Darko Kovacevic and Russian Dmitri Khokhlov .","Karpin , who has captained Russia and appeared in this summer 's World Cup , attacked the federation decision .",apw_eng_20020918_0215_8:7_discard,discard
apw_eng_20020912_0009_10:8,neg-ext-subj,immediately_available,immediately,available,No one from the Information Ministry was immediately available for comment Thursday .,apw_eng_20020912_0009_10,8,apw_eng_200209,Government officials have said the laws are designed to limit  -LBQ-  unfair  -RDQ-  reporting of Indonesia and the promotion of Western viewpoints .,"The vaguely worded bill also permits the government to temporarily shut down local news broadcasts it claims violate the law , or which show pornographic or  -LBQ-  sadistic  -RDQ-  scenes .",apw_eng_20020912_0009_10:8_discard,discard
apw_eng_19960704_0358_60:14,neg-ext-subj,quite_sure,quite,sure,"By Joe Kay NEW YORK _ In a sport where no one 's quite sure how good a 20-year-old will be , the New York Yankees are taking a dlrs 1.6 million gamble on a 16-year-old Venezuelan outfielder .",apw_eng_19960704_0358_60,14,apw_eng_199607,Has moved .,Slug Sports-Baseball-Yankees-Melian .,apw_eng_19960704_0358_60:14_discard,discard
apw_eng_20080616_1363_30:5,neg-ext-subj,really_willing,really,willing,"-LBQ-  No one is really willing to let the market run and dive in until they hear from Goldman ,  -RDQ-  he said .",apw_eng_20080616_1363_30,5,apw_eng_200806,"Lehman rose $ 1.14 , or 4.5 percent , to $ 26.98 .","In other financial news , insurer American International Group Inc. named former Citigroup Inc. executive Robert Willumstad as chief executive .",apw_eng_20080616_1363_30:5_discard,discard
apw_eng_20040304_0051_30:6,neg-ext-subj,yet_certain,yet,certain,"However , no one is yet certain whether Muslim girls wishing to cover their hair will be allowed to wear smaller apparel like bandannas _ or whether Sikh boys will permitted to keep their turbans .",apw_eng_20040304_0051_30,6,apw_eng_200403,Instructions are to be distributed to schools around the nation .,"Education Minister Luc Ferry is to meet with representatives of France 's tiny Sikh population _ estimated at some 4,000 _ on March 10 .",apw_eng_20040304_0051_30:6_discard,discard
apw_eng_20090128_0234_17:9,neg-ext-subj,immediately_available,immediately,available,A Buckingham Palace official said no one was immediately available to comment on the matter Wednesday .,apw_eng_20090128_0234_17,9,apw_eng_200901,"A security train that swept the tracks an hour before the Queen 's locomotive chugged through the area spotted nothing , he said .",,apw_eng_20090128_0234_17:9_discard,discard
apw_eng_20090121_0292_15:14,neg-ext-subj,immediately_available,immediately,available,No one in the editing department of the China Daily Web site was immediately available to answer questions .,apw_eng_20090121_0292_15,14,apw_eng_200901,"-LBQ-  Americans might care a lot about the presidential inauguration , but Chinese may not be very interested .  -RDQ-","The full translation of Obama 's speech could be viewed on the Web site of Hong Kong-based broadcaster Phoenix Satellite Television , which has a reputation as a more independent news source .",apw_eng_20090121_0292_15:14_discard,discard
apw_eng_19941113_0121_29:4,neg-ext-subj,quite_sure,quite,sure,No one is quite sure what sparked the altercation that led to Tamimi 's death Oct. 23 .,apw_eng_19941113_0121_29,4,apw_eng_199411,"An army statement said it  -LBQ-  forbids the practice of verifying the kill at all and there is no such practice in the Central Command ,  -RDQ-  the military name for the West Bank .","Palestinians say the soldier in question had a reputation for insulting Arabs with graphic sexual remarks , trying to help himself to merchandise in nearby stores and pummeling a few men each week .",apw_eng_19941113_0121_29:4_discard,discard
apw_eng_20020224_0727_16:4,neg-ext-subj,absolutely_sure,absolutely,sure,No one is absolutely sure .,apw_eng_20020224_0727_16,4,apw_eng_200202,"The I.D. photo , taken in the 1990s , shows a man with a shaved head and normal build ; the last photographs of Arellano Felix showed him with a heavy build and a shaggy hairstyle .",But as Sinaloa Gov. Juan Milan noted  -COL-   -LBQ-  This was n't any common gunslinger .  -RDQ-,apw_eng_20020224_0727_16:4_discard,discard
apw_eng_20020215_0394_7:6,neg-ext-subj,immediately_available,immediately,available,No one from Madrid was immediately available to confirm the report .,apw_eng_20020215_0394_7,6,apw_eng_200202,"Real Madrid 's rightback Geremi Njitap made contact with the club Thursday for the first time since Cameroon 's victory but his arrival day is still not known , the sports daily Marca reported Friday .",The newspaper As said Friday that both Eto'o and Njitap could be punished by having their next spell on duty with Cameroon reduced as a result of FIFA 's recent ruling on late arrivals .,apw_eng_20020215_0394_7:6_discard,discard
apw_eng_20020208_0352_4:4,neg-ext-subj,immediately_available,immediately,available,No one was immediately available at Real Madrid for comment Friday .,apw_eng_20020208_0352_4,4,apw_eng_200202,The radio report added that the 29-year-old wanted his agent Jose Veiga to begin negotiations in time to depart Madrid this summer .,"Figo , who won the FIFA award for world soccer player of the year in December , has four years to run on his contract .",apw_eng_20020208_0352_4:4_discard,discard
apw_eng_20040401_0387_10:4,neg-ext-subj,immediately_available,immediately,available,No one was immediately available at Rome police office to comment on the reports .,apw_eng_20040401_0387_10,4,apw_eng_200404,That bomb was defused .,"In December , a package containing explosive powder burst into flames when it was opened by European Commission President Romano Prodi at his home in Bologna .",apw_eng_20040401_0387_10:4_discard,discard
apw_eng_20060422_0557_20:6,neg-ext-subj,really_interested,really,interested,"Before , no one was really interested .  -RDQ-",apw_eng_20060422_0557_20,6,apw_eng_200604,Since my Hitler salute _ which was of course inappropriate _ it 's been a big story .,,apw_eng_20060422_0557_20:6_discard,discard
apw_eng_19960612_0865_10:7,neg-ext-subj,really_sure,really,sure,"After that , no one is really sure what direction events will take .",apw_eng_19960612_0865_10,7,apw_eng_199606,"The ministers are expected to discuss plans for the Bosnia force at least through the elections , expected to be held in September .","The defense ministers from the 16 NATO nations , including France for the first time in 30 years , are meeting in their regular semiannual session .",apw_eng_19960612_0865_10:7_discard,discard
