hit_id,category,colloc,adv,adj,sent_text,sent_id,adv_index,json_source,prev_sent,next_sent
apw_eng_20020710_0319_7:34,neg-ext-subj,fully_informed,fully,informed,"Crossland said he met regularly with General Momcilo Perisic , then the army commander , and General Aleksandar Dimitrijevic , the former head of military intelligence , but concluded that neither officer was fully informed of activity on the ground in Kosovo .",apw_eng_20020710_0319_7,34,apw_eng_200207,"Albanian areas  -LBQ-  were completely burned out ,  -RDQ-  Crossland said , but senior army officers in Belgrade seemed to have no direct control .","Perisic and Dimitrijevic  -LBQ-  were unhappy with how the chain of command was organized , particularly with the army being in direct support of police operations in Kosovo ,  -RDQ-  he told the court ."
apw_eng_19960721_0608_11:16,neg-ext-subj,particularly_happy,particularly,happy,"Neither winning coach , Argentina 's Daniel Passarella nor Portugal 's Eduardo Vingada , was particularly happy with his team 's performance .",apw_eng_19960721_0608_11,16,apw_eng_199607,...,"-LBQ-  It was a good victory , but not a good game on our part ,  -RDQ-  Vingada said ."
apw_eng_20100930_0363_5:4,neg-ext-subj,completely_unexpected,completely,unexpected,Neither development was completely unexpected and market declines remained modest .,apw_eng_20100930_0363_5,4,apw_eng_201009,"Meanwhile , Moody 's Investor Services cut Spain 's public debt rating , a move many in the markets had expected but which confirms that Europe will be slow to emerge from its debt crisis .","Britain 's FTSE 100 was down 0.2 percent at 5,561.11 while Germany 's DAX was 0.3 percent lower at 6,230.85 ."
apw_eng_20100923_0559_4:5,neg-ext-subj,too_concerned,too,concerned,"Neither team will be too concerned about being eliminated from England 's second-tier cup competition at the third-round stage -- both played largely reserve sides and are more concerned with progress in the Premier League , FA Cup and Europe .",apw_eng_20100923_0559_4,5,apw_eng_201009,"City , which spent more than 120 million pounds -LRB- $ 187 million -RRB- in the latest transfer window , is fourth -- three points further back -- and will want to show Chelsea it is a realistic title contender this season by beating the Blues at Eastlands in the day 's early kickoff .","-LBQ-  We could n't take any risks ,  -RDQ-  said City manager Roberto Mancini ."
apw_eng_20070308_1226_21:5,neg-ext-subj,totally_certain,totally,certain,But neither side is totally certain of the composition of their best bowling attack .,apw_eng_20070308_1226_21,5,apw_eng_200703,"If the foundations are set , we should do well , our batting is fantastic .  -RDQ-","For England , Plunkett and Sajid Mahmood are competing with Jon Lewis and Jimmy Anderson for the seamers spots ."
apw_eng_20060928_0109_18:5,neg-ext-subj,very_specific,very,specific,Neither company has been very specific about the pace or extent of any plans for network upgrades in the remainder of their markets .,apw_eng_20060928_0109_18,5,apw_eng_200609,"There are about 33 million homes overall in the areas served by Verizon 's local phone network , and 36 million in AT&T 's markets .","Verizon has generally started selling FiOS , a brand derived from the words  -LBQ-  fiber optic services ,  -RDQ-  in two phases , first offering the broadband services and cable TV later , in part because the company needs to secure local video franchises in many markets ."
apw_eng_20020218_1466_3:5,neg-ext-subj,particularly_comforting,particularly,comforting,Neither scenario can be particularly comforting for the 15 current and former independent directors of Enron who have served since the board waived the company 's ethics code to let a top executive work both sides of business deals with the company .,apw_eng_20020218_1466_3,5,apw_eng_200202,"At worst , they rubber-stamped shady deals and then stood by idly as secretive partnerships helped bleed Enron Corp. to death .","-LBQ-  When you 're on the board and someone comes to you and says he wants to waive a conflict-of-interest rule , here is why they pay you all that money ,  -RDQ-  said Nell Minow of The Corporate Library , which monitors governance issues ."
apw_eng_19961220_0908_16:5,neg-ext-subj,particularly_impressive,particularly,impressive,Neither team has been particularly impressive .,apw_eng_19961220_0908_16,5,apw_eng_199612,"The Emirates were the only team to get to the semifinals without a loss , having only stumbled with a 1-1 draw against South Korea in the first round .",The Emirates biggest victory was a 2-0 win over lightly regarded Indonsia and got through the quarters and semis with 1-0 victories .
apw_eng_20050826_0049_18:6,neg-ext-subj,well_fleshed-out,well,fleshed-out,"But neither brother is terribly well fleshed-out , though a subplot harkening to their childhood _ and an unfortunate acquisition of magic beans _ is meant to convey longtime resentments .",apw_eng_20050826_0049_18,6,apw_eng_200508,"The actors seem to be having a good time bouncing off each other , with Damon reveling in the flashier of the two roles as the more gregarious Grimm -LRB- and affecting a passable British accent -RRB- .","So when Jacob pleads to Will ,  -LBQ-  You 're my brother _ I want you to believe in me ,  -RDQ-  the moment lacks the resonance for which it strives ."
apw_eng_20091204_0869_8:20,neg-ext-subj,quite_ready,quite,ready,But the postponement of immigration discussions is the latest in a series of small signs neither side may be quite ready for reconciliation after so much discord for so long .,apw_eng_20091204_0869_8,20,apw_eng_200912,"She then stayed an extra six days and even met with Cuban Deputy Foreign Minister Dagoberto Rodriguez , however , raising hopes for a thaw in nearly a half century of ice-cold relations .","In recent weeks , President Obama sent a message to Cuba 's top dissident blogger after she said she was roughed up by security agents , and prominent American black leaders have denounced racism on the island -- prompting a blistering Thursday night response from Cuban artists , writers and intellectuals ."
apw_eng_20061108_1766_31:18,neg-ext-subj,especially_supportive,especially,supportive,"Bush appointed both Roberts and Alito , and most legal analysts believe that neither man will be especially supportive of abortion rights .",apw_eng_20061108_1766_31,18,apw_eng_200611,"Abortion opponents are optimistic the court will uphold the law because Justice Sandra Day O'Connor , part of the majority in the 2000 case , has retired and her place was taken by Justice Samuel Alito .","Justice Anthony Kennedy , the court 's swing voter following O'Connor 's departure , dissented so strongly in the Nebraska case that many court observers believe he is unlikely to switch sides ."
apw_eng_20001106_0237_11:4,neg-ext-subj,very_busy,very,busy,Neither goaltender was very busy .,apw_eng_20001106_0237_11,4,apw_eng_200011,Thornton converted Sundstrom 's soft pass by one-timing a shot over Potvin 's right shoulder for his sixth goal of the season .,"Nabokov faced just 24 shots and Potvin stopped 17 of 19 shots , including a breakaway by Vincent Damphousse with 40 seconds left in the game ."
apw_eng_20001103_0180_4:12,neg-ext-subj,entirely_happy,entirely,happy,"-LBQ-  A successful negotiation is one in which neither side is entirely happy ,  -RDQ-  union spokeswoman Barbara Goodman said .",apw_eng_20001103_0180_4,12,apw_eng_200011,"Teachers also voted by ballot , where the contract won approval by a vote of 3,822 to 641 .",-LBQ-  We gained some language that no one is talking about .
apw_eng_19950211_0333_20:22,neg-ext-subj,as_large,as,large,"The Institutional Revolutionary Party admits to losing only two state elections anywhere in Mexico until now , and neither state is as large as Jalisco , whose capital is Guadalajara , the country 's second-largest city .",apw_eng_19950211_0333_20,22,apw_eng_199502,"The crackdown comes on the eve of Sunday 's gubernatorial election in the west-central state of Jalisco , where polls indicate that Zedillo 's governing party could suffer the worst loss in its 66-year history .",Polls have repeatedly shown the governing party 10 to 20 percentage points behind the conservative National Action Party .
apw_eng_20090228_0049_14:4,neg-ext-subj,especially_appealing,especially,appealing,"Neither prospect was especially appealing to the young administration , which also has moved cautiously on other legal matters involving national security issues .",apw_eng_20090228_0049_14,4,apw_eng_200902,The administration acted quickly to indict al-Marri in civilian court so that it could seek dismissal of the Supreme Court case without having to file a legal brief that either would defend the Bush administration 's position or abandon it .,"The court asked al-Marri 's lawyers to respond by Tuesday , making it possible that the justices could come to a decision at their private conference on March 6 ."
apw_eng_20001206_0149_20:4,neg-ext-subj,particularly_exciting,particularly,exciting,"Neither bout was particularly exciting , however , and selling a third might not work .",apw_eng_20001206_0149_20,4,apw_eng_200012,"Holyfield got a disputed draw with Lewis in their first fight , and Lewis won a decision in the second to unify the heavyweight title .","-LBQ-  My own belief is Lewis will duck Evander ,  -RDQ-  Thomas said ."
apw_eng_20070207_0179_5:4,neg-ext-subj,immediately_available,immediately,available,Neither gymnast was immediately available for comment .,apw_eng_20070207_0179_5,4,apw_eng_200702,"Their decision was confirmed to Associated Press on Tuesday by their father , Sandy , and their agent , Sheryl Shade .","-LBQ-  We know that USA Gymnastics has been in discussions with the Hamms about their future training and competitive plans ,  -RDQ-  said U.S. Olympic Committee spokesman Darryl Seibel ."
apw_eng_20080318_1714_4:5,neg-ext-subj,immediately_available,immediately,available,Neither yacht club was immediately available for comment .,apw_eng_20080318_1714_4,5,apw_eng_200803,Golden Gate backs BMW Oracle Racing .,"However , the cup could be decided in a showdown between Alinghi and BMW Oracle Racing in catamarans later this year ."
apw_eng_20071017_1607_15:4,neg-ext-subj,particularly_effective,particularly,effective,Neither side was particularly effective in the first half .,apw_eng_20071017_1607_15,4,apw_eng_200710,Johan Djourou was removed in the 17th minute for what appeared to be a hamstring injury while U.S. midfielder DaMarcus Beasley left in the 31st minute after bruising an ankle .,"The U.S. finally threatened late in the first-half , when Benny Feilhaber 's ball into Clint Dempsey was sent wide to Eddie Lewis , but his first touch went long and goalkeeper Pascal Zuberbuehler was able to knock his shot from 12 yards away ."
apw_eng_20061017_1021_23:6,neg-ext-subj,particularly_worried,particularly,worried,He said neither side is particularly worried about Sri Lanka 's civilians -- but both worry about losing the international community 's support .,apw_eng_20061017_1021_23,6,apw_eng_200610,"-LBQ-  There 's even more reason to meet now to put a halt to this senseless confrontation ,  -RDQ-  said Perera of the National Peace Council .",Sri Lankan media reported that Germany last week froze euro38 million -LRB- US$ 47.5 million -RRB- meant for projects in both government and Tamil areas until the peace process is restarted .
