hit_id,category,colloc,adv,adj,sent_text,sent_id,adv_index,json_source,prev_sent,next_sent
nyt_eng_19970203_0685_16:10,neg-ext-subj,very_desirable,very,desirable,"-LBQ-  Standing alone , neither of these companies is very desirable ,  -RDQ-  he said .",nyt_eng_19970203_0685_16,10,nyt_eng_199702,"But together , HomeBase and Builders Square could be worth more than the sum of their parts , said Derby Securities analyst Otto F. Grote .",Kmart said it plans to reclassify Builders Square as a  -LBQ-  discontinued operation  -RDQ-  in its year-end financial statements and record a net loss of $ 350 million to $ 400 million from discontinued operations .
nyt_eng_19971002_0443_4:5,neg-ext-subj,really_capable,really,capable,Neither of them is really capable of anything plain .,nyt_eng_19971002_0443_4,5,nyt_eng_199710,"However simply he approaches this familiar milieu , Stone winds up treating his story 's sin-soaked connivers the way Francis Ford Coppola treated vampires .",So  -LBQ-  U-Turn  -RDQ-  becomes a showcase for the filmmaker 's terrific arsenal of visual mannerisms and free-association imagery .
nyt_eng_19991028_0130_71:5,neg-ext-subj,as_high,as,high,"Neither is anywhere near as high as Amicalola , but they 're breathtaking nonetheless .",nyt_eng_19991028_0130_71,5,nyt_eng_199910,The park is also adjacent to the two cascades at Anna Ruby Falls .,"And though leaf-peepers wo n't find Amicalola 's panoramic vistas here , there are plenty of pretty views ."
nyt_eng_19991025_0485_19:5,neg-ext-subj,as_eager,as,eager,But neither has been as eager as Chafee to work with Democrats or as ready to cross the Republican leadership .,nyt_eng_19991025_0485_19,5,nyt_eng_199910,"Sen. John Warner of Virginia is chairman of the Armed Services Committee , and Sen. Richard Lugar of Indiana heads the Agriculture Committee .","In recent years the Senate has lost a significant group of Republicans who found it natural to seek bipartisan alliances , from Mark Hatfield of Oregon , to Alan Simpson of Wyoming , to John Danforth of Missouri , to Nancy Kassebaum Baker of Kansas , to Hank Brown of Colorado ."
nyt_eng_19991025_0417_17:3,neg-ext-subj,especially_chummy,especially,chummy,"Neither was especially chummy with their colleagues , though Gore had more pals in the House than both of them , put together , had in the Senate .",nyt_eng_19991025_0417_17,3,nyt_eng_199910,Bradley was unaccustomedly eloquent the next year in warning of deteriorating race relations .,"In the Senate , Gore 's run for the presidency in his first term made him seem presumptuous to some senators , and he was snidely labeled Prince Albert ."
nyt_eng_19991022_0063_7:34,neg-ext-subj,as_dark,as,dark,"Soderbergh is best known for his first movie -LRB-  -LBQ-  sex , lies , and videotape  -RDQ-  -RRB- and his last one -LRB-  -LBQ-  Out of Sight  -RDQ-  -RRB- , but neither is as dark , or as bristlingly experimental , as some of the films he made in between .",nyt_eng_19991022_0063_7,34,nyt_eng_199910,"Characters flash forward to imagined conversations , flash back to fractured memories , then speak at the shifting juncture of both .","Not many folks saw the surreal  -LBQ-  Schizopolis ,  -RDQ-  in which the director played a blanched suburbanite who swaps identities with a dentist , but believe you us _ it 's a triumph of weirdness ."
nyt_eng_19991016_0138_46:3,neg-ext-subj,as_colorful,as,colorful,"Neither is as colorful as Gov. Kirk Fordice , and for many voters that 's probably a relief .",nyt_eng_19991016_0138_46,3,nyt_eng_199910,Both have had long political careers and both are focusing on improving the state 's dismal record on education .,"Fordice , who made permanent enemies of most of the legislators with his ornery nature , is now on the outs with citizens ."
nyt_eng_19991012_0309_20:37,neg-ext-subj,as_good,as,good,"If his injury forces him to the bench , then Torre will play either Ledee or Shane Spencer in right field , and while Spencer might have more experience in right than Ledee , neither is as good as O'Neill .",nyt_eng_19991012_0309_20,37,nyt_eng_199910,O'Neill 's status will have a significant impact on the Yankees ' defense .,"Right field in Fenway Park might be the most difficult outfield position in all of baseball , with its low , curving fence from right field to right-center , and its huge expanse ."
nyt_eng_19960422_0534_42:5,neg-ext-subj,as_complicated,as,complicated,"-LBQ-  But neither were as complicated as the city process ,  -RDQ-  she said .",nyt_eng_19960422_0534_42,5,nyt_eng_199604,-LBQ-  But it 's an incredibly complicated process .  -RDQ-,That red tape has stalled millions of dollars in aid .
nyt_eng_19960418_0374_14:3,neg-ext-subj,particularly_troubled,particularly,troubled,"Neither is particularly troubled to be carrying their moniker of  -LBQ-  baby  -RDQ-  even into adulthood , and each , given the choice , would choose to be the youngest again .",nyt_eng_19960418_0374_14,3,nyt_eng_199604,"Benson says hers was  -LBQ-  a gas ,  -RDQ-  and Greene says ,  -LBQ-  I felt a great sense of security , lots of love .  -RDQ-","Not surprisingly , what tips the scale one way or the other is family structure and dynamics ."
nyt_eng_19990130_0264_54:4,neg-ext-subj,particularly_fast,particularly,fast,Neither back is particularly fast or elusive and they both came into the league with absolutely no fan fare .,nyt_eng_19990130_0264_54,4,nyt_eng_199901,And that will be just one more thing that makes them amazingly similar .,"Both had undistinguished college careers _ Anderson at Utah , Davis at Long Beach State and then Georgia ."
nyt_eng_19990121_0256_9:8,neg-ext-subj,especially_believable,especially,believable,"At the same time , neither is especially believable in his or her off-beat part .",nyt_eng_19990121_0256_9,8,nyt_eng_199901,But each is acting so far against their respective  -LBQ-  type  -RDQ-  that they 're virtually unrecognizable _ and never generate much romantic chemistry or any real movie star charisma .,"Richard Hawkins ' script _ which the studio brags it rescued from its  -LBQ-  slush pile  -RDQ-  of unsolicited scripts _ is halfway trying to be one of those mid-60s  -LBQ-  Swinging London  -RDQ-  comedies that celebrate eccentricity and rebellion -LRB-  -LBQ-  Morgan ! ,  -LBQ-  The Knack ,  -RDQ-  etc. -RRB- ."
nyt_eng_19990114_0312_25:5,neg-ext-subj,currently_true,currently,true,Neither of those is currently true .,nyt_eng_19990114_0312_25,5,nyt_eng_199901,But that estimate was based in part on the assumption that Brazil would not unravel and that Japanese growth would not decline .,"-LBQ-  If there were no additional complications , Europe could still grow at rates that might be called satisfactory ,  -RDQ-  Visco said ."
nyt_eng_19961025_0132_46:8,neg-ext-subj,that_indomitable,that,indomitable,"Neither , standing alone , is all that indomitable .",nyt_eng_19961025_0132_46,8,nyt_eng_199610,Yankees and Atlanta Braves might be unbeatable .,Each has discovered _ and probed _ the other 's vulnerabilities in the first five games of this Series .
nyt_eng_19961022_0796_32:7,neg-ext-subj,as_painful,as,painful,"But neither of those injuries was as painful as the groin injury he has now , which made Sunday 's performance incredible .",nyt_eng_19961022_0796_32,7,nyt_eng_199610,He tried to play with an injured shoulder last year before he was forced into surgery .,"He could n't walk to the line of scrimmage without limping , but in the fourth quarter he was again diving into the pile for yardage and stretching out for yardage and , finally , rolling out to the end zone for the winning touchdown ."
nyt_eng_19961022_0285_3:11,neg-ext-subj,as_confounding,as,confounding,"Neither of the two earlier  -LBQ-  Anthology  -RDQ-  sets was as confounding as this one - there are but two fully complete , previously unreleased songs -LRB-  -LBQ-  Not Guilty  -RDQ-  and  -LBQ-  What 's the New Mary Jane ,  -RDQ-  both of which have been available on the bootleg market for years -RRB- , and a handful of home demo recordings -LRB-  -LBQ-  Honey Pie ,  -RDQ-   -LBQ-  Junk ,  -RDQ-   -LBQ-  Piggies  -RDQ-  -RRB- which shed precious little light on the Beatles ' creative process .",nyt_eng_19961022_0285_3,11,nyt_eng_199610,"Covering the end of the group 's days in the recording studio , 1968 and ' 69 ,  -LBQ-  Anthology 3  -RDQ-  will be released Tuesday -LRB- 10-29 -RRB- by Capitol Records .","So the set is heavy with early , mostly slower takes of familiar titles -LRB-  -LBQ-  Sexy Sadie ,  -RDQ-   -LBQ-  Helter Skelter ,  -RDQ-   -LBQ-  I 'm So Tired  -RDQ-  -RRB- and ragged run-throughs of rock 'n' roll oldies by a band that was , by the end , splitting wide open ."
nyt_eng_19961016_0106_10:3,neg-ext-subj,very_expensive,very,expensive,Neither is very expensive .,nyt_eng_19961016_0106_10,3,nyt_eng_199610,"Truth is , either will work just fine , and both are worlds faster than using floppy disks for a backup .","Just to give you a notion , I 'll give some specific examples ."
nyt_eng_19980427_0078_22:3,neg-ext-subj,always_easy,always,easy,"Neither is always easy , but both are honorable tasks .",nyt_eng_19980427_0078_22,3,nyt_eng_199804,"It continues to oblige Israel to a survival that , in its justice , is worthy of its imperative .",E-Mail  -COL-  teepencolumn -LRB- at -RRB- coxnews.com
nyt_eng_19980424_0322_19:6,neg-ext-subj,politically_inclined,politically,inclined,"-LBQ-  Neither of them are politically inclined ,  -RDQ-  Finch said .",nyt_eng_19980424_0322_19,6,nyt_eng_199804,"His mother , Monica Finch , is a 911 dispatcher for Franklin County and his father , Ralph Finch , is a truckdriver .","Finch , who serves on the Student Senate at Ottawa University , said he became interested in history and politics in high school ."
nyt_eng_19980423_0451_31:4,neg-ext-subj,particularly_sophisticated,particularly,sophisticated,-LBQ-  Neither were particularly sophisticated and did n't know much about drugs .  -RDQ-,nyt_eng_19980423_0451_31,4,nyt_eng_199804,"-LBQ-  I do n't think they had any idea something like this could happen ,  -RDQ-  Ellett Jr. said .",Ellett Jr. said his father and Dolan cooperated with police and city officials and spent money on substantial improvements .
nyt_eng_19980403_0552_37:4,neg-ext-subj,as_successful,as,successful,Neither has been as successful on the track as they would like .,nyt_eng_19980403_0552_37,4,nyt_eng_199804,There 's very little that we ca n't relate to .  -RDQ-,"Sawyer , who finished eighth in the points last season , has one BGN victory in 261 starts ."
nyt_eng_19990914_0236_36:17,neg-ext-subj,very_accessible,very,accessible,"-LBQ-  I liked both Ted Turner and August Busch III , but neither of them was very accessible .  -RDQ-",nyt_eng_19990914_0236_36,17,nyt_eng_199909,"-LBQ-  To me , the fact that I could talk to George , that he made himself available , made it possible for us to develop mutual respect ,  -RDQ-  he writes .","Through it all , Joe Torre has kept his sense of humor ."
nyt_eng_19990910_0011_28:19,neg-ext-subj,particularly_sure,particularly,sure,It 's hard for them to be worried about the sale of Wizards when neither of them is particularly sure of what Hasbro is .,nyt_eng_19990910_0011_28,19,nyt_eng_199909,"They tend to stick to action games , first-person shooter games , Mortal Kombat .","-LBQ-  Hasbro , Hasbro , Hasbro ... ,  -RDQ-  said Haupt , trying to jog his memory ."
nyt_eng_19990904_0153_107:5,neg-ext-subj,very_materialistic,very,materialistic,Neither of us is very materialistic .,nyt_eng_19990904_0153_107,5,nyt_eng_199909,I do n't think she will .,We both like to fish and ride motorcycles .
nyt_eng_19990308_0356_29:15,neg-ext-subj,particularly_uplifting,particularly,uplifting,"There are basically two explanations for your manager 's behavior , and neither is particularly uplifting .",nyt_eng_19990308_0356_29,15,nyt_eng_199903,The fact is that it would be foolish to do nothing in this situation .,"The first is that he is the kind of manager who goes through the charade of listening , while hearing very little ."
nyt_eng_19951023_0442_45:7,neg-ext-subj,wholly_reassuring,wholly,reassuring,Yet neither of these points is wholly reassuring .,nyt_eng_19951023_0442_45,7,nyt_eng_199510,"Xenotransplanters also point out that in the handful of transplants that have already happened , none of the patients has died from an unknown disease .",An experiment that works will quickly be copied .
nyt_eng_19970305_0017_3:3,neg-ext-subj,quite_ready,quite,ready,Neither was quite ready for the return flight to Fort Worth .,nyt_eng_19970305_0017_3,3,nyt_eng_199703,TCU power forward Dennis Davis arrived there also .,"Bearing down hard inside in the Horned Frogs ' 1-3-1 half-court zone press , the duo came through with key contributions that sparked a rallying 72-61 victory against the Cowboys during the opening round of the Western Athletic Conference tournament ."
nyt_eng_19980709_0486_4:8,neg-ext-subj,that_great,that,great,But that neither of them are all that great says more about the current state of world soccer than anything else might .,nyt_eng_19980709_0486_4,8,nyt_eng_199807,"That Brazil and France , which will face off Sunday night at the Stade de France in Saint-Denis , may also be the two finest teams -- sorry , Holland -- in the tournament makes it all the better .","The Brazilians have stumbled through this tournament , constantly seeking to find form , a search that has led to moments of brilliant offensive soccer and little else ."
nyt_eng_19990422_0430_28:3,neg-ext-subj,yet_willing,yet,willing,Neither is yet willing to support a land attack .,nyt_eng_19990422_0430_28,3,nyt_eng_199904,"But that would mean aligning political support from its government and from Greece , whose port at Salonnika would be crucial .","Though the difficulties are formidable , there are powerful reasons why NATO might at least want to have an option to use combat troops ."
nyt_eng_19950515_0333_7:5,neg-ext-subj,really_surprised,really,surprised,Neither of them was really surprised .,nyt_eng_19950515_0333_7,5,nyt_eng_199505,Three times .  -RDQ-,"Since suffering a stroke 15 years ago , the man has been afflicted with a rare condition called amusia ."
nyt_eng_19951127_0334_3:18,neg-ext-subj,exactly_sure,exactly,sure,"We are operating under a bit of a handicap in the sense that neither of us is exactly sure what the project is , how it is to be done or when it is due .",nyt_eng_19951127_0334_3,18,nyt_eng_199511,"My wife thinks that she can get an  -LBQ-  A ,  -RDQ-  due to the fact that she is handy with scissors and paste , while I would be content with a  -LBQ-  B ,  -RDQ-  unless the teacher is one of those fussy types who insist that assignments be turned in on time , in which case I 'd settle for a  -LBQ-  C  -RDQ-  or even a  -LBQ-  D-plus .  -RDQ-","All of this information was sent home from school some time ago , but we suspect it disappeared , like so much information before it , into a space-time continuum and is now being puzzled over by parents on the planet Zork who could have sworn that their son was supposed to do a report on why Zorkosaurusus became extinct ."
nyt_eng_19951122_0198_21:10,neg-ext-subj,always_true,always,true,"In real life , neither of these scenarios is always true .",nyt_eng_19951122_0198_21,10,nyt_eng_199511,"Meanwhile , the SAT-failure drives a jalopy to his dilapidated dump beside an alligator-infested swamp while the rowboat in back of the outhouse sinks .",Doing well on the SAT does not guarantee success .
nyt_eng_19980528_0135_13:4,neg-ext-subj,very_easy,very,easy,But neither is very easy .,nyt_eng_19980528_0135_13,4,nyt_eng_199805,There are two obvious ways of meeting the demand  -COL-  Train more Americans or hire skilled workers from abroad .,"President Bill Clinton is threatening to veto a bill passed by the Senate that would increase the number of visas granted to high-technology workers from places such as India , Russia and Central Europe ."
nyt_eng_19980509_0051_41:3,neg-ext-subj,immediately_available,immediately,available,Neither was immediately available to comment .,nyt_eng_19980509_0051_41,3,nyt_eng_199805,"On Friday he briefed Harold Varmus , the director of the institutes , and Francis Collins , director of the agency 's part of the human genome project , about the new company 's plans .","Venter forecast that the possession of the human genome sequence would stimulate new directions in medicine and biology , just as his sequencing of the first bacterial genome has led to a wave of other microbes being spun through sequencing machines ."
nyt_eng_19980508_0427_80:16,neg-ext-subj,as_likely,as,likely,"The panther logo and snook logo are quite striking , granted , but neither is as likely to stop traffic as a hooded , white-robed figure standing next to a burning cross .",nyt_eng_19980508_0427_80,16,nyt_eng_199805,why the state of Florida should refrain from promoting it on license plates .,"Possible slogans include  -LBQ-  White Supremacists Are People , Too ,  -RDQ-   -LBQ-  Have You Hugged a Bigot Today ?  -RDQ-  and  -LBQ-  Integrate This !  -RDQ-"
nyt_eng_19950316_0276_54:3,neg-ext-subj,physically_impressive,physically,impressive,Neither is physically impressive .,nyt_eng_19950316_0276_54,3,nyt_eng_199503,"In the presidency , both men come between two charismatic figures .",They were short and opinionated .
nyt_eng_19980619_0010_21:3,neg-ext-subj,entirely_true,entirely,true,Neither is entirely true .,nyt_eng_19980619_0010_21,3,nyt_eng_199806,-LBQ-  Now I 'm mediocre .  -RDQ-,"He had a couple of magical moments , chipping in for a birdie on No. 4 and draining a 60-foot birdie putt on No. 9 ."
nyt_eng_19980605_0093_19:6,neg-ext-subj,anywhere_close,anywhere,close,Neither of these eventualities was anywhere close to the foregone conclusion that Schlesinger and others would have us believe .,nyt_eng_19980605_0093_19,6,nyt_eng_199806,It must be noted that all the projections about what Kennedy might have achieved are based on the premise that he would have been president _ that he would have won his party 's nomination and defeated Richard Nixon in the general election .,"But what if Bobby had become president ? Would he have saved the world , as Schlesinger believes ? Or would he have left the world a bigger mess than he found it , as his detractors would suggest ?"
nyt_eng_19960122_0612_70:11,neg-ext-subj,quite_sure,quite,sure,"Both gaze toward the console television , but neither is quite sure what 's on , nor seems to care .",nyt_eng_19960122_0612_70,11,nyt_eng_199601,"On this Saturday , Bessie sits on one side of the living room , Gladys on another .",Stand clear .
nyt_eng_19960119_0091_10:3,neg-ext-subj,immediately_available,immediately,available,Neither were immediately available for comment .,nyt_eng_19960119_0091_10,3,nyt_eng_199601,The PNB vice presidents said both Favila and board Chairman Daniel Lacson had said they were n't opposed to the move .,"Reports of management trying to gain more power at PNB pushed the bank 's shares up 20 pesos , or 6.2 percent , to 342.50 on the Philippine Stock Exchange ."
nyt_eng_19960116_0209_12:3,neg-ext-subj,exactly_new,exactly,new,Neither are exactly new .,nyt_eng_19960116_0209_12,3,nyt_eng_199601,"As further ratified by the recent Grammy nominations , the new faces of rock consensus _ which record sales say we 're all supposed to agree on _ are Alanis Morissette and Hootie & the Blowfish .","Morissette , at 21 , already enjoyed a career as Canada 's answer to squeaky teen queen Debbie Gibson and a juvenile stint slinging goop on Nickolodeon 's  -LBQ-  You Ca n't Do That on Television .  -RDQ-"
nyt_eng_19960102_0701_31:7,neg-ext-subj,as_dominating,as,dominating,Neither of the Europeans will be as dominating as Heitmann sometimes was .,nyt_eng_19960102_0701_31,7,nyt_eng_199601,None of the current players has the streaky brilliance of Baer .,But Price is counting on a consistency and chemistry that will more than make up for those losses .
nyt_eng_19980825_0115_15:15,neg-ext-subj,especially_outstanding,especially,outstanding,The Piedmont region had good years in 1996 and in 1989 ; neither was especially outstanding in Tuscany .,nyt_eng_19980825_0115_15,15,nyt_eng_199808,"Italy 's last truly great year for wine was 1990 , and before that , 1985 .","But in 1997 , the weather gave winemakers a break ."
nyt_eng_19980803_0210_23:7,neg-ext-subj,independently_wealthy,independently,wealthy,"-LBQ-  Neither of the candidates is independently wealthy ,  -RDQ-  said Dave Puglia , campaign manager for Lungren .",nyt_eng_19980803_0210_23,7,nyt_eng_199808,"At the same time , Davis rounded up a $ 1,500 donation from a union for cement masons and $ 2,500 from the International Association of Plumbing & Mechanical Officials .",-LBQ-  Both of them have to go to donors and raise money the old-fashioned way .
nyt_eng_19950819_0002_43:18,neg-ext-subj,as_bad,as,bad,-LBQ-  I got a taste of the fans and the press in New York and neither was as bad as they 're made out to be .  -RDQ-,nyt_eng_19950819_0002_43,18,nyt_eng_199508,"-LBQ-  There were a lot of young players I had a chance to influence , not just in baseball , but life as a whole ,  -RDQ-  Butler said .",
nyt_eng_19950805_0206_24:7,neg-ext-subj,too_successful,too,successful,"-LBQ-  Neither of us has been too successful in the last couple of years , have we ?  -RDQ-  quipped the elder Ellwood , a 69-year-old Minnesota physician who is widely considered the founder of the HMO movement and who recently tried unsuccessfully to sell Washington on a  -LBQ-  managed-competition  -RDQ-  model for health reform .",nyt_eng_19950805_0206_24,7,nyt_eng_199508,His father _ health policy entrepreneur Paul Ellwood _ had a similar experience .,-LBQ-  I try to tell David  -COL-  ` This is just the beginning . '
nyt_eng_19990806_0423_30:4,neg-ext-subj,as_bad,as,bad,But neither was as bad as the news on McKnight .,nyt_eng_19990806_0423_30,4,nyt_eng_199908,"Along with Adams , the next most serious injury from the scrimmage was to cornerback Kevin Mathis , with a lower back contusion .","Because the trade with Seattle occurred in June ,  -LBQ-  RMcKnight S had n't been in any minicamps , any coaching sessions ... we were just getting to know each other really ,  -RDQ-  Gailey said ."
nyt_eng_19970407_0218_19:32,neg-ext-subj,as_little,as,little,"But what about Russia 's far reaches ? Is there as much money to burn in Murmansk as there obviously is in Moscow ? Perhaps not , but neither is there as little as was previously believed .",nyt_eng_19970407_0218_19,32,nyt_eng_199704,-LBQ-  Clearly the price of real estate in the world is directly related to the distance from the Kremlin walls .  -RDQ-,"A survey released in March of about 4,000 people across Russia estimated that the average Russian household takes in about $ 205 to $ 220 a month _ nearly double the official totals ."
nyt_eng_19970403_0147_16:16,neg-ext-subj,as_interactive,as,interactive,"There 's Freedomfest '97 and the city of Atlanta 's site , although neither are as interactive as the first site .",nyt_eng_19970403_0147_16,16,nyt_eng_199704,Freaknik.com is n't the only Web site .,"The consortium of Butler , Porter , Greene and Shaw _ all consultants to larger companies hoping to venture into cyberspace _ built the Freaknik Web site to prove that African-Americans ' interest in the Internet is huge ."
nyt_eng_19990210_0006_26:3,neg-ext-subj,entirely_successful,entirely,successful,Neither was entirely successful .,nyt_eng_19990210_0006_26,3,nyt_eng_199902,They cultivated the U.S. but tried to avoid becoming its pawn .,The king balanced between Arab nationalism and the need to conciliate Israel and keep Washington friendly .
nyt_eng_19990730_0182_73:7,neg-ext-subj,faintly_postmodern,faintly,postmodern,"-LBQ-  Neither of them is even faintly postmodern ,  -RDQ-  she says .",nyt_eng_19990730_0182_73,7,nyt_eng_199907,O'Connor-Ambrose believes that experience was pivotal for both of the Genoveses .,"-LBQ-  They both believe there is a truth , that human nature has meaning and that life has a purpose .  -RDQ-"
nyt_eng_19990715_0255_21:3,neg-ext-subj,too_crazy,too,crazy,Neither are too crazy about that idea .,nyt_eng_19990715_0255_21,3,nyt_eng_199907,"On the Internet , as with cassettes , people can easily make copies of music and distribute them for free or for profit without the artists or the labels receiving a dime .","Realizing the potential to make _ or lose _ money , major labels have been working to embrace and control the Internet ."
nyt_eng_19990709_0112_2:11,neg-ext-subj,even_close,even,close,"There is truth in both views , but neither is even close to the whole story .",nyt_eng_19990709_0112_2,11,nyt_eng_199907,"Connecticut has a contradictory public image , seen as a bland suburb of New York yet regarded as a backwater of traditional Yankee stodginess .",The part of Fairfield County known as the Gold Coast is truly oriented toward New York .
nyt_eng_19990704_0024_7:3,neg-ext-subj,as_dominant,as,dominant,"Neither were as dominant as Paden , who the final 21 laps and won by 2.126 seconds .",nyt_eng_19990704_0024_7,3,nyt_eng_199907,Other feature winners were 16-year-old sensation Josh Wise in USAC TQ Midgets and Reedley 's Jim Tartaglia in CAM 360 Super Modifieds .,"-LBQ-  This was the first time I 've run this car ,  -RDQ-  Paden said ."
