hit_id,category,colloc,adv,adj,sent_text,sent_id,adv_index,json_source,prev_sent,next_sent
nyt_eng_19941020_0329_2:4,neg-ext-subj,physically_able,physically,able,Neither has been physically able to compete since the U.S. Open .,nyt_eng_19941020_0329_2,4,nyt_eng_199410,"The bad back syndrome is striking the men 's and women 's tours with equal severity  -COL-  top-ranked Steffi Graf is n't sure when or whether she 'll play again this year , and 34-year-old Ivan Lendl is starting to wonder whether he 'll play again at all .","While it 's extremely unlikely that Graf will lose her No. 1 ranking to Arantxa Sanchez Vicario by the year 's end , it is a virtual certainty that Lendl will finish the season out of the Top 20 for the first time since 1978 ."
nyt_eng_19941017_0383_4:3,neg-ext-subj,as_good,as,good,Neither is as good as ESPN 's  -LBQ-  NFL Gameday .  -RDQ-,nyt_eng_19941017_0383_4,3,nyt_eng_199410,"The former performs for an hour , the latter for 30 minutes .","-LBQ-  We do n't need an hour ,  -RDQ-  said Ricky Diamond , NBC 's producer ."
nyt_eng_19981126_0109_17:11,neg-ext-subj,particularly_startling,particularly,startling,"By today 's standards , neither of these films is particularly startling .",nyt_eng_19981126_0109_17,11,nyt_eng_199811,"The MPAA was a love child of two films  -COL-   -LBQ-  Who 's Afraid of Virginia Woolf ? ,  -RDQ-  which talked frankly about sex , and  -LBQ-  Blowup ,  -RDQ-  which showed it .","But in the mid - '60s , they were revolutionary ."
nyt_eng_19981109_0173_38:6,neg-ext-subj,medically_trained,medically,trained,"-LBQ-  Neither of us are medically trained , but if I was playing armchair psychologist , I 'd say that all of the people in the book had a lot of drive and ambition and success and a need to overcome adversity ,  -RDQ-  she said .",nyt_eng_19981109_0173_38,6,nyt_eng_199811,But Madigan said there are some obvious personality traits that each notable displays .,Story Filed By Cox Newspapers
nyt_eng_19981109_0060_16:4,neg-ext-subj,as_effective,as,effective,And neither was as effective as putting heavy users through treatment programs .,nyt_eng_19981109_0060_16,4,nyt_eng_199811,"Using mathematical models , the study found that , dollar for taxpayer dollar , mandatory minimum sentences were less effective in reducing cocaine consumption than previous sentencing structures .",The study also found mandatory minimums are less cost-effective for reducing cocaine-related crime than either of those other alternatives .
nyt_eng_19980328_0244_7:7,neg-ext-subj,as_large,as,large,And neither of those leads was as large as the one he has here .,nyt_eng_19980328_0244_7,7,nyt_eng_199803,"He has closed the deal the past two times he slept on a 54-hole lead , at the 1994 Buick Invitational and the 1993 U.S. Open .","-LBQ-  If I do n't win , no matter what someone else shoots , I 'll think I could 've shot well enough to stay ahead of him ,  -RDQ-  Janzen said ."
nyt_eng_19980323_0346_9:38,neg-ext-subj,as_important,as,important,"My British friends and relative say their system of rewarding faithful supporters of the party in power with a seat in the House of Lords , or a Gartership , is much wiser since neither are nearly as important as ambassadorial posts .",nyt_eng_19980323_0346_9,38,nyt_eng_199803,President Clinton kept him on a year and then returned to the tradition of rewarding important political backers with ambassadorships to Britain .,"But some of the best American ambassadors I have known , from Ellsworth Bunker in the India of the '50s to Felix Rohatyn in the France of the '90s , were businessmen who received presidential political appointments ."
nyt_eng_19980312_0247_7:5,neg-ext-subj,too_dignified,too,dignified,Neither of them is too dignified to don silks and waddle around the stage as a blob or too remote to deny their audience the pleasure of batting inflatables around the theater at the joyful conclusion of  -LBQ-  Air Time .  -RDQ-,nyt_eng_19980312_0247_7,5,nyt_eng_199803,"Ms. Santos , a principal dancer with the Opera Paulista Company of Sao Paulo , Brazil , shares with Garbo a penchant for comedy and acrobatics when not displaying her grace and talent as a ballerina .",PRODUCTION NOTES  -COL-
nyt_eng_19980303_0127_9:24,neg-ext-subj,as_wonderful,as,wonderful,"-LRB- Many restaurants use turmeric or annatto oil , a dark red oil made by gently heating achiote seeds , but neither is as wonderful as saffron . -RRB-",nyt_eng_19980303_0127_9,24,nyt_eng_199803,"An effortless way to make the dish something much more glamorous is to add a pinch of saffron _ and with it will come the lovely yellow color typical of these dishes and an unmatched , exotic perfumed flavor .","When buying saffron , steer clear of the tiny vials that contain a few threads ; go to a reputable specialty store and buy either a gram , which will cost less than $ 10 and contain about 500 threads , or a quarter of an ounce , which will cost about $ 40 and last several years ."
nyt_eng_19981023_0142_42:15,neg-ext-subj,completely_wrong,completely,wrong,The difficulty for voters is that neither answer is completely right and neither is completely wrong .,nyt_eng_19981023_0142_42,15,nyt_eng_199810,"This is why managed care is a genuinely confusing issue  -COL-  Should voters believe the anecdotes , which are real and horrifying , or should they accept the evidence that people are mostly happy with their own insurance , happy to be paying less , and as healthy as they have ever been ? Both parties in the '98 campaign offer an easy answer to that question .",
nyt_eng_19981016_0126_11:21,neg-ext-subj,that_quick,that,quick,Neither of the LX 470 's two top rivals _ the Lincoln Navigator and the Range Rover _ are quite that quick .,nyt_eng_19981016_0126_11,21,nyt_eng_199810,"As heavy as it is , the LX 470 can accelerate from zero to 60 mph in just 10 seconds , which is unmatched in the full-size SUV class .","The LX 470 's ride is much smoother and softer than before , and the vehicle does n't lean in tight turns as dramatically as the LX 450 does ."
nyt_eng_19981008_0180_23:11,neg-ext-subj,as_informative,as,informative,"In the end , neither of the films is half as informative or effective as  -LBQ-  Fire on the Track  -RDQ-  _ the stirring TV documentary that reportedly inspired both films , but was credited by neither .",nyt_eng_19981008_0180_23,11,nyt_eng_199810,"Since these were some of the failings of the first Prefontaine film , one wonders why Towne and Cruise would go to the trouble to make another film and not do a better job of filling in the blanks .",Without Limits .
nyt_eng_19971214_0119_1:16,neg-ext-subj,entirely_comfortable,entirely,comfortable,"The theater has always offered a welcome refuge for poets , even if neither is entirely comfortable in the other 's company .",nyt_eng_19971214_0119_1,16,nyt_eng_199712,,"Happily , Seamus Heaney 's one work for the stage ,  -LBQ-  The Cure at Troy ,  -RDQ-  is a lyrical and evocative retelling of Sophocles '  -LBQ-  Philoctetes ,  -RDQ-  and the Jean Cocteau Repertory has mounted a lively production that is the New York premiere of the Irish Nobel laureate 's version of the Greek drama ."
nyt_eng_19960307_0832_24:7,neg-ext-subj,as_flabby,as,flabby,But neither of those weaklings was as flabby as  -LBQ-  The Birdcage .  -RDQ-,nyt_eng_19960307_0832_24,7,nyt_eng_199603,His latest films _  -LBQ-  Regarding Henry  -RDQ-  and  -LBQ-  Wolf  -RDQ-  _ have fallen flat .,The movie has one awkward payoff in the category of something you never thought a star like Hackman would ever do .
nyt_eng_19960303_0173_11:3,neg-ext-subj,especially_dazzling,especially,dazzling,"Neither was especially dazzling , nor were they trying to be .",nyt_eng_19960303_0173_11,3,nyt_eng_199603,"Jason Isringhausen , Bill Pulsipher and Juan Acevedo each threw two innings for their first action of the spring .","Isringhausen , a right-hander entering his first full season in the big leagues , gave up two hits , including a solo home run to Palmeiro in the first inning ."
nyt_eng_19961220_0242_39:11,neg-ext-subj,particularly_interested,particularly,interested,"When she learned that neither of the little ones was particularly interested in Tickle Me Elmo , Alicia -LRB- who asked that I not use her last name -RRB- decided to sell the Tickle Me Elmos , maybe make a couple of dollars .",nyt_eng_19961220_0242_39,11,nyt_eng_199612,"-LBQ-  The offers were so ridiculous I ca n't even sell it ,  -RDQ-  said Alicia , who bought dolls for her niece and her goddaughter several weeks ago .","-LBQ-  How can someone be so sick as to pay $ 500 for a doll ? I thought someone might bid $ 100 , but it scares me to even think about meeting with someone who would hand over $ 500 for this piece of red fur that shakes .  -RDQ-"
nyt_eng_19961206_0218_28:3,neg-ext-subj,immediately_prepared,immediately,prepared,Neither was immediately prepared to comment on Lang 's report .,nyt_eng_19961206_0218_28,3,nyt_eng_199612,"American and BA have said they 're unwilling to give up any slots and have said that if regulators force a giveaway , they should be paid for .","It said 70 of the slots should be given up for the winter season in 1997 and 28 more in the following summer season , allowing other airlines to compete once BA and American begin the pact next year ."
nyt_eng_19980129_0222_65:12,neg-ext-subj,especially_bright,especially,bright,"Naturally this gets complicated and , since neither of them is especially bright , eventually leads to a sale to an undercover government agent and a stream of wild contrivances , from a stolen gun to a homicidal maniac released from prison .",nyt_eng_19980129_0222_65,12,nyt_eng_199801,A pair of homicide officers -LRB- James Belushi and Tupac Shakur in his final role -RRB- pad their paychecks by selling drugs and then retrieving their merchandise for resale by killing their customers .,"-LBQ-  As ` Gang Related ' comes none too soon to its conclusion , the long tentacle of coincidence nearly strangles suspended disbelief  -RDQ-  -LRB- Lawrence Van Gelder -RRB- ."
nyt_eng_19980120_0731_31:27,neg-ext-subj,as_trendy,as,trendy,"More and more meats are described as  -LBQ-  rubbed  -RDQ-  or  -LBQ-  crusted ,  -RDQ-  and while focaccia and seven-grain breads remain popular , neither is as trendy as ciabatta , the rustic Northern Italian oval that has conquered the sandwich territory , for now .",nyt_eng_19980120_0731_31,27,nyt_eng_199801,"As soon as one new ingredient joins the sandwich fold , it 's seemingly everywhere  -COL-  witness the profusion of sandwiches with avocado , or chipotle-flavored mayonnaise or aioli .","But too often , the effort to achieve individuality results in sameness , particularly in sandwich descriptions , which have adopted some of the overheated menu prose of fancy restaurants ."
nyt_eng_19980114_0540_12:4,neg-ext-subj,i._many,i.,many,"But neither am I. Many of the folks I know found the film entertaining because its characters , or at least the situations they find themselves in , seem familiar .",nyt_eng_19980114_0540_12,4,nyt_eng_199801,"And , because appreciation of a movie is subjective , they are not entirely wrong .","-LBQ-  Soul Food  -RDQ-  is a story of a mother , her three daughters and their husbands and kids who are bound together by a 40-year-old tradition  -COL-  Sunday dinner at grandma 's house ."
