hit_id,category,colloc,adv,adj,sent_text,sent_id,adv_index,json_source,prev_sent,next_sent,label,status
nyt_eng_19981022_0492_94:11,neg-ext-subj,too_far-fetched,too,far-fetched,"The evening at least suggests that no plot line is too far-fetched , nor has the nation ever been more provoked to needing catharsis .",nyt_eng_19981022_0492_94,11,nyt_eng_199810,"Reading from transcripts of real hearings , Culver Casson portrays Monica Lewinsky before the grand jury .",-LRB- Ozier Muhammad\/New York Times Photo -RRB-,nyt_eng_19981022_0492_94:11_discard,discard
nyt_eng_19981022_0399_32:18,neg-ext-subj,as_important,as,important,"From his point of view , he said ,  -LBQ-  No career , including mine , is as important as breaking the hold of this system of legalized bribery .  -RDQ-",nyt_eng_19981022_0399_32,18,nyt_eng_199810,"In effect , Feingold is gambling his political career on the premise that he can stick up for the principles embodied in his reform bill , specifically its ban on soft money , and still win a second term .","Asked how close he was to saying ,  -LBQ-  I 'd rather be right than re-elected ,  -RDQ-  Feingold answered  -COL-   -LBQ-  Oh , I 'm there already .",nyt_eng_19981022_0399_32:18_discard,discard
nyt_eng_19981002_0174_9:17,neg-ext-subj,vividly_red,vividly,red,Not even cornflowers can match the blue of an indigo bunting ; no rose is as vividly red as a scarlet tanager .,nyt_eng_19981002_0174_9,17,nyt_eng_199810,A garden 's birds are a fine complement to its flowers and vegetables .,"Even drab-color birds improve the landscape , like plants grown as a quiet background .",nyt_eng_19981002_0174_9:17_discard,discard
nyt_eng_19990328_0198_6:36,neg-ext-subj,too_small,too,small,"The Yugoslavs , a technically savvy group for decades , have used the Web to create an entire news network consisting of e-mail exchanges , chat rooms and bulletin boards _ where no rumor is too small to dissect at length and almost no hamlet too remote to mention .",nyt_eng_19990328_0198_6,36,nyt_eng_199903,This is the first instance of warfare where a small but significant slice of the population has Internet access .,"Members of the diaspora community , not sated by 24-hour cable television news , catch themselves hunched over their computer screens for five , six , seven hours a day , trolling for reports from home .",nyt_eng_19990328_0198_6:36_discard,discard
nyt_eng_19990324_0379_31:6,neg-ext-subj,immediately_available,immediately,available,No detailed casualty reports were immediately available .,nyt_eng_19990324_0379_31,6,nyt_eng_199903,NATO 's 17 days of air strikes against Serbian forces in Bosnia in 1995 were conducted at the request of the embattled Bosnian government against military targets of the Bosnian Serbs .,"But scores of Yugoslav military bases and depots , aircraft and munitions factories were expected to be targeted by NATO forces equipped with more than 400 bomber aircraft from European bases , and missile weaponry aboard a half dozen warships in the Adriatic region .",nyt_eng_19990324_0379_31:6_discard,discard
nyt_eng_19990324_0028_20:4,neg-ext-subj,immediately_available,immediately,available,No information was immediately available about survivors .,nyt_eng_19990324_0028_20,4,nyt_eng_199903,"He also appeared on  -LBQ-  Roseanne ,  -RDQ-   -LBQ-  Dave 's World ,  -RDQ-   -LBQ-  Sister , Sister  -RDQ-  and  -LBQ-  Mad About You .  -RDQ-",,nyt_eng_19990324_0028_20:4_discard,discard
nyt_eng_19990322_0062_44:17,neg-ext-subj,as_controversial,as,controversial,"-LRB- BEGIN ITALICS HERE -RRB- Perhaps no part of the original  -LBQ-  EYAWTKAS BWATA  -RDQ-  was as controversial as Chapter 8 ,  -LBQ-  Male Homosexuality .  -RDQ-",nyt_eng_19990322_0062_44,17,nyt_eng_199903,But the mental suffering can go on for years .,"With pronouncements like  -LBQ-  The majority of gay guys , when they cruise , dispense with the courtship  -RDQ-  and  -LBQ-  Homosexuals thrive on danger ,  -RDQ-  it depicted homosexual life as unrelievedly bleak and impersonal  -COL-  -LRB- END ITALICS HERE -RRB-",nyt_eng_19990322_0062_44:17_discard,discard
nyt_eng_19990320_0083_44:17,neg-ext-subj,as_controversial,as,controversial,"-LRB- BEGIN ITALICS HERE -RRB- Perhaps no part of the original  -LBQ-  EYAWTKAS BWATA  -RDQ-  was as controversial as Chapter 8 ,  -LBQ-  Male Homosexuality .  -RDQ-",nyt_eng_19990320_0083_44,17,nyt_eng_199903,But the mental suffering can go on for years .,"With pronouncements like  -LBQ-  The majority of gay guys , when they cruise , dispense with the courtship  -RDQ-  and  -LBQ-  Homosexuals thrive on danger ,  -RDQ-  it depicted homosexual life as unrelievedly bleak and impersonal  -COL-  -LRB- END ITALICS HERE -RRB-",nyt_eng_19990320_0083_44:17_discard,discard
nyt_eng_19990320_0082_44:17,neg-ext-subj,as_controversial,as,controversial,"-LRB- BEGIN ITALICS HERE -RRB- Perhaps no part of the original  -LBQ-  EYAWTKAS BWATA  -RDQ-  was as controversial as Chapter 8 ,  -LBQ-  Male Homosexuality .  -RDQ-",nyt_eng_19990320_0082_44,17,nyt_eng_199903,But the mental suffering can go on for years .,"With pronouncements like  -LBQ-  The majority of gay guys , when they cruise , dispense with the courtship  -RDQ-  and  -LBQ-  Homosexuals thrive on danger ,  -RDQ-  it depicted homosexual life as unrelievedly bleak and impersonal  -COL-  -LRB- END ITALICS HERE -RRB-",nyt_eng_19990320_0082_44:17_discard,discard
nyt_eng_19990316_0076_117:30,neg-ext-subj,too_small,too,small,"consolidator has opened a Web site to accept bids on domestic and overseas tickets , and the owner says that no bid _ not even $ 1 _ is too small to start .",nyt_eng_19990316_0076_117,30,nyt_eng_199903,WITH  -COL-  TRAVEL BRIEFS  -COL-  A New York tour operator and airline-ticket,BOOKS  -COL-  ` VISIONS OF TECHNOLOGY ',nyt_eng_19990316_0076_117:30_discard,discard
nyt_eng_19990311_0094_31:40,neg-ext-subj,too_small,too,small,"TRAVEL BRIEFS _ A New York tour operator and airline-ticket consolidator has opened a Web site to accept bids on domestic and overseas tickets , and the owner says that no bid _ not even $ 1 _ is too small to start .",nyt_eng_19990311_0094_31,40,nyt_eng_199903,Times News Service -RRB-,"-LRB- Staff , N.Y.",nyt_eng_19990311_0094_31:40_discard,discard
nyt_eng_19991129_0180_3:18,neg-ext-subj,too_horrifying,too,horrifying,"It serves as a reminder that , as Europe enters the 21st century , no nightmare is too horrifying to be real .",nyt_eng_19991129_0180_3,18,nyt_eng_199911,"Now , Srebrenica _  -LBQ-  place of silver ,  -RDQ-  known to the Romans as Argentaria _ stands as the ultimate symbol of the horror that Serbian ethnic-cleanser Slobodan Milosevic has unleashed in the Balkans in the past decade .","In the half-century since 1945 , politicians have repeatedly chanted about  -LBQ-  learning the lessons of history .  -RDQ-",nyt_eng_19991129_0180_3:18_discard,discard
nyt_eng_19991129_0179_3:18,neg-ext-subj,too_horrifying,too,horrifying,"It serves as a reminder that , as Europe enters the 21st century , no nightmare is too horrifying to be real .",nyt_eng_19991129_0179_3,18,nyt_eng_199911,"Now , Srebrenica _  -LBQ-  place of silver ,  -RDQ-  known to the Romans as Argentaria _ stands as the ultimate symbol of the horror that Serbian ethnic-cleanser Slobodan Milosevic has unleashed in the Balkans in the past decade .","In the half-century since 1945 , politicians have repeatedly chanted about  -LBQ-  learning the lessons of history .  -RDQ-",nyt_eng_19991129_0179_3:18_discard,discard
nyt_eng_19991129_0051_3:18,neg-ext-subj,too_horrifying,too,horrifying,"It serves as a reminder that , as Europe enters the 21st century , no nightmare is too horrifying to be real .",nyt_eng_19991129_0051_3,18,nyt_eng_199911,"Now , Srebrenica _  -LBQ-  place of silver ,  -RDQ-  known to the Romans as Argentaria _ stands as the ultimate symbol of the horror that Serbian ethnic-cleanser Slobodan Milosevic has unleashed in the Balkans in the past decade .","In the half-century since 1945 , politicians have repeatedly chanted about  -LBQ-  learning the lessons of history .  -RDQ-",nyt_eng_19991129_0051_3:18_discard,discard
nyt_eng_19991129_0050_3:18,neg-ext-subj,too_horrifying,too,horrifying,"It serves as a reminder that , as Europe enters the 21st century , no nightmare is too horrifying to be real .",nyt_eng_19991129_0050_3,18,nyt_eng_199911,"Now , Srebrenica _  -LBQ-  place of silver ,  -RDQ-  known to the Romans as Argentaria _ stands as the ultimate symbol of the horror that Serbian ethnic-cleanser Slobodan Milosevic has unleashed in the Balkans in the past decade .","In the half-century since 1945 , politicians have repeatedly chanted about  -LBQ-  learning the lessons of history .  -RDQ-",nyt_eng_19991129_0050_3:18_discard,discard
nyt_eng_19991129_0049_3:18,neg-ext-subj,too_horrifying,too,horrifying,"It serves as a reminder that , as Europe enters the 21st century , no nightmare is too horrifying to be real .",nyt_eng_19991129_0049_3,18,nyt_eng_199911,"Now , Srebrenica _  -LBQ-  place of silver ,  -RDQ-  known to the Romans as Argentaria _ stands as the ultimate symbol of the horror that Serbian ethnic-cleanser Slobodan Milosevic has unleashed in the Balkans in the past decade .","In the half-century since 1945 , politicians have repeatedly chanted about  -LBQ-  learning the lessons of history .  -RDQ-",nyt_eng_19991129_0049_3:18_discard,discard
nyt_eng_19991108_0100_16:17,neg-ext-subj,as_prestigious,as,prestigious,"Musicians often referred to a gig as an  -LBQ-  apple ,  -RDQ-  and no gig was as prestigious as playing New York City _ hence playing the  -LBQ-  big apple .  -RDQ-",nyt_eng_19991108_0100_16,17,nyt_eng_199911,Its likely origin was in a Harlem club in the 1920s named the Big Apple .,"Q  -COL-  If I put a savings account in my name and a relative 's name , can Medicare and the government take this money and use it to pay for my expenses in a nursing home ? I am trying to look down the road .",nyt_eng_19991108_0100_16:17_discard,discard
nyt_eng_19991104_0430_93:9,neg-ext-subj,too_brief,too,brief,Manhattan detectives who decided that no life is too brief to go unrecognized arranged an elaborate funeral at the cathedral for an anonymous newborn baby girl whose body they had found abandoned last month in a street corner trash bin .,nyt_eng_19991104_0430_93,9,nyt_eng_199911,buildings are reflected on the window of a hearse carrying the coffin of a young infant following a funeral Mass at St. Patrick 's Cathedral on Thursday .,-LRB- Angel Franco\/New York Times Photo -RRB-,nyt_eng_19991104_0430_93:9_discard,discard
nyt_eng_19991104_0429_93:9,neg-ext-subj,too_brief,too,brief,Manhattan detectives who decided that no life is too brief to go unrecognized arranged an elaborate funeral at the cathedral for an anonymous newborn baby girl whose body they had found abandoned last month in a street corner trash bin .,nyt_eng_19991104_0429_93,9,nyt_eng_199911,buildings are reflected on the window of a hearse carrying the coffin of a young infant following a funeral Mass at St. Patrick 's Cathedral on Thursday .,-LRB- Angel Franco\/New York Times Photo -RRB-,nyt_eng_19991104_0429_93:9_discard,discard
nyt_eng_19991104_0427_93:9,neg-ext-subj,too_brief,too,brief,Manhattan detectives who decided that no life is too brief to go unrecognized arranged an elaborate funeral at the cathedral for an anonymous newborn baby girl whose body they had found abandoned last month in a street corner trash bin .,nyt_eng_19991104_0427_93,9,nyt_eng_199911,buildings are reflected on the window of a hearse carrying the coffin of a young infant following a funeral Mass at St. Patrick 's Cathedral on Thursday .,-LRB- Angel Franco\/New York Times Photo -RRB-,nyt_eng_19991104_0427_93:9_discard,discard
nyt_eng_19991104_0425_93:9,neg-ext-subj,too_brief,too,brief,Manhattan detectives who decided that no life is too brief to go unrecognized arranged an elaborate funeral at the cathedral for an anonymous newborn baby girl whose body they had found abandoned last month in a street corner trash bin .,nyt_eng_19991104_0425_93,9,nyt_eng_199911,buildings are reflected on the window of a hearse carrying the coffin of a young infant following a funeral Mass at St. Patrick 's Cathedral on Thursday .,-LRB- Angel Franco\/New York Times Photo -RRB-,nyt_eng_19991104_0425_93:9_discard,discard
nyt_eng_19991104_0243_27:5,neg-ext-subj,too_complicated,too,complicated,No problem here is too complicated to be settled by a good-humored dance scene .,nyt_eng_19991104_0243_27,5,nyt_eng_199911,There he finds temptation in the form of an old flame and a lot of genial guy talk about the meaning of marriage .,Another demonstration that current movies about upscale black characters have much more solid traditional values than ones about catty white teen-agers -LRB- Maslin -RRB- .,nyt_eng_19991104_0243_27:5_discard,discard
nyt_eng_19970924_0381_10:8,neg-ext-subj,as_dynamic,as,dynamic,"No area of the economy has been as dynamic this decade as exports , which more than doubled between 1992 and 1996 .",nyt_eng_19970924_0381_10,8,nyt_eng_199709,Exports .,"Mexico accounted for less than 7 percent of all U.S. imports in 1993 , a figure expected to rise this year to 10 percent .",nyt_eng_19970924_0381_10:8_discard,discard
nyt_eng_19970922_0199_19:5,neg-ext-subj,as_willing,as,willing,No tobacco executive is as willing as Broughton to discuss differences within the industry .,nyt_eng_19970922_0199_19,5,nyt_eng_199709,B.A.T said it was  -LBQ-  encouraged  -RDQ-  that Clinton did n't reject the June 20 accord and  -LBQ-  discouraged  -RDQ-  by Vice President Gore 's remarks that the administration would n't settle for  -LBQ-  half-a-loaf .  -RDQ-,"He has even criticized the June pact signed by the company , saying it contained  -LBQ-  fallacious thinking  -RDQ-  and that he signed it only reluctantly .",nyt_eng_19970922_0199_19:5_discard,discard
nyt_eng_19970918_0578_3:5,neg-ext-subj,immediately_available,immediately,available,No other details were immediately available .,nyt_eng_19970918_0578_3,5,nyt_eng_199709,Zedillo and President Arnoldo Aleman Lacayo of Nicaragua were expected to sign an agreement during a ceremony at 7 p.m. -LRB- 8 p.m. U.S. Eastern -RRB- Thursday at the National Palace .,"Last year , Mexico posted a trade surplus of $ 40.4 million with Nicaragua , up from a $ 22.7 million surplus in 1995 and a $ 4.4 million deficit in 1990 , according to the government 's Banco",nyt_eng_19970918_0578_3:5_discard,discard
nyt_eng_19970917_0304_5:4,neg-ext-subj,too_strong,too,strong,No words are too strong _ nor any action too outrageous _ for British Columbia 's feisty Premier Glen Clark .,nyt_eng_19970917_0304_5,4,nyt_eng_199709,negotiations of this summer 's U.S.-Canada salmon war have produced a curious reversal in positions taken by two of the prime combatants .,"In Juneau , an old mining town from which Alaska politicians have long railed against America 's federal government and fishing interests of the  -LBQ-  lower 48  -RDQ-  states , Gov. Tony Knowles is preaching peace .",nyt_eng_19970917_0304_5:4_discard,discard
nyt_eng_19970917_0297_5:4,neg-ext-subj,too_strong,too,strong,No words are too strong _ nor any action too outrageous _ for British Columbia 's feisty Premier Glen Clark .,nyt_eng_19970917_0297_5,4,nyt_eng_199709,negotiations of this summer 's U.S.-Canada salmon war have produced a curious reversal in positions taken by two of the prime combatants .,"In Juneau , an old mining town from which Alaska politicians have long railed against America 's federal government and fishing interests of the  -LBQ-  lower 48  -RDQ-  states , Gov. Tony Knowles is preaching peace .",nyt_eng_19970917_0297_5:4_discard,discard
nyt_eng_19970913_0068_39:17,neg-ext-subj,too_far-reaching,too,far-reaching,"And , in what has at times felt like mass hysteria , no suggestion has been too far-reaching .",nyt_eng_19970913_0068_39,17,nyt_eng_199709,"In Paris , newspapers have reported that some tourist groups are being led to the spot in the tunnel where she met her death .",Some have proposed renaming Heathrow Airport after the princess .,nyt_eng_19970913_0068_39:17_discard,discard
nyt_eng_19970910_0728_20:4,neg-ext-subj,too_small,too,small,No job was too small for him .,nyt_eng_19970910_0728_20,4,nyt_eng_199709,"Christopher gave off the sense that he wanted a deal , he wanted a trophy , more than the parties themselves did , so he ended up as their baby sitter .",He was reduced to a messenger because he had no message of his own .,nyt_eng_19970910_0728_20:4_discard,discard
nyt_eng_19970903_0258_44:6,neg-ext-subj,plain_average,plain,average,No season has ever been plain average .,nyt_eng_19970903_0258_44,6,nyt_eng_199709,"Foer sifted through the Lexis-Nexis database for Broadway-related stories from the past five years and found  -COL-   -LBQ-  In the Times ' pages , Broadway has died a thousand deaths and prospered in a thousand booms .",...,nyt_eng_19970903_0258_44:6_discard,discard
nyt_eng_19950327_0348_9:4,neg-ext-subj,too_insignificant,too,insignificant,"No fragment is too insignificant , it seems .",nyt_eng_19950327_0348_9,4,nyt_eng_199503,"Of great interest to Christian scholars are possible connections between the ideas and phrases of some of these documents and those of the New Testament , written 100 to 300 years later .","For instance , one tiny piece of scroll appears to contain text similar to a line that appears in the Gospel of St. Mark .",nyt_eng_19950327_0348_9:4_discard,discard
nyt_eng_19950326_0125_7:8,neg-ext-subj,quite_ordinary,quite,ordinary,No tale of two lovers is ever quite ordinary .,nyt_eng_19950326_0125_7,8,nyt_eng_199503,"But Ms. Harbury tells it as a love story , her first , though she was married once before to a Texas lawyer whom she lived with only briefly .",Yet Ms. Harbury 's romance carried special poignancy and sadness .,nyt_eng_19950326_0125_7:8_discard,discard
nyt_eng_19950326_0122_7:8,neg-ext-subj,quite_ordinary,quite,ordinary,No tale of two lovers is ever quite ordinary .,nyt_eng_19950326_0122_7,8,nyt_eng_199503,"But Ms. Harbury tells it as a love story , her first , though she was married once before to a Texas lawyer whom she lived with only briefly .",Yet Ms. Harbury 's romance carried special poignancy and sadness .,nyt_eng_19950326_0122_7:8_discard,discard
nyt_eng_19950315_0447_24:5,neg-ext-subj,so_important,so,important,"-LBQ-  No president is so important that we will belong to him if he undermines us on this issue ,  -RDQ-  said Ms. Waters , who is black .",nyt_eng_19950315_0447_24,5,nyt_eng_199503,"-LBQ-  No party is so important that we will belong to it if it undermines us on this issue ,  -RDQ-  said Rep. Maxine Waters , D-Calif . , who was co-chairwoman of Clinton 's 1992 national campaign .",-LRB- STORY CAN END HERE .,nyt_eng_19950315_0447_24:5_discard,discard
nyt_eng_19950315_0447_23:5,neg-ext-subj,so_important,so,important,"-LBQ-  No party is so important that we will belong to it if it undermines us on this issue ,  -RDQ-  said Rep. Maxine Waters , D-Calif . , who was co-chairwoman of Clinton 's 1992 national campaign .",nyt_eng_19950315_0447_23,5,nyt_eng_199503,But the group meeting Wednesday at the White House made it clear that the president would alienate many of the Democratic party 's most loyal supporters should he backtrack on affirmative action .,"-LBQ-  No president is so important that we will belong to him if he undermines us on this issue ,  -RDQ-  said Ms. Waters , who is black .",nyt_eng_19950315_0447_23:5_discard,discard
nyt_eng_19950310_0493_5:5,neg-ext-subj,immediately_available,immediately,available,No further information was immediately available .,nyt_eng_19950310_0493_5,5,nyt_eng_199503,"The FBI background check on Carns unearthed  -LBQ-  a problem with some domestic help he brought into the country ,  -RDQ-  the source said .","Carns , a former combat pilot who had been named by Clinton to replace former CIA director R. James Woolsey , has been spending time with his family on the West Coast while waiting for the background check on his candidacy to proceed , according to officials .",nyt_eng_19950310_0493_5:5_discard,discard
nyt_eng_19950304_0150_1:11,neg-ext-subj,too_short,too,short,"In the hallways of Congress , no legislative provision is too short , no sentence too succinct , no word too insignificant to be manipulated by lobbyists for advantage .",nyt_eng_19950304_0150_1,11,nyt_eng_199503,,But tracing the language of the product liability legislation that is working its way through the House of Representatives offers telling lessons in the riches that can be found in obscurity .,nyt_eng_19950304_0150_1:11_discard,discard
nyt_eng_19981124_0110_14:16,neg-ext-subj,too_large,too,large,"On the north shore of Oahu , the coastline becomes theater  -COL-  no wave is too large for the world 's most daring and accomplished surfers , who look like specks in the winter swell .",nyt_eng_19981124_0110_14,16,nyt_eng_199811,"As for surfing , winter is its zenith , a time when  -LBQ-  pray for surf  -RDQ-  is the prevailing mantra and waves are n't big unless they 're 15 feet or higher .","These attractions are free , a considerable plus in a state reeling with economic woes .",nyt_eng_19981124_0110_14:16_discard,discard
nyt_eng_19981123_0195_14:16,neg-ext-subj,too_large,too,large,"On the north shore of Oahu , the coastline becomes theater  -COL-  no wave is too large for the world 's most daring and accomplished surfers , who look like specks in the winter swell .",nyt_eng_19981123_0195_14,16,nyt_eng_199811,"As for surfing , winter is its zenith , a time when  -LBQ-  pray for surf  -RDQ-  is the prevailing mantra and waves are n't big unless they 're 15 feet or higher .","These attractions are free , a considerable plus in a state reeling with economic woes .",nyt_eng_19981123_0195_14:16_discard,discard
nyt_eng_19981123_0194_14:16,neg-ext-subj,too_large,too,large,"On the north shore of Oahu , the coastline becomes theater  -COL-  no wave is too large for the world 's most daring and accomplished surfers , who look like specks in the winter swell .",nyt_eng_19981123_0194_14,16,nyt_eng_199811,"As for surfing , winter is its zenith , a time when  -LBQ-  pray for surf  -RDQ-  is the prevailing mantra and waves are n't big unless they 're 15 feet or higher .","These attractions are free , a considerable plus in a state reeling with economic woes .",nyt_eng_19981123_0194_14:16_discard,discard
nyt_eng_19981103_0086_35:23,neg-ext-subj,entirely_terror-proof,entirely,terror-proof,The attempted bombing of a bus full of Israeli children last week illustrates yet again that no security arrangement can ever be entirely terror-proof .,nyt_eng_19981103_0086_35,23,nyt_eng_199811,The agreement at Wye did nothing to revive that hope and little to prevent the horror .,"The prevailing belief in Israel is that if the children on the bus had been hurt , the Wye agreement would effectively have been nullified .",nyt_eng_19981103_0086_35:23_discard,discard
nyt_eng_19981101_0076_10:5,neg-ext-subj,as_dependable,as,dependable,But no group is as dependable as African Americans in their support of a political party .,nyt_eng_19981101_0076_10,5,nyt_eng_199811,"With voter turnout Tuesday expected to be low , as it usually is in non-presidential elections , both parties are targeting their core supporters .","In every presidential election since 1964 , no fewer than seven out of 10 blacks have voted Democratic .",nyt_eng_19981101_0076_10:5_discard,discard
nyt_eng_19961007_0701_30:4,neg-ext-subj,ever_likely,ever,likely,No Libertarian is ever likely to win the White House .,nyt_eng_19961007_0701_30,4,nyt_eng_199610,"Billionaire Perot , on the other hand _ supposedly so alarmed about the national debt _ has taken more than $ 29 million in federal campaign money .","The party 's principles are incompatible with cant , log-rolling , something-for-everybody and political largesse .",nyt_eng_19961007_0701_30:4_discard,discard
nyt_eng_19961004_0085_4:5,neg-ext-subj,immediately_available,immediately,available,No further details were immediately available .,nyt_eng_19961004_0085_4,5,nyt_eng_199610,"The sackings are the first since Cornelis ,  -LBQ-  Cor  -RDQ-  Boonstra succeeded Jan Timmer as president of the electronics company on Tuesday .","On the Amsterdam bourse , Philips ' shares fell 20 cents to 60.7 guilders .",nyt_eng_19961004_0085_4:5_discard,discard
nyt_eng_19961003_0211_57:7,neg-ext-subj,as_loud,as,loud,"No sound in any courtroom is as loud as the defendant 's silence when he is accused of the most serious crime of all , murder .",nyt_eng_19961003_0211_57,7,nyt_eng_199610,But after the trial he wanted to talk to everyone else about what happened .,"And he chooses not to deny it from the witness stand ? When a person is falsely accused of a murder , it should take a team of wild horses to keep him from the witness stand .",nyt_eng_19961003_0211_57:7_discard,discard
nyt_eng_19961003_0208_57:7,neg-ext-subj,as_loud,as,loud,"No sound in any courtroom is as loud as the defendant 's silence when he is accused of the most serious crime of all , murder .",nyt_eng_19961003_0208_57,7,nyt_eng_199610,But after the trial he wanted to talk to everyone else about what happened .,"And he chooses not to deny it from the witness stand ? When a person is falsely accused of a murder , it should take a team of wild horses to keep him from the witness stand .",nyt_eng_19961003_0208_57:7_discard,discard
