hit_id,category,colloc,adv,adj,sent_text,sent_id,adv_index,json_source,prev_sent,next_sent,label,status
nyt_eng_19960721_0124_23:15,neg-ext-subj,that_simple,that,simple,"As the abortion debate shows , nothing about men , women and politics is that simple .",nyt_eng_19960721_0124_23,15,nyt_eng_199607,-LBQ-  Uh-uh .  -RDQ-,,nyt_eng_19960721_0124_23:15_discard,discard
nyt_eng_19960720_0306_23:15,neg-ext-subj,that_simple,that,simple,"As the abortion debate shows , nothing about men , women and politics is that simple .",nyt_eng_19960720_0306_23,15,nyt_eng_199607,-LBQ-  Uh-uh .  -RDQ-,,nyt_eng_19960720_0306_23:15_discard,discard
nyt_eng_19960720_0127_23:15,neg-ext-subj,that_simple,that,simple,"As the abortion debate shows , nothing about men , women and politics is that simple .",nyt_eng_19960720_0127_23,15,nyt_eng_199607,-LBQ-  Uh-uh .  -RDQ-,,nyt_eng_19960720_0127_23:15_discard,discard
nyt_eng_19960704_0207_42:28,neg-ext-subj,truly_private,truly,private,"I always assume that whenever I 'm on line , there 'll be a rec-ord of it somewhere , and that nothing done on the Internet is truly private .",nyt_eng_19960704_0207_42,28,nyt_eng_199607,But the citizen 's most valuable defense is prudence and common sense .,"A little paranoid , perhaps .",nyt_eng_19960704_0207_42:28_discard,discard
nyt_eng_19970917_0215_15:30,neg-ext-subj,so_compelling,so,compelling,"Who needs anything more than Internet access ? Until recently , the services ' appeal was supposed to be the exclusive content they provide , but nothing has been so compelling it can not be ignored .",nyt_eng_19970917_0215_15,30,nyt_eng_199709,"So are chat areas , games , newspapers , encyclopedias and travel agents .","It may be , in fact , that the online service will have to rely less on content than on style , on the kind of environment it creates , on the elegance of its structure and on the design of the screen .",nyt_eng_19970917_0215_15:30_discard,discard
nyt_eng_19970914_0122_15:30,neg-ext-subj,so_compelling,so,compelling,"Who needs anything more than Internet access ? Until recently , the services ' appeal was supposed to be the exclusive content they provide , but nothing has been so compelling it can not be ignored .",nyt_eng_19970914_0122_15,30,nyt_eng_199709,"So are chat areas , games , newspapers , encyclopedias and travel agents .","It may be , in fact , that the online service will have to rely less on content than on style , on the kind of environment it creates , on the elegance of its structure and on the design of the screen .",nyt_eng_19970914_0122_15:30_discard,discard
nyt_eng_19970904_0858_22:5,neg-ext-subj,so_simple,so,simple,But nothing is ever so simple in Russia these days .,nyt_eng_19970904_0858_22,5,nyt_eng_199709,"president last year , it looked as if Russia was finally about to roll out the red carpet for Western oil companies .","Instead of moving smartly ahead , several major new oil projects have been put on hold .",nyt_eng_19970904_0858_22:5_discard,discard
nyt_eng_19970904_0857_22:5,neg-ext-subj,so_simple,so,simple,But nothing is ever so simple in Russia these days .,nyt_eng_19970904_0857_22,5,nyt_eng_199709,"president last year , it looked as if Russia was finally about to roll out the red carpet for Western oil companies .","Instead of moving smartly ahead , several major new oil projects have been put on hold .",nyt_eng_19970904_0857_22:5_discard,discard
nyt_eng_19970904_0842_6:5,neg-ext-subj,so_simple,so,simple,But nothing is ever so simple in Russia these days .,nyt_eng_19970904_0842_6,5,nyt_eng_199709,"And with Yeltsin 's free marketeers in charge , the opportunity to turn the economy around was supposed to supplant endless ideological debate .","Instead of moving smartly ahead , several major new oil projects have been put on hold .",nyt_eng_19970904_0842_6:5_discard,discard
nyt_eng_19970904_0840_6:5,neg-ext-subj,so_simple,so,simple,But nothing is ever so simple in Russia these days .,nyt_eng_19970904_0840_6,5,nyt_eng_199709,"And with Yeltsin 's free marketeers in charge , the opportunity to turn the economy around was supposed to supplant endless ideological debate .","Instead of moving smartly ahead , several major new oil projects have been put on hold .",nyt_eng_19970904_0840_6:5_discard,discard
nyt_eng_19970904_0750_22:5,neg-ext-subj,so_simple,so,simple,But nothing is ever so simple in Russia these days .,nyt_eng_19970904_0750_22,5,nyt_eng_199709,"president last year , it looked as if Russia was finally about to roll out the red carpet for Western oil companies .","Instead of moving smartly ahead , several major new oil projects have been put on hold .",nyt_eng_19970904_0750_22:5_discard,discard
nyt_eng_19970904_0749_22:5,neg-ext-subj,so_simple,so,simple,But nothing is ever so simple in Russia these days .,nyt_eng_19970904_0749_22,5,nyt_eng_199709,"president last year , it looked as if Russia was finally about to roll out the red carpet for Western oil companies .","Instead of moving smartly ahead , several major new oil projects have been put on hold .",nyt_eng_19970904_0749_22:5_discard,discard
nyt_eng_19950426_0503_5:27,neg-ext-subj,as_beautiful,as,beautiful,"She had come to Washington to campaign before Congress against the colorization of movies , which seemed appropriate , since nothing filmed in color was ever as beautiful as the sight of Ginger Rogers in a feathery gown spinning through a black and white Art Deco moonscape with Fred Astaire .",nyt_eng_19950426_0503_5,27,nyt_eng_199504,"She was sitting because her legs bothered her , but she was full of vinegar .",Watching herself in the colorized  -LBQ-  42nd Street  -RDQ-  had upset her .,nyt_eng_19950426_0503_5:27_discard,discard
nyt_eng_19981119_0152_71:3,neg-ext-subj,too_casual,too,casual,"Nothing is too casual or too portentous to escape him , including the increasing likelihood of a violent death .",nyt_eng_19981119_0152_71,3,nyt_eng_199811,"Even though one may balk at one or another of his positions , his personal history of how the Third Reich month by month , sometimes week by week , accelerated its crusade against the Jews gives as accurate a picture of Nazi trickery and brutality as we are likely to have .",Not all of Klemperer 's entries report the minutiae of living .,nyt_eng_19981119_0152_71:3_discard,discard
nyt_eng_19981110_0047_26:8,neg-ext-subj,ever_inevitable,ever,inevitable,"But the truth is that nothing was ever inevitable , not before the election and certainly not now .",nyt_eng_19981110_0047_26,8,nyt_eng_199811,"This position had its origins back in the silly days when the conventional wisdom among press and pols alike was that impeachment was  -LBQ-  inevitable ,  -RDQ-  that any deals or plea bargains should come at the virtually certain  -LBQ-  trial  -RDQ-  stage in the Senate .","Even before the election , there was nothing approaching a two-thirds majority in the Senate for tossing Clinton out of office .",nyt_eng_19981110_0047_26:8_discard,discard
nyt_eng_19951102_0136_79:10,neg-ext-subj,too_outlandish,too,outlandish,"Gambling , sex , Wayne Newton _ nothing is too outlandish .",nyt_eng_19951102_0136_79,10,nyt_eng_199511,"that anything goes way out here , away from decent folk .","Then , they tried to hold two major heavyweight fights on the same night .",nyt_eng_19951102_0136_79:10_discard,discard
nyt_eng_19951101_0091_11:29,neg-ext-subj,too_intimate,too,intimate,"Under the proddings of their masters and mistresses of ceremonies _ Jenny or Jerry or Sally or Ricki or whoever _ the participants tell all ; nothing is too intimate to spill , and they are grimly , hilariously earnest about spilling it .",nyt_eng_19951101_0091_11,29,nyt_eng_199511,"By any reasonable standard , the programs , combinations of party games and confrontation therapy , are repulsive ; they make the reformed  -LBQ-  Oprah  -RDQ-  seem like a fount of edification .","These are freak shows , with exhibitions of dysfunction in many forms , often with a sexual twist , run by shameless hucksters who are never more disgusting than when they are pretending to sympathize with the poor creatures they are displaying to a studio audience that is encouraged to whoop encouragement and howl displeasure .",nyt_eng_19951101_0091_11:29_discard,discard
nyt_eng_19970412_0081_5:8,neg-ext-subj,as_certain,as,certain,"For the time being , nothing is as certain as taxes on death .",nyt_eng_19970412_0081_5,8,nyt_eng_199704,The $ 100 billion the estate tax will raise in the next five years is essential to the goal in Congress and the White House of balancing the budget by 2002 .,"But down the road , Gingrich 's view may well prevail .",nyt_eng_19970412_0081_5:8_discard,discard
nyt_eng_19970408_0279_39:3,neg-ext-subj,so_eloquent,so,eloquent,Nothing is so eloquent as a slip of the tongue .,nyt_eng_19970408_0279_39,3,nyt_eng_199704,"In the same way , union leader Luis Barrionuevo , another man close to Argentina 's president , revealed the secret of corruption when he declared sincerely , even casually , more than five years ago , as if it were a well-accepted fact  -COL-   -LBQ-  In Argentina nobody makes money through hard work .  -RDQ-","Words , as Locke said ,  -LBQ-  are only the symbols of ideas which are in the mind who utters them .  -RDQ-",nyt_eng_19970408_0279_39:3_discard,discard
nyt_eng_19970407_0221_39:3,neg-ext-subj,so_eloquent,so,eloquent,Nothing is so eloquent as a slip of the tongue .,nyt_eng_19970407_0221_39,3,nyt_eng_199704,"In the same way , union leader Luis Barrionuevo , another man close to Argentina 's president , revealed the secret of corruption when he declared sincerely , even casually , more than five years ago , as if it were a well-accepted fact  -COL-   -LBQ-  In Argentina nobody makes money through hard work .  -RDQ-","Words , as Locke said ,  -LBQ-  are only the symbols of ideas which are in the mind who utters them .  -RDQ-",nyt_eng_19970407_0221_39:3_discard,discard
nyt_eng_19970407_0220_39:3,neg-ext-subj,so_eloquent,so,eloquent,Nothing is so eloquent as a slip of the tongue .,nyt_eng_19970407_0220_39,3,nyt_eng_199704,"In the same way , union leader Luis Barrionuevo , another man close to Argentina 's president , revealed the secret of corruption when he declared sincerely , even casually , more than five years ago , as if it were a well-accepted fact  -COL-   -LBQ-  In Argentina nobody makes money through hard work .  -RDQ-","Words , as Locke said ,  -LBQ-  are only the symbols of ideas which are in the mind who utters them .  -RDQ-",nyt_eng_19970407_0220_39:3_discard,discard
nyt_eng_19971126_0887_14:5,neg-ext-subj,that_different,that,different,"Perhaps nothing would be that different after all , especially in those parts of the Midwest _ and households in the Midwestern diaspora _ where the true sign of Thanksgiving dinner is a lead-crystal dish full of Spanish olives .",nyt_eng_19971126_0887_14,5,nyt_eng_199711,"The speculation does arise , however _ what would have happened if that first Thanksgiving had come in a lean year and the Pilgrims had been relegated to eating , say , opossum ? What if they had kindled a national taste for it ? Would possum breeders now be raising a super possum ? Would we recline , at the end of a long Thanksgiving feast , into a stupor of marsupiality and play dead for a while ?","This is a day to give thanks , and one of the things to give thanks for is the turkey _ not the big-busted commercial bird , but its leaner , wiser wild ancestor .",nyt_eng_19971126_0887_14:5_discard,discard
nyt_eng_19971118_0009_19:5,neg-ext-subj,even_hot,even,hot,Nothing is imminent or even hot on the burner .,nyt_eng_19971118_0009_19,5,nyt_eng_199711,-LBQ-  There have n't been any specific trades presented to us .,We 're listening and sorting through some things .  -RDQ-,nyt_eng_19971118_0009_19:5_discard,discard
nyt_eng_19961021_0607_5:4,neg-ext-subj,so_simple,so,simple,But nothing is so simple in Russia .,nyt_eng_19961021_0607_5,4,nyt_eng_199610,"-LBQ-  Sesame Street ,  -RDQ-  which is history 's most influential children 's television program , is often exported and usually welcome in the country to which it is sent .","It took five years and $ 6 million to develop an indigenous show that would appeal to Russian children , yet not be so gloomy that the people from Children 's Television Workshop refused to produce it .",nyt_eng_19961021_0607_5:4_discard,discard
nyt_eng_19961014_0131_27:12,neg-ext-subj,reliably_lucrative,reliably,lucrative,But the biggest reason is that nothing else is quite as reliably lucrative as tobacco .,nyt_eng_19961014_0131_27,12,nyt_eng_199610,Other crops demand marketing expertise that Kentucky farmers lack .,"The net return per acre is about $ 2,000 , compared with $ 200 - $ 300 for corn -LRB- maize -RRB- or soybeans , according to William Snell , an agricultural economist at the University of Kentucky .",nyt_eng_19961014_0131_27:12_discard,discard
nyt_eng_19961013_0228_14:15,neg-ext-subj,really_simple,really,simple,"Seamlessness is a form of fakery , Eisenman is saying , since nothing is really simple and nothing in life is really seamless .",nyt_eng_19961013_0228_14,15,nyt_eng_199610,The clashing angles make being in the Aronoff Center feel like living on a fault line  -COL-  the message of the building is to express the discordancies in life .,"But is exaggerating that idea also a form of fakery ? Well , it is certainly a form of mannerism _ and this is nothing if not a highly mannered building .",nyt_eng_19961013_0228_14:15_discard,discard
nyt_eng_19961012_0139_15:28,neg-ext-subj,as_symbolic,as,symbolic,"Despite the ongoing questions of credibility and integrity brought on by labor-management conflicts , the shifting of franchises and the movement of players , nothing has been as symbolic as that spray of spit .",nyt_eng_19961012_0139_15,28,nyt_eng_199610,"The likes of Albert Belle , George Steinbrenner and The Commissioner Who Is Not There have been the current messengers , but even Commissioner Kenesaw Mountain Landis turns out to have been a retrograde bigot who scapegoated Shoeless Joe primarily for public relations reasons .","-LBQ-  Alomar teaches us that authority can be spat at ,  -RDQ-  French says ,  -LBQ-  that all our institutions can be mocked and knocked down .",nyt_eng_19961012_0139_15:28_discard,discard
nyt_eng_19961011_0044_27:12,neg-ext-subj,reliably_lucrative,reliably,lucrative,But the biggest reason is that nothing else is quite as reliably lucrative as tobacco .,nyt_eng_19961011_0044_27,12,nyt_eng_199610,Other crops demand marketing expertise that Kentucky farmers lack .,"The net return per acre is about $ 2,000 , compared with $ 200 - $ 300 for corn -LRB- maize -RRB- or soybeans , according to William Snell , an agricultural economist at the University of Kentucky .",nyt_eng_19961011_0044_27:12_discard,discard
nyt_eng_19961011_0043_27:12,neg-ext-subj,reliably_lucrative,reliably,lucrative,But the biggest reason is that nothing else is quite as reliably lucrative as tobacco .,nyt_eng_19961011_0043_27,12,nyt_eng_199610,Other crops demand marketing expertise that Kentucky farmers lack .,"The net return per acre is about $ 2,000 , compared with $ 200 - $ 300 for corn -LRB- maize -RRB- or soybeans , according to William Snell , an agricultural economist at the University of Kentucky .",nyt_eng_19961011_0043_27:12_discard,discard
nyt_eng_19950925_0305_30:12,neg-ext-subj,immediately_useful,immediately,useful,hereditary aspects of crime agree that nothing in their studies is immediately useful for treating crimiinals .,nyt_eng_19950925_0305_30,12,nyt_eng_199509,CRIME-GENE-SCI -LRB- Undated -RRB- _ Participants at conference on,By Natalie Angier .,nyt_eng_19950925_0305_30:12_discard,discard
nyt_eng_19950915_0276_18:10,neg-ext-subj,racially_motivated,racially,motivated,"Not true , Carroll said  -COL-   -LBQ-  Nothing is racially motivated .",nyt_eng_19950915_0276_18,10,nyt_eng_199509,The ACLU and other detractors also argue that the sheriff is setting up the roadblocks to harass the beachgoers because they are black .,The officer in charge of the detail is black .,nyt_eng_19950915_0276_18:10_discard,discard
nyt_eng_19950912_0115_18:10,neg-ext-subj,racially_motivated,racially,motivated,"Not true , Carroll said  -COL-   -LBQ-  Nothing is racially motivated .",nyt_eng_19950912_0115_18,10,nyt_eng_199509,The ACLU and other detractors also argue that the sheriff is setting up the roadblocks to harass the beachgoers because they are black .,The officer in charge of the detail is black .,nyt_eng_19950912_0115_18:10_discard,discard
nyt_eng_19950912_0114_18:10,neg-ext-subj,racially_motivated,racially,motivated,"Not true , Carroll said  -COL-   -LBQ-  Nothing is racially motivated .",nyt_eng_19950912_0114_18,10,nyt_eng_199509,The ACLU and other detractors also argue that the sheriff is setting up the roadblocks to harass the beachgoers because they are black .,The officer in charge of the detail is black .,nyt_eng_19950912_0114_18:10_discard,discard
nyt_eng_19950911_0274_35:4,neg-ext-subj,as_difficult,as,difficult,"And nothing is as difficult to open , or as frustrating , as a CD case .",nyt_eng_19950911_0274_35,4,nyt_eng_199509,"I 'm referring to those packages in which batteries , bolts , nuts , screws and stereo headsets are seemingly sealed for the ages .","The people who package CDs are as evil as those who package men 's shirts with countless straight pins , one of which always seems to still be present in the shirt as you put it on for the first time .",nyt_eng_19950911_0274_35:4_discard,discard
nyt_eng_19950906_0165_20:3,neg-ext-subj,as_wonderful,as,wonderful,Nothing is as wonderful for the child and as easy on the parents as a stack of mailers all addressed and ready to go into the mailbox .,nyt_eng_19950906_0165_20,3,nyt_eng_199509,"Take steps to increase the odds of developing a mutual correspondence by sending a stack of stamped , self-addressed mailers to a grandchild .","If awaiting the birth of a grandchild , purchase a cassette tape player as a present for the expectant couple .",nyt_eng_19950906_0165_20:3_discard,discard
nyt_eng_19950901_0112_5:5,neg-ext-subj,solid_perfect,solid,perfect,"While nothing is dead solid perfect , those who did the deal believe it 's about as close to a free lunch as Kansas City is ever likely to get .",nyt_eng_19950901_0112_5,5,nyt_eng_199509,"What 's left unsaid , of course , is that a lot of taxpayers nevertheless will become willing partners in the riverfront development when they leave a little or a lot at the Flamingo 's gaming tables .",Hilton is committed to fork over at least $ 3 million a year for a decade in rent and grants .,nyt_eng_19950901_0112_5:5_discard,discard
nyt_eng_19950321_0361_18:6,neg-ext-subj,that_simple,that,simple,But nothing involving Microsoft is that simple .,nyt_eng_19950321_0361_18,6,nyt_eng_199503,The consensus among several risk arbitragers who have consulted legal experts is that on strict antitrust grounds any objection to a Microsoft-Intuit merger is fairly weak .,"Because it dominates the market for the software that runs most personal computers currently , Microsoft is seen as having a unique position .",nyt_eng_19950321_0361_18:6_discard,discard
nyt_eng_19980617_0551_20:7,neg-ext-subj,terribly_simple,terribly,simple,"Nothing , it seems , is terribly simple in the pitiless arena of teen magazines , where nuances of cover lines are as carefully calibrated as precision weaponry .",nyt_eng_19980617_0551_20,7,nyt_eng_199806,"Christina Ferrari , 33 , editor in chief of Teen People , the latest offspring of People Weekly , in her office at the Time-Life Building .",-LBQ-  It 's a fine line we walk with teen-agers .,nyt_eng_19980617_0551_20:7_discard,discard
nyt_eng_19980617_0550_20:7,neg-ext-subj,terribly_simple,terribly,simple,"Nothing , it seems , is terribly simple in the pitiless arena of teen magazines , where nuances of cover lines are as carefully calibrated as precision weaponry .",nyt_eng_19980617_0550_20,7,nyt_eng_199806,"Christina Ferrari , 33 , editor in chief of Teen People , the latest offspring of People Weekly , in her office at the Time-Life Building .",-LBQ-  It 's a fine line we walk with teen-agers .,nyt_eng_19980617_0550_20:7_discard,discard
nyt_eng_19980617_0548_20:7,neg-ext-subj,terribly_simple,terribly,simple,"Nothing , it seems , is terribly simple in the pitiless arena of teen magazines , where nuances of cover lines are as carefully calibrated as precision weaponry .",nyt_eng_19980617_0548_20,7,nyt_eng_199806,"Christina Ferrari , 33 , editor in chief of Teen People , the latest offspring of People Weekly , in her office at the Time-Life Building .",-LBQ-  It 's a fine line we walk with teen-agers .,nyt_eng_19980617_0548_20:7_discard,discard
nyt_eng_19980617_0530_10:7,neg-ext-subj,terribly_simple,terribly,simple,"Nothing , it seems , is terribly simple in the pitiless arena of teen magazines , where nuances of cover lines are as carefully calibrated as precision weaponry .",nyt_eng_19980617_0530_10,7,nyt_eng_199806,"So it 's really , you know , it 's not that simple .  -RDQ-","The Hanson problem is typical  -COL-  because most of the pop group 's fans are at the younger edge of the spectrum , between 11 and 14 , the group 's presence on a magazine cover might send a disastrously wrong signal to the more desirable readers at the upper end , from 16 to 18 , which is Teen People 's playground .",nyt_eng_19980617_0530_10:7_discard,discard
nyt_eng_19980611_0089_38:21,neg-ext-subj,as_simple,as,simple,"There are ways to make a case for preservation based on local economics , he said , but nothing is as simple as it seems .",nyt_eng_19980611_0089_38,21,nyt_eng_199806,"But some of our effort must be focused on making a case for direct economic benefits , to everyone from policy makers ranging right down to small farmers .  -RDQ-","-LBQ-  Three and a half billion people on the planet use medicinal plants for some part of primary health care ,  -RDQ-  he noted .",nyt_eng_19980611_0089_38:21_discard,discard
nyt_eng_19980609_0194_38:21,neg-ext-subj,as_simple,as,simple,"There are ways to make a case for preservation based on local economics , he said , but nothing is as simple as it seems .",nyt_eng_19980609_0194_38,21,nyt_eng_199806,"But some of our effort must be focused on making a case for direct economic benefits , to everyone from policy makers ranging right down to small farmers .  -RDQ-","-LBQ-  Three and a half billion people on the planet use medicinal plants for some part of primary health care ,  -RDQ-  he noted .",nyt_eng_19980609_0194_38:21_discard,discard
nyt_eng_19980609_0193_38:21,neg-ext-subj,as_simple,as,simple,"There are ways to make a case for preservation based on local economics , he said , but nothing is as simple as it seems .",nyt_eng_19980609_0193_38,21,nyt_eng_199806,"But some of our effort must be focused on making a case for direct economic benefits , to everyone from policy makers ranging right down to small farmers .  -RDQ-","-LBQ-  Three and a half billion people on the planet use medicinal plants for some part of primary health care ,  -RDQ-  he noted .",nyt_eng_19980609_0193_38:21_discard,discard
nyt_eng_19980609_0160_38:21,neg-ext-subj,as_simple,as,simple,"There are ways to make a case for preservation based on local economics , he said , but nothing is as simple as it seems .",nyt_eng_19980609_0160_38,21,nyt_eng_199806,"But some of our effort must be focused on making a case for direct economic benefits , to everyone from policy makers ranging right down to small farmers .  -RDQ-","-LBQ-  Three and a half billion people on the planet use medicinal plants for some part of primary health care ,  -RDQ-  he noted .",nyt_eng_19980609_0160_38:21_discard,discard
nyt_eng_19980609_0159_38:21,neg-ext-subj,as_simple,as,simple,"There are ways to make a case for preservation based on local economics , he said , but nothing is as simple as it seems .",nyt_eng_19980609_0159_38,21,nyt_eng_199806,"But some of our effort must be focused on making a case for direct economic benefits , to everyone from policy makers ranging right down to small farmers .  -RDQ-","-LBQ-  Three and a half billion people on the planet use medicinal plants for some part of primary health care ,  -RDQ-  he noted .",nyt_eng_19980609_0159_38:21_discard,discard
nyt_eng_19980605_0123_38:21,neg-ext-subj,as_simple,as,simple,"There are ways to make a case for preservation based on local economics , he said , but nothing is as simple as it seems .",nyt_eng_19980605_0123_38,21,nyt_eng_199806,"But some of our effort must be focused on making a case for direct economic benefits , to everyone from policy makers ranging right down to small farmers .  -RDQ-","-LBQ-  Three and a half billion people on the planet use medicinal plants for some part of primary health care ,  -RDQ-  he noted .",nyt_eng_19980605_0123_38:21_discard,discard
nyt_eng_19980605_0122_38:21,neg-ext-subj,as_simple,as,simple,"There are ways to make a case for preservation based on local economics , he said , but nothing is as simple as it seems .",nyt_eng_19980605_0122_38,21,nyt_eng_199806,"But some of our effort must be focused on making a case for direct economic benefits , to everyone from policy makers ranging right down to small farmers .  -RDQ-","-LBQ-  Three and a half billion people on the planet use medicinal plants for some part of primary health care ,  -RDQ-  he noted .",nyt_eng_19980605_0122_38:21_discard,discard
