hit_id,category,colloc,adv,adj,sent_text,sent_id,adv_index,json_source,prev_sent,next_sent,label,status
nyt_eng_19950731_0104_6:6,neg-ext-subj,yet_available,yet,available,"While no specific figure was yet available , he said the company should n't have to take any charges related to the delay .",nyt_eng_19950731_0104_6,6,nyt_eng_199507,"Steve Olivant , a company spokesman , said the costs would n't be anything greater than  -LBQ-  normal cost overruns  -RDQ-  that construction projects are prone to .","The costs wo n't have a significant impact on results , he said .",nyt_eng_19950731_0104_6:6_discard,discard
nyt_eng_19950731_0064_6:6,neg-ext-subj,yet_available,yet,available,"While no specific figure was yet available , he said the company should n't have to take any charges related to the delay .",nyt_eng_19950731_0064_6,6,nyt_eng_199507,"Steve Olivant , a company spokesman , said the costs would n't be anything greater than  -LBQ-  normal cost overruns  -RDQ-  that construction projects are prone to .","The costs wo n't have a significant impact on results , he said .",nyt_eng_19950731_0064_6:6_discard,discard
nyt_eng_19950725_0615_13:4,neg-ext-subj,currently_available,currently,available,"No figures are currently available as to how much of the $ 2.5 billion is set aside for minority students , but a Justice Department review now is under way , Winston said .",nyt_eng_19950725_0615_13,4,nyt_eng_199507,"Judith Winston , an attorney with the U.S. Department of Education , said officials in Washington want assurances from UC regents that federal funds earmarked for minority students  -LBQ-  will continue to be administered as required by law .  -RDQ-","Rev. Jesse Jackson , who was in Los Angeles on Tuesday protesting a plan to layoff thousands of county workers by the end of the month , blasted Wilson , saying he is playing the race card in his bid for the presidency .",nyt_eng_19950725_0615_13:4_discard,discard
nyt_eng_19950715_0069_29:7,neg-ext-subj,so_tenacious,so,tenacious,Experts say no other addiction is so tenacious .,nyt_eng_19950715_0069_29,7,nyt_eng_199507,What would work ? Research by the FDA and by the Institute of Medicine of the National Academy of Sciences found that it is easier to prevent children from starting to smoke than it is to get addicted smokers to quit .,"Studies have demonstrated that while the high is not as great as that from heroin and the withdrawal not as fierce , the cravings for nicotine are equal to or greater than those for heroin .",nyt_eng_19950715_0069_29:7_discard,discard
nyt_eng_19970218_1265_17:10,neg-ext-subj,immediately_available,immediately,available,"In the parallel currency market , no information was immediately available on the sol 's closing price .",nyt_eng_19970218_1265_17,10,nyt_eng_199702,"Pesquera Austral , which began trading yesterday , climbed 7.5 percent at 4.30 soles , with  -LBQ-  many sales pending ,  -RDQ-  Siles said .","Yesterday , the sol closed at 2.621 \/ 2.624 soles to the U.S. dollar .",nyt_eng_19970218_1265_17:10_discard,discard
nyt_eng_19970218_0257_8:14,neg-ext-subj,too_vicious,too,vicious,"And once we get the culprit , no form of torture would be too vicious .",nyt_eng_19970218_0257_8,14,nyt_eng_199702,Janet Reno ought to appoint a special prosecutor to find out who thought it would be good to let kids stay home at a time of year when some of them have n't even opened all their Christmas presents .,Parents would pay big bucks for a shot at inflicting serious pain on this fool .,nyt_eng_19970218_0257_8:14_discard,discard
nyt_eng_19970212_0462_19:10,neg-ext-subj,immediately_available,immediately,available,"In the parallel currency market , no information was immediately available on the sol 's closing price .",nyt_eng_19970212_0462_19,10,nyt_eng_199702,Cahua supplies Lima power distributor Edelnor and the country 's northcentral electricity network .,The sol closed yesterday at 2.636 \/ 2.639 soles to the U.S. dollar .,nyt_eng_19970212_0462_19:10_discard,discard
nyt_eng_19970202_0196_16:4,neg-ext-subj,too_young,too,young,No child is too young and no image is too grotesque .,nyt_eng_19970202_0196_16,4,nyt_eng_199702,"Hustler 's cartoons have portrayed little girls naked , sometimes blind , and available for sex .",An example of Hustler humor is a cartoon of a doctor in a maternity ward holding up a stillborn girl and making a crude sexual reference .,nyt_eng_19970202_0196_16:4_discard,discard
nyt_eng_19950514_0030_112:6,neg-ext-subj,directly_responsible,directly,responsible,But no U.S. agency is directly responsible for monitoring public health beyond U.S. borders .,nyt_eng_19950514_0030_112,6,nyt_eng_199505,"The U.S. military , as part of its effort to keep soldiers alive , maintains a small worldwide network of laboratories .","To fill this perilous gap , Donald Henderson of the Johns Hopkins School of Public Health proposes that the United States and other developed countries spend $ 150 million a year to fund 15 surveillance clinics , located near rain forests and on the outskirts of large tropical cities , along with 10 state-of-the-art virology labs .",nyt_eng_19950514_0030_112:6_discard,discard
nyt_eng_19971029_0325_17:5,neg-ext-subj,even_close,even,close,No other senator is even close to producing comprehensive tobacco legislation .,nyt_eng_19971029_0325_17,5,nyt_eng_199710,"If Hatch can produce bipartisan support for his measure , he will assure himself of a leading role in whatever approach the Senate takes .",Republican leaders in the Senate favor a coordinated approach to tobacco legislation and have asked Hatch to hold back for now .,nyt_eng_19971029_0325_17:5_discard,discard
nyt_eng_19971028_0033_3:12,neg-ext-subj,economically_powerful,economically,powerful,"-LBQ-  It 's a global downward spiral and no government is economically powerful enough to stop it ,  -RDQ-  said Shinji Ide , general manager at Yamaichi Investment Trust Management Co. , which handles 4.73 trillion yen -LRB- $ 38 billion -RRB- in securities .",nyt_eng_19971028_0033_3,12,nyt_eng_199710,Bank of Tokyo-Mitsubishi Ltd. and Canon Inc. paced the fall .,"The benchmark Nikkei 225 stock average fell 725.67 points , or 4.26 percent , to 16,312.69 -- its lowest close since July 25 , 1995 .",nyt_eng_19971028_0033_3:12_discard,discard
nyt_eng_19971021_0822_21:7,neg-ext-subj,as_star-crossed,as,star-crossed,"Probably no television teen-ager has been as star-crossed in his sexual exploration as Xander , Buffy 's male pal .",nyt_eng_19971021_0822_21,7,nyt_eng_199710,"-LBQ-  If I was old enough to have sex ,  -RDQ-  said a sexily dressed high school girl on a recent episode of  -LBQ-  Clueless ,  -RDQ-   -LBQ-  I 'd be withholding .  -RDQ-",He 's still haunted by that experience with the praying mantis .,nyt_eng_19971021_0822_21:7_discard,discard
nyt_eng_19971010_0405_26:5,neg-ext-subj,ultimately_responsible,ultimately,responsible,"No single designer is ultimately responsible for the look of this house ; instead , a large team reports to creative director Rossella Jardini .",nyt_eng_19971010_0405_26,5,nyt_eng_199710,There 's a lot to be said for going your own way _ as long as you do n't get lost .,"This season , design by committee just did n't work .",nyt_eng_19971010_0405_26:5_discard,discard
nyt_eng_19971010_0404_26:5,neg-ext-subj,ultimately_responsible,ultimately,responsible,"No single designer is ultimately responsible for the look of this house ; instead , a large team reports to creative director Rossella Jardini .",nyt_eng_19971010_0404_26,5,nyt_eng_199710,There 's a lot to be said for going your own way _ as long as you do n't get lost .,"This season , design by committee just did n't work .",nyt_eng_19971010_0404_26:5_discard,discard
nyt_eng_19971008_0756_26:4,neg-ext-subj,yet_available,yet,available,"No ratings are yet available for the Woodward trial , according to Lynn Rosenstrach , Court TV 's vice president for media relations .",nyt_eng_19971008_0756_26,4,nyt_eng_199710,"No sooner had the day 's testimony ended than Court TV moved into more than an hour of commentary on the case , interspersed with promotions for its next Boston-area case _ involving a woman with breast cancer who alleges doctors delayed a biopsy that could have saved her life .","But Court TV clearly has high hopes , given that it devoted a full day to it Wednesday .",nyt_eng_19971008_0756_26:4_discard,discard
nyt_eng_19971228_0109_1:9,neg-ext-subj,so_puzzling,so,puzzling,"No president in a long time has been so puzzling , such a mixture of contradictions .",nyt_eng_19971228_0109_1,9,nyt_eng_199712,,Bill Clinton can charm the birds from the trees _ and abandon friends without apology .,nyt_eng_19971228_0109_1:9_discard,discard
nyt_eng_19971215_0538_21:5,neg-ext-subj,too_vile,too,vile,"-LBQ-  No slander is too vile , no canard too preposterous , to find voice among those who regard the President as their mortal enemy .  -RDQ-",nyt_eng_19971215_0538_21,5,nyt_eng_199712,"-LBQ-  No phenomenon of the times is more disturbing than the persistent hatred of President Roosevelt which finds a more and more poisonous expression among a considerable section of the American people ,  -RDQ-  reported columnist Marquis Child in 1938 .","Not only did Roosevelt haters call him a Communist and denounce the New Deal as a  -LBQ-  Red Deal ,  -RDQ-  but they also accused him of stealing money from the government , diverting funds from the March of Dimes for his own use , and being involved in the kidnapping of the Lindbergh baby and the assassination of Huey Long .",nyt_eng_19971215_0538_21:5_discard,discard
nyt_eng_19971210_0027_16:5,neg-ext-subj,too_small,too,small,No detail apparently was too small to have been overlooked .,nyt_eng_19971210_0027_16,5,nyt_eng_199712,"Outfitted in Meier 's signature white paneling , the new center shimmered in the wintry twilight like a nervous debutante at a coming-out ball .","Even the weather cooperated , as a cold front began drifting out of the region , leaving behind crisp air and jaw-dropping views of snow-glazed mountains from the Getty 's numerous upper-level walkways .",nyt_eng_19971210_0027_16:5_discard,discard
nyt_eng_19971209_0496_42:6,neg-ext-subj,so_large,so,large,I believe no problem is so large or so difficult that it ca n't,nyt_eng_19971209_0496_42,6,nyt_eng_199712,"MORE ` DO N'T WORRY , BE CRABBY `",be blamed on somebody else .,nyt_eng_19971209_0496_42:6_discard,discard
nyt_eng_19971209_0495_42:6,neg-ext-subj,so_large,so,large,I believe no problem is so large or so difficult that it ca n't,nyt_eng_19971209_0495_42,6,nyt_eng_199712,"MORE ` DO N'T WORRY , BE CRABBY `",be blamed on somebody else .,nyt_eng_19971209_0495_42:6_discard,discard
nyt_eng_19971209_0461_4:5,neg-ext-subj,immediately_available,immediately,available,No further information was immediately available .,nyt_eng_19971209_0461_4,5,nyt_eng_199712,Shares in the company were down C$ 0.10 to C$ 50.30 when trading was halted prior to the announcement .,,nyt_eng_19971209_0461_4:5_discard,discard
nyt_eng_19971204_0529_37:6,neg-ext-subj,too_great,too,great,No challenge in M&amp;A is too great .,nyt_eng_19971204_0529_37,6,nyt_eng_199712,These are exuberant times .,Go for it .,nyt_eng_19971204_0529_37:6_discard,discard
nyt_eng_19991028_0349_21:5,neg-ext-subj,too_complicated,too,complicated,No problem here is too complicated to be settled by a good-humored dance scene .,nyt_eng_19991028_0349_21,5,nyt_eng_199910,There he finds temptation in the form of an old flame and a lot of genial guy talk about the meaning of marriage .,Another demonstration that current movies about upscale black characters have much more solid traditional values than ones about catty white teen-agers -LRB- Maslin -RRB- .,nyt_eng_19991028_0349_21:5_discard,discard
nyt_eng_19980925_0221_9:17,neg-ext-subj,vividly_red,vividly,red,Not even cornflowers can match the blue of an indigo bunting ; no rose is as vividly red as a scarlet tanager .,nyt_eng_19980925_0221_9,17,nyt_eng_199809,A garden 's birds are a fine complement to its flowers and vegetables .,"Even drab-colored birds improve the landscape , like plants grown as a quiet background .",nyt_eng_19980925_0221_9:17_discard,discard
nyt_eng_19980913_0115_16:5,neg-ext-subj,scientifically_representative,scientifically,representative,No such crowd is scientifically representative of the population at large .,nyt_eng_19980913_0115_16,5,nyt_eng_199809,"But pressed on whether the president should be impeached for what Starr depicts as his perjury over the affair , very few of the people White encountered on his campaign rounds said yes .","Still , at the park-and-ride station this morning , a reporter conducting random interviews for an hour could not find anyone favoring impeachment until , at last , he called out to the crowd , specifically seeking those who favored the action .",nyt_eng_19980913_0115_16:5_discard,discard
nyt_eng_19991224_0082_47:5,neg-ext-subj,as_aggressive,as,aggressive,"No team has been as aggressive in piling on talent , and payroll .",nyt_eng_19991224_0082_47,5,nyt_eng_199912,"have acquired Mike Piazza , Robin Ventura , Armando Benitez and now Mike Hampton .",And the reason is obivous  -COL-  the Mets share New York with the world champion Yankees and are trying to compete .,nyt_eng_19991224_0082_47:5_discard,discard
nyt_eng_19991224_0080_9:5,neg-ext-subj,as_aggressive,as,aggressive,"No team has been as aggressive in piling on talent , and payroll .",nyt_eng_19991224_0080_9,5,nyt_eng_199912,"have acquired Mike Piazza , Robin Ventura , Armando Benitez and now Mike Hampton .",And the reason is obivous  -COL-  the Mets share New York with the world champion Yankees and are trying to compete .,nyt_eng_19991224_0080_9:5_discard,discard
nyt_eng_19991212_0069_22:9,neg-ext-subj,particularly_dangerous,particularly,dangerous,"Separately , no single bit of information was particularly dangerous .",nyt_eng_19991212_0069_22,9,nyt_eng_199912,"-LBQ-  Computers are great , but computers are not going to give you all the information you need ,  -RDQ-  said Brett Kappenman , another Agora investigator .",But in aggregate _ and in the wrong hands _ it could be ruinous .,nyt_eng_19991212_0069_22:9_discard,discard
nyt_eng_19960527_0081_69:24,neg-ext-subj,far_different,far,different,Republicans are eager to saddle a Democratic administration with the baggage of arms deals with Iran _ no matter if the circumstances are far different from 1986 .,nyt_eng_19960527_0081_69,24,nyt_eng_199605,How could these same lawmakers now turn around and excoriate the Clinton administration for winking at violations of the embargo ? One answer is campaign-year politics .,"Congressmen are , as ever , miffed about the fact that they had not been notified about the administration 's wink-and-nod policy .",nyt_eng_19960527_0081_69:24_discard,discard
nyt_eng_19960526_0554_14:25,neg-ext-subj,as_aggressive,as,aggressive,"Many states across the country have been ordered by their senior judges to revamp their school funding formulas , but no court has been as aggressive as New Jersey 's .",nyt_eng_19960526_0554_14,25,nyt_eng_199605,"The challenge facing New Jersey has national implications , not least because of Whitman 's prominence as an avid tax-cutter and rising Republican star .","To reach school equity , Gov. Jim Florio raised the income tax , creating a furor that ultimately led to his defeat by Whitman in 1993 .",nyt_eng_19960526_0554_14:25_discard,discard
nyt_eng_19960526_0158_69:24,neg-ext-subj,far_different,far,different,Republicans are eager to saddle a Democratic administration with the baggage of arms deals with Iran _ no matter if the circumstances are far different from 1986 .,nyt_eng_19960526_0158_69,24,nyt_eng_199605,How could these same lawmakers now turn around and excoriate the Clinton administration for winking at violations of the embargo ? One answer is campaign-year politics .,"Congressmen are , as ever , miffed about the fact that they had not been notified about the administration 's wink-and-nod policy .",nyt_eng_19960526_0158_69:24_discard,discard
nyt_eng_19960519_0326_29:8,neg-ext-subj,again_likely,again,likely,"No reader of Ms. Miller is ever again likely to think that Arabs are closer to one another , let alone Iranians , than Sicilians are to Finns .",nyt_eng_19960519_0326_29,8,nyt_eng_199605,"Fair-minded to her fingertips , Ms. Miller offers sensible thoughts and afterthoughts on a part of the world Americans find intermittently fascinating , sometimes scary , but invariably baffling .",-LRB- MORE -RRB-,nyt_eng_19960519_0326_29:8_discard,discard
nyt_eng_19960501_0168_38:15,neg-ext-subj,thoroughly_comfortable,thoroughly,comfortable,"Folklorist W. D. Weatherford explains humor 's efficacy  -COL-   -LBQ-  No master could be thoroughly comfortable around a sullen slave ; and , conversely , a master , unless he was utterly humorless , could not overwork or brutally treat a jolly fellow , one who could make him laugh .  -RDQ-",nyt_eng_19960501_0168_38,15,nyt_eng_199605,Humor was the slave 's talisman .,"For society 's pariahs , humor symbolizes a rhetorical effigy , having the power to destabilize the enemy 's control .",nyt_eng_19960501_0168_38:15_discard,discard
nyt_eng_19980730_0071_9:17,neg-ext-subj,yet_available,yet,available,"Additional costs would be for equipment brought into the search area , but no tally is yet available on that .",nyt_eng_19980730_0071_9,17,nyt_eng_199807,"Most of the search cost is personnel related , he said , but most of the personnel involved already are on the payroll and have just been reassigned temporarily to this mission .",Q.,nyt_eng_19980730_0071_9:17_discard,discard
nyt_eng_19980729_0227_34:29,neg-ext-subj,as_challenging,as,challenging,"A  -COL-  It is a new game in the sense that no other position I have held , either in the public or private sectors , has been as challenging or complex , requiring such a diverse array of skills and resources .",nyt_eng_19980729_0227_34,29,nyt_eng_199807,"Q  -COL-  How has your experience _ both in the public and private sectors _ helped you as ambassador , or is this a whole new ball game ?","At the same time , having been in the private sector has helped me understand the dynamics of the non-governmental relations between Mexico and the United States .",nyt_eng_19980729_0227_34:29_discard,discard
nyt_eng_19980723_0037_22:15,neg-ext-subj,so_complex,so,complex,Yet Korsch cautioned that Welby fostered an unrealistic expectation that no medical problem is so complex that it ca n't be neatly wrapped up in an hour .,nyt_eng_19980723_0037_22,15,nyt_eng_199807,"By contrast , she lamented , in today 's modern world of managed health care ,  -LBQ-  There 's all kinds of technology interposed , not to mention that everybody is so concerned about AIDS that nobody seems to touch a patient anymore without rubber gloves .  -RDQ-","-LBQ-  Doctors are very success-oriented , and both doctors and patients like short-term gratification , which was usually available on the Marcus Welby show ,  -RDQ-  she said .",nyt_eng_19980723_0037_22:15_discard,discard
nyt_eng_19980713_0260_3:17,neg-ext-subj,as_happy,as,happy,"But while dazzling new products were scarce at Macworld , no doubt many people were just as happy to take home some optimism about the future of Macintosh .",nyt_eng_19980713_0260_3,17,nyt_eng_199807,Visitors to the show typically found that promises almost outnumbered actual products .,The centerpiece of the show was an aqua and white beach ball of a computer called the iMac .,nyt_eng_19980713_0260_3:17_discard,discard
nyt_eng_19980713_0198_44:17,neg-ext-subj,as_happy,as,happy,"But while dazzling new products were scarce at Macworld , no doubt many people were just as happy to take home some optimism about the future of the Macintosh line .",nyt_eng_19980713_0198_44,17,nyt_eng_199807,Visitors to the show typically found that promises almost outnumbered actual products .,The new iMac was the most interesting .,nyt_eng_19980713_0198_44:17_discard,discard
nyt_eng_19980706_0158_44:15,neg-ext-subj,very_effective,very,effective,"One final point  -COL-  It is also worth remembering that no insect repellent is very effective against stinging insects like bees , yellow jackets and other wasps and fire ants .",nyt_eng_19980706_0158_44,15,nyt_eng_199807,Or you can try adding soybean oil to your child 's favorite sunscreen .,"Nor do black flies , which are biters , seem to have much respect for repellents currently on the market .",nyt_eng_19980706_0158_44:15_discard,discard
nyt_eng_19980702_0387_39:5,neg-ext-subj,as_deft,as,deft,No other film is as deft at showing the disjunction between what our impulses are and what society demands of us .,nyt_eng_19980702_0387_39,5,nyt_eng_199807,Jean Renoir 's  -LBQ-  Rules of the Game  -RDQ-  might just as well claim the top spot .,"Cocteau 's  -LBQ-  Orphee  -RDQ-  is also a great deal of fun , playing with all the tricks of cinema to create visual magic .",nyt_eng_19980702_0387_39:5_discard,discard
nyt_eng_19980702_0193_15:6,neg-ext-subj,as_enduring,as,enduring,"But no invasion has been as enduring or as lucrative as the invasion of the summer people , a tradition that dates to the 1870s , when Rehoboth Beach , the hub of the Delaware shore , became a Methodist campground .",nyt_eng_19980702_0193_15,6,nyt_eng_199807,"And through it all , the shore has always offered four-star avian hospitality during the spring migration , when millions of horseshoe-crab eggs make Delaware the prime layover for red knots and other birds commuting between South American winter homes and Arctic breeding grounds .","You can still find Methodists and campgrounds , but mostly you will find families from the mid-Atlantic states , the Capitol Hill crowd -LRB- Rehoboth , 125 miles from Washington , has long billed itself as  -LBQ-  the nation 's summer capital  -RDQ-  -RRB- and a share of the 20-somethings .",nyt_eng_19980702_0193_15:6_discard,discard
nyt_eng_19950906_0109_2:5,neg-ext-subj,immediately_available,immediately,available,No further details were immediately available .,nyt_eng_19950906_0109_2,5,nyt_eng_199509,Volkswagen AG said its wage talks with the IG Metall union have broken off and will continue Monday .,The company said it will issue a further statement later today .,nyt_eng_19950906_0109_2:5_discard,discard
nyt_eng_19950906_0107_3:5,neg-ext-subj,immediately_available,immediately,available,No further details were immediately available .,nyt_eng_19950906_0107_3,5,nyt_eng_199509,The company said it will issue a further statement later today .,Volkswagen shares are up 4 marks at 466.5 after being as high as 467 earlier .,nyt_eng_19950906_0107_3:5_discard,discard
nyt_eng_19941116_0218_15:5,neg-ext-subj,too_young,too,young,But no object is too young to escape Thaw 's eye .,nyt_eng_19941116_0218_15,5,nyt_eng_199411,"And experts on Indian art say that Thaw 's beaded bags , made to be slung over the shoulder bandoleer-style , include rare examples , documenting the evolution of these objects , which are particular to the Great Lakes region .","He searches out the works of contemporary Indian artists , paying $ 500 to $ 1,000 for baskets and ceramics that he firmly believes will increase substantially in value .",nyt_eng_19941116_0218_15:5_discard,discard
nyt_eng_19970323_0054_7:9,neg-ext-subj,so_close,so,close,No U.K. government has been so far behind so close to the election and recovered to win .,nyt_eng_19970323_0054_7,9,nyt_eng_199703,It 's currently more than 20 points and still rising .,"In a British Broadcasting Corp. television interview , Brown said Labor would not name the companies subject to the windfall tax because when Chancellors spell out taxes , they never identify targets by name .",nyt_eng_19970323_0054_7:9_discard,discard
nyt_eng_19970320_0632_6:4,neg-ext-subj,too_brazen,too,brazen,"No means is too brazen , too partisan , too malicious to use in the service of power .",nyt_eng_19970320_0632_6,4,nyt_eng_199703,Both are dominated to an extraordinary degree by the attitude that the end justifies the means .,The Lake hearings were an example .,nyt_eng_19970320_0632_6:4_discard,discard
nyt_eng_19970311_0613_16:15,neg-ext-subj,politically_realistic,politically,realistic,"In the face of a blatantly partisan vendetta , no other presidential course was politically realistic .",nyt_eng_19970311_0613_16,15,nyt_eng_199703,"The White House stonewalled much of last term 's Senate investigation of Whitewater and assorted overhyped mini-scandals , led by campaign-crazed New York Sen. Alfonse D'Amato , no model of ethical purity himself .","Voters wisely blamed D'Amato , not the president , and the senator sank disastrously in the New York polls .",nyt_eng_19970311_0613_16:15_discard,discard
nyt_eng_19971124_0257_17:20,neg-ext-subj,yet_available,yet,available,"The drug will be available sometime in 1998 after the DEA certifies it , and no pricing information is yet available , Knoll officials said .",nyt_eng_19971124_0257_17,20,nyt_eng_199711,Seaton said the company is taking a conservative approach as researchers did n't find any evidence that Meridia was being abused .,The drug will enter a market for drugs that have recently seen quite a few troubles at the FDA .,nyt_eng_19971124_0257_17:20_discard,discard
nyt_eng_19971124_0249_17:20,neg-ext-subj,yet_available,yet,available,"The drug will be available sometime in 1998 after the DEA certifies it , and no pricing information is yet available , Knoll officials said .",nyt_eng_19971124_0249_17,20,nyt_eng_199711,Seaton said the company is taking a conservative approach as researchers did n't find any evidence that Meridia was being abused .,The drug will enter a market for drugs that have recently seen quite a few troubles at the FDA .,nyt_eng_19971124_0249_17:20_discard,discard
