hit_id,category,colloc,adv,adj,sent_text,sent_id,adv_index,json_source,prev_sent,next_sent,label,status
nyt_eng_20080110_0033_8:4,neg-ext-subj,really_sure,really,sure,-LBQ-  Nobody is really sure .,nyt_eng_20080110_0033_8,4,nyt_eng_200801,"-LBQ-  Has Iran made a conscious decision to scale down support of these attacks ?  -RDQ-  an administration official said Wednesday , speaking on the condition of anonymity because he was discussing intelligence .","It 's possible they really have , and it 's possible they have n't .",nyt_eng_20080110_0033_8:4_discard,discard
nyt_eng_20080109_0189_11:4,neg-ext-subj,really_sure,really,sure,-LBQ-  Nobody is really sure .,nyt_eng_20080109_0189_11,4,nyt_eng_200801,-LBQ-  Has Iran made a conscious decision to scale down support of these attacks ?  -RDQ-  an administration official asked Wednesday .,"It 's possible they really have , and it 's possible they have n't .",nyt_eng_20080109_0189_11:4_discard,discard
nyt_eng_20080109_0186_8:4,neg-ext-subj,really_sure,really,sure,-LBQ-  Nobody is really sure .,nyt_eng_20080109_0186_8,4,nyt_eng_200801,-LBQ-  Has Iran made a conscious decision to scale down support of these attacks ?  -RDQ-  an administration official asked Wednesday .,"It 's possible they really have , and it 's possible they have n't .",nyt_eng_20080109_0186_8:4_discard,discard
nyt_eng_20070619_0206_13:22,neg-ext-subj,really_ready,really,ready,"-LBQ-  We continue to struggle from big problem to big problem with Band Aids and the bleeding continues and nobody is really ready to stand up and make the tough decisions ,  -RDQ-  Bloomberg said .",nyt_eng_20070619_0206_13,22,nyt_eng_200706,"Traveling from San Francisco to Silicon Valley and Los Angeles , he used pointed language to attack the ways of Washington , while promoting his own centrist approach .",,nyt_eng_20070619_0206_13:22_discard,discard
nyt_eng_20091003_0141_15:55,neg-ext-subj,as_disappointing,as,disappointing,"But as much as Dioner Navarro regressed , as frustrating as Matt Garza 's season -LRB- and James Shields ' -RRB- became , as maddeningly inconsistent as B.J. Upton was , as bad as Grant Balfour and other relievers looked at times , as horrid a year as Andy Sonnanstine had , nobody was as disappointing as Pat Burrell .",nyt_eng_20091003_0141_15,55,nyt_eng_200910,"In contrast to the MVP race , this field seemed to grow as the season went on .",Maybe in all of baseball .,nyt_eng_20091003_0141_15:55_discard,discard
nyt_eng_20020505_0066_20:10,neg-ext-subj,quite_sure,quite,sure,"CAMBODIA-CREATURE -LRB- Penh , Cambodia -RRB- _ Nobody is quite sure what",nyt_eng_20020505_0066_20,10,nyt_eng_200205,AFGHAN -LRB- Undated -RRB- _ The day 's developments . By Carlotta Gall .,"it is _ cow , goat , antelope , gazelle _ a mysterious creature that is said to roam the hidden mountain ranges of Cambodia .",nyt_eng_20020505_0066_20:10_discard,discard
nyt_eng_20080421_0220_50:32,neg-ext-subj,as_connected,as,connected,"But associates say he revels in his ability to  -LBQ-  work the system ,  -RDQ-  as his friend and sometimes partner , Stanley Abrams , put it  -COL-   -LBQ-  Nobody is as connected as Donald .  -RDQ-",nyt_eng_20080421_0220_50,32,nyt_eng_200804,"-LBQ-  They are a pain in the ` you-know-what ,  -RDQ-  ' he said .",Diamond is close to most of Arizona 's congressional delegation and is candid about his expectations as a fundraiser .,nyt_eng_20080421_0220_50:32_discard,discard
nyt_eng_20001224_0410_14:3,neg-ext-subj,quite_sure,quite,sure,"Nobody is quite sure how the Port Authority could constructively change the fee system , but Alfred E. Kahn , chairman of the Council of Wage and Price Stability under President Carter and known as the father of airline deregulation , said the pricing system should resemble the one used in  -LBQ-  bumping  -RDQ-  passengers when flights are overbooked .",nyt_eng_20001224_0410_14,3,nyt_eng_200012,"Slots for flights at La Guardia come on the market only infrequently but are worth about $ 2 million , according to people in the airline business ; few new airlines have enough capital on hand to compete with established carriers .","In that case , the airline offers bonuses to people who will get off the plane and take a later flight , rewarding those who value money more than time .",nyt_eng_20001224_0410_14:3_discard,discard
nyt_eng_20001223_0084_17:13,neg-ext-subj,totally_right,totally,right,"-LBQ-  Nobody 's got a pointer on the truth , nobody is totally right , and we need to be doing more listening to each other and trying to find common ground .  -RDQ-",nyt_eng_20001223_0084_17,13,nyt_eng_200012,"-LBQ-  My whole view of the world is that we 're in a new aspect of human affairs ,  -RDQ-  Clinton said , in a recent Oval Office interview in response to a question about the impact of the Internet that quickly expanded to address broader themes .","Of course , Clinton 's own parsing of the truth infuriated a large segment of the populace , and his short-term legacy may well be the most closely contested presidential election in 124 years , its legal machinations and 24-hour-a-day tactical cut-and-thrust constituting the pitch-perfect coda to his often rancorous political era .",nyt_eng_20001223_0084_17:13_discard,discard
nyt_eng_20001223_0080_18:13,neg-ext-subj,totally_right,totally,right,"-LBQ-  Nobody 's got a pointer on the truth , nobody is totally right , and we need to be doing more listening to each other and trying to find common ground .  -RDQ-",nyt_eng_20001223_0080_18,13,nyt_eng_200012,"-LBQ-  My whole view of the world is that we 're in a new aspect of human affairs ,  -RDQ-  Clinton said , in a response to a question about the impact of the Internet that quickly expanded to address broader themes .","Of course , Clinton 's own parsing of the truth infuriated a large segment of the populace , and his short-term legacy may well be the most closely contested presidential election in more than a century , its legal machinations and 24-hour-a-day tactical cut-and-thrust constituting the pitch-perfect coda to his often rancorous political era .",nyt_eng_20001223_0080_18:13_discard,discard
nyt_eng_20000426_0028_67:10,neg-ext-subj,really_worried,really,worried,"-LBQ-  When we started Design Reactor , nobody was really worried .  -RDQ-",nyt_eng_20000426_0028_67,10,nyt_eng_200004,"-LBQ-  I do n't think anyone has any fear ,  -RDQ-  Patrick Lee said .","Besides , considering that just about everyone in the office is still under 30 , it 's not as though this is the end of the line for anybody .",nyt_eng_20000426_0028_67:10_discard,discard
nyt_eng_20000406_0080_12:21,neg-ext-subj,very_surprised,very,surprised,"And if politicians play politics with a small boy 's life , nobody likes it much , but nobody 's very surprised , either .",nyt_eng_20000406_0080_12,21,nyt_eng_200004,"So if Elian now clutches at the hands of those who have been with him in Miami , if he holds on to them for dear life the way he clung to that rubber ring , who can blame him ? If he has constructed a kind of provisional happiness in his new Florida backyard , we should understand that as a psychological survival mechanism , not as a permanent replacement for his father 's love .","Al Gore weighs in with a poorly thought-through scheme to turn Elian and his father into U.S. residents -LRB- a scheme which Juan Miguel Gonzalez instantly rejects -RRB- , and we know that he 's trying _ and almost certainly failing _ to win a few Cuban Republican votes .",nyt_eng_20000406_0080_12:21_discard,discard
nyt_eng_20000406_0079_12:21,neg-ext-subj,very_surprised,very,surprised,"And if politicians play politics with a small boy 's life , nobody likes it much , but nobody 's very surprised , either .",nyt_eng_20000406_0079_12,21,nyt_eng_200004,"So if Elian now clutches at the hands of those who have been with him in Miami , if he holds on to them for dear life the way he clung to that rubber ring , who can blame him ? If he has constructed a kind of provisional happiness in his new Florida backyard , we should understand that as a psychological survival mechanism , not as a permanent replacement for his father 's love .","Al Gore weighs in with a poorly thought-through scheme to turn Elian and his father into U.S. residents -LRB- a scheme which Juan Miguel Gonzalez instantly rejects -RRB- , and we know that he 's trying _ and almost certainly failing _ to win a few Cuban Republican votes .",nyt_eng_20000406_0079_12:21_discard,discard
nyt_eng_20000406_0078_12:21,neg-ext-subj,very_surprised,very,surprised,"And if politicians play politics with a small boy 's life , nobody likes it much , but nobody 's very surprised , either .",nyt_eng_20000406_0078_12,21,nyt_eng_200004,"So if Elian now clutches at the hands of those who have been with him in Miami , if he holds on to them for dear life the way he clung to that rubber ring , who can blame him ? If he has constructed a kind of provisional happiness in his new Florida backyard , we should understand that as a psychological survival mechanism , not as a permanent replacement for his father 's love .","Al Gore weighs in with a poorly thought-through scheme to turn Elian and his father into U.S. residents -LRB- a scheme which Juan Miguel Gonzalez instantly rejects -RRB- , and we know that he 's trying _ and almost certainly failing _ to win a few Cuban Republican votes .",nyt_eng_20000406_0078_12:21_discard,discard
nyt_eng_20000405_0202_109:26,neg-ext-subj,really_sick,really,sick,"But last night I turned on  -LBQ-  Law and Order  -RDQ-  and it 's  -LBQ-  The Dot-Com Murder ,  -RDQ-  you know ? Nobody 's really sick of it because it 's such an integral part of our lives .",nyt_eng_20000405_0202_109,26,nyt_eng_200004,"ZAPOLIN _ It 's funny , I 've been hearing this even before the Super Bowl _ everybody 's sick of the dot-coms .","And part of our commercial was saying ,  -LBQ-  You know what ? If two guys like us can have a dot-com and an ad on the Super Bowl , then the dream lives .  -RDQ-",nyt_eng_20000405_0202_109:26_discard,discard
nyt_eng_20100920_0182_27:3,neg-ext-subj,exactly_sure,exactly,sure,"Nobody is exactly sure how many veterans take their own lives , but the federal Centers for Disease Control and Prevention estimate that veterans make up about 20 percent of the more than 30,000 suicides each year .",nyt_eng_20100920_0182_27,3,nyt_eng_201009,"There were 32 suicides in June , a grim high .",The military is becoming more aware of the problem .,nyt_eng_20100920_0182_27:3_discard,discard
nyt_eng_20001029_0047_25:3,neg-ext-subj,quite_sure,quite,sure,Nobody is quite sure what impact this will have .,nyt_eng_20001029_0047_25,3,nyt_eng_200010,The first is the United Auto Workers ' recent success in turning election day into a paid holiday .,A poll by Mitchell Research & Communications found that male union members were equally divided between the two candidates _ and anyway they might decide to use the holiday to go hunting rather than to the polls .,nyt_eng_20001029_0047_25:3_discard,discard
nyt_eng_20001027_0040_25:3,neg-ext-subj,quite_sure,quite,sure,Nobody is quite sure what impact this will have .,nyt_eng_20001027_0040_25,3,nyt_eng_200010,The first is the United Auto Workers ' recent success in turning election day into a paid holiday .,A poll by Mitchell Research & Communications found that male union members were equally divided between the two candidates _ and anyway they might decide to use the holiday to go hunting rather than to the polls .,nyt_eng_20001027_0040_25:3_discard,discard
nyt_eng_20001024_0191_77:9,neg-ext-subj,quite_sure,quite,sure,"Meantime , he acknowledged ,  -LBQ-  Nobody is quite sure where the ethical bounds are anymore .  -RDQ-",nyt_eng_20001024_0191_77,9,nyt_eng_200010,"-LBQ-  We are evolving a new morality , for the Army and the profession ,  -RDQ-  Killebrew said .",LF END WOOD,nyt_eng_20001024_0191_77:9_discard,discard
nyt_eng_20001018_0123_77:9,neg-ext-subj,quite_sure,quite,sure,"Meantime , he acknowledged ,  -LBQ-  Nobody is quite sure where the ethical bounds are anymore .  -RDQ-",nyt_eng_20001018_0123_77,9,nyt_eng_200010,"-LBQ-  We are evolving a new morality , for the Army and the profession ,  -RDQ-  Killebrew said .",LF END WOOD,nyt_eng_20001018_0123_77:9_discard,discard
nyt_eng_20001018_0067_77:9,neg-ext-subj,quite_sure,quite,sure,"Meantime , he acknowledged ,  -LBQ-  Nobody is quite sure where the ethical bounds are anymore .  -RDQ-",nyt_eng_20001018_0067_77,9,nyt_eng_200010,"-LBQ-  We are evolving a new morality , for the Army and the profession ,  -RDQ-  Killebrew said .",LF END WOOD,nyt_eng_20001018_0067_77:9_discard,discard
nyt_eng_20000703_0133_60:7,neg-ext-subj,as_smart,as,smart,"As they say , nobody is as smart as everybody .  -RDQ-",nyt_eng_20000703_0133_60,7,nyt_eng_200007,"If you put them all together , you can form something better than any individual opinion .",-LRB- Fenella Saunders is an associate editor at Discover magazine . -RRB-,nyt_eng_20000703_0133_60:7_discard,discard
nyt_eng_20000703_0132_60:7,neg-ext-subj,as_smart,as,smart,"As they say , nobody is as smart as everybody .  -RDQ-",nyt_eng_20000703_0132_60,7,nyt_eng_200007,"If you put them all together , you can form something better than any individual opinion .",-LRB- Fenella Saunders is an associate editor at Discover magazine . -RRB-,nyt_eng_20000703_0132_60:7_discard,discard
nyt_eng_20000703_0131_60:7,neg-ext-subj,as_smart,as,smart,"As they say , nobody is as smart as everybody .  -RDQ-",nyt_eng_20000703_0131_60,7,nyt_eng_200007,"If you put them all together , you can form something better than any individual opinion .",-LRB- Fenella Saunders is an associate editor at Discover magazine . -RRB-,nyt_eng_20000703_0131_60:7_discard,discard
nyt_eng_20000703_0130_60:7,neg-ext-subj,as_smart,as,smart,"As they say , nobody is as smart as everybody .  -RDQ-",nyt_eng_20000703_0130_60,7,nyt_eng_200007,"If you put them all together , you can form something better than any individual opinion .",-LRB- Fenella Saunders is an associate editor at Discover magazine . -RRB-,nyt_eng_20000703_0130_60:7_discard,discard
nyt_eng_20070913_0244_16:3,neg-ext-subj,even_sure,even,sure,"Nobody is even sure if he is signed past this season , and Kraft and Belichick have both danced around the question of how long Belichick would stay on .",nyt_eng_20070913_0244_16,3,nyt_eng_200709,His contract status is a tightly held secret .,"During his investigation , Goodell determined that because the tape was seized before the end of the first quarter Sunday , it did not have an impact on the Patriots ' victory over the Jets .",nyt_eng_20070913_0244_16:3_discard,discard
nyt_eng_20041029_0174_14:4,neg-ext-subj,very_excited,very,excited,-LBQ-  Nobody was very excited to receive him .  -RDQ-,nyt_eng_20041029_0174_14,4,nyt_eng_200410,"-LBQ-  It is not going to help the image of France to give a haven to someone who is perceived as a terrorist by American public opinion ,  -RDQ-  the French official said .","But the prevailing view was that Arafat , as the legitimate , elected head of the Palestinian Authority , could not be refused .",nyt_eng_20041029_0174_14:4_discard,discard
nyt_eng_20060524_0205_1:10,neg-ext-subj,tirelessly_reverential,tirelessly,reverential,"Nobody in Saddam Hussein 's inner circle was more tirelessly reverential toward him while he was in power than Tariq Aziz , who is said to have been in the habit of saluting the telephone when Saddam called .",nyt_eng_20060524_0205_1,10,nyt_eng_200605,,"So it was little surprise on Wednesday when Aziz , 70 , became the first senior member of the old ruling elite to testify on behalf of Saddam at his trial on charges of crimes against humanity .",nyt_eng_20060524_0205_1:10_discard,discard
nyt_eng_20040912_0124_17:10,neg-ext-subj,very_specific,very,specific,-LBQ-  Nobody has an answer and nobody 's being very specific .  -RDQ-,nyt_eng_20040912_0124_17,10,nyt_eng_200409,"-LBQ-  That 's a straight line from '52 through '68 to today ,  -RDQ-  said Douglas C. Foyle , a political scientist at Wesleyan University who is at work on a book about the effect of campaigns on foreign policy .","In those earlier campaigns , the challengers won after offering only the fuzziest of alternatives on the wars then dragging on .",nyt_eng_20040912_0124_17:10_discard,discard
nyt_eng_20000817_0284_26:6,neg-ext-subj,yet_sure,yet,sure,"In practice , nobody is yet sure which services will prove practical and what consumers will be willing to pay for them .",nyt_eng_20000817_0284_26,6,nyt_eng_200008,"Supporters of third-generation networks talk of high-speed mobile Internet access , scores of  -LBQ-  mobile commerce  -RDQ-  applications and even the ability to receive streams of video over a cellular phone .",But most analysts say ordinary mobile telephone service will become steadily cheaper and will no longer provide the booming revenue that wireless operators have enjoyed during the last decade .,nyt_eng_20000817_0284_26:6_discard,discard
nyt_eng_20060816_0312_15:3,neg-ext-subj,quite_sure,quite,sure,Nobody was quite sure what a slow-moving George Steinbrenner meant in his brief speech when he said the Yankees were building this new pleasure palace for  -LBQ-  you people .  -RDQ-,nyt_eng_20060816_0312_15,3,nyt_eng_200608,"At the groundbreaking , there was no sound of discord , only the vague acknowledgment that not everybody loves this kind of progress .","Was the Boss referring to the upwardly mobile Yankee fans from New Jersey and Westchester who can afford the baseball tickets of today ? Was he addressing the youths of the Bronx who were paraded into the ceremony as charming props , and who may be given a few thousand tickets here and there ? Who , exactly , are  -LBQ-  you people  -RDQ-  ? But George does not elaborate much these days .",nyt_eng_20060816_0312_15:3_discard,discard
nyt_eng_20010212_0176_18:3,neg-ext-subj,exactly_sure,exactly,sure,Nobody 's exactly sure why Coldplay caught on in the colonies when acclaimed Brit acts ranging from London Suede to PJ Harvey have mostly met hearty disinterest .,nyt_eng_20010212_0176_18,3,nyt_eng_200102,"At the very least , we get a chance to see America .  -RDQ-","Even the acclaimed Travis album did n't do as well as expected , possibly because its catchy single ,  -LBQ-  Why Does It Always Rain on Me ?  -RDQ-  was promoted during the summer months , a time when rainy days are far from the average listener 's thoughts .",nyt_eng_20010212_0176_18:3_discard,discard
nyt_eng_20090706_0031_36:12,neg-ext-subj,very_interested,very,interested,"For most of his life , West assumed that nobody was very interested in his wartime ordeal .",nyt_eng_20090706_0031_36,12,nyt_eng_200907,He subsisted on virtually no rations while being marched from Poland across Northern Europe to the Western front .,That changed 10 years ago when he joined the Dayton chapter of the American Ex-Prisoners of War .,nyt_eng_20090706_0031_36:12_discard,discard
nyt_eng_20000627_0275_60:7,neg-ext-subj,as_smart,as,smart,"As they say , nobody is as smart as everybody .  -RDQ-",nyt_eng_20000627_0275_60,7,nyt_eng_200006,"If you put them all together , you can form something better than any individual opinion .",-LRB- Fenella Saunders is an associate editor at Discover magazine . -RRB-,nyt_eng_20000627_0275_60:7_discard,discard
nyt_eng_20000627_0273_60:7,neg-ext-subj,as_smart,as,smart,"As they say , nobody is as smart as everybody .  -RDQ-",nyt_eng_20000627_0273_60,7,nyt_eng_200006,"If you put them all together , you can form something better than any individual opinion .",-LRB- Fenella Saunders is an associate editor at Discover magazine . -RRB-,nyt_eng_20000627_0273_60:7_discard,discard
nyt_eng_20000627_0254_60:7,neg-ext-subj,as_smart,as,smart,"As they say , nobody is as smart as everybody .  -RDQ-",nyt_eng_20000627_0254_60,7,nyt_eng_200006,"If you put them all together , you can form something better than any individual opinion .",-LRB- Fenella Saunders is an associate editor at Discover magazine . -RRB-,nyt_eng_20000627_0254_60:7_discard,discard
nyt_eng_20000627_0252_60:7,neg-ext-subj,as_smart,as,smart,"As they say , nobody is as smart as everybody .  -RDQ-",nyt_eng_20000627_0252_60,7,nyt_eng_200006,"If you put them all together , you can form something better than any individual opinion .",-LRB- Fenella Saunders is an associate editor at Discover magazine . -RRB-,nyt_eng_20000627_0252_60:7_discard,discard
nyt_eng_20000627_0249_60:7,neg-ext-subj,as_smart,as,smart,"As they say , nobody is as smart as everybody .  -RDQ-",nyt_eng_20000627_0249_60,7,nyt_eng_200006,"If you put them all together , you can form something better than any individual opinion .",-LRB- Fenella Saunders is an associate editor at Discover magazine . -RRB-,nyt_eng_20000627_0249_60:7_discard,discard
nyt_eng_20000616_0326_26:19,neg-ext-subj,quite_sure,quite,sure,"And they are up for grabs because , with no pressing national issue this year , nobody is quite sure how the swing voters are going to swing .",nyt_eng_20000616_0326_26,19,nyt_eng_200006,They have emerged as swing states because they include voters who almost religiously support one party or another and  -LBQ-  swing voters  -RDQ-  who change their allegiance depending on the issues and candidates .,"A war , recession or environmental disaster makes it possible to mobilize voters nationally , said Greg Haas , a Columbus-based Democratic consultant who directed Bill Clinton 's 1992 Ohio campaign .",nyt_eng_20000616_0326_26:19_discard,discard
nyt_eng_20020913_0328_22:5,neg-ext-subj,that_naive,that,naive,-LBQ-  Nobody can be that naive since 9\/11 .  -RDQ-,nyt_eng_20020913_0328_22,5,nyt_eng_200209,"-LBQ-  When you first hear about it , you think , not here , not in my backyard .  -RDQ-",CBS News first reported the arrests Friday night .,nyt_eng_20020913_0328_22:5_discard,discard
nyt_eng_20010522_0549_78:4,neg-ext-subj,really_proud,really,proud,"-LBQ-  Nobody 's really proud of doing something like that ,  -RDQ-  Lee says today .",nyt_eng_20010522_0549_78,4,nyt_eng_200105,"Among veterans of the 157th regiment , legend has it that Patton threw the report in his wastebasket , tossed in a match and barked at the investigators  -COL-   -LBQ-  Get the hell out of here !  -RDQ-  But a copy made its way to the National Archives .",-LBQ-  The Army trained you to fight .,nyt_eng_20010522_0549_78:4_discard,discard
nyt_eng_20010522_0204_78:4,neg-ext-subj,really_proud,really,proud,"-LBQ-  Nobody 's really proud of doing something like that ,  -RDQ-  Lee says today .",nyt_eng_20010522_0204_78,4,nyt_eng_200105,"Among veterans of the 157th regiment , legend has it that Patton threw the report in his wastebasket , tossed in a match and barked at the investigators  -COL-   -LBQ-  Get the hell out of here !  -RDQ-  But a copy made its way to the National Archives .",-LBQ-  The Army trained you to fight .,nyt_eng_20010522_0204_78:4_discard,discard
nyt_eng_20010522_0183_76:4,neg-ext-subj,really_proud,really,proud,"-LBQ-  Nobody 's really proud of doing something like that ,  -RDQ-  Lee says today .",nyt_eng_20010522_0183_76,4,nyt_eng_200105,"Among veterans of the 157th regiment , legend has it that Patton threw the report in his wastebasket , tossed in a match and barked at the investigators  -COL-   -LBQ-  Get the hell out of here !  -RDQ-  But a copy made its way to the National Archives .",-LBQ-  The Army trained you to fight .,nyt_eng_20010522_0183_76:4_discard,discard
nyt_eng_20000321_0384_1:7,neg-ext-subj,actually_enthusiastic,actually,enthusiastic,Nobody in his right mind is actually enthusiastic when that service cart starts inching down the aisle with the flight attendants passing out the meals with their frightening soup-kitchen cheeriness .,nyt_eng_20000321_0384_1,7,nyt_eng_200003,,"But it was 8 -COL- 30 a.m. , and back in the last row of steerage I was getting hungry in that first hour of the haul from New York to Dallas .",nyt_eng_20000321_0384_1:7_discard,discard
nyt_eng_20001115_0104_102:59,neg-ext-subj,absolutely_sure,absolutely,sure,"And the benefits , none of them were apparent at the time people were voting , because the economy was already improving rapidly , but people did n't feel it yet ; the crime rate was dropping , but people did n't feel it yet ; the Brady Bill was beginning to work , but nobody could be absolutely sure that they were n't going to be somehow disadvantaged in their hunting or sporting or whatever .",nyt_eng_20001115_0104_102,59,nyt_eng_200011,"We passed the assault-weapons ban , we passed NAFTA _ all wildly controversial .",So we lost probably a dozen members of Congress that the NRA took out .,nyt_eng_20001115_0104_102:59_discard,discard
nyt_eng_20001114_0075_102:59,neg-ext-subj,absolutely_sure,absolutely,sure,"And the benefits , none of them were apparent at the time people were voting , because the economy was already improving rapidly , but people did n't feel it yet ; the crime rate was dropping , but people did n't feel it yet ; the Brady Bill was beginning to work , but nobody could be absolutely sure that they were n't going to be somehow disadvantaged in their hunting or sporting or whatever .",nyt_eng_20001114_0075_102,59,nyt_eng_200011,"We passed the assault-weapons ban , we passed NAFTA _ all wildly controversial .",So we lost probably a dozen members of Congress that the NRA took out .,nyt_eng_20001114_0075_102:59_discard,discard
