hit_id,bigram_lower,adj_form_lower,all_forms_lower,adv_form_lower,text_window,token_str
nyt_eng_20000429_0200_10:4-5,particularly_acute,acute,(+)_particularly_acute,particularly,"the problem is particularly acute in weeks like this , when","the problem is particularly acute in weeks like this , when the newspaper and television buildup to Saturday 's Kentucky Derby will give horse racing its broadest exposure of the year ."
pcc_eng_23_097.8155_x1564799_04:14-15,particularly_acute,acute,(+)_particularly_acute,particularly,"areas of melbourne , with effects being particularly acute in my electorate .","These changes will affect all suburban areas of Melbourne , with effects being particularly acute in my electorate ."
pcc_eng_14_106.5276_x1705757_28:8-9,particularly_acute,acute,(+)_particularly_acute,particularly,the battle between these two outlooks is particularly acute for communist union officials .,The battle between these two outlooks is particularly acute for communist union officials .
pcc_eng_28_067.4797_x1075622_04:4-5,particularly_acute,acute,(+)_particularly_acute,particularly,"the uncertainty is particularly acute , given the high rate at","The uncertainty is particularly acute , given the high rate at which the Supreme Court reverses the Federal Circuit ."
pcc_eng_14_014.5740_x0219155_14:4-5,particularly_acute,acute,(+)_particularly_acute,particularly,this conundrum becomes particularly acute when we 're trying to understand,"This conundrum becomes particularly acute when we 're trying to understand crystallisation , the process by which particles , randomly distributed in a solution , can form highly ordered crystal structures , given the right conditions ."
pcc_eng_13_093.9234_x1501943_29:4-5,particularly_acute,acute,(+)_particularly_acute,particularly,the problem is particularly acute in sao paulo state in brazil,The problem is particularly acute in Sao Paulo state in Brazil .
nyt_eng_20021219_0105_65:13-14,particularly_acute,acute,(+)_particularly_acute,particularly,that the decline in factory prices is particularly acute this year as retailers squeeze their,but analysts and manufacturers say that the decline in factory prices is particularly acute this year as retailers squeeze their suppliers even harder .
nyt_eng_20090511_0078_17:8-9,particularly_acute,acute,(+)_particularly_acute,particularly,"for europe , the french revolution was particularly acute , as french armies invaded much","for Europe , the French Revolution was particularly acute , as French armies invaded much of the continent and imposed radical institutional change - removing privileges for nobility , clergy , and guilds , and imposing civil codes - on conquered territories ."
pcc_eng_08_087.9557_x1407724_10:20-21,particularly_acute,acute,(+)_particularly_acute,particularly,economy and the cash problem there is particularly acute .,"It 's the most populous country in Africa , has a growing economy and the cash problem there is particularly acute ."
pcc_eng_16_073.2778_x1169684_073:43-44,particularly_acute,acute,(+)_particularly_acute,particularly,for display ad driven models this is particularly acute .,"As the Mail Online prepares to turn its first profit , there is a wider argument playing out about whether journalism can or should be valued by how well and widely it is distributed - for display ad driven models this is particularly acute ."
pcc_eng_14_054.6225_x0866690_04:13-14,particularly_acute,acute,(+)_particularly_acute,particularly,"women of color generally , and is particularly acute for black women , the study","It 's more pronounced for women of color generally , and is particularly acute for black women , the study finds ."
pcc_eng_02_034.8538_x0548044_18:4-5,particularly_acute,acute,(+)_particularly_acute,particularly,the challenges are particularly acute in the new york city area,"The challenges are particularly acute in the New York City area , where mass transit moves more than 8 million people every day , 24/7 , into and out of a city with 520 miles of waterfront ."
pcc_eng_05_039.9487_x0630458_38:21-22,particularly_acute,acute,(+)_particularly_acute,particularly,"( aamd ) revealed the disparity remains particularly acute at wealthy institutions , despite incremental","The new study , released Wednesday by the Association of Art Museum Directors ( AAMD ) revealed the disparity remains particularly acute at wealthy institutions , despite incremental progress in narrowing the gap ."
pcc_eng_22_057.0104_x0905162_06:6-7,particularly_acute,acute,(+)_particularly_acute,particularly,"the left 's ire was particularly acute four years ago , because brennan","The left 's ire was particularly acute four years ago , because Brennan had been a high- level CIA official during the Bush Administration ."
pcc_eng_29_048.7424_x0770968_07:3-4,particularly_acute,acute,(+)_particularly_acute,particularly,this is particularly acute on the international stage .,This is particularly acute on the international stage .
pcc_eng_11_044.7199_x0707474_004:14-15,particularly_acute,acute,(+)_particularly_acute,particularly,"will impose , oil companies face a particularly acute one : the demand for their","Of the many costs climate change will impose , oil companies face a particularly acute one : the demand for their product will have to shrink ."
pcc_eng_14_063.1921_x1005011_11:7-8,particularly_acute,acute,(+)_particularly_acute,particularly,"the need to be creative was particularly acute for the a's , who after","The need to be creative was particularly acute for the A's , who after losing to the ever-affluent Yankees in the 2001 playoffs , saw their three star players drawn away by the call of lucrative free agency ."
pcc_eng_29_041.8525_x0659894_22:18-19,particularly_acute,acute,(+)_particularly_acute,particularly,to welfare in the last parliament felt particularly acute and remain of very deep concern,It is against this backdrop that some of the changes to welfare in the last Parliament felt particularly acute and remain of very deep concern .
pcc_eng_29_014.8052_x0222937_31:40-41,particularly_acute,acute,(+)_particularly_acute,particularly,country 's financial system and creating a particularly acute headache for russian banks .,But perhaps there is a silver lining - in an odd twisted way - the concerns about Ukrainian banks and the currency peg have seen deposit outflows increasing the risk to the country 's financial system and creating a particularly acute headache for Russian banks .
pcc_eng_14_026.0980_x0405497_03:5-6,particularly_acute,acute,(+)_particularly_acute,particularly,but hunger pangs were particularly acute this time around because the dallas-,"But hunger pangs were particularly acute this time around because the Dallas- born - and - raised designer centered her fall collection around a particularly memorable meal at Ferran Adria 's El Bulli , the experimental haute cuisine restaurant on the north coast of Spain , three years ago ."
apw_eng_20040425_0541_13:4-5,particularly_acute,acute,(+)_particularly_acute,particularly,"the scramble is particularly acute in the czech republic , where","the scramble is particularly acute in the Czech Republic , where beer is the preferred beverage ."
pcc_eng_26_095.0757_x1521355_030:19-20,particularly_acute,acute,(+)_particularly_acute,particularly,", and the risks of opportunism are particularly acute in the bp - rosneft jv","The nature of the oil business makes this problem particularly acute , and the risks of opportunism are particularly acute in the BP - Rosneft JV ."
pcc_eng_17_006.9748_x0096645_36:4-5,particularly_acute,acute,(+)_particularly_acute,particularly,this conflict is particularly acute among american editors and is one,This conflict is particularly acute among American editors and is one reason why there is no strong national organization for professional editors : editors cannot agree on whether we are business people first or artisans first .
