hit_id,bigram_lower,adj_form_lower,all_forms_lower,adv_form_lower,text_window,token_str
pcc_eng_08_015.9360_x0241491_14:3-4,particularly_new,new,(+)_particularly_new,particularly,what 's particularly new is that inn joy travel users,"What 's particularly new is that Inn Joy Travel users are linked through social media to activity providers , giving access to both reviews and previous users , as well as the owner of the service ."
pcc_eng_18_069.9837_x1117175_40:7-8,particularly_new,new,(+)_particularly_new,particularly,twitter is going to be something particularly new yet very relationship .,Twitter is going to be something particularly new yet very relationship .
pcc_eng_06_089.6953_x1434414_19:31-32,particularly_new,new,(+)_particularly_new,particularly,help make sure this tool would be particularly new definition no fakes would try to,"Cook sure that your advice for certain would you ought to be able so that you can withstand the criticism of the screen help make sure this tool would be particularly new definition no fakes would try to be allowed , keep in mind this would absolutely not be naturally thought of by other one people and / or it should be inherently useful ."
pcc_eng_14_072.0829_x1149194_1:5-6,particularly_new,new,(+)_particularly_new,particularly,if you have any particularly new equipment that you picked up in,If you have any particularly new equipment that you picked up in Canada you might want to bring the receipt as well so the border guard ca n't accuse of you picking it up in the US and making you pay taxes on it .
pcc_eng_21_014.7538_x0222125_18:09-10,particularly_new,new,(+)_particularly_new,particularly,"that 's the case , what 's particularly new about netezza 's claimed "" interoperability","If that 's the case , what 's particularly new about Netezza 's claimed "" interoperability "" with SQL Server and Microsoft 's BI stack ?"
pcc_eng_15_056.0787_x0890207_20:1-2,particularly_new,new,(+)_particularly_new,particularly,"particularly new services are scarce , but the","Particularly new services are scarce , but the necessity for them is massive ."
pcc_eng_04_059.0422_x0937511_33:14-15,particularly_new,new,(+)_particularly_new,particularly,"by web site customer knowledge evaluation , particularly new versus repeat customers , and referral","Take note of segmentation info offered by web site customer knowledge evaluation , particularly new versus repeat customers , and referral sources ."
pcc_eng_06_038.4863_x0606292_35:23-24,particularly_new,new,(+)_particularly_new,particularly,"more and more features becoming available , particularly new on -line services for online account","This site is continually being developed and updated in line with customer requirements , with more and more features becoming available , particularly new on -line services for Online account holders ."
pcc_eng_00_030.8032_x0481723_09:2-3,particularly_new,new,(+)_particularly_new,particularly,"a particularly new standpoint , often put forward in","A particularly new standpoint , often put forward in direct contradiction to the current mainstream of evolutionary biology , presents a conception which is bound to the formal theory of dynamic systems and methodologically to the mathematical modelling of regulatory networks ."
pcc_eng_08_013.8838_x0208306_60:32-33,particularly_new,new,(+)_particularly_new,particularly,hesitant to say it shows off anything particularly new or exciting via this distinct vitola,"This latest addition to the Casa Magna D. Magnus II line certainly maintains the track record of the previous releases , though I 'm hesitant to say it shows off anything particularly new or exciting via this distinct vitola ."
pcc_eng_25_098.0642_x1570750_05:30-31,particularly_new,new,(+)_particularly_new,particularly,"writing , the demand for improvements and particularly new features in addition to the technical",""" As things on Tron evolved and Tron Wallet started to scale to the current 54 K users at the time of writing , the demand for improvements and particularly new features in addition to the technical complexity and time requirements to implement fees in the code has led to the review of our business model and the transition to a new model and revenue share plan . """
pcc_eng_06_029.2259_x0456665_10:6-7,particularly_new,new,(+)_particularly_new,particularly,the challenge for many -- particularly new -- operators is simply knowing what,"The challenge for many -- particularly new -- operators is simply knowing what 's required of them from a documentation standpoint , she adds ."
