hit_id,adv_form_lower,adj_form_lower,bigram_lower,neg_form_lower,all_forms_lower,text_window,token_str
pcc_eng_01_038.4475_x0605155_087:38-39-40,terribly,interested,terribly_interested,not,not_terribly_interested,to play by rules he 's not terribly interested in .,"Of course , it could be ( and has been ) argued that complaining of a "" tin ear for dialogue "" and of "" flat "" characters again asks Powers to play by rules he 's not terribly interested in ."
pcc_eng_14_096.4146_x1542578_092:3-4-5,terribly,interested,terribly_interested,not,not_terribly_interested,He 's not terribly interested .,He 's not terribly interested .
pcc_eng_03_008.2632_x0117416_081:4-5-6,terribly,interested,terribly_interested,not,not_terribly_interested,His colleagues were not terribly interested in his results .,His colleagues were not terribly interested in his results .
pcc_eng_21_098.8039_x1580162_09:3-4-5,terribly,interested,terribly_interested,not,not_terribly_interested,i 'm not terribly interested in giving up the stuff in,"I 'm not terribly interested in giving up the stuff in my medicine cabinet , but like any good Prepper , I know there may"
pcc_eng_27_104.7892_x1678974_14:23-24-25,terribly,interested,terribly_interested,not,not_terribly_interested,"in waiting , but she 's not terribly interested in him .","As the lead member of the Dore Milaje , Okoye is one of T'Challa 's wives in waiting , but she 's not terribly interested in him ."
pcc_eng_07_058.0252_x0921605_22:61-62-63,terribly,interested,terribly_interested,not,not_terribly_interested,out -- because president johnson is not terribly interested in whether intellectuals do n't like,"The point is that , essentially , the enemy -- as I think I quoted in one poem from Rosa Luxemburg -- is in your own country . ( 2 ) I mean , you 're not going to be able to do a good goddamn thing about Vietnam - - that 's absolutely out -- because President Johnson is not terribly interested in whether intellectuals do n't like Vietnam or not ."
pcc_eng_03_038.9236_x0614302_18:3-4-5,terribly,interested,terribly_interested,not,not_terribly_interested,i 'm not terribly interested in tweaking design ( remember that,"I 'm not terribly interested in tweaking design ( remember that part about not being a web developer ? ) , so using bootstrap was a pretty easy and mostly painless way to get a much better looking skin on the project after building the core in Python ."
pcc_eng_03_002.3549_x0021893_32:3-4-5,terribly,interested,terribly_interested,not,not_terribly_interested,we 're not terribly interested in establishing a 1105 brand beyond,We 're not terribly interested in establishing a 1105 brand beyond the media industry .
pcc_eng_21_076.4172_x1218725_26:12-13-14,terribly,interested,terribly_interested,not,not_terribly_interested,"message out , and they 're not terribly interested in responding to press queries about","They want to get their message out , and they 're not terribly interested in responding to press queries about topics that do n't "" align "" with their agendas ."
pcc_eng_05_002.2990_x0021125_097:39-40-41,terribly,interested,terribly_interested,not,not_terribly_interested,way is so delicious i 'm not terribly interested in trying the spit thing again,I would say I may try it again with Steve someday but to be honest the chicha recipe I have in the book that is made by malting corn kernels the standard way is so delicious I 'm not terribly interested in trying the spit thing again !
pcc_eng_08_074.9036_x1196600_12:13-14-15,terribly,interested,terribly_interested,not,not_terribly_interested,"track police killings , clearly is not terribly interested in the safety of its citizens","A government that does not even track police killings , clearly is not terribly interested in the safety of its citizens ."
pcc_eng_16_021.4400_x0331025_08:08-09-10,terribly,interested,terribly_interested,not,not_terribly_interested,"story of anvil ) , is not terribly interested in myth , acknowledging it where","The Story of Anvil ) , is not terribly interested in myth , acknowledging it where it must , but mostly focusing on Hitchcock the man , with Hitchcock the artist mostly relegated to a background role ."
pcc_eng_11_010.8196_x0158891_21:3-4-5,terribly,interested,terribly_interested,not,not_terribly_interested,she 's not terribly interested in writing for fun at home,"She 's not terribly interested in writing for fun at home , though ."
pcc_eng_18_032.7212_x0513453_026:15-16-17,terribly,interested,terribly_interested,not,not_terribly_interested,"breeds , most chow chows are not terribly interested in being man 's best friend","Although not nearly as dangerous as some other breeds , most Chow Chows are not terribly interested in being man 's best friend ."
nyt_eng_20000104_0332_27:25-26-27,terribly,interested,terribly_interested,not,not_terribly_interested,"a stimulating conversationalist , albeit one not terribly interested in small talk , and a","self-assured , energetic and , at last , happy , she made her formal debut into society as a stimulating conversationalist , albeit one not terribly interested in small talk , and a graceful dancer ."
pcc_eng_13_038.4649_x0605788_19:27-29-30,terribly,interested,terribly_interested,not,not_terribly_interested,pretty clear that he 's not too terribly interested in actually doing it .,"He agreed that submerging his mini- Rapture would give it "" a whole new dimension , "" but also made it pretty clear that he 's not too terribly interested in actually doing it ."
pcc_eng_03_005.4902_x0072559_06:19-20-21,terribly,interested,terribly_interested,not,not_terribly_interested,"savage , and in the end not terribly interested in christianity - they seem to","The tribes , the Yahgan and the Ona , are primitive and savage , and in the end not terribly interested in Christianity - they seem to have no gods or religion at all , only some superstitions and rituals - and the father gives up being a missionary , but raises his family and develops settlements where life is hard , sheep are raised , the land is gradually settled , and in some ways the lives of the natives are improved ."
apw_eng_19971231_0678_24:5-7-8,terribly,interested,terribly_interested,not,not_terribly_interested,yet ibm indonesia does not seem terribly interested in keeping their commitment to provide,yet IBM Indonesia does not seem terribly interested in keeping their commitment to provide these services to us in Medan .
pcc_eng_20_085.7295_x1368977_02:3-4-5,terribly,interested,terribly_interested,not,not_terribly_interested,i 'm not terribly interested in the minutiae of fundamentalist baptist,I 'm not terribly interested in the minutiae of fundamentalist Baptist politics in the mid-1960s ; it 's far too depressing and demoralizing .
pcc_eng_09_011.0059_x0162199_055:7-8-9,terribly,interested,terribly_interested,not,not_terribly_interested,"a : no , i 'm not terribly interested in the mechanics of how that","A : No , I 'm not terribly interested in the mechanics of how that place came to be ."
nyt_eng_20000206_0226_24:4-5-6,terribly,interested,terribly_interested,not,not_terribly_interested,`` i 'm not terribly interested in introspection but i do have,`` I 'm not terribly interested in introspection but I do have deep convictions . ''
pcc_eng_00_063.0310_x1002811_106:1-6-7,terribly,interested,terribly_interested,not,not_terribly_interested,Not that the reviewer is terribly interested anyway .,Not that the reviewer is terribly interested anyway .
pcc_eng_26_032.7760_x0513664_77:11-12-13,terribly,interested,terribly_interested,not,not_terribly_interested,"intrigues you , if you 're not terribly interested in roguelikes , this might be","Even if the premise intrigues you , if you 're not terribly interested in roguelikes , this might be one to pass on ."
pcc_eng_20_007.1603_x0099254_08:4-5-6,terribly,interested,terribly_interested,not,not_terribly_interested,they 're typically not terribly interested in talking on the nuclear issue,They 're typically not terribly interested in talking on the nuclear issue specifically .
