hit_id,bigram_lower,adv_form_lower,adj_form_lower,all_forms_lower,text_window,token_str
pcc_eng_19_018.9900_x0290214_12:08-09-10,immediately_evident,immediately,evident,not_immediately_evident,the manufacturer is from china is not immediately evident ; this fact is hidden within,"That the manufacturer is from China is not immediately evident ; this fact is hidden within a chain of various corporate entities , including holding companies registered in the British Virgin Islands ."
nyt_eng_20000308_0481_48:4-5-6,immediately_evident,immediately,evident,not_immediately_evident,"although it is not immediately evident in the broad market indexes ,","although it is not immediately evident in the broad market indexes , most shares are currently trading at bear market levels ."
pcc_eng_12_030.6465_x0480020_18:4-5-6,immediately_evident,immediately,evident,not_immediately_evident,"the costs are not immediately evident , and can be easily overlooked","The costs are not immediately evident , and can be easily overlooked , because the probability of being caught and punished for pirating is very small ."
pcc_eng_05_093.3665_x1494403_138:08-11-12,immediately_evident,immediately,evident,not_immediately_evident,"name , birthmarks are not necessarily always immediately evident at birth .","Contrary to their name , birthmarks are not necessarily always immediately evident at birth ."
pcc_eng_25_089.6299_x1434110_08:31-32-33,immediately_evident,immediately,evident,not_immediately_evident,"for purchase , though it was not immediately evident who should be cooking .","Tables and benches line the main cabin , and the open galley offers beer , chips , burgers , and egg and sausage sandwiches for purchase , though it was not immediately evident who should be cooking ."
apw_eng_20020516_0151_4:7-8-9,immediately_evident,immediately,evident,not_immediately_evident,the severity of the blow was not immediately evident and kumble continued to bat .,the severity of the blow was not immediately evident and Kumble continued to bat .
pcc_eng_18_008.8210_x0126549_03:10-12-13,immediately_evident,immediately,evident,not_immediately_evident,"with you , it may not be immediately evident some flirt overtly while some flirt","When a woman flirts with you , it may not be immediately evident some flirt overtly while some flirt in a subtle manner ."
pcc_eng_08_048.1916_x0763949_23:20-21-22,immediately_evident,immediately,evident,not_immediately_evident,", noting that "" it is not immediately evident to us how apple replaces the","And JMP analysts put a rare "" hold "" rating on the stock , noting that "" it is not immediately evident to us how Apple replaces the irreplaceable and we are maintaining our neutral stance on the stock until it becomes clear -- either that innovation and operational efficiencies will continue unabated under new management or that they are breaking down . """
pcc_eng_02_009.4012_x0135676_073:20-21-22,immediately_evident,immediately,evident,not_immediately_evident,a beauty and attraction that is not immediately evident from a consideration of her physical,"Conversely , the appearance of an average looking woman can begin to acquire a beauty and attraction that is not immediately evident from a consideration of her physical features alone ."
