hit_id,bigram_lower,adj_form_lower,all_forms_lower,adv_form_lower,text_window,token_str
pcc_eng_03_082.0901_x1313141_3:14-15,ever_good,good,(+)_ever_good,ever,season 4 episode 4 ( was she ever good at her job ? ),How To Get Away With Murder Season 4 Episode 4 ( Was She Ever Good at Her Job ? )
pcc_eng_06_024.0486_x0373022_192:36-37,ever_good,good,(+)_ever_good,ever,"his beloved hockey -- he was only ever good , never great .","As long as I 've known him , he 's been obsessed with sports , and although he played pretty much everything -- basketball , soccer , and his beloved hockey -- he was only ever good , never great ."
pcc_eng_20_070.7784_x1127578_27:6-7,ever_good,good,(+)_ever_good,ever,is being rude and offensive ever good ?,Is being rude and offensive ever good ?
pcc_eng_10_088.1467_x1408431_3:22-23,ever_good,good,(+)_ever_good,ever,"4 episode 4 , ' was she ever good at her job ? '","Watch this scene from ' How to Get Away with Murder , ' Season 4 Episode 4 , ' Was She Ever Good at Her Job ? '"
pcc_eng_03_057.8840_x0921406_11:4-5,ever_good,good,(+)_ever_good,ever,she 's only ever good in game of thrones ...,She 's only ever good in Game of Thrones ...
pcc_eng_17_026.7036_x0415923_38:5-6,ever_good,good,(+)_ever_good,ever,but is that answer ever good enough ?,But is that answer ever good enough ?
pcc_eng_24_106.3738_x1704908_04:26-27,ever_good,good,(+)_ever_good,ever,90s rolled around and boy were they ever good .,"By the time I was really into all things with four wheels and a spoiler , the ' 90s rolled around and boy were they ever good ."
pcc_eng_04_107.09835_x1728439_02:09-10,ever_good,good,(+)_ever_good,ever,first year that valentine 's day was ever good for me .,The first year that Valentine 's Day was ever good for me .
nyt_eng_19940825_0261_29:8-9,ever_good,good,(+)_ever_good,ever,"he also questioned `` whether it 's ever good for the government , even in","he also questioned `` whether it 's ever good for the government , even in its role of law enforcer , to send out letters that are abject lies . ''"
pcc_eng_19_026.6624_x0414233_068:1-2,ever_good,good,(+)_ever_good,ever,ever good and perfect gift comes form above,Ever good and perfect gift comes form above .
pcc_eng_04_016.7275_x0253917_2:8-9,ever_good,good,(+)_ever_good,ever,is this kind of open boardroom warfare ever good for shareholders ?,Is this kind of open boardroom warfare ever good for shareholders ?
pcc_eng_10_036.8363_x0579747_087:4-5,ever_good,good,(+)_ever_good,ever,"the only person ever good enough was jesus christ , who","The only person ever good enough was Jesus Christ , who came to Earth and is the Son of God ."
