hit_id,bigram_lower,adv_form_lower,adj_form_lower,all_forms_lower,text_window,token_str
pcc_eng_10_008.7486_x0125083_3:4-5,any_simpler,any,simpler,(+)_any_simpler,this doesnt receive any simpler than in which !,This doesnt receive any simpler than in which !
pcc_eng_20_069.3933_x1105062_29:20-21,any_simpler,any,simpler,(+)_any_simpler,will get more convoluted before it gets any simpler .,"If that has your head spinning , rest easy , the plot will get more convoluted before it gets any simpler ."
pcc_eng_10_050.3337_x0797737_42:1-2,any_simpler,any,simpler,(+)_any_simpler,"any simpler , it looks like a cartoon","Any simpler , it looks like a cartoon and a joke ."
pcc_eng_17_102.6317_x1642907_160:22-25-26,any_simpler,any,simpler,hardly_any_simpler,its chrono-matic models could hardly have been any simpler .,"Hamilton must have exhausted its inventory of geometric tricks with the Fontainebleau , and the design of its Chrono-Matic models could hardly have been any simpler ."
pcc_eng_29_012.2594_x0181896_107:3-5-6,any_simpler,any,simpler,n't_any_simpler,It ca n't be any simpler .,It ca n't be any simpler .
pcc_eng_09_096.4428_x1544372_11:3-5-6,any_simpler,any,simpler,n't_any_simpler,It could n't be any simpler than that .,It could n't be any simpler than that .
apw_eng_20020110_1506_5:3-5-6,any_simpler,any,simpler,n't_any_simpler,it did n't get any simpler when he finally left home .,it did n't get any simpler when he finally left home .
pcc_eng_27_029.8328_x0465322_3:3-5-6,any_simpler,any,simpler,n't_any_simpler,it could n't be any simpler to assemble and it 's easy,"It could n't be any simpler to assemble and it 's easy to transport , especially as it comes with a carry handle ."
pcc_eng_29_010.2184_x0149071_036:07-09-10,any_simpler,any,simpler,n't_any_simpler,for a cash advance could n't be any simpler .,Applying for a cash advance could n't be any simpler .
pcc_eng_23_082.1170_x1310711_1:3-5-6,any_simpler,any,simpler,n't_any_simpler,It could n't be any simpler to use .,It could n't be any simpler to use .
pcc_eng_02_035.1050_x0552047_29:19-21-22,any_simpler,any,simpler,n't_any_simpler,"of the revolution , are n't necessarily any simpler to answer than the questions that","The questions they pursue , whether about military maneuvers or the ultimate value of the Revolution , are n't necessarily any simpler to answer than the questions that fill grad-school dissertations ."
pcc_eng_01_100.1340_x1602483_03:14-16-17,any_simpler,any,simpler,n't_any_simpler,in one device that could n't be any simpler to use .,The Lush Ice Stig is the perfect all in one device that could n't be any simpler to use .
pcc_eng_11_087.0053_x1392132_13:15-17-18,any_simpler,any,simpler,n't_any_simpler,"it a pattern ) could n't be any simpler : you knit , knit ,","And the pattern ( if we can even call it a pattern ) could n't be any simpler : you knit , knit , knit and let the yarn speak for itself ."
pcc_eng_09_015.7362_x0238784_08:5-7-8,any_simpler,any,simpler,n't_any_simpler,This little project could n't be any simpler .,This little project could n't be any simpler .
pcc_eng_28_049.0044_x0776702_21:6-8-9,any_simpler,any,simpler,n't_any_simpler,"i mean , it ca n't be any simpler than that .","I mean , it ca n't be any simpler than that ."
pcc_eng_05_037.4734_x0590598_05:22-24-25,any_simpler,any,simpler,n't_any_simpler,link and the response could n't be any simpler : it appears cleaner like that,"It 's just like they asked themselves : "" Why possess a haircut ? "" useful link and the response could n't be any simpler : it appears cleaner like that ."
pcc_eng_02_007.4663_x0104373_13:25-27-28,any_simpler,any,simpler,n't_any_simpler,removed ) this recipe could n't be any simpler .,Once the cassava is defrosted and chopped ( and a few of the inner fibrous veins that still remained removed ) this recipe could n't be any simpler .
nyt_eng_19980318_0481_6:13-15-16,any_simpler,any,simpler,n't_any_simpler,ever _ and technology is n't getting any simpler .,businesses are more dependent on technology than ever _ and technology is n't getting any simpler .
pcc_eng_10_079.9487_x1276007_40:18-20-21,any_simpler,any,simpler,n't_any_simpler,drop and the ingredients could n't be any simpler .,"It is easy as breeze to make , delicious to the last drop and the ingredients could n't be any simpler ."
pcc_eng_11_064.1551_x1022105_40:3-5-6,any_simpler,any,simpler,n't_any_simpler,It ca n't be any simpler than that .,It ca n't be any simpler than that .
pcc_eng_21_090.3774_x1444504_06:26-28-29,any_simpler,any,simpler,n't_any_simpler,"in control , it could n't be any simpler than bill pay reminders .","With the familiarity of Outlook and making it easier to get things done , and customizable , so you stay in control , it could n't be any simpler than Bill Pay Reminders ."
pcc_eng_09_040.1900_x0634263_15:4-6-7,any_simpler,any,simpler,n't_any_simpler,The premise could n't be any simpler .,The premise could n't be any simpler .
pcc_eng_20_083.3713_x1330987_10:13-15-16,any_simpler,any,simpler,n't_any_simpler,money and those savings could n't be any simpler to get .,We pride ourselves in helping you save money and those savings could n't be any simpler to get .
pcc_eng_05_002.1847_x0019219_11:4-7-8,any_simpler,any,simpler,n't_any_simpler,The process could n't have been any simpler .,The process could n't have been any simpler .
nyt_eng_20000306_0104_33:11-13-14,any_simpler,any,simpler,n't_any_simpler,a computer : advice does n't get any simpler or easier to read than this,Dave 's Guides _ Buying a Computer : Advice does n't get any simpler or easier to read than this .
pcc_eng_15_017.3260_x0263352_45:4-6-7,any_simpler,any,simpler,n't_any_simpler,this mix could n't be any simpler and it could n't be any,This mix could n't be any simpler and it could n't be any more delicious .
pcc_eng_10_022.9715_x0355001_26:5-7-8,any_simpler,any,simpler,n't_any_simpler,Rule number three could n't be any simpler :,Rule number three could n't be any simpler :
pcc_eng_14_097.0638_x1553045_029:5-7-8,any_simpler,any,simpler,n't_any_simpler,Making this remedy could n't be any simpler .,Making this remedy could n't be any simpler .
pcc_eng_02_094.5442_x1512577_36:3-5-6,any_simpler,any,simpler,n't_any_simpler,It could n't be any simpler .,It could n't be any simpler .
pcc_eng_04_002.8280_x0029615_29:07-09-10,any_simpler,any,simpler,n't_any_simpler,a disc profile really could n't be any simpler .,Creating a DISC profile really could n't be any simpler .
pcc_eng_15_090.2995_x1443414_071:4-6-7,any_simpler,any,simpler,n't_any_simpler,The recipe could n't be any simpler .,The recipe could n't be any simpler .
pcc_eng_00_044.1110_x0696598_23:12-14-15,any_simpler,any,simpler,n't_any_simpler,charging it up again could n't be any simpler !,"When your battery is empty , charging it up again could n't be any simpler !"
pcc_eng_23_033.6336_x0526803_40:3-4-5,any_simpler,any,simpler,n't_any_simpler,things are n't any simpler on the business side of spellman,Things are n't any simpler on the business side of Spellman Investigations ....
pcc_eng_24_079.8890_x1276158_05:3-5-6,any_simpler,any,simpler,n't_any_simpler,it could n't be any simpler to take advantage of this great,"It could n't be any simpler to take advantage of this great offer , just book your stay with us through our website and you 'll receive your voucher when you check in ."
pcc_eng_29_085.2439_x1360678_25:1-4-5,any_simpler,any,simpler,nor_any_simpler,nor were things any simpler when cap was unaware that stark,Nor were things any simpler when Cap was unaware that Stark and Iron Man were actually one and the same .
pcc_eng_23_086.5804_x1383271_006:08-10-11,any_simpler,any,simpler,not_any_simpler,"annapolis , il movers could not be any simpler !","Finding professional Annapolis , IL movers could not be any simpler !"
pcc_eng_28_013.4622_x0201899_051:2-3-4,any_simpler,any,simpler,not_any_simpler,but not any simpler .,but not any simpler .
pcc_eng_10_059.2675_x0942131_28:6-8-9,any_simpler,any,simpler,not_any_simpler,"likewise , the controls could not be any simpler .","Likewise , the controls could not be any simpler ."
pcc_eng_20_001.3965_x0006316_16:3-5-6,any_simpler,any,simpler,not_any_simpler,It can not be any simpler .,It can not be any simpler .
pcc_eng_05_016.3328_x0248347_31:4-5-6,any_simpler,any,simpler,not_any_simpler,mainly they are not any simpler than screens and require routine ladder,Mainly they are not any simpler than screens and require routine ladder maintenance .
pcc_eng_02_083.9536_x1341196_29:31-33-34,any_simpler,any,simpler,not_any_simpler,".mov wrapper , workflow could not be any simpler .","Workflow simplified Built to support the DV family of codecs , as well as the Quick Time animation codec , while using the industry standard .mov wrapper , workflow could not be any simpler ."
pcc_eng_03_048.6493_x0771787_28:13-14-15,any_simpler,any,simpler,not_any_simpler,"as simple as possible , but not any simpler .","The PTDC prides itself on being as simple as possible , but not any simpler ."
pcc_eng_06_070.0843_x1117789_4:07-09-10,any_simpler,any,simpler,not_any_simpler,"them into an appetizer could not be any simpler -- for this flavorful recipe ,","Converting them into an appetizer could not be any simpler -- for this flavorful recipe , all you need is a toaster !"
nyt_eng_19961128_0003_5:23-25-26,any_simpler,any,simpler,not_any_simpler,"seniors , the predicament could not be any simpler .","uncertainty remains about how this game will affect Robinson 's future , but for the 14 USC seniors , the predicament could not be any simpler ."
pcc_eng_29_082.8160_x1321403_58:5-7-8,any_simpler,any,simpler,not_any_simpler,"this intergalactic garland could not be any simpler , and the kids love making","This intergalactic garland could not be any simpler , and the kids love making them to hang all around the house !"
pcc_eng_26_032.6667_x0511861_18:2-4-5,any_simpler,any,simpler,not_any_simpler,Could not be any simpler than that .,Could not be any simpler than that .
pcc_eng_03_003.3205_x0037401_11:5-6-7,any_simpler,any,simpler,not_any_simpler,"our lives were probably not any simpler without facebook , but they were","Our lives were probably not any simpler without Facebook , but they were certainly less plugged - in ."
pcc_eng_20_043.3575_x0684179_061:3-5-6,any_simpler,any,simpler,not_any_simpler,It could not be any simpler .,It could not be any simpler .
apw_eng_19980609_1498_39:06-09-10,any_simpler,any,simpler,not_any_simpler,units for command could not have been any simpler as battlezone employs a high-intuitive interface,selecting units for command could not have been any simpler as BattleZone employs a high-intuitive interface .
pcc_eng_03_092.7450_x1485504_10:10-12-13,any_simpler,any,simpler,not_any_simpler,the gt - 120 could not be any simpler .,The basic operation of the GT - 120 could not be any simpler .
pcc_eng_20_081.1197_x1294481_15:6-8-9,any_simpler,any,simpler,not_any_simpler,hawaiian grilled cheese sandwich could not be any simpler .,Hawaiian grilled cheese sandwich could not be any simpler .
