hit_id,category,colloc,adv,adj,sent_text,sent_id,adv_index,json_source,prev_sent,next_sent,label,status
apw_eng_19971231_0853_7:21,unknown-polarity,so_lazy,so,lazy,"In a recent interview , she said  -COL-   -LBQ-  Every year my New Year 's resolution is do n't be so lazy , get things done , do n't procrastinate , do more exercise , and be more careful about people and things .  -RDQ-",apw_eng_19971231_0853_7,21,apw_eng_199712,"Or perhaps Mirren , 51 , was belatedly following a New Year 's resolution .",,apw_eng_19971231_0853_7:21_discard,discard
apw_eng_19971230_0807_21:4,unknown-polarity,now_aware,now,aware,"Every Malaysian is now aware of what he or she needs to do  -COL-  save and cut costs , spend not on luxury items , import only essentials , make more local goods and export them , do not expect huge wage increases , cut perks and allowances , sacrifice .",apw_eng_19971230_0807_21,4,apw_eng_199712,"In Malaysia 's case , the people have been asked to swallow the bitter pills of austerity to expedite economic recovery .",These are basic things that do not cause extreme pain to the individual .,apw_eng_19971230_0807_21:4_discard,discard
apw_eng_19971229_0377_6:24,unknown-polarity,as_dangerous,as,dangerous,"Vitaly Budko , chairman of the Russian Independent Trade Union of Coal Miners , has said every coal mine in Russia is potentially as dangerous .",apw_eng_19971229_0377_6,24,apw_eng_199712,"Earlier this month , 67 miners were killed by a methane gas explosion in a Siberian mine , marking one of the worst disasters in Russia 's mining industry in decades .",Deputy Prime Minister Yakov Urinson has said that 86 of Russia 's 200 coal mines will be closed next year .,apw_eng_19971229_0377_6:24_discard,discard
apw_eng_19970419_0874_11:6,unknown-polarity,quite_delightful,quite,delightful,"Every time , it was quite delightful .",apw_eng_19970419_0874_11,6,apw_eng_199704,And Matisse painted the same picture God knows how many thousand times .,"And people like Horton Foote , who I think is a wonderful writer , writes essentially the same play again and again ,  -RDQ-  Beresford goes on , still tickled at his observation .",apw_eng_19970419_0874_11:6_discard,discard
apw_eng_20070320_0535_10:12,unknown-polarity,very_difficult,very,difficult,"-LBQ-  Every first match -LRB- at an international meet -RRB- is very difficult ,  -RDQ-  he added .",apw_eng_20070320_0535_10,12,apw_eng_200703,-LBQ-  We let the German team back in the game .,-LBQ-  This is a problem for us .,apw_eng_20070320_0535_10:12_discard,discard
apw_eng_20070320_0196_10:12,unknown-polarity,very_difficult,very,difficult,"-LBQ-  Every first match -LRB- at an international meet -RRB- is very difficult ,  -RDQ-  he added .",apw_eng_20070320_0196_10,12,apw_eng_200703,-LBQ-  We let the German team back in the game .,-LBQ-  This is a problem for us .,apw_eng_20070320_0196_10:12_discard,discard
apw_eng_20070306_1082_8:25,unknown-polarity,jointly_responsible,jointly,responsible,"The judges in Leeuwarden said that while there was cooperation between different chapters ,  -LBQ-  that does n't mean that every individual chapter is jointly responsible for the acts of other chapters .  -RDQ-",apw_eng_20070306_1082_8,25,apw_eng_200703,Prosecutors accuse Hells Angels chapters throughout the Netherlands of organized involvement in weapons and drugs offenses .,"The Harlingen chapter 's club house was raided in 2005 as part of a large scale investigation into allegations of extortion , intimidation , weapons and drugs trafficking .",apw_eng_20070306_1082_8:25_discard,discard
apw_eng_20070302_0918_7:10,unknown-polarity,very_important,very,important,"It 's a new discipline but every trophy is very important ,  -RDQ-  said Austria Alpine director Hans Pum .",apw_eng_20070302_0918_7,10,apw_eng_200703,-LBQ-  It 's an important trophy .,-LBQ-  You have ski good in downhill and slalom .,apw_eng_20070302_0918_7:10_discard,discard
apw_eng_20070105_0072_62:14,unknown-polarity,completely_brilliant,completely,brilliant,"Every second and every inch of  -LBQ-  Chicago ,  -RDQ-  she says is completely brilliant .",apw_eng_20070105_0072_62,14,apw_eng_200701,"Now she 'll get another chance to shimmy and strut in fishnets , and all that jazz .",-LBQ-  I understand what the show is .,apw_eng_20070105_0072_62:14_discard,discard
apw_eng_20100312_0651_25:9,unknown-polarity,as_dangerous,as,dangerous,-LBQ-  In the Premier League every game is as dangerous .,apw_eng_20100312_0651_25,9,apw_eng_201003,"-LBQ-  The most important thing , that we keep our humility , work hard for each other and then we have a chance ,  -RDQ-  Arsenal manager Arsene Wenger said .",We have to make sure we prepare well for Hull .,apw_eng_20100312_0651_25:9_discard,discard
apw_eng_19980112_1074_34:4,unknown-polarity,now_aware,now,aware,"Every Malaysian is now aware of what he or she needs to do  -COL-  save and cut costs , spend not on luxury items , import only essentials , make more local goods and export them , do not expect huge wage increases , cut perks and allowances , sacrifice .",apw_eng_19980112_1074_34,4,apw_eng_199801,"In Malaysia 's case , the people have been asked to swallow the bitter pills of austerity to expedite economic recovery .",These are basic things that do not cause extreme pain to the individual .,apw_eng_19980112_1074_34:4_discard,discard
apw_eng_19980112_1074_21:4,unknown-polarity,now_aware,now,aware,"Every Malaysian is now aware of what he or she needs to do  -COL-  save and cut costs , spend not on luxury items , import only essentials , make more local goods and export them , do not expect huge wage increases , cut perks and allowances , sacrifice .",apw_eng_19980112_1074_21,4,apw_eng_199801,"In Malaysia 's case , the people have been asked to swallow the bitter pills of austerity to expedite economic recovery .",These are basic things that do not cause extreme pain to the individual .,apw_eng_19980112_1074_21:4_discard,discard
apw_eng_20090913_0324_17:21,unknown-polarity,genuinely_concerned,genuinely,concerned,I told him that aside from meeting Mitchell he should rest a bit because I believe that every Israeli is genuinely concerned for our president .  -RDQ-,apw_eng_20090913_0324_17,21,apw_eng_200909,-LBQ-  He spoke with me about what he plans to tell envoy Mitchell .,French President Nicolas Sarkozy also dispatched a letter saying how pleased he was to learn that Peres had recovered from the brief medical scare .,apw_eng_20090913_0324_17:21_discard,discard
apw_eng_20090913_0293_17:21,unknown-polarity,genuinely_concerned,genuinely,concerned,I told him that aside from meeting Mitchell he should rest a bit because I believe that every Israeli is genuinely concerned for our president .  -RDQ-,apw_eng_20090913_0293_17,21,apw_eng_200909,-LBQ-  He spoke with me about what he plans to tell envoy Mitchell .,Peres has enjoyed a political career spanning seven decades .,apw_eng_20090913_0293_17:21_discard,discard
apw_eng_20090902_0018_14:11,unknown-polarity,really_loud,really,loud,"Every time I won a point , the crowd was really loud .",apw_eng_20090902_0018_14,11,apw_eng_200909,It was lots of fun .,I had thrills down my spine .  -RDQ-,apw_eng_20090902_0018_14:11_discard,discard
apw_eng_20090901_0012_10:6,unknown-polarity,so_candid,so,candid,"Not every country has been so candid when facing an epidemic  -COL-  China was heavily criticized for its slow response to SARS in 2003 , while Argentina refused to declare a national public health emergency when swine flu flared there in July .",apw_eng_20090901_0012_10,6,apw_eng_200909,"In hindsight , Mexico 's most effective action -- one now emulated around the world -- was immediately telling its own citizens when the new virus was detected .","But Mexico 's openness did n't come cheap  -COL-  Economists say the outbreak cost the country billions of dollars , mostly in losses from tourism .",apw_eng_20090901_0012_10:6_discard,discard
apw_eng_20030311_0849_17:18,unknown-polarity,very_important,very,important,"-LBQ-  I realize it 's not going to last forever , so every match is very , very important to me .",apw_eng_20030311_0849_17,18,apw_eng_200303,Coetzer said she appreciates playing more now that she 's gotten older .,"I do n't always look like I 'm having fun , but deep inside I am ,  -RDQ-  she said .",apw_eng_20030311_0849_17:18_discard,discard
apw_eng_20030304_0181_15:9,unknown-polarity,very_experienced,very,experienced,"-LBQ-  Every player in the squad is already very experienced ,  -RDQ-  Wilkinson said .",apw_eng_20030304_0181_15,9,apw_eng_200303,"Uncapped center Ollie Smith features on the bench , along with lock Simon Shaw and flanker Alex Sanderson .",-LBQ-  What 's important is that we concentrate on the game in hand and keep ourselves firmly focussed on the opposition .  -RDQ-,apw_eng_20030304_0181_15:9_discard,discard
apw_eng_20031012_0270_24:4,unknown-polarity,so_close,so,close,Every game was so close in the third set and I could feel the match going away from me .,apw_eng_20031012_0270_24,4,apw_eng_200310,-LBQ-  Kim was just better today .,I just got tired .  -RDQ-,apw_eng_20031012_0270_24:4_discard,discard
apw_eng_20090724_0552_13:12,unknown-polarity,well_aware,well,aware,"-LBQ-  I 'm strongly convinced that every Chechen person should be well aware of the processes that are taking place , and should take part in them .  -RDQ-",apw_eng_20090724_0552_13,12,apw_eng_200907,"-LBQ-  I would like to express delight that this has taken place ,  -RDQ-  Zakayev said through a translator .","Abdurakhmanov , who was representing the Kremlin-backed government of President Ramzan Kadyrov , said talks had centered on  -LBQ-  political stability in the Chechen republic and the final consolidation of Chechen society .  -RDQ-",apw_eng_20090724_0552_13:12_discard,discard
apw_eng_19960725_1129_20:9,unknown-polarity,always_negative,always,negative,"-LBQ-  Every time I 'm tested it 's always negative , and I 'm tested again and again and again .",apw_eng_19960725_1129_20,9,apw_eng_199607,"-LBQ-  No , I have never used performance-enhancing drugs ,  -RDQ-  she said Wednesday night .","For every one time a person on the U.S. national team is tested , I 'm tested five times .  -RDQ-",apw_eng_19960725_1129_20:9_discard,discard
apw_eng_19960725_0605_37:9,unknown-polarity,always_negative,always,negative,"-LBQ-  Every time I 'm tested it 's always negative , and I 'm tested again and again and again .",apw_eng_19960725_0605_37,9,apw_eng_199607,"-LBQ-  I just have to laugh at it ,  -RDQ-  she said of the rumors .","For every one time a person on the U.S. national team is tested , I 'm tested five times .  -RDQ-",apw_eng_19960725_0605_37:9_discard,discard
apw_eng_19960725_0411_31:9,unknown-polarity,always_negative,always,negative,"-LBQ-  Every time I 'm tested it 's always negative , and I 'm tested again and again and again .",apw_eng_19960725_0411_31,9,apw_eng_199607,"-LBQ-  I just have to laugh at it ,  -RDQ-  she said of the rumors .","For every one time a person on the U.S. national team is tested , I 'm tested five times .  -RDQ-",apw_eng_19960725_0411_31:9_discard,discard
apw_eng_19970808_1332_14:4,unknown-polarity,so_hard,so,hard,Every match is so hard .,apw_eng_19970808_1332_14,4,apw_eng_199708,-LBQ-  The depth on the tour is unbelievable .,"Everyone 's getting stronger , hitting the ball harder and faster .  -RDQ-",apw_eng_19970808_1332_14:4_discard,discard
apw_eng_19970808_1330_14:4,unknown-polarity,so_hard,so,hard,Every match is so hard .,apw_eng_19970808_1330_14,4,apw_eng_199708,-LBQ-  The depth on the tour is unbelievable .,"Everyone 's getting stronger , hitting the ball harder and faster .  -RDQ-",apw_eng_19970808_1330_14:4_discard,discard
apw_eng_20030821_0596_10:14,unknown-polarity,extremely_important,extremely,important,"-LBQ-  Every race from now until the end of the season is obviously extremely important , but this race could really put one of the contenders _ hopefully Tony _ in a very strong position for the championship .  -RDQ-",apw_eng_20030821_0596_10,14,apw_eng_200308,"-LBQ-  A driver can make a difference around this racetrack , and I think Tony is as good as they come as far as being able to make up a little bit if the car is not absolutely perfect ,  -RDQ-  said Green , president of Andretti Green Racing .",There 's also a considerable amount of emotion for Andretti .,apw_eng_20030821_0596_10:14_discard,discard
apw_eng_20091228_0015_22:15,unknown-polarity,now_resistant,now,resistant,Dr. White said virtually every case of malaria he sees in western Cambodia is now resistant to drugs .,apw_eng_20091228_0015_22,15,apw_eng_200912,"Already , The Associated Press found , resistance to malaria has spread faster and wider than previously documented .","And in the Pailin area , patients given artemisinin take twice as long as those elsewhere to be clear of the parasite -- 84 hours instead of the typical 48 , and sometimes even 96 .",apw_eng_20091228_0015_22:15_discard,discard
apw_eng_20020925_0529_14:10,unknown-polarity,extremely_important,extremely,important,"-LBQ-  So every shot from that point on was extremely important ,  -RDQ-  Langer said .",apw_eng_20020925_0529_14,10,apw_eng_200209,"-LBQ-  Whatever the outcome , it would determine the outcome of the Ryder Cup for that year .","-LBQ-  And I managed to come from 2 down to to even and even then had a chance to win this thing on the 18th , which I missed .",apw_eng_20020925_0529_14:10_discard,discard
apw_eng_19961002_0790_23:12,unknown-polarity,as_much,as,much,-LBQ-  But I ca n't guarantee that every year will be as much of a surprise as last year .  -RDQ-,apw_eng_19961002_0790_23,12,apw_eng_199610,"-LBQ-  There will be no leaks this year ,  -RDQ-  said Lundestad .",Last year 's award to Rotblat and his Pugwash society came as a complete surprise to the usually well-informed Norwegian news media .,apw_eng_19961002_0790_23:12_discard,discard
apw_eng_19970919_0415_23:6,unknown-polarity,very_concerned,very,concerned,"-LBQ-  Every indictee should be very concerned ... whether he can relax comfortably or sleep soundly ,  -RDQ-  Scheffer warned .",apw_eng_19970919_0415_23,6,apw_eng_199709,"This summer , international troops have twice snatched indicted suspects in the former Yugoslavia , prompting many to go into hiding to avoid arrest .",,apw_eng_19970919_0415_23:6_discard,discard
apw_eng_19980813_0885_20:16,unknown-polarity,very_good,very,good,"-LBQ-  Every -LRB- Swiss -RRB- franc that we can get back in his name is very good ,  -RDQ-  he said , but added ,  -LBQ-  It 's been so many years , and I understand that it will take more for them to give out the money .  -RDQ-",apw_eng_19980813_0885_20,16,apw_eng_199808,"Haber , whose entire family was wiped out by the Nazis , is now hoping that someone from the claims office will contact him .",Thursday 's agreement calls for the money to be paid out over four years .,apw_eng_19980813_0885_20:16_discard,discard
apw_eng_19980429_0275_32:9,unknown-polarity,always_negative,always,negative,"-LBQ-  Every time I 'm tested it 's always negative , and I 'm tested again and again and again .",apw_eng_19980429_0275_32,9,apw_eng_199804,"-LBQ-  I just have to laugh at it ,  -RDQ-  Smith said in Atlanta of the rumors .","For every one time a person on the U.S. national team is tested , I 'm tested five times .  -RDQ-",apw_eng_19980429_0275_32:9_discard,discard
apw_eng_19980429_0118_24:9,unknown-polarity,always_negative,always,negative,"-LBQ-  Every time I 'm tested it 's always negative , and I 'm tested again and again and again .",apw_eng_19980429_0118_24,9,apw_eng_199804,"-LBQ-  I just have to laugh at it ,  -RDQ-  Smith said in Atlanta of the rumors .","For every one time a person on the U.S. national team is tested , I 'm tested five times .  -RDQ-",apw_eng_19980429_0118_24:9_discard,discard
apw_eng_19980429_0035_22:9,unknown-polarity,always_negative,always,negative,"-LBQ-  Every time I 'm tested it 's always negative , and I 'm tested again and again and again .",apw_eng_19980429_0035_22,9,apw_eng_199804,"-LBQ-  I just have to laugh at it ,  -RDQ-  Smith said in Atlanta of the rumors .","For every one time a person on the U.S. national team is tested , I 'm tested five times .  -RDQ-",apw_eng_19980429_0035_22:9_discard,discard
apw_eng_19980429_0007_19:9,unknown-polarity,always_negative,always,negative,"-LBQ-  Every time I 'm tested it 's always negative , and I 'm tested again and again and again .",apw_eng_19980429_0007_19,9,apw_eng_199804,"-LBQ-  I just have to laugh at it ,  -RDQ-  Smith said in Atlanta of the rumors .","For every one time a person on the U.S. national team is tested , I 'm tested five times .  -RDQ-",apw_eng_19980429_0007_19:9_discard,discard
apw_eng_20071016_1349_4:6,unknown-polarity,bit_worried,bit,worried,Every shot I was a bit worried .,apw_eng_20071016_1349_4,6,apw_eng_200710,"-LBQ-  I saw a little bit of the nice coastline and scenery , but it was very much a workmanlike day .","It was a tough day out there for me , and luckily , the putts were dropping and it kept me right in there .  -RDQ-",apw_eng_20071016_1349_4:6_discard,discard
apw_eng_20090626_0431_13:6,unknown-polarity,absolutely_precise,absolutely,precise,Every step he took was absolutely precise and fluid at the same time .  -RDQ-,apw_eng_20090626_0431_13,6,apw_eng_200906,"On Thursday , Martin Scorsese , who directed Jackson 's 1987 video ,  -LBQ-  Bad ,  -RDQ-  marveled at his  -LBQ-  absolute mastery of movement on the one hand , and of the music on the other .","But even as Jackson played a major influence on TV , it was n't always under his control .",apw_eng_20090626_0431_13:6_discard,discard
apw_eng_20090607_0418_14:6,unknown-polarity,pretty_emotional,pretty,emotional,"-LBQ-  Every race has been pretty emotional , all the old memories come flooding back ,  -RDQ-  said Button , who spent last season at the back of the grid .",apw_eng_20090607_0418_14,6,apw_eng_200906,"Button joined Mansell , Damon Hill , Jim Clark , Jackie Stewart and James Hunt as the only Britons to win six races in a season .",-LBQ-  We thought it was going to be a tougher battle today .  -RDQ-,apw_eng_20090607_0418_14:6_discard,discard
apw_eng_20090607_0416_14:6,unknown-polarity,pretty_emotional,pretty,emotional,"-LBQ-  Every race has been pretty emotional , all the old memories come flooding back ,  -RDQ-  said Button , who spent last season at the back of the grid .",apw_eng_20090607_0416_14,6,apw_eng_200906,"Button joined Mansell , Damon Hill , Jim Clark , Jackie Stewart and James Hunt as the only Britons to win six races in a season .",-LBQ-  We thought it was going to be a tougher battle today .  -RDQ-,apw_eng_20090607_0416_14:6_discard,discard
apw_eng_19980612_1576_9:4,unknown-polarity,deeply_aware,deeply,aware,"Every Macedonian is deeply aware that ethnic conflict there can lead to a break-up of their small , young country of just under 2 million , possibly sparking a wider Balkan conflict .",apw_eng_19980612_1576_9,4,apw_eng_199806,But Macedonia 's sizeable ethnic Albanian minority is naturally bound to kin in Kosovo and Albania .,The government statement made no mention of a special session of parliament to approve the NATO maneuvers .,apw_eng_19980612_1576_9:4_discard,discard
apw_eng_19980612_1571_9:4,unknown-polarity,deeply_aware,deeply,aware,"Every Macedonian is deeply aware that ethnic conflict there can lead to a break-up of their small , young country of just under 2 million , possibly sparking a wider Balkan conflict .",apw_eng_19980612_1571_9,4,apw_eng_199806,But Macedonia 's sizeable ethnic Albanian minority is naturally bound to kin in Kosovo and Albania .,The government statement made no mention of a special session of parliament to approve the NATO maneuvers .,apw_eng_19980612_1571_9:4_discard,discard
