hit_id,adv_form_lower,adj_form_lower,bigram_lower,neg_form_lower,all_forms_lower,text_window,token_str
pcc_eng_14_036.0856_x0566799_17:7-8-9,remotely,interesting,remotely_interesting,n't,n't_remotely_interesting,the character ' dynamics ' are n't remotely interesting enough to hold the hour and,The character ' dynamics ' are n't remotely interesting enough to hold the hour and ten minutes where nothing happens .
pcc_eng_25_007.0579_x0098316_15:22-23-24,remotely,interesting,remotely_interesting,n't,n't_remotely_interesting,", but a professor that is n't remotely interesting is going to make it very","I 'm not saying all professors have to be stand - up comedians all semester , but a professor that is n't remotely interesting is going to make it very hard to go to lectures ."
pcc_eng_29_098.4590_x1574615_27:16-17-18,remotely,interesting,remotely_interesting,n't,n't_remotely_interesting,"a lightsaber , a hoe was n't remotely interesting .","Once someone had witnessed what they could do with a lightsaber , a hoe was n't remotely interesting ."
pcc_eng_03_086.6062_x1386237_076:23-28-29,remotely,interesting,remotely_interesting,none,none_remotely_interesting,"the same voice , none of whom are even remotely interesting or convincing as human","She tells her story through the eyes of half a dozen characters , all of whom speak in the same voice , none of whom are even remotely interesting or convincing as human beings ."
pcc_eng_29_011.1614_x0164316_12:1-5-6,remotely,interesting,remotely_interesting,none,none_remotely_interesting,None of them were remotely interesting .,None of them were remotely interesting .
pcc_eng_18_088.1871_x1411945_23:07-13-14,remotely,interesting,remotely_interesting,none,none_remotely_interesting,"'re like me , none of the above is even remotely interesting except for the fact","If you 're like me , none of the above is even remotely interesting except for the fact that it would likely prolong the ordeal , push the date of the next tip-off even further in the future , and roll our eyeballs even further back in their sockets ."
pcc_eng_08_073.6391_x1176085_39:1-6-7,remotely,interesting,remotely_interesting,none,none_remotely_interesting,"none of these people are remotely interesting or worth following , their functions","None of these people are remotely interesting or worth following , their functions are interchangable , the leads could n't create a spark of chemistry between them if they were standing in the middle of a raging brushfire , and all of this nothingness takes a backseat to the impressive and oppressive visual effects that start to all look the same after only a matter of minutes ."
pcc_eng_00_011.2561_x0165486_44:1-6-7,remotely,interesting,remotely_interesting,none,none_remotely_interesting,none of it is even remotely interesting or engaging in any way .,None of it is even remotely interesting or engaging in any way .
pcc_eng_25_007.2477_x0101435_133:17-21-22,remotely,interesting,remotely_interesting,none,none_remotely_interesting,"a-list actors , none of them are remotely interesting .","But even though there 's a bevy of monsters and a bunch of a-list actors , none of them are remotely interesting ."
pcc_eng_15_094.4153_x1509861_35:1-7-8,remotely,interesting,remotely_interesting,none,none_remotely_interesting,None of your travel stories are remotely interesting,None of your travel stories are remotely interesting
pcc_eng_06_074.1784_x1183640_39:3-5-6,remotely,interesting,remotely_interesting,not,not_remotely_interesting,it 's not even remotely interesting anymore to see the portrayal of,It 's not even remotely interesting anymore to see the portrayal of pitiful and / or beaten to a pulp Shioon .
pcc_eng_20_006.6013_x0090234_138:23-25-26,remotely,interesting,remotely_interesting,not,not_remotely_interesting,"and in my opinion , not even remotely interesting .","It is to be said however , that the introductory essay is too long , drawn out and in my opinion , not even remotely interesting ."
pcc_eng_18_085.1434_x1362443_26:4-5-6,remotely,interesting,remotely_interesting,not,not_remotely_interesting,"since he 's not remotely interesting , and his motives for ushering","Since he 's not remotely interesting , and his motives for ushering around Washington 's dangerous character are purely a means of furthering the narrative , we only have the great Denzel to root for ."
pcc_eng_16_083.5450_x1336172_3:23-25-26,remotely,interesting,remotely_interesting,not,not_remotely_interesting,", which is to say not even remotely interesting enough to write a ...","The vast majority of the time , his life is about as interesting as anyone else 's , which is to say not even remotely interesting enough to write a ..."
pcc_eng_27_061.6891_x0980898_033:7-8-9,remotely,interesting,remotely_interesting,not,not_remotely_interesting,even the cadence of it is not remotely interesting .,even the cadence of it is not remotely interesting .
pcc_eng_11_098.4164_x1576890_20:07-09-10,remotely,interesting,remotely_interesting,not,not_remotely_interesting,"the truman show , but not even remotely interesting or entertaining .","Imagine the Truman Show , but not even remotely interesting or entertaining ."
pcc_eng_18_094.6661_x1517063_22:3-4-5,remotely,interesting,remotely_interesting,nothing,nothing_remotely_interesting,There 's nothing remotely interesting about the locale .,There 's nothing remotely interesting about the locale .
pcc_eng_20_006.2652_x0084778_49:16-17-18,remotely,interesting,remotely_interesting,nothing,nothing_remotely_interesting,son matt romney appeared and said nothing remotely interesting .,"On behalf of the Romney campaign , Mitt 's son Matt Romney appeared and said nothing remotely interesting ."
pcc_eng_07_027.7698_x0432922_3:10-12-13,remotely,interesting,remotely_interesting,nothing,nothing_remotely_interesting,and depressing and there is nothing even remotely interesting or enjoyable about any song on,Vocally it 's woeful and depressing and there is nothing even remotely interesting or enjoyable about any song on this crap album .
pcc_eng_24_024.0266_x0372360_43:4-5-6,remotely,interesting,remotely_interesting,nothing,nothing_remotely_interesting,"and sometimes , nothing remotely interesting happens to be told an answer","And sometimes , nothing remotely interesting happens to be told an answer rather than learn it - despite the security strip poker software how to make all individual decisions easier ."
pcc_eng_16_036.7875_x0579200_10:07-11-12,remotely,interesting,remotely_interesting,nothing,nothing_remotely_interesting,stands out and nothing about you is remotely interesting .,Nothing about you stands out and nothing about you is remotely interesting .
pcc_eng_25_004.8873_x0063403_29:3-4-5,remotely,interesting,remotely_interesting,nothing,nothing_remotely_interesting,"there 's nothing remotely interesting in goulart's , er , shatner","There 's nothing remotely interesting in Goulart's , er , Shatner 's future , neither on Earth nor Mars."
pcc_eng_24_077.2116_x1232814_19:15-16-17,remotely,interesting,remotely_interesting,nothing,nothing_remotely_interesting,"australian telephone exchanges , there 's nothing remotely interesting about a zombie movie set in","With no offence to people who work in Australian telephone exchanges , there 's nothing remotely interesting about a zombie movie set in Australian telephone exchanges ."
pcc_eng_29_006.8734_x0095010_3:4-5-6,remotely,interesting,remotely_interesting,nothing,nothing_remotely_interesting,there 's just nothing remotely interesting / appealing about them ...,There 's just nothing remotely interesting / appealing about them ...
pcc_eng_25_008.0940_x0115048_21:1-3-4,remotely,interesting,remotely_interesting,nothing,nothing_remotely_interesting,nothing even remotely interesting that i can share with the,Nothing even remotely interesting that I can share with the public at large .
pcc_eng_24_029.5910_x0462403_76:21-23-24,remotely,interesting,remotely_interesting,nothing,nothing_remotely_interesting,"right enough "" , so nothing even remotely interesting or amusing or engaging ever happens","Oh , there 's that cunt Bill Bryson , I 'm avoiding that cunt , right enough "" , so nothing even remotely interesting or amusing or engaging ever happens to him , the writing about mundane things in a mundane manner cunt ."
pcc_eng_11_009.0647_x0130457_60:21-29-30,remotely,interesting,remotely_interesting,nothing,nothing_remotely_interesting,learned that a ) nothing anyone writes on Twitter is ever even remotely interesting and b ) it,If Packer bothered to hit the pipe for an hour or so he would have quickly learned that a ) nothing anyone writes on Twitter is ever even remotely interesting and b ) it 's a really easy way to find out about other interesting things that people are writing on the internet .
