hit_id,colloc,sent_text,relay_form,neg_form,adv_form,adj_form,text_window,sent_id,prev_sent,sent_text,token_str,lemma_str,next_sent,relay_lemma,neg_lemma,adv_lemma,adj_lemma,relay_index,neg_index,adv_index,adj_index,dep_relay_source,dep_relay_target,dep_relay_relation,dep_neg_source,dep_neg_target,dep_neg_relation,dep_mod_source,dep_mod_target,dep_mod_relation,json_source,match_ix,colloc,category
nyt_eng_20040504_0030_5:6-10-11,more_important,"As it has turned out , few Spurs have been more important than the young Parker .",Spurs,few,more,important,"out , few Spurs have been more important than the",nyt_eng_20040504_0030_5,"Had Kidd accepted San Antonio 's offer and become a Spur , Tony Parker would have had an uncertain role -LRB- if any -RRB- with the Spurs .","As it has turned out , few Spurs have been more important than the young Parker .","as it has turned out , few Spurs have been more important than the young Parker .","as it has turn out , few spur have be more important than the young Parker .","-LRB- Rosner , Austin American-Statesman -RRB-",Spurs,few,more,important,7,6,10,11,"{'lemma': 'important', 'ix': 11, 'xpos': 'JJ', 'deprel': 'root', 'head': '.'}","{'lemma': 'spur', 'ix': 7, 'xpos': 'NNS', 'deprel': 'nsubj', 'head': 'important'}",nsubj,"{'lemma': 'spur', 'ix': 7, 'xpos': 'NNS', 'deprel': 'nsubj', 'head': 'important'}","{'lemma': 'few', 'ix': 6, 'xpos': 'JJ', 'deprel': 'amod', 'head': 'spur'}",amod,"{'lemma': 'important', 'ix': 11, 'xpos': 'JJ', 'deprel': 'root', 'head': '.'}","{'lemma': 'more', 'ix': 10, 'xpos': 'RBR', 'deprel': 'advmod', 'head': 'important'}",advmod,nyt_eng_200405,6-10-11,more_important,nonimmediateNeg
nyt_eng_20040501_0032_36:1-15-16,as_effective,"-LBQ-  No matter how well trained and alert they are , they 're simply not as effective .",matter,No,as,effective,"`` No matter how well trained and alert they are , they 're simply not as effective .",nyt_eng_20040501_0032_36,"-LBQ-  A human being has his limits ,  -RDQ-  the consultant said .","-LBQ-  No matter how well trained and alert they are , they 're simply not as effective .","`` No matter how well trained and alert they are , they 're simply not as effective .","`` no matter how well trained and alert they be , they be simply not as effective .",They ca n't be at all places at all times .,matter,No,as,effective,2,1,15,16,"{'lemma': 'effective', 'ix': 16, 'xpos': 'JJ', 'deprel': 'root', 'head': '.'}","{'lemma': 'matter', 'ix': 2, 'xpos': 'NN', 'deprel': 'advmod', 'head': 'effective'}",advmod,"{'lemma': 'matter', 'ix': 2, 'xpos': 'NN', 'deprel': 'advmod', 'head': 'effective'}","{'lemma': 'no', 'ix': 1, 'xpos': 'DT', 'deprel': 'dep', 'head': 'matter'}",dep,"{'lemma': 'effective', 'ix': 16, 'xpos': 'JJ', 'deprel': 'root', 'head': '.'}","{'lemma': 'as', 'ix': 15, 'xpos': 'RB', 'deprel': 'advmod', 'head': 'effective'}",advmod,nyt_eng_200405,1-15-16,as_effective,nonimmediateNeg
nyt_eng_20040501_0006_36:26-33-34,truly_untouchable,"Jamison accepted his role and claimed the Sixth Man of the Year award , but does his future include continuing to come off the bench ? No one , including Nowitzki , is truly untouchable as the Mavs continue to search for that elusive low-post presence .",one,No,truly,untouchable,"bench ? No one , including Nowitzki , is truly untouchable as the",nyt_eng_20040501_0006_36,"Walker , entering the last year of his contract , never became the point forward Nelson envisioned , but remains a valuable trade commodity .","Jamison accepted his role and claimed the Sixth Man of the Year award , but does his future include continuing to come off the bench ? No one , including Nowitzki , is truly untouchable as the Mavs continue to search for that elusive low-post presence .","Jamison accepted his role and claimed the Sixth Man of the Year award , but does his future include continuing to come off the bench ? No one , including Nowitzki , is truly untouchable as the Mavs continue to search for that elusive low-post presence .","Jamison accept he role and claim the Sixth man of the year award , but does he future include continue to come off the bench ? no one , include Nowitzki , be truly untouchable as the Mavs continue to search for that elusive low-post presence .","-LBQ-  I do n't know that we wo n't have the same group ,  -RDQ-  Donnie Nelson said .",one,No,truly,untouchable,27,26,33,34,"{'lemma': 'untouchable', 'ix': 34, 'xpos': 'JJ', 'deprel': 'ccomp', 'head': 'accept'}","{'lemma': 'one', 'ix': 27, 'xpos': 'CD', 'deprel': 'nsubj', 'head': 'untouchable'}",nsubj,"{'lemma': 'one', 'ix': 27, 'xpos': 'CD', 'deprel': 'nsubj', 'head': 'untouchable'}","{'lemma': 'no', 'ix': 26, 'xpos': 'DT', 'deprel': 'det', 'head': 'one'}",det,"{'lemma': 'untouchable', 'ix': 34, 'xpos': 'JJ', 'deprel': 'ccomp', 'head': 'accept'}","{'lemma': 'truly', 'ix': 33, 'xpos': 'RB', 'deprel': 'advmod', 'head': 'untouchable'}",advmod,nyt_eng_200405,26-33-34,truly_untouchable,nonimmediateNeg
nyt_eng_20040223_0032_22:14-19-20,as_likely,"-LBQ-  It 's a dramatic difference ,  -RDQ-  Arnold said , noting that leaves without endophytes were three times as likely to die and lost twice as much leaf tissue , showing large , brown lesions .",leaves,without,as,likely,noting that leaves without endophytes were three times as likely to die,nyt_eng_20040223_0032_22,"Researchers then exposed plants with endophytes , and without them , to a devastating disease known as Phytophthora .","-LBQ-  It 's a dramatic difference ,  -RDQ-  Arnold said , noting that leaves without endophytes were three times as likely to die and lost twice as much leaf tissue , showing large , brown lesions .","`` It 's a dramatic difference , '' Arnold said , noting that leaves without endophytes were three times as likely to die and lost twice as much leaf tissue , showing large , brown lesions .","`` it be a dramatic difference , '' Arnold say , note that leaf without endophyte be three time as likely to die and lose twice as much leaf tissue , show large , brown lesion .","-LBQ-  When the endophytes were there , the damage just never went anywhere .  -RDQ-",leaves,without,as,likely,13,14,19,20,"{'lemma': 'likely', 'ix': 20, 'xpos': 'JJ', 'deprel': 'ccomp', 'head': 'note'}","{'lemma': 'leaf', 'ix': 13, 'xpos': 'NNS', 'deprel': 'nsubj', 'head': 'likely'}",nsubj,"{'lemma': 'leaf', 'ix': 13, 'xpos': 'NNS', 'deprel': 'nsubj', 'head': 'likely'}","{'lemma': 'without', 'ix': 14, 'xpos': 'IN', 'deprel': 'prep', 'head': 'leaf'}",prep,"{'lemma': 'likely', 'ix': 20, 'xpos': 'JJ', 'deprel': 'ccomp', 'head': 'note'}","{'lemma': 'as', 'ix': 19, 'xpos': 'RB', 'deprel': 'advmod', 'head': 'likely'}",advmod,nyt_eng_200402,14-19-20,as_likely,nonimmediateNeg
nyt_eng_20040219_0015_5:1-6-7,as_influential,"But no union endorsement is potentially as influential as that of the 13-million-member AFL-CIO , which is often credited with having the nation 's most effective get-out-the-vote operation .",endorsement,no,as,influential,but no union endorsement is potentially as influential as that,nyt_eng_20040219_0015_5,"Labor unions have skirmished for months over which Democratic candidate to support for president , and the candidates have tried to strike the necessary chords to appeal to the unions ' call for a candidate who will protect American jobs and industry .","But no union endorsement is potentially as influential as that of the 13-million-member AFL-CIO , which is often credited with having the nation 's most effective get-out-the-vote operation .","but no union endorsement is potentially as influential as that of the 13-million-member AFL-CIO , which is often credited with having the nation 's most effective get-out-the-vote operation .","but no union endorsement be potentially as influential as that of the 13-million-member AFL-CIO , which is often credit with have the nation 's most effective get-out-the-vote operation .","Kerry , speaking on Thursday to AFL-CIO members in Washington , D.C. , after receiving the endorsement , said ,  -LBQ-  I will continue to fight for what is fair , for what is common sense , for what taps into mainstream American values in this country .  -RDQ-",endorsement,no,as,influential,3,1,6,7,"{'lemma': 'influential', 'ix': 7, 'xpos': 'JJ', 'deprel': 'root', 'head': '.'}","{'lemma': 'endorsement', 'ix': 3, 'xpos': 'NN', 'deprel': 'nsubj', 'head': 'influential'}",nsubj,"{'lemma': 'endorsement', 'ix': 3, 'xpos': 'NN', 'deprel': 'nsubj', 'head': 'influential'}","{'lemma': 'no', 'ix': 1, 'xpos': 'DT', 'deprel': 'det', 'head': 'endorsement'}",det,"{'lemma': 'influential', 'ix': 7, 'xpos': 'JJ', 'deprel': 'root', 'head': '.'}","{'lemma': 'as', 'ix': 6, 'xpos': 'RB', 'deprel': 'advmod', 'head': 'influential'}",advmod,nyt_eng_200402,1-6-7,as_influential,nonimmediateNeg
nyt_eng_20040212_0021_5:14-17-18,as_close,"Why home-cooked ? The best reason is that , unless you live there , no restaurant is as close to your bedroom as your own kitchen .",restaurant,no,as,close,"there , no restaurant is as close to your",nyt_eng_20040212_0021_5,"Nonetheless , Valentine 's Day presents an opportunity to explore _ or , better yet , demonstrate _ the seductive nature of a delicious home-cooked meal , especially one full of foods with a reputation as aphrodisiacs .","Why home-cooked ? The best reason is that , unless you live there , no restaurant is as close to your bedroom as your own kitchen .","why home-cooked ? The best reason is that , unless you live there , no restaurant is as close to your bedroom as your own kitchen .","why home-cooked ? the best reason be that , unless you live there , no restaurant be as close to you bedroom as you own kitchen .","At home , you and your partner have ultimate control over the pace of the evening , and that pace can be driven by your own appetites for the food and for each other .",restaurant,no,as,close,15,14,17,18,"{'lemma': 'close', 'ix': 18, 'xpos': 'JJ', 'deprel': 'ccomp', 'head': 'be'}","{'lemma': 'restaurant', 'ix': 15, 'xpos': 'NN', 'deprel': 'nsubj', 'head': 'close'}",nsubj,"{'lemma': 'restaurant', 'ix': 15, 'xpos': 'NN', 'deprel': 'nsubj', 'head': 'close'}","{'lemma': 'no', 'ix': 14, 'xpos': 'DT', 'deprel': 'det', 'head': 'restaurant'}",det,"{'lemma': 'close', 'ix': 18, 'xpos': 'JJ', 'deprel': 'ccomp', 'head': 'be'}","{'lemma': 'as', 'ix': 17, 'xpos': 'RB', 'deprel': 'advmod', 'head': 'close'}",advmod,nyt_eng_200402,14-17-18,as_close,nonimmediateNeg
nyt_eng_20040207_0022_6:20-23-24,very_serious,That is only the latest outrage in a long series of actions that have made it clear neither the president nor Congress is very serious about fixing the system .,president,nor,very,serious,neither the president nor Congress is very serious about fixing,nyt_eng_20040207_0022_6,"After the trauma of the Florida recount , Congress passed the Help America Vote Act , and when Bush signed it , he declared that  -LBQ-  when problems aryselion promised for election improvements at the state level this year .",That is only the latest outrage in a long series of actions that have made it clear neither the president nor Congress is very serious about fixing the system .,that is only the latest outrage in a long series of actions that have made it clear neither the president nor Congress is very serious about fixing the system .,that be only the latest outrage in a long series of action that have make it clear neither the president nor Congress be very serious about fix the system .,"The Election Assistance Commission , which is charged with administering the act , was appointed nearly a year after the legal deadline .",president,nor,very,serious,19,20,23,24,"{'lemma': 'serious', 'ix': 24, 'xpos': 'JJ', 'deprel': 'xcomp', 'head': 'make'}","{'lemma': 'president', 'ix': 19, 'xpos': 'NN', 'deprel': 'nsubj', 'head': 'serious'}",nsubj,"{'lemma': 'president', 'ix': 19, 'xpos': 'NN', 'deprel': 'nsubj', 'head': 'serious'}","{'lemma': 'nor', 'ix': 20, 'xpos': 'CC', 'deprel': 'cc', 'head': 'president'}",cc,"{'lemma': 'serious', 'ix': 24, 'xpos': 'JJ', 'deprel': 'xcomp', 'head': 'make'}","{'lemma': 'very', 'ix': 23, 'xpos': 'RB', 'deprel': 'advmod', 'head': 'serious'}",advmod,nyt_eng_200402,20-23-24,very_serious,nonimmediateNeg
nyt_eng_20040205_0051_4:5-7-8,fully_exempt,"By 2001 , he was no longer fully exempt on Tour , and he was primarily playing on the Nationwide Tour , sorely missing the big time .",longer,no,fully,exempt,he was no longer fully exempt on Tour,nyt_eng_20040205_0051_4,"After being one of the Tour 's top-30 money winners in 1996 and 1997 , Tolles saw his game steadily decline .","By 2001 , he was no longer fully exempt on Tour , and he was primarily playing on the Nationwide Tour , sorely missing the big time .","by 2001 , he was no longer fully exempt on Tour , and he was primarily playing on the Nationwide Tour , sorely missing the big time .","by 2001 , he be no longer fully exempt on Tour , and he was primarily play on the Nationwide Tour , sorely miss the big time .","-LBQ-  You can go play at your local club with your buds and get a few shots and still have good competition ,  -RDQ-  Tolles said .",longer,no,fully,exempt,6,5,7,8,"{'lemma': 'exempt', 'ix': 8, 'xpos': 'JJ', 'deprel': 'root', 'head': '.'}","{'lemma': 'longer', 'ix': 6, 'xpos': 'RB', 'deprel': 'advmod', 'head': 'exempt'}",advmod,"{'lemma': 'longer', 'ix': 6, 'xpos': 'RB', 'deprel': 'advmod', 'head': 'exempt'}","{'lemma': 'no', 'ix': 5, 'xpos': 'RB', 'deprel': 'advmod', 'head': 'longer'}",advmod,"{'lemma': 'exempt', 'ix': 8, 'xpos': 'JJ', 'deprel': 'root', 'head': '.'}","{'lemma': 'fully', 'ix': 7, 'xpos': 'RB', 'deprel': 'advmod', 'head': 'exempt'}",advmod,nyt_eng_200402,5-7-8,fully_exempt,nonimmediateNeg
nyt_eng_20040204_0006_17:11-14-15,as_interested,"Sharpton is not in that league , and black voters may no longer be as interested in sending a message as in making their ballots count .",longer,no,as,interested,voters may no longer be as interested in sending,nyt_eng_20040204_0006_17,"When the Rev. Jesse Jackson ran for president , African-Americans voted for him because they wanted him to serve as their proxy , even though he had no chance of winning .","Sharpton is not in that league , and black voters may no longer be as interested in sending a message as in making their ballots count .","Sharpton is not in that league , and black voters may no longer be as interested in sending a message as in making their ballots count .","Sharpton be not in that league , and black voter may no longer be as interested in send a message as in make they ballot count .",It is important that future debates be limited to only two or three people .,longer,no,as,interested,12,11,14,15,"{'lemma': 'interested', 'ix': 15, 'xpos': 'JJ', 'deprel': 'conj', 'head': 'be'}","{'lemma': 'longer', 'ix': 12, 'xpos': 'RB', 'deprel': 'advmod', 'head': 'interested'}",advmod,"{'lemma': 'longer', 'ix': 12, 'xpos': 'RB', 'deprel': 'advmod', 'head': 'interested'}","{'lemma': 'no', 'ix': 11, 'xpos': 'RB', 'deprel': 'advmod', 'head': 'longer'}",advmod,"{'lemma': 'interested', 'ix': 15, 'xpos': 'JJ', 'deprel': 'conj', 'head': 'be'}","{'lemma': 'as', 'ix': 14, 'xpos': 'RB', 'deprel': 'advmod', 'head': 'interested'}",advmod,nyt_eng_200402,11-14-15,as_interested,nonimmediateNeg
nyt_eng_20040201_0002_3:35-37-38,as_consistent,"After a phenomenal run through t ` epop half of the men 's draw and past the world 's No. 1 player Andy Roddick and defending champion Andre Agassi , Safin 's first serve was no longer as consistent or convincing in the match that mattered most .",longer,no,as,consistent,serve was no longer as consistent or convincing,nyt_eng_20040201_0002_3,"Safin was not fine , at least not by the standards he set in the matches leading up to Sunday 's showdown with No. 2 seed Roger Federer of Switzerland .","After a phenomenal run through t ` epop half of the men 's draw and past the world 's No. 1 player Andy Roddick and defending champion Andre Agassi , Safin 's first serve was no longer as consistent or convincing in the match that mattered most .","after a phenomenal run through t ` epop half of the men 's draw and past the world 's No. 1 player Andy Roddick and defending champion Andre Agassi , Safin 's first serve was no longer as consistent or convincing in the match that mattered most .","after a phenomenal run through t ` epop half of the man 's draw and past the world 's no. 1 player Andy Roddick and defend champion Andre Agassi , Safin 's first serve be no longer as consistent or convincing in the match that matter most .","His ground strokes were not as steady ; his approach shots not quite as precise ; his returns not quite as intimidating ; his dark side not nearly as subverted as he let his racket fly and his fears flit across his broad , stubble-covered face .",longer,no,as,consistent,36,35,37,38,"{'lemma': 'consistent', 'ix': 38, 'xpos': 'JJ', 'deprel': 'root', 'head': '.'}","{'lemma': 'longer', 'ix': 36, 'xpos': 'RB', 'deprel': 'advmod', 'head': 'consistent'}",advmod,"{'lemma': 'longer', 'ix': 36, 'xpos': 'RB', 'deprel': 'advmod', 'head': 'consistent'}","{'lemma': 'no', 'ix': 35, 'xpos': 'RB', 'deprel': 'advmod', 'head': 'longer'}",advmod,"{'lemma': 'consistent', 'ix': 38, 'xpos': 'JJ', 'deprel': 'root', 'head': '.'}","{'lemma': 'as', 'ix': 37, 'xpos': 'RB', 'deprel': 'advmod', 'head': 'consistent'}",advmod,nyt_eng_200402,35-37-38,as_consistent,nonimmediateNeg
nyt_eng_20040201_0001_15:0-6-7,more_memorable,"No one , though , is more memorable than The Drive .",one,no,more,memorable,"no one , though , is more memorable than The",nyt_eng_20040201_0001_15,Forty-seven times ierback in league history .,"No one , though , is more memorable than The Drive .","no one , though , is more memorable than The Drive .","no one , though , be more memorable than the Drive .","It came on a cold , gray day in Cleveland in early 1997 , when Elway drove the underdog Broncos 98 yards on 15 plays , firing a strike to Mark Jackson for the game-tying touchdown with 44 seconds left in regulation .",one,no,more,memorable,1,0,6,7,"{'lemma': 'memorable', 'ix': 7, 'xpos': 'JJ', 'deprel': 'root', 'head': '.'}","{'lemma': 'one', 'ix': 1, 'xpos': 'NN', 'deprel': 'nsubj', 'head': 'memorable'}",nsubj,"{'lemma': 'one', 'ix': 1, 'xpos': 'NN', 'deprel': 'nsubj', 'head': 'memorable'}","{'lemma': 'no', 'ix': 0, 'xpos': 'DT', 'deprel': 'det', 'head': 'one'}",det,"{'lemma': 'memorable', 'ix': 7, 'xpos': 'JJ', 'deprel': 'root', 'head': '.'}","{'lemma': 'more', 'ix': 6, 'xpos': 'RBR', 'deprel': 'advmod', 'head': 'memorable'}",advmod,nyt_eng_200402,0-6-7,more_memorable,nonimmediateNeg
